210,"basically the future. climate change. sexual harassment. peer pressure. acid attacks, against muslims. my biggest fear is bullying."
211,to raise awareness of the issues around climate change. the prisons minister says there are early signs that violence
212,over climate change. now on bbc news a look ahead to sportsday at 6:30 tonight.
213,"and take to the streets, in protest against climate change. now on bbc news it's time for the film review."
214,a new study has warned that climate change could cause two-thirds of himalayan glaciers to melt by the end
215,on climate change. these students in ullapool in scotland joined thousand of others across the country in a protest organised
216,"tomorrow, thousands of children across the uk will walk out of school for two hours in an effort to persuade politicians to bring in tougher measures to deal with global warming. the schools for climate action movement started after a 15 -year-old girl called greta thunberg started a solo protest outside her parliament buildings in sweden."
217,"thank you very much. a rare moment of unity in a divided america - congress celebrates a record number of women in national politics - during president trump's state of the union address. there's a warning on global warming, as the met office predicts we are in the middle of what is likely to be the hottest decade since records began."
218,"for sunday, because it looks like we could see a spell of heavy rain pushing into england and wales to bring the weekend to a close. next week, though, high-pressure returns. it's looking quieter once again. this is bbc news, the headlines: scientists have warned that global warming may be about to hit a tipping point,"
219,"skipping school - thousands of pupils take to the streets in protest over climate change. award-winning author, andrea levy, whose works chronicled"
220,"to the streets in protest over climate change. and in port they have taken some serious scalps so far in the fa cup,"
221,and both have been taking part in climate change protests today. how was it for you both? it was incredible. it was extremely
222,still to come: making their voices heard - children from across britain skip school to protest about climate change. nine years and 15000 deaths
223,tackle climate change. those are the main stories. right now we have mike. we are starting with equine flu and how horseracing
224,"climate change, invasive species and critically how we use our land. increasing intensification of agriculture. around the world, suitable habitat is being consumed"
225,"amol rajan, bbc news. president trump is preparing a new panel to assess whether climate change is a threat to us national security."
226,"making their voices heard - children from across britain skip school to protest about climate change. nine years and 15000 deaths after going into afghanistan,"
227,"to our planet's insect diversity - climate change, invasive species and critically how we use our land. the increasing intensification of agriculture. around the world, suitable"
228,"after thousands of uk school children walked out of class last week to demand action on climate change, we're challenging a group of students from"
229,"accusations, outline this for us?l memberof the member of the house of lords, the head of the climate change committee, which is involved in"
230,"in solidarity with greta, holly has been missing an hour of class every friday morning. i care about climate change because it's my future and it's"
231,for you now from bbc news: scientists have issued the starkest warning yet on climate change. they say the world's set for the hottest decade ever recorded.
232,to brighton. cardiff. to stroud. schoolchildren went on strike over climate change in more than 60 towns and cities across the country. all of them young.
233,disciplinary action pales in significance to the danger these youngsters think the planet is under from climate change. the american footballer colin kaepernick has reached an out
234,"to come home to have her baby. thousands of pupils skip school and take to the streets in protest against climate change. award-winning author, andrea leavy --  _"
235,yes. why now? we are living in a time where climate change is the critical issue and we have got 12 years to take measures to halt
236,"insects. the report says intensive farming is the number one culprit for insect decline. followed by pollution, invasive species and climate change. in the last 50 years"
237,"a few decades. insects are vital pollinators so any decline threatens food production. pesticides, agriculture and climate change are being blamed. here's our environment correspondent, victoria gill."
238,we will be bringing all the ideas where adaptation to climate change where specific schemes will reduce mania. -- ammonia. i say it is very important not
239,"i want to get scottish leaders to take climate change seriously, and that they are destroying my future. most of my teachers are quite supportive of me."
240,warmer and that range depends on what we do in terms of mitigating climate change. let's look at the bbc news app to see what she had
241,"for the first time, global warming may be about to hit a tipping point, a level of temperature rise that could bring rapid and far-reaching changes for our planet, creating conditions we've never experienced before. nasa scientists have already confirmed that the warmest years on record are the past five years. now analysts from the uk's met office say there's a risk global"
242,unpredictable and unstable and we are taking action for our future that will hopefully not be devastated by the climate crisis we are facing. at the moment we cannot be certain for what the consequences will be. there is apathy because
243,our generation and must deal with it in less than 12 years. what would you like the government to do? we have four demands. the first thing is the government to immediately declare a climate crisis and our second and third demands evolve
244,"george, how do we deal with it, what would you like the government to do? we have four demands. the first is for the government to immediately declare eight climate crisis. our second and third demands involve reforming the national curriculum."
245,"pesticides, agriculture and climate change are being blamed. more details from our environment correspondent, victoria gill. they're the planet's smallest, most essential workers, producing ourfood, cleaning up our waste."
246,complacent about the threat from islamist terror groups. thousands of pupils skip school and take to the streets in protest over climate change. the fa cup returns tonight
247,"all of this is. as a result of climate change, the arctic is warming at about twice as fast as the global average. what that means is that"
248,a new report on climate change and extreme weather - we're likely to experience things we've not seen in hundreds of years. the pope admits for the first time
249,"to take climate change seriously, and that they are destroying my future. most of my teachers are quite supportive of me. unfortunately, the highland council and my headteacher don't"
250,"buildings continues. gas hobs and boilers could be banned from new homes within six years to meet carbon emissions targets. the committee on climate change, which advises the government,"
251,"decades of data to help combat climate change. prince charles has chosen his bride. the prince proposed to lady diana spencer three weeks ago. she accepted, she says,"
252,"president maduro. and the big freeze, wavy search for the world's old est freeze, wavy search for the world's oldest ice could transform our understanding of climate change. -- wavy search.            _"
253,researchers in antarctica are searching for the world's oldest ice. scientists hope it'll enable them to better understand past climate change - and predict future variations. caroline rigby reports.
254,"thank you, i can't believe all this, this is unbelievable to me. a stark warning from the un - climate change could affect our ability to feed the world."
255,murder hundreds of people at a nazi concentration camp in world war ii. -- muenster. he denies the charges. climate change is widely considered the greatest challenge of our age.
256,to stroud. school-children went on strike over climate change in more than 60 towns and cities across the country. all of them young. if we don't change it who will?
257,killed more than forty troops. cutting school to cut climate change - thousands of children in the uk go on strike to join worldwide protests over the environment. hello and welcome
258,as quickly as possible. -- shamima begum. thousands of pupils skip school and take to the streets in protest against climate change. a 27-year-old man is to appear in
259,the thousands of children who walked out of classes across the country today to demand more action from the government on climate change. those are the front pages. we will
260,"disciplinary action pales in significance to the danger these youngsters think the planet is under from climate change. frankie mccamley, bbc news, manchester. police in northern bulgaria have launched an inquiry"
261,"this from rod downey. hejoins me via webcam full stop it's a remarkable thing to see, how unusual is this? as a result of climate change, the arctic is warming at"
262,"pesticides, agriculture and climate change are being blamed. our environment correspondent victoria gill has more details. they are the planet's smallest, most essential workers, producing ourfood, cleaning up our waste."
263,"moments from a climate analyst, and if you want more on climate change in the latest predictions, go to the bbc news website. -- we will. or download the bbc news app."
264,"the people in power to do more about climate change, so what greta and rosie represent is the growing number of younger voices now able to do that as well."
265,"tuesday over climate change will stop dating at is, they want strict age limits. is placing a generation of children at risk of grooming and sexual input as mac explication. -- exploitation.       _"
266,"yogita limaye, bbc news, mumbai. this is beyond one hundred days. still to come. wild weather has many wondering if climate change is playing a part. we'll get the science"
267,to last for only a couple of days. there's a stark warning that the world's ability to produce food is being put under threat by climate change and farming practices.
268,"and, as a committee calls for uk homes to be better equipped, homes to be better equipped to prepare for the effects of climate change, we'll be speaking to an energy"
269,climate change is the great question. let us catch up on what the weather is doing. good evening. the weather maps are pointing to another every day tomorrow. today we
270,temperatures in some parts of the country surpassing record temperatures. they have been concerned that climate change also played a part. the warmer weather is expected to continue into today.
271,"who also warn that the scandal of badly insulated homes must be tackled if targets for climate change have any hope of being reached. our environment analyst, roger harrabin reports."
272,"then the mail on sunday claims the tory peer and head of the climate change committee, john selwyn gummer, has been paid £600000 from green businesses who stand to make"
273,climate change and predict the earth's future. scientists from norway are the latest to join the race to find the world's oldest ice. the ice can tell us the relation
274,"not be devastated by the climate crisis we are facing. but at the moment we cannot be certain of what the consequences will be if the apathy continues. there is apathy, and a lot of times, because people don't know how to start looking at"
275,"of their classrooms to demand more action on climate change. award-winning author, andrea levy, whose works chronicled the windrush generation, has died aged 62. here's your business headlines on afternoon live."
276,"to help her return to the uk as quickly as possible. thousands of pupils skip school, and take to the streets, in protest against climate change. how our personal data has been manipulated"
277,"to help her return to the uk as quickly as possible. thousands of pupils skip school, and take to the streets, in protest against climate change. how our personal data has been manipulated"
278,"said she wanted to come home to have her baby. thousands of pupils skip school and take to the streets, in protest against climate change. how our personal data has been manipulated"
279,"the report says intensive farming is number one culprit for insect decline, followed by pollution, invasive species and climate change. in the last 50 years we have been losing insects to insecticides."
280,"a few decades. insects are vital pollinators so any decline threatens food production. pesticides, agriculture and climate change are being blamed. here's our environment correspondent, victoria gill. they are the planet's smallest"
281,planning on taking part in friday's one-day 'strike' to protest against climate change that they should go to school instead. they have 15 weeks of holidays and half terms to demonstrate
282,"did the secretary of state see those wonderful people campaigning for the environment against climate change last week, last friday? some of them are in the gallery today. can't we harness those young"
283,"are questions about climate change, what impact does that had on our ability to take action? well some issues bother me, i think that it is a security threat, but we have been"
284,scientists have been telling us. the met office say we have had the warmest winter day on record but it would be simplistic to list this to climate change unless a study has
285,"making electricity is through wind farms. what we want to do again is a huge investment, delivering more clea n clean energy and as well is tackling climate change. , what it does is"
286,you for having me. researchers in antarctica are searching for the world's oldest ice. scientists hope it'll enable them to better understand past climate change and predict future variations. caroline rigby has more.
287,"of climate change. hello and welcome. it's the biggest night of the year in hollywood. the ceremony for the 91st academy awards, better known as the oscars, is drawing to a close."
288,"are suffering the opposite. drought, heatwaves and bush fires. is the world's weather getting more extreme and is climate change to blame? also on the programme: the abuse allegations which have rocked"
289,"and environment at melbourne's monash university. i asked her whether these extreme weather conditions are connected as a result of climate change. look, there has certainly been some weird and strange weather happening."
290,"of their classrooms to demand more action on climate change. and the award-winning author, andrea levy, whose works include the bestseller small island, has died at the age of 62. good morning."
291,"lesson time.'jon donnison reports. from london. to brighton. cardiff. to stroud. school-children went on strike over climate change, in more than 60 towns and cities across the country. all of them young."
292,"can do about this? well, a recent report by the intergovermental panel on climate change, which is an international body, suggested that in order to stay below that 1.5 degrees threshold we need to"
293,"a real sense of urgency in cardiff and, in manchester, there was music. # born to love in everyone. before nine-year-old lilia had her say. i'm worried about climate change because of the animals."
294,"the report says intensive farming is the number one culprit for insect decline, followed by pollution, invasive species and climate change. in the last 50 years, we have been losing insects to pesticides and"
295,invasive species and climate change. in the last 50 years we have been losing insects to insecticides. it must leave an impact on the environment. it is a very bad system. butterflies and mothss
296,the bramble cay melomys is believed to be the first mammal to have been killed off by human-induced climate change. this bodycam footage shows the terryfing moment an avalanche struck a swiss ski
297,"i want to get scottish leaders to take climate change seriously, and that they're destroying my future. most of my teachers are quite supportive of me. unfortunately the highland council and my headteacher don't"
298,"now, when it comes to climate change? we want them to declare a climate emergency immediately. which would mean what? which would mean them prioritising and other mental reform. at the moment they seem to"
299,"about climate change. but there are a growing number of younger voices now able to do that, as well. patiently waiting at fort william is 13-year-old holly gillibrand. what do we want?"
300,iam i am ashamed that our vice president of the united states stood up here and never mentioned the word climate change. i wish there was a way to hold the president of the united
301,"re-entering the paris pact on climate change. so, that will force. it will probably have a considerable amount of appeal among women, particularly young women. she has also been involved in a spat"
302,"recently, concern about climate change, taking away some of our important insect population. we know insects are declining around the world, that's many things. pesticides, insect diseases, habitat loss, but we don't know that much"
303,"let's speak to climate change expert tom burke in our london newsroom to find out more. so many people sort of enjoying the weather that you have concerns, do you? this is exactly what climate"
304,"and the rest of the team, that is your tuesday sport briefing. bye for now. we wa nt we want to see that, don't we? climate change is widely considered the greatest challenge no"
305,"been attributed many times to human induced climate change. well, that was ailie gallant, speaking with babita a little earlier. thailand's prime minister says he could consider drastic actions, including limiting the use of vehicles,"
306,hi5 his daughter. he is now 28 years later the head of the government's climate change committee. but he also has a family run consultancy which works with companies on handouts and lucrative taxpayer
307,"thousands of pupils strike in protest over climate change. award-winning author, andrea levy, whose works chronicled the windrush generation, has died aged 62. coming up on afternoon live all the sport - with hugh ferris with a look ahead"
308,"out of classes today - to demonstrate against climate change. downing street has criticised the action, which it says will cause disruption to their learning. our reporter athar ahmad joined me earlier from a protest outside the houses of parliament."
309,"to demand more action on climate change. award-winning author, andrea levy, whose works chronicled the windrush generation, has died aged 62. and in sport: they've already taken some serious scalps so far in this year's fa cup."
310,liverpool's city centre. this is st george's hall about 100 school pupils here from roughly 20 schools came to protest about climate change. among them these pupils. why are you here today? we are worried about the lack
311,legal challenges that he himself says he is expecting to happen straightaway. thank you very much. thousands of schoolchildren across the uk have walked out of classes today - to demonstrate against climate change. downing street has criticised
312,"a wall on mexico's border, saying 'walls work' pupils walk out of their classrooms to demand more action on climate change. award-winning author, andrea levy, whose works chronicled the windrush generation, has died aged 62. here's your business"
313,"but the threat of school disciplinary action pales in significance to the danger these youngsters think the planet is under from climate change. frankie mccamley, bbc news, manchester. welljoining me now is george and scarlett who are 15,"
314,that our voices are heard on this releva nt relevant dialogue. who do you think needs more education in this? you see the curriculum has to be adjusted to include climate change at school. is the children or adults
315,"in cardiff and, in manchester, there was music. before nine-year-old lilia had her say. i'm worried about climate change because of the animals. would you like it if your home was disappearing in front"
316,"thousands of children who walked out of classrooms to demand more action from the government on climate change. that is a quick look at those front pages, let's start off with the lead story, donald trump he"
317,"kids on strike from school to protest about the lack of action at government level across the world over climate change. my first reaction was, they should be in school. why can't they do this on a"
318,"marching in brighton. a real sense of urgency in cardiff and, in manchester, there was music. # born to love in everyone. before nine-year-old lilia had her say. i'm worried about climate change because of the animals."
319,"protests are a waste of lesson time and increasing teachers' workload, but the threat of school disciplinary action pales in significance to the danger these youngsters think the planet is under from climate change. frankie mccamley, bbc news, manchester."
320,"marching in brighton. a real sense of urgency in cardiff and, in manchester, there was music. # born to love in everyone. before nine-year-old lilia had her say. i'm worried about climate change because of the animals."
321,"particularly in tropical areas where climate change is known to have a big impact. the seriousness of this is obvious to everybody but it also must be very serious for other species because, of course, insects"
322,"guarding is to ship the polar bear. we need to find a solution and what is becoming increasingly serious issue across the arctic. that's quite a sentence, isn't in this area of climate change we need to find a"
323,"in trouble right now. those losses, scientists say, could jeopardise our way of life. so much of our atmospheric carbon, which is linked to climate change, that's stored in the soil, and that's cycled through the soil by insects."
324,"a few decades. that's the alarming suggestion of a major scientific study by researchers in australia, which claims that pesticides, agriculture and climate change are all drastically affecting the insect world. victoria gill reports. they're the planet's smallest,"
325,"in trouble right now. those losses, scientists say, could jeopardise our way of life. so much of our atmospheric carbon, which is linked to climate change, that's stored in the soil, and that's cycled through the soil by insects."
326,"so any decline threatens food production, and there are warnings now that 40% of species could be gone within just a few decades. pesticides, agriculture and climate change are being blamed. 0ur environment correspondent victoria gill has more details."
327,"there are three key things that this study highlights as threats to our planet's insect diversity - climate change, invasive species and critically, how we use our land. the increasing intensification of agriculture. around the world, suitable"
328,"primarily our activities and food production that's been driving them for the declines. three key things that they highlight as threats to our planets insect diversity. climate change, invasive species and critically how we use our land. the"
329,"report, how damaging pesticides can be. if you combine it with urbanisation and climate change. these four factors have made a toxic environment for insects and sadly, it has meant their populations are rapidly declining. eight times"
330,"area are a disasterfor are a disaster for insects. the report says intensive farming is number one culprit for insect decline, followed by pollution, invasive species and climate change. in the last 50 years we have been"
331,"hello, everyone. this is newsday. i'm rico hizon in singapore. the headlines: the starkest warning yet on climate change. scientists say the world's set for the hottest decade ever recorded. we are looking at really big changes"
332,"a real tragedy it is a national tragedy. thank you. the drax power station in north yorkshire has become the first in the world to reverse climate change on a tiny scale, in a process known as 'carbon negative'."
333,i'm rico hizon in singapore. thanks forjoining us. i'm babita sharma in london. our top stories: scientists have issued the starkest warning yet on climate change - they say the world's set for the hottest decade ever recorded.
334,in sentiment in terms of the us being a global threat but it did not surprise me that climate change came out as the number two ranked threat after cyber attacks from other countries. it highlights the extent
335,"action particularly on understanding climate change and responding to it. know where those lobby groups more powerful than where you are, katty. right, | powerful than where you are, katty. right, i guess the question is we"
336,have had a slew of reports on the dangers of climate change in the course of the last three or four months dash what policy prescriptions do you think you could recommend that would be adoptable in
337,"there by the end of 2021, costing 3500 jobs. and the international edition of the new york times has more on the impact of climate change on a popular hiking destination in switzerland. it looks at how glacial"
338,"david cornock. still to come should pupils be allowed time off school to go on a climate change protest? the international financier bill browder, who's a fierce critic of the russian leader vladimir putin, has said that"
