445,including best director for alfonso cuaron. green book has taken best picture in the last few minutes. researchers in antarctica are searching for the world's oldest ice. scientists hope it'll enable them to better understand past climate change and predict future variations. caroline rigby has more.
446,"against delaying brexit. in a moment, we'll bejoining hugh woozencroft for sportsday but first a look at what else is coming up this evening on bbc news: after eight, we'll be discussing what you can do to help tackle climate change in conjunction with the government's"
447,"last year, emissions from housing rose when they should be falling to help combat climate change. we risk saving up a problem for the next generation if we don't make actions and put our plans in place now. so, we know that spending a small"
448,"in which the uae plays a key role. he arrived in abu dhabi on sunday night for a three-day visit, during which he will lead a historical open-air mass for some 135000 catholics. climate change will affect the colour of the sea,"
449,"both here in australia and abroad in the last few years. in terms of the polar vortex, interestingly, there might bea might be a climate change connection there as well which does sound counterintuitive, but it is something which scientists are looking into. talk us through that,"
450,"experienced last summer, those are definitely on the rise and have been treated many times to human induced climate change. well, that was ailie gallant, speaking with babita and little earlier. thailand's prime minister says he could consider drastic actions - including limiting the use of vehicles -  _"
451,"ta ke save lives. we can do so much more, take action on climate change, defend individual liberties with fair-minded judges. fair-mindedjudges. none fair-minded judges. none of these ambitions are possible without the bedrock guarantee of our right to vote. let's be clear, voter"
452,"cancer, and to introduce legislation against late term abortion. there has been much talk about that already, of course. there was nothing whatsoever about climate change. what there was on foreign policy was news of a new summit, a second summit with the north korean"
453,"the tory peer and head of the climate change committee, john selwyn gummer, has been paid £600000 from green businesses who stand to make millions from his advice. it reports mps say he should have declared the payments. he denies any conflict of interest"
454,"on clothing helping to boost sales. pupils are walking out of their classrooms to demand more action on climate change. the award-winning author, andrea levy, whose works include the bestseller small island, has died at the age of sixty-two."
455,"who is 26 years old, who grew up in the netherlands, where he is suspected of involvement in a terrorism plot. on the front page of the guardian this morning is a picture of children involved in yesterday's climate change protests. in fact, theresa may criticised them"
456,"that we manage ourselves, rather than in response to what happens to us us through climate change.” mentioned at the start of this that the mp, one of the mps initiated today's debate said she had been inspired by the kind of action taken"
457,"what action will you be taking to reassure our generation about climate change ? george, it is great to see you, if i was 40 years younger i would be out with you today, even though i don't want to create any extra workload for teachers and what we want people"
458,"we'll have a special report from our correspondent on the border between california and mexico. schools out! thousands of pupils strike in protest over climate change. prisons continue to cause concern as books sprayed with drugs are smuggled into one of britain's most troubled jails. award-winning author, andrea levy,"
459,"that national emergency in order to secure the billions of dollars he needs to build that border wall without needing congressional approval. thousands of children across the uk are on strike from school today, joining worldwide protests against climate change. they've denounced the government for what they call an alarming"
460,"the day and as these boys aside, many pupils like them are thinking about perhaps skipping school again in the future in order to be here and to have their voices heard around the issue of climate change. a company which monitors offenders as part of the government's partial"
461,"leadership, nancy pelosi for example, was smart in pointing out that if you play this game for you to declare a national emergency, what happens when there is president who says it is about climate change? on the same day he declared the emergency we had another big"
462,"our top stories: the most alarming warning yet on climate change. scientists believe the world is set for the hottest years ever recorded. after sweeping gains against the so-called is militants in syria and iraq, donald trump claims total defeat is just days away. it should be formally"
463,"what action will you be taking to reassure our generation about climate change? george, it is great to see you. if i was 40 years younger i would be out with you today, even though i don't want to create any extra workload for teachers. what we want is people"
464,"have been taking part in a a day of protests, calling for action on climate change. 0rganisers say pupils walked out of schools in more than 60 towns and cities, to highlight what they see as a lack of action by the government. manchester, is one of the places"
465,# born to love in everyone. before nine-year-old lilia had her say. i'm worried about climate change because of the animals. would you like it if your home was disappearing in front of your eyes? this is clearly the first time many of these pupils have ever
466,"in a day of protests, calling for action on climate change. frankie mccamley reports from manchester, where children have been out in force. we are angry that the government's not doing anything, but we also see it as important to fight for our futures. to all the politicians,"
467,"things we are doing. we have the committee on climate change, an independent body, i am throwing lots of words are you but i am excited about this too. i have asked them advice on how we get to a net zero economy. sorry, we have left the energy"
468,"powers to pay for a border wall with mexico. the head of mi6 has warned governments in europe not to become complacent to the threat from islamic terror groups. thousands of pupils skip school , and take to the streets , in protest against climate change. schoolchildren across the uk"
469,# born to love in everyone. before nine-year-old lilia had her say. i'm worried about climate change because of the animals. would you like it if your home was disappearing in front of your eyes? this is clearly the first time many of these pupils have ever
470,"national emergency powers to fund the border wall with mexico. the democrats accuse him of 'an abuse of power.' schoolchildren across the uk, have been taking part in a day of protests, calling for action on climate change. 0rganisers say pupils walked out of schools in more than 60 towns"
471,in the region's settlement. officials say about six to ten can regularly be seen in and around the local military garrison. climate change has caused arctic sea ice to melt and that has driven polar bears to spend more time on land in an effort to find food.
472,"so much of our atmospheric carbon, which is linked to climate change, that's stored in the soil, and that's cycled through the soil by insects. our food is grown in the soil, that's made by insects. and then our food is then pollinated by insects. every single step along that has"
473,"and our food production practices that have been driving these declines. there are three key things that this study highlights as threats to our planet's insect diversity - climate change, invasive species, and critically, how we use our land, the increasing intensification of agriculture. around the world, suitable habitat"
474,"could jeopardise our way of life. so much of our atmospheric carbon, which is linked to climate change, that's stored in the soil, and that's cycled through the soil by insects. our food is grown in the soil, that's made by insects. and then our food is then"
475,"but, as much as we rely on insects, it is primarily our activities and our food production practices that have been driving these declines. there are three key things that this study highlights as threats to our planet's insect diversity - climate change, invasive species, and critically, how we use our land,"
476,"butterflies will start their long flight north as they prepare to spend the spring and summer months over the border in the us and canada. but climate change is having a real effect on butterfly numbers, and some scientists fear that within 20 years, they could be extinct."
477,since december more than 50 polar bears have been reported in the main settlement. officials say around 6-10 settlement. officials say around 6-10 can regularly be seen around a local military garrison. climate change has caused arctic sea ice to melt and that has driven polar bears
478,"gielgud, that is entertainment's select club. it could happen. you are watching breakfast. still to come this morning: when journalist david wallace-wells started interviewing scientists about climate change, he was told the outlook is much worse than people realise. he will be here to tell us how"
479,"they are thanking the community for everything they have done this week that she has a close group of friends. sarah, thank you. the drax power station in north yorkshire has become the first in the world to reverse climate change on a tiny scale - in a process known"
480,the technology captures carbon dioxide from burning wood pellets. the company says it's the first time it has been tried anywhere in the world and could help tackle climate change. our environment analyst roger harrabin explains. we humans or trees a great debt. when they are going the absorb much
481,"truly remarked -- remarkable migration is getting ready to take place. next one, millions of monarch butterflies will start their long ﬂight flight north as they repaired to spend this bring in some months over the border in the us and canada. but climate change is having a real"
482,"hello, everyone. i'm rico hizon in singapore. the headlines: the starkest warning yet on climate change. scientists say the world's set for the hottest decade ever recorded. we are looking at really big changes in the climate. we're going into territory that we have never been in before."
483,"the latest headlines for you: scientists have issued the starkest warning yet on climate change. they say the world is set for the hottest decade ever recorded. after sweeping gains against the so-called is militants in syria and iraq, donald trump has claimed total defeat is just days away."
484,told by many people that we have haps 12 years to avoid the most catastrophic effects of man-made climate change. the new figures coming from the met office in the uk and from the nasa scientist seem to be very specific about a much shorter period. what is significant
485,"celsius over the preindustrial level, and that is very significant because the paris agreement on climate change says that we should try to limit increases in temperature at that level, so we may have already exceeded at least one of the initial targets on paris.|j"
486,"to the economy, hundreds of billions of dollars every year, again and we do not do something quickly about this problem. what are the chances of doing something about the problem? the most powerful man in the world, donald trump, does not believe in climate change, he says it isa"
487,"i believe it's a gang of extremists. and urging the chinese to chop out the pork. the un says the world's largest consumer of meat is causing the biggest emission of climate-change gases. good morning. it's 9am in singapore, one in the morning in london, and eight in the evening"
488,"it's usually the job of environmental lobbyists or experienced campaigners to tell the people in power to do more about climate change. but there are a growing number of younger voices now able to do that, as well. patiently waiting at fort william"
489,"what i'm going to say is, would you like to ask the energy minister a question? yes. what action will you be taking to reassure our generation about climate change because in the end it is as who is going to suffer? george, it is great to see you. i"
490,"we need to be in a place where all of the emissions we might be creating in some parts of the economy are taken away by other things we're doing. -- net zero. and we have a committee on climate change in the uk, an independent body, i'm actually really excited"
491,to review that honour. an education minister has warned students thinking of taking part in a climate change protest on friday that missing school is not the answer. lord agnew said absence created disruption for both pupils and teachers. but a liberal democrat peer said anyone missing lessons
492,"theissues thank you forjoining us. of all of the issues that have become subject to political paralysis or partisanship here in the united states, climate change perhaps is the most depressing one. is it possible to take part in partisan politics out of american politics cosmic not entirely. it's been too"
493,education minister warned pupils planning on taking part in friday's one-day strike to protest against climate change that they should go to school instead. they had 15 weeks of holidays and half-terms to demonstrate without incurring disruption and extra workload to teachers. an average primary school
494,"for you to declare a national emergency, what happens when there is president who says it is about climate change? i hate to point this out but on the same day he declared this emergency, there was another big shooting in the us. by people died in illinois."
495,"former us secretary of state, john kerry, has slammed the climate change record of the current us government, personally criticising president donald trump and vice-president mike pence. kerry was speaking at the munich security conference which, as we've reported, was also attended by the vice-president."
496,"which splashes on what the paper calls a devastating new book onjeremy corbyn's leadership credentials. a head teachers' union has applauded a planned strike by school pupils who will walk out of lessons on friday over climate change. that's according to the sunday express, which also carries tonight's news"
497,"season was 2018 even intojune quite a busy season was 2018 even into june there intojune there was quite a vigorous storm came through, people may remember hector. it is difficult to get a sense of a trend, people are wondering if it is climate change. the season with"
498,we risk saving up a problem for the next generation if we don't make actions and put plans in place now. so we know that spending a small amount of money now to address climate change saves a big cost in the future. that's a cost that will fall
499,climate change is widely considered the greatest challenge of our age. the consequences of a warming planet could be drastic for generations to come. if scientists are to understand what's happening they need good data - and one man in colorado has made it his mission to supply as much as possible.
500,"according to a white house memo, the committee will be headed by retired princeton professor william happer. mr happer's views on climate change put him at odds with scientific consensus. he believes that increased carbon dioxide levels aren't a bad thing - but would actually benefit the planet by spurring"
501,"finding friends to verify what you just made up. there are facts and there is make believe and we have got to deal with the wealth of fa cts . facts. well the world cannot tackle climate change is the biggest polluter does nothing but it also sets a precedent, that other"
502,"juan guaido as president, following mass street protests last month. the world's ability to produce food is being put under threat by climate change and farming practices according to a un study. scientists have been studying the plants, animals and micro-organisms that we rely on to survive."
503,"new disease, a problem with climate change so it's very important to haveit change so it's very important to have it very broad and wide range of species to feed the world. with global population approaching 8 billion people, the un warns we need to rethink the way we produce our"
504,"rolled out until the award ceremony on sunday. we'll be in la - finding out just what it takes to actually win an oscar. advisors to the government on climate change, say gas boilers and cookers should be banned in new homes, within six years. so, what can we do"
505,"on a few species to feed the world, because anything can happen. you can have a new disease, you can have a problem with climate change, so it's very important to have available a wider range of species to feed the world. with the global population approaching 8 billion people,"
506,"because anything can happen. you can have a new disease, you can have a problem with climate change, so it's very important to have available a wider range of species to feed the world. with the global population approaching 8 billion people, the un warns we need to rethink"
507,"areas. creating new areas where spaces can thrive, linking together habitats across the landscape so we do not have so many extinction as a result of climate change, and only government can do that. we have seen the children out in the streets around the world campaigning about"
508,"it's very risky really to focus just on a few species to feed the world, because anything can happen. you can have a new disease, you can have a problem with climate change, so it's very important to have available a wider range of species to feed the world."
509,"houses must be much better insulated so they need less heating, the report says. last year emissions from housing rose when they should be falling to help combat climate change. we risk saving up a problem for the next generation if we don't make actions and put our plans"
510,in place now. so we know that spending a small amount of money now to address climate change saves a big cost in the future. that's a cost that will fall on the young generation today and we know that the houses that we see around us will be around
511,"scientists say climate change, land lost and disease are driving the loss. i've come behind the scenes at kew gardens where you can see crops that are grown around the world. from this citrus tree to curry leaves and coffee. the big problem is we are becoming more and more"
512,encouraged by people in the energy industry getting the message. the financial community really has picked up very strongly on the risks associated with climate change but i think we need governments to listen to what our children are saying and to treat this as an emergency. to do
513,"of climate change. hello and welcome. it's the biggest night of the year in hollywood. the ceremony for the 91st academy awards, better known as the oscars is well under way. mahershala ali has won his second, best supporting actor oscar in three years, this time for green book."
514,"beake, bbc news, yangon. you're watching newsday on the bbc. still to come on the programme: while the us suffers in a polar vortex, australians are suffering the opposite - drought, heatwaves, and bush fires. is the world's weather getting more extreme and is climate change to blame? also on the programme:"
515,"think they be proud, and missing geography today and i think she'd be proud that i'm protesting about the environment. will you come out to the street again? yes, if there was another protest about climate change, i'm here. the protest is expected to continue for much of the"
516,"a climate emergency and fully include young people in decision-making especially when it comes to issues around climate change. thank you. more now on the case of shamima begum, the british schoolgirl who fled to syria to join the islamic state group. i spoke to aamer anwar earlier."
517,"now. we know spending a small amount of money now to address climate change says they've the cost in the future. that is the cost that will fall on the young generation today, and we know that the houses we see around us will be around for a very"
518,"you can have a problem with climate change, so it's very important to have available a wider range of species to feed the world. with the global population approaching 8 billion people, the un warns we need to rethink the way we produce our food and we need to act fast."
519,"the man who booked emiliano sala's fateful flight to cardiff city , alleges the player was abandoned by the club, but doesn't blame anyone for his death. a disappointing turnout at the first climate change debate in two years which was led by lib dem mp layla moran who secured"
520,"man who said they are victims of michaeljackson in the programme tomorrow from ten. the uk needs to 'decarbonise capitalism' if we are to truly tackle climate change, according to former energy secretary sir ed davey. the ex-minister put forward a raft of radical policy ideas to shift"
521,"it is primarily our activities and our food production practices that have been driving these declines. there are three key things that this study highlights as threats to our planet's insect diversity - climate change, invasive species, and critically, how we use our land, the increasing intensification of agriculture. around the world, suitable habitat"
522,this is bbc news - our latest headlines. donald trump is set to invoke emergency powers to pay for his pledged border wall. we'll have a special report from our correspondent on the border between california and mexico. pupils walk out of their classrooms to demand more action on climate change. prisons continue to cause concern
523,the strike in parliament square to try and raise awareness around the issue of climate change. these being mirrored across more than 60 towns and cities across the uk today where stu d e nts and cities across the uk today where students have deliberately taken the day of school in order to be here.
524,"who ran away to join the islamic state and now wants to come home to have her baby - call on the government to help her return to the uk as quickly as possible thousands of pupils skip school, and take to the streets, in protest against climate change. how our personal data"
525,"scarlett there who joined the earlier to discuss those climate change protests across the country earlier today. the headlines on bbc news: president trump confirms he will invoke emergency powers to pay for a border wall with mexico. the family of the british teenager, shameema begum, who ran away to join the islamic"
526,"have to cut our carbon by a certain amount overa certain amount over a certain amount of time. but we have to act together, i am the minister for energy and also climate change and you have heard about the paris agreement in 2015 where 196 about the paris agreement in 2015"
527,"do with the british is supporters among them. daniel sandford, bbc news. here, schoolchildren across the uk have been taking part in a day of protests, calling for action on climate change. organisers say pupils walked out of schools in more than 60 towns and cities to highlight what they see as a lack"
528,"spoken to you a lot longer. -- quality of the line. schoolchildren across the uk, have been taking part in a day of protests, calling for action on climate change. 0rganisers say pupils walked out of schools in more than 60 towns and cities, to highlight what they see as a lack of action"
529,"the uk and ireland are on strike. they've walked out of lessons to show their concern about the threat of escalating climate change. this day of action follows the example of greta thunberg, a swedish schoolgirl who has been protesting outside her country s parliament since august. we can speak now to four"
530,0fficials home to around 300000 people. officials say around six to ten can regularly be seen in and around a local military garrison. climate change has caused arctic sea ice to melt and that has driven polybius to spend more time on land in an effort to find food. this change in
531,"the earth's entire insect population to extinction within a century, according to a major new scientific study. insects are vital pollinators, so any decline threatens food production and the latest warnings suggest 40% of species could be gone within a few decades. pesticides, agriculture and climate change are being blamed. more details from our environment"
532,"driving these declines. there are three key things that this study highlights as threats to our planet's insect diversity - climate change, invasive species, and critically, how we use our land, the increasing intensification of agriculture. around the world, suitable habitat is being consumed by farming and urbanisation, and the study says widespread use of synthetic"
533,"next month, millions of new monarch butterflies will start their long flight north as they prepare to spend the spring and summer months over the border in the us and canada. but climate change is having a real effect on butterfly numbers, and some scientists fear that within 20 years, they could be extinct."
534,"3000 people, and since december, more than 50 bears have been reported in the region's main settlement. 0fficials reported in the region's main settlement. officials say around 6-10 settlement. officials say around 6-10 can regularly be seen in and around a local military garrison. climate change has caused arctic sea"
