339,"for more on the political fight over climate change policies we can cross now to christine todd whitman, who served as head of the environmental protection agency under president george w bush. thank you forjoining us. of all of"
340,"education, climate change, what to do about nuclear duties, monetary policy, these are all things that will be on the table. in this election, he is setting the table. here is one thing that is different"
341,"of women in national politics. a new report on climate change and extreme weather - we're likely to experience things we've not seen since records began. coming up on sportsday later in the hour on bbc news,"
342,at the plant near selby is carbon negative and helping to combat climate change on a very small scale. but environmentalists have expressed opposition. our environment analyst roger harrabin reports. we humans owe trees a great
343,"also says much more must also be done on existing homes, such as draught-proofing and external-shading to prepare for the effects of climate change. our environment analyst roger harrabin reports. cars, planes and industry normally"
344,"so we know that spending a small amount of money now to address climate change saves a big cost in the future. that's a cost that will fall on the young generation today, and we know that the houses"
345,london grind to a halt after historic snowfalls. but this week the views outside the building so very different. it's too simplistic to say it is a direct result of climate change - but it's getting harder and harder
346,that animals and plants vital for feeding the world are disappearing by the day and that the world's ability to produce food is being put under threat by climate change and farming practices. now it's time to look
347,"and enjoy and we are destroying it, from pollution, climate change, all sorts of things and the only way things will change if people change their shopping and eating habits. keep your tweets coming in on that"
348,"the world's fish stocks are overfished. scientists say that climate change, land loss and disease are driving this loss. i come behind the scenes at kew gardens where you can see crops grown around the world, from this"
349,"so, what can we do to change or adapt our homes in the battle against climate change? our correspondent, emma vardy, has been finding out. this is extremely energy efficient. these are very high quality windows."
350,extinct by climate change. that story really upset me. we thought we would bring you the more hopeful story of the animal at the thought was long gone which has now been spotted. so today we thought we'd
351,"weeks ago a lot of schoolchildren decided they were going to take action. they took action because they were worried about climate change. they did it through organising on social media. nobody told them to do it, nobody asked"
352,"and climate change together probably constitute the biggest threat because the impact on all sorts of different ways around how the habitats were, how species are able to survive in habitats and if the habitats are fragmented and the"
353,"more than 20 degrees. let's hear from a climate change expert. what i think we will see, in relation to power for electricity, and even poor transport, is they will leapfrog, much as they did with"
354,"it warns cuts to children's centres, health visiting and services to support parents have left families vulnerable. if understanding climate change has become the greatest challenge of our age, then one man in colorado has made"
355,"climate change expert, thank you very much. it was record temperatures yesterday and matters out and about frost. a lot of compere and contrast pictures. surely look out of the square window now? look outside bet. there is a"
356,"20 degrees celsius. the direction of the air and the right pressure conditions contributed to the unseasonably warm weather, but there have been some concerns that climate change also played a part. the warm weather is expected"
357,"researchers in antarctica are searching for the world's oldest ice. scientists hope it'll enable them to better understand past climate change - and predict future variations. caroline rigby reports. it may be the coldest region on earth, but scientists believe"
358,debate in popular democracy that seems to be working fine now. researchers in antarctica are searching for the world's oldest ice. scientists hope it'll enable them to better understand past climate change - and predict future variations.
359,"for taking time out of classes. there were many thousands, particularly in westminster, holding banners and complaining about the lack of government action to stop various things to do with climate change. president trump has weighed"
360,"this is unbelievable to me. a stark warning from the un, climate change could affect our ability to feed the world. and coming up - we'll be looking at the impact that fashion is having on our planet."
361,uk was in the grip of the beast from the east. how much of this is due to climate change is the great question. let us catch up on what the weather is doing. good evening.
362,"quality, where his allergies. infectious diseases. natural disasters. so on. the good news is, that the steps we have to take to tackle climate change are almost invariably good for health. so if we shift our transport systems to"
363,"quarterly return on our stocks. long-term thinking is key to solving this problem. from our planet our health, and doctor christopher jones with the research for climate change in manchester, thank you so much for"
364,"but critics have accused her of being publicity-seeking, and promoting the idea of kids missing school. the victoria derbyshire programme s james waterhouse has been to meet some of the teenagers taking action against climate change. our world shouldn't have"
365,"those losses, scientists say, could jeopardise our way of life. so much of our atmospheric carbon, which is linked to climate change, that's stored in the soil, and that's cycled through the soil by insects. our food is grown in the soil,"
366,"delete my pupils have skipped school to be here today at this strike in parliament square to try and raise awareness around the issue of climate change, and these scenes are being mirrored across more than 60 towns and cities across the uk"
367,to protest about what they say is the government's inaction over climate change. demonstrations have been held in 60 towns and cities. let's take a look at some - starting in ullapool in scotland. what do we want! when do we want!
368,"of government action for the that climate change is about to cause. within the government is not doing enough to combat the harmful effects of what is going to be the greatest ecological disaster in human to stop subsidies, and yet the"
369,"from the met office, it looks that we will continue that warming trend. and 1.5 degrees celsius was the lowest level at which it was hoped that humankind could avoid catastrophic climate change. the suggestion is that there is a very"
370,"home to have her baby - call on the government to help her return to the uk as quickly as possible. thousands of pupils skip school, and take to the streets, in protest against climate change. sport now, and for a full"
371,"climate action! chanting in ullapool. . marching in brighton. a real sense of urgency in cardiff and, in manchester, there was music. # born to love in everyone. before nine-year-old lilia had her say. i'm worried about climate change because of the animals."
372,"against climate change that they should go to school instead. they had 15 weeks of holidays and half-terms to demonstrate without incurring disruption and extra workload to teachers. an average primary school lesson cost £1600, is secondary school lesson £1900."
373,"ambassadors who hope to recommend a revised deal soon to avoid thousands of children across the uk are on strike from school today, joining worldwide protests against climate change. they've denounced the government for what they call an alarming lack of leadership."
374,"cardiff. to stroud. school-children went on strike over climate change, in more than 60 towns and cities across the country. all of them young. if we don't change it who will? we are missing like our education, so that shows we"
375,"that burden you leave to us children. and on the bbc this morning, one young protestor here was putting the government on the spot. what action will you be taking to reassure our generation about climate change? george, it is great"
376,dialogue of our generation. he didn't want -- need more education in this? you say the curriculum needs to be adjusted to include climate change at school. is that the children or the adults who need educating? i think it is definitely
377,"have been taking part in a a day of protests, calling for action on climate change. 0rganisers say pupils walked out of schools in more than 60 towns and cities, to highlight what they see as a lack of action by the government."
378,"schoolchildren across the uk have been taking part in a day of protests, calling for action on climate change. 0rganisers say pupils walked out of schools in more than 60 towns and cities, to highlight what they see as a lack"
379,"the government has said today's protests are a waste of lesson time and increasing teachers' workload, but the threat of school disciplinary action pales in significance to the danger these youngsters think the planet is under from climate change. engineers say they've successfully"
380,regularly be seen in and around the local military garrison. climate change has caused arctic sea ice to melt and that has driven polar bears to spend more time on land in an effort to find food. but this change in behaviour
381,"solution? there nothing that springs to mind, as there? tackling climate change and stabilising the arctic has to be the first and foremost solution to this. on the ground, increasing the amount of these polar bear patrols we set up and ensuring"
382,"species within just a few decades. that's the alarming suggestion of a major scientific study by researchers in australia, which claims that pesticides, agriculture and climate change are all drastically affecting the insect world. victoria gill reports. they're the planet's smallest,"
383,"absolutely, moths and bees and beetles are all massively in trouble right now. those losses, scientitsts say, could jeopardise our way of life. so much of our atmospheric carbon which is linked to climate change, that is stored in the soil,"
384,the first in the world to capture carbon dioxide by burning wood pellets. the company says the electricity it is producing during a trial at the plant near selby is carbon negative and helping to combat climate change on a very small scale.
385,in north yorkshire has become the first in the world to reverse climate change on a tiny scale - in a process known as 'carbon negative'. drax burns seven million tonnes of wood chips each year to drive generators to make electricity.
386,to how much voters care about issues like climate change and it is a bit ofa of a change for the us right now because america has always relied on strong alliances with partners around the world and we have to be
387,"mentioned is being exacerbated by direct impacts like building over habitats and physically killing animals forfood, animals for food, but then further exacerbated by climate change so these factors interrelate to create a new domain of risk we are calling"
388,climate change. all industries have to get to net zero emissions by 2050. we think fashion has been marking its own homework for far too long. and only ten major retailers are signed up to the government's sustainable clothing action plan. we
389,"effectively we are having more british food on more british plates and not less, and you look at the challenges with climate change, air miles and everything else, it makes sense that we focus on farmers' ability to care for the environment"
390,of school tomorrow to demand that politicians take stronger action on climate change. it isa it is a small price to pay you for standing upfor our it is a small price to pay you for standing up for our planet. if you
391,"taylor about her protest? firstly, i would say i think climate change is massively important, as a parent of two children, i am really concerned about what the world is going to be like for them when they are 40 and"
392,"because it's my future and it's pretty bleak if we don't do anything about climate change. for more than a century, our planet has been getting warmer. and the row over what global leaders should do about it isn't exactly cooling off."
393,"chance that the scepticism about climate change that we heard from trump in the white house is going to galvanise people want to do more, to ta ke take on more of the button because its not having to limit happening at"
394,"that a good idea? it is a good idea for the end use, recycling and reproducing, it is good for the economy bringing in newjobs. but no one is looking at the beginning part of it, climate change is the big"
395,"mr trump's administration opposes action on climate change and favours boosting us production of oil, gas and coal. john kerry says he feels ashamed of the current policies, which he says will end up costing more in the long run."
396,"in the lords, another education minister warned pupils planning on taking part in friday's one-day strike to protest against climate change that they should go to school instead. they had 15 weeks of holidays and half-terms to demonstrate"
397,"european union is also a very important at on the global arena and important issues such as development corporation, at china against climate change. does the panel believes that knowledge on the eu as a global actor should be further"
398,"civil society. they think we had to address climate change because we had 20 years left and we are really screwed. yeah, ithink screwed. yeah, i think we can change, but we had to move quickly. and listen to other people."
399,scientists have issued the starkest warning yet on climate change. they say the world's set for the hottest decade ever recorded. controversy over comments from european council president donald tusk. he said there's 'special place in hell' for those who promoted
400,"next week, though, high-pressure returns, it's looking quieter. hello, everyone. i'm rico hizon in singapore. the headlines: the starkest warning yet on climate change. scientists say the world's set for the hottest decade ever recorded. we are looking at really big"
401,"environment as well. favouring the united states re-entering the paris pa ct united states re-entering the paris pact on climate change. so, that will probably have a considerable amount of appeal among women, particularly young women. she has"
402,"on what the paper calls a devastating new book onjeremy corbyn's leadership credentials. a head teachers' union has applauded a planned strike by school pupils who will walk out of lessons on friday over climate change. that's according to the sunday express,"
403,"united states climate change is happening, the scientists have formed a consensus across the world and we know what that means. but i think. we can say clearly that there is a consensus of scientists? that it is human induced, yes. and i"
404,the un has issued a stark warning that animals and plants vital for feeding the world are disappearing by the day and that the world's ability to produce food is being put under threat by climate change and farming practices.
405,"wonderful people campaigning for the environment against climate change last week, last friday? some of them are in the gallery today. can't we harness those young people's enthusiasm, tackling the waste, tackling the waste crime, the litter, blogging, clearing the planet up"
406,"there are and of course, globally there is a big decline of insects generally. scientists concerned about climate change, taking away some of our important insect population. we know that insects are declining around the world that's for many things, habitat loss,"
407,"help us understand climate change and better predict the planet's future. researchers from norway are the latest to join the international raised to find the world's allders eyes, that formed nearly 1.5 million yea rs years ago. the ice can tell us the"
408,help us understand climate change and better predict the planet's future. research is from norway are the latest to join the international race to find the world's oldest ice. that which was formed more than 1.5 million years ago. the ice can tell
409,"bed, whether that will spread over parts of the barrier reef, which is already stressed with climate change and the recent floods in north queensland. larissa waters, the co-leader of the green party, deputy leader in australia, said that she"
410,"i asked her whether these extreme weather conditions are connected as a result of climate change. look, there's certainly been some weird and strange weather happening. i have to say, the timing of the events, the fact that they have kind of happened"
411,"temperatures both here in australia and abroad in the last few years. in terms of the polar vortex, interestingly, there might be a climate change connection there as well, which does sound counterintuitive, but it's something which scientists are looking into."
412,"the return of shamima begum the british teenager who fled to syria to join the islamic state group. pupils walk out of their classrooms to demand more action on climate change. and the award-winning author, andrea levy, whose works include"
413,day. there are signs here saying homework is worse than climate change and pupils i have spoken to say they will continue to carry out dislikes for as long as necessary. the uk student climate network said they want the government to declare
414,"stocks are overfished. scientists say that climate change, land loss and disease are driving this loss. i have come behind-the-scenes at kew gardens where you can see crops that are grown around the world, from this citrus tree,"
415,"mirror tomorrow! my there is a big issue with climate change and we have seen this going on before but we have got to look at this, we have got concerns behind this. one piece of happy news. olivia colman is the"
416,"against, what we know are the detriments that are on the line in the next sort of 20 - a0 years where we might see the impact of climate change if we don't mitigate and track and avoid it. i think it's fairto"
417,"you're watching afternoon live - these are our headlines: donald trump threatens to invoke emergency powers to pay for his border wall with mexico. pupils walk out of their classrooms to demand more action on climate change. award-winning author, andrea levy, whose works chronicled"
418,"the paris climate change agreement, by 2100 temperatures would have risen over three degrees and which would cause an un-sustained and threatened huge amounts of equal ecological leather now. we are worried even if the government make these commitments we want them to"
419,"as you can see, hundreds of pupils have skipped school to be here today at this strike in parliament square to try and raise awareness around the issue of climate change, and these scenes are being mirrored across more than 60 towns and cities across the uk"
420,"but the threat of school disciplinary action pales in significance to the danger these youngsters think the planet is under from climate change. frankie mccamley, bbc news, manchester. the american footballer colin kaepernick has reached an"
421,"state and now wants to come home to have her baby, call on the government to help her return to the uk as quickly as possible. thousands of pupils skip school and take to the streets in protest against climate change. the indian government says pakistan"
422,"schoolchildren across the uk have been taking part in a a day of protests, calling for action on climate change. organisers say pupils walked out of schools in more than 60 towns and cities, to highlight what they see as a lack of action by the government."
423,"in significance to the danger these youngsters think the planet is under from climate change. frankie mccamley, bbc news, in manchester. a man has been charged with the murder of three elderly men in exeter."
424,"protest climate change. a record number of children are now in care in england, but often the reasons for deciding to put a child in care aren't always clear. you see, auntie carol explained to me as i sat on my case, jamaica used to be part"
425,"scientists say, could jeopardise our way of life. so much of our carbon which is linked to climate change is stored in the soil and that's cycle through the soil by insects. our food is grown in the soil is made by insects in our food"
426,"next month, millions of new monarch butterflies will start their long flight north as they prepare to spend the spring and summer months over the border in the us and canada. but climate change is having a real effect on butterfly numbers, and some scientists fear"
427,"climate change has caused arctic sea ice to melt, which has driven polar bears to spend more time on land in an effort to find food. but this change in behaviour, from hunters to scavengers, has seen them increasingly come into contact and conflict with humans."
428,"mrgrumpy! you be in favour of that? don't be mr grumpy! climate change is a huge thing. there is far too much hot air, lip service, c02, expended on it, and fartoo air, lip service, c02, expended on it, and far too little action. it is"
429,"we tackle climate change. humans owe trees and grea when we humans owe trees and great debt. when they are growing they absorb much of the carbon dioxide emissions that are overheating the planet. that is why the uk's biggest power station, drax in yorkshire, has"
430,"the latest headlines: scientists have issued the starkest warning yet on climate change - they say the world's set for the hottest decade ever recorded. the director of the queen biopic bohemian rhapsody, bryan singer, has had his name suspended from the film's nomination for a bafta award"
431,"but that's not a view shared by other experts, who call the prospect 'naive.' coming up in the next half hour: a small brown rat from australia becomes the world's first mammal to go extinct due to climate change. plus, we revisit the bay in thailand"
432,"to spend the spring and summer months over the border in the us and canada. but climate change is having a real effect on butterfly numbers, and some scientists fear that within 20 years, they could be extinct. well, a while back, mike headed"
433,"the starkest warning yet on climate change. scientists say the world's set for the hottest decade ever recorded. we are looking at really big changes in the climate, we are going into territory that we have never been in before. we have not experienced this"
434,"to spend the spring and summer months over the border in the us and canada. but climate change is having a real effect on butterfly numbers, and some scientists fear that within 20 years, they could be extinct. well, a while back, mike headed"
435,of the threat of climate change. with everything else that's been going on this week there was a brief respite in the commons on thursday morning where mps wanted to know what was being done to keep alive that most traditional of past times
436,think that the president got a little upset when his director of national intelligence testified in front of congress and made it clear that climate change is a threat to national security. and so he wanted to bring together a group of
437,threat to the world's food sources due to a decline in biodiversity caused by factors including pollution and climate change. and finally to technology and time magazine which looks at donald trump's tweets that have raised some eyebrows about the development of 5 and 66
438,"returns to earth sometime next year. here's our briefing on some of the key events happening later. thousands of students around the world are expected to take part in further protests against climate change as part of the 'fridays for future' campaign. meanwhile, the eu's trade"
439,"the property to the natural gas grid for cooking and heating purposes. that's the conclusion of government advisors who also warn that the scandal of badly insulated homes must be tackled, if targets for climate change have any hope of being reached. our environment analyst,"
440,so we know that spending a small amount of money now to address climate change saves a big cost in the future. that's a cost that will fall on the young generation today and we know that the houses that we see around us will be around
441,"climate change etc. if you are asked to put them in order of importance in terms of danger, what would be number one? it is easier if there is one thing to focus on and i am not going to do that because we are"
442,"family say they will continue to fight for. there's a stark warning that the world's ability to produce food is being put under threat by climate change and farming practices. the un has been studying the plants, animals and micro-organisms that we rely on to survive."
443,"scientists are telling us would happen. as the climate change, we are going to get more extreme weather. allen todd exactly when we again to get that more extreme weather that this is an example, dislike it was this time last year, very extreme weather, as the"
444,"been carried out. that's exactly right, we should get the results of those studies very shortly in what is called attribution science, telling us just exactly how much climate change played a part in increasing the likelihood of this kind of event happening. what we"
