123,"thing is climate change is such a threat to all of us. right and outreach is important because a lot of people don't believe it's real. and that's -- it's funny because today i was just reading on twitter, scott kelly, the"
124,"the size of the state of florida, my home state, the governor there, let's say he's hesitant to say the words climate change, how do you reach those leaders and connect them to what is actually happening? well, i mean that's a very"
125,"obviously it's going to be interesting the whole world is waiting. i hope that he will address climate change and be more proactive and if not, then there are a lot of citizens that will and a lot of cities in the u.s."
126,"the big focus of the week, north korea, of course, and its rogue nuclear ambitions the iran deal president trump has spoken out forcefully against and the climate change agreement that president trump withdrew from but now or may or may not be"
127,"first and the mission of the un is about the world. they are trying to figure out how one fits with another. somebody who is climate change, for example, has pulled out of the deal and maybe there is a"
128,"from the paris climate change deal, although there seems to be a little question now about whether the door is open this much. but you withdraw from one, and then you withdraw from another, and your allies are left holding"
129,"with reagan and romania and poland to promote freedom. you have donald trump rue fusing to cooperate with pope francis on climate change. reagan was a global player who had many, many friends. trump is more isolationist and likes to go it alone."
130,"parties in texas to come together and say, you know, we're going to provide the relief people need and we're going to start taking climate change seriously. it shouldn't be a partisan issue. science is science. we don't debate medical science."
131,"guests. and i think it is one that we frankly haven't had on a national level thus far and it is not necessarily climate change dependent. houston is built on a coastal prairie, any city would have been ravaged. please don't misunderstand what"
132,already will not meet the current 100-year flood standard and we know from climate change that these storms will be worse and more intense. so this is a policy issue going forward that i hop the president and his administration focus on.
133,regular operating business and it's not routine and something we can easily sustain and it's better to re-open the doors as fast as possible. the administration saw a connection between climate change and homeland security and that the frequency and intensity
134,"trump has withdrawn from the climate change accord, we were leaders in that effort and this is a major, major problem, withdrawing in terms of u.s. leadership, secondly, when you look at the state department budget, i serve on the funding"
135,"climate change and hurricanes, the jury's still out on that? i woopts say that necessarily. i think all the available evidence suggests that we may be starting to see an increase in h the intensity of the strongest storms and that signal will"
136,"storms, you have to wonder if climate change is beginning to have a noticeable affect. but in future decades it will be even more clear. so category 5, which is what irma is, we're seeing wind gust, chad myers just reported to us"
137,"climate change, but we can call it earth, wind and fire. how about that? does that work for you? it's how we mitigate against thing that is are predictable and more intense as we go forward. north korea, my concern about"
138,"i mean, we get rainy day flooding, climate change, it's real. all of this, you know, whether you agree it's human, manufactured or not, look, it's happening and we have to be careful. we have to be ready. the shelters are open."
139,"independence and reliable electricity for everyone and provide the internet for everyone, wouldn't life be better? it takes investment and people disagree in what to invest and somehow climate change has become part of this. if you live your life with the"
140,"and so you heard the president ee kwif voe indicating on climate change and heard earlier today when he was talking to the residents here, that they've never seen a storm the likes of which irma brought to the shores of florida earlier"
141,"talk at the climate change week this week, and i felt angry on what happened there, and i was at the paris talks. it felt like so much hope that the world was going to rally around with this problem, and"
142,"it may already bringing them about. so to omit that existential threat, climate change, that's what it is, it's irresponsible and blind and i don't know how he gets away with that. i have to call that fake news or"
143,poster child for climate change. the mayor is 'outfront' and we have an update on this missing couple. you may remember them. heard from four days ago as irma was lashing into the florida keys. the last thing she said was they were getting ready to go
144,"mayor blames climate change for r irma. he's out with a message for president trump and an update on a couple who vanished through the florida keys, leaving a relative desperate for information. been trying to prepe for this day. and i'm still not ready."
145,"martin savidge reporting from key west. thank you. the focus these past few weeks has been on these historic, massive hurricanes. that has some people asking the president if he has at all altered his views on climate change. well, we've had bigger storms"
146,i think you have to look what the administration has been doing on climate change issues. this is an area he is not inconsistent. he has consistently been trying to dismantle almost every regulation that president obama put into place. so if you look at national
147,"flexibility on climate change? it sounds like he won't, that he is ready to renegotiate american terms. but i think he is also going to hit the u.n. saying, look, you've got to reform yourself. all presidents have said that. and it's hard to reform the u.n."
148,"change play in the ferocious strength of hurricane irma and the intense flooding caused by irma and harvey? well, on monday, u.s. homeland security adviser refused to say whether climate change had been a factor or irma's strength at all. the head of the epa, scott"
149,"assembly of the united nations. we're not here to talk about 'game of thrones,' we're here to talk about something you're very passionate about, climate change, why is that? i'm a good will ambassador and they have what's known as the 17 global goals for 2030 one"
150,round. and it's kind of the same thing with climate change. there is no -- there's no point in discussing it any more. the facts are real. it's happening. it's not even -- you can't discuss it. so let's just deal with it. among the scientific
151,"want us to combat climate change if it wasn't real? it's -- i think -- the fact is -- the whole thing is we need to educate ourselves and i, you know, i'm just an actor. i'm just trying to use whatever spotlight 'game of thrones' is"
152,"understand that it's important to do something to mitigate, to affect the trajectory of a warming earth. it but is it worth also getting serious about adapting to the reality of climate change? if everything you're describing is true, do we need to start"
153,"permanent and strong and enduring, she can be blunt in the example of the u.s. paris climate change deal. certainly donald trump on the world stage in the coming peek in new york has not been like it was before. nick peyton walsh in london."
154,"here are u.n. reform like you said, but north korea and the rising nuclear threat certainly looming large in everyone's mind. the iran nuclear agreement also important. climate change of course another point of conversation. but again, north korea is something that is going to be"
155,"wrong when he talks about climate change being a hoax. i think it is a very serious, serious problem for our country and around the world. i believe we have to transform our energy system away from fossil fuel to sustainable energy and energy efficiency."
156,"50 deaths, will hurricane harvey cause houston to turn away from its fair zoning or perhaps be a turning point in the national debate over climate change. and the president visited texas again today. how best does a"
157,"whatever adjective you want to use and then you quoted brock long from fema, this is a storm the united states has not yet seen and what you say, they are all talking about, albeit not identifying by name, is climate change. will hurricane harvey, when we"
158,"hurricanes that hit florida. what's important right now is to make sure the response is there and it's beyond my ability to analyze right now. we continue to take seriously the climate change, want the cause of it and the things we observe and the rising"
159,"at the same time, does the thought occur to you that, geez, maybe there is somethinging to this climate change thing and its connection to powerful hurricanes or do you separate the two and say boy, these are a lot of hurricanes coming our"
160,like these rapid-fire strong storms coming from harvey to irma. now this is a category 5. that sounds really ominous but you're saying you don't have enough science to hang your hat on this being be climate change. is well i think we have to
161,"to improve our prepare d nts. we have to reduce our green house gas emissions so the climate change effect might be lower some what. jason, thank you very much. you bet. now we have to resolve a cliff-hanger we left you on"
162,"harvey, irma, maria. stl a scientific explanation why we've seen so many powerful storms this year, bill? those of us who accept the science of climate change connect all of these with having more heat energy in the atmosphere. you guys, that's what it is."
163,"climate change and the intensity of the storms that we are seeing right now. look, you can never be 100% about links, but the scientists have said the storms are going to get more and more and more intense and more and more often,"
164,"it's more fake than any fake news assertion by president trump. this agreement is so fundamental. i mean, watch all these hurricanes and the devastation, you can't take your mind off extreme weather events. that's exactly what climate change is going to bring about."
165,all the climate change. the president says this is a bad deal. we can get a better deal. it's bad for the economy. it's bad for the climate. what do you say when he says that to you? first of all it's bad for the
166,"chatter, it's time for the government to take action, to help restore order and get people back on their feet in florida and texas. the fact is that we are in a, you say, shouldn't we be talking about climate change now, we're in a period of relatively low"
167,"noaa, the national oceanic and atmospheric administration has concluded that climate change is happening, human activity is contributing to it and the warming of the planet and ocean temperatures creates conditions that allow for storms to get bigger and stronger and more intense. given all that, and given the"
168,"pruitt, has told cnn in advance of irma's landfall that it was insensitive to talk about climate change right now. how should we think about an event like this and the broader issue of science and public policy. to help me understand the impact of all of this, neil degrasse"
169,benefits almost even if wasn't climate change. i completely agree. there should be added benefits. there's nothing wrong with added benefits. it's great if we can agree to do something even if we might not be coming from the same page as to why we want to do it.
170,"down. the fact is on some of the most america first positions there have been signals of softening with confusion. the whole thing about the climate change deal, are they going to back off leaving it. clearly there's something going on there, something of a signal, but admittedly, very skeptical"
171,"yesterday on the sunday shows indicate there's going to be no softening of this america first message. clearly on some policy positions there's been consideration. we talked about this a few minutes ago on climate change, maybe if they can find a better deal they might stay engaged."
172,"the same suggestion to the side. that is, should the conversation at some point be about why these happen and if climate change has something to do with it. both of them dismissed that as being disrespectful to the plight of the survivors on the ground. what do you think?"
173,"joining me now is vernon lobe. the managing editor of the houston chronicle who wrote this column in the washington post, harvey should be the turning point in fighting climate change. i'm trying to stick with some good news and deal with the bad. so let me begin with asking you,"
174,people today in houston as we starting to rip out soggy drywall are thinking about climate change. but something is going on here that we've never seen before. houston is a city that is used to be flooded. i've worked in houston for almost four years and we've had
175,become more clear over time. we're just at the beginning of this in terms of the climate change effect on storms. and we expect these effects to man test themselves more strongly into the coming decades. the signal right now is weak or hard to detect just because we
176,"don't have that many years in the record, but as time wears on, i think it's going to become more clear. in other words you don't have enough evidence or science to say definitively that it's climate change that's making us see -- look, what looks to us"
177,"talk about anything that matters as long as i think i have a chance to deliver. i believe climate change is real. let's not talk about it, let's fix it. the dream. act cats need a place to stay and we secure our board. i'm willing to do the minimum"
178,"about climate change. the united nations president addressed the storms today. listen to this. we have a big one going right now. i've never seen winds like this and puerto rico, you take a look at what's happening there and just one after another. i think we're doing a good job."
179,"reporter: and despite seeing that devastation firsthand down here in florida, the president told reporters on air force one in that news-filled gaggle earlier today that he's not changed his view on climate change and the connection to stronger, more powerful storms. here's what he had to say about"
180,"said on arrival, look, we don't believe any of this is acted on the climate change front. this is this sense among european officials and particular french ones that perhaps what we heard in the rose garden back in july was rhetoric and that something can be done to continue the"
181,"then, of course, what happened in america when people, you know, denied climate change and said they would not rally on and help the rest of the world get on top of this problem. i wanted to get here and talk about it and rally help for the"
182,"first speech to talk about climate change. it was purposeful so that that could be a driving global agenda item in the years ahead. i'm not sure what we take away from this speech aside from his ability and willingness to use more heated rhetoric. and the fact that, you know"
183,"global issue, the issue of climate change. and so we'll have to wait and see whether the white house has anymore to say about their stance on this in the coming days. back to you. athena jones, thank you so much for the report. more misery appears to be headed for the caribbean islands."
184,"? . well, it hasn't helped the u.s. standing. not just the specific decision, well, it hasn't helped the u.s. standing. not just the specific decision, well, it hasn't helped the u.s. standing. not just the specific decision, but for example donald trump's denial of climate change and scientific issues by the head of"
185,"believer in international bodies of government. that's true. and it's different because president obama because he came in with a lot of support in the world. and when he gave his first speech, he talked about climate change and got a standing ovation. president trump is coming into a much more difficult environment"
186,reporter: almost a few hours later talking to reporters on air force one trying to make a case that there was a stronger storm in the '30s and '40s. the scientific community believes there is a strong likelihood there is a connection between climate change and these hurricanes. these violent storms that we're
187,"not take precautions just in case. and if you were the head of a company and you went to your board and said, you know, i don't believe in climate change, we have that plant right by the water, but i'm not going to do anything. they would throw you out instantly."
188,what we are focusing on right now is taking care of the folks who survived this disaster who need our immediate help. there's plenty of time later on to have those discussions and i know we will because climate change is clearly a big topic for the media but we will continue to focus our attention
189,climate change under trump and the u.s. position of trade under trump are the two things that are most out of step with the rest ever the world. and it is something he will have to address with the u.n. general assembly this week. because most of the world got on board with this agreement that
190,"the america first agenda at the meeting of the united nations, a global body that is all about addressing global issues. 195 countries signed on to this climate accord and they certainly see this as a global issue. the issue of climate change. so we will have to wait and see whether the white house has any"
