0,"robust. i want to mention someone pushing back on this, a professor of atmospheric science at the university of washington is pushing back on the idea that the massive flooding we saw from hurricane harvey was caused by climate change or global warming."
1,"important point, which is we have probably passed the pint of simply having a strategy which is about stopping global warming. what we need now is a strategy to mitigate -- i'm sorry, to adapt to global warming."
2,"though he announced the u.s. would be withdrawing in june, this is a lengthy process under the terms of the paris agreement. it was something that was going to take until november of 2020. it's also important to note the u.s. sets its own goals when it comes to reducing greenhouse gas"
3,"well a. few people in the white house. i guess my point is, now is no time to talk about climate change, and it's intensetive to talk about climate change and we"
4,"houston area, as i understand it, than any time that people have measured. is it related to climate change? is some of the intensity and the magnitude of this rainfall related to climate change?"
5,"storms. scientist say the reason they were so massive and devastating there will be climate change, rising temperatures increasing the intensity and impact of major storm since they feed off water. the trump administration refuses to bring climate change."
6,"havoc that we've seen, why is fighting it or trying to learn more about a waste of money? jake, i'll be more than happy to have a longer discussion on another day about climate change, man-made climate change."
7,"peter in my last segment i began a conversation about the role of climate change in hurricane harvey. and i want to put on the screen something that you wrote. for houston, the cruel irony is that the greenhouse gases that contribute to superstorms are"
8,this is nothing but -- but boosterism for their cause based on the sufferings and the disasters of people. it is shameful. so the climate change agenda
9,"you would be like a poster child for what this activist republican base hates. you know, you believe in global institutions. you believe in trade. you believe in climate change."
10,"bill in paris a couple of years ago where the world was coming together to hammer out an agreement, small agreement to save the planet. by taking meaningful action to tackle climate change."
11,"glimpse. he tweeted about the london terrorist attack. i think with the special relationship between the u.s. and the uk, when we disagree, we are able to say that. with the paris climate change"
12,"his daughter ivanka, not to get out of the paris climate agreement earlier this year. he did that. the president re-empathizing he's not changed his view on climate change. he remains skeptic on climate"
13,"bucket. that risque routine by president barack obama supervised by my next guest, david lit. in 2011 became one of the youngest white house speechwriters in history. besides the usual topics like health care and climate change,"
14,drama. and then there is climate. these hurricanes are not caused by global warming but their frequency and zbensty a intensi likely magnified by climate change but we're worried about
15,"things to come, and the insurance companies are showing that this is the start of things to come because the price of insurance against these sorts of events is going up and up and up. so yeah, look, climate change is"
16,"breaking hurricane in weeks, climate change back in focus but the white house won't draw a connection between global warming and the weather. im eris teen romans, 30 minutes past the you hour."
17,"as you say, why would we cancel a trade deal with south korea? they're not our enemy. we're supposed to be looking north. we need to look at international leadership. we're looking at first of all, this -- president trump has withdrawn from the climate change accord."
18,"only the life threatening conditions but what might be unfolding for years and months. and i would tell you one step beyond that, again, there needs to be a conversation about the severitity of these hurricanes and the submerged debate about what climate change means in"
19,"growth, because it's a very fair question, a good question, if you want to include growth, because we're going to go like a rocket ship, we're going to more than make up the difference. mr. president, the severity of the storm, do you think there's climate change?"
20,"care of the taxpayers' money but also make sure we get the money to the folks who need it. we'll handle this in a business like, responsible fashion while still showing tremendous compassion for the folks who have been injured. you said it is a waste of taxpayer money to research and fight climate change."
21,"told 'time' magazine this week, quote, we have no doubt this is a result of global warming and sea level rise and climate change. the white house came out this week and said, when asked about this, that it would need to conduct, quote, a trend analysis to determine if there's a"
22,if we reduce our greenhouse gases we benefit as does everybody else. and it would be great if everybody did it but we shouldn't penalize our self by not doing what we can.
23,"2025. so you have another seven years to go. we are certainly going to make that. number three, i think it's true that whether china orny other country reduces their greenhouse gases, we all will benefit or suffer."
24,"connected to the oil and petro chemical economy on which the city built its fortune. will this be a turning point of sorts relative to that national conversation? yeah, well nobody can blame houston itself for a global"
25,"come in a greater frequency. and climate change it real. you're living the consequences of climate change. and those who do not belief in climate change, we're hoping that when they would have looked at these natural disasters"
26,"know, and really doesn't mean much. but i think he raises a very important point, which is we have probably passed the pint of simply having a strategy which is about stopping global warming. what we need now is a strategy to mitigate -- i'm sorry, to adapt to global warming. because it is happening."
27,we candace agree on how to deal with immigration and climate change. lets disagree but lets not say there is climate change or five million vot
28,"president and epa who makes decisions need to talk about climate change. if this is not climate change, i don't know what it is. hurricanes happen one way or"
29,"likely magnified by climate change, and yet we have been worried about too much government activism. not just in climate change li itself. houston chose to have almost no"
30,the wrong call and pleati policing needs to get better. hurricane irma is one the strongest storms ever. is this the sign of things to come? how much of a role is climate
31,"the u.s. sets its own goals when it comes to reducing greenhouse gas emissions under this agreement. and so that is something the u.s. could look to change, to change those targets that it set for itself. but this has now become"
32,"climate change. of course i believe in climate change. but you don't think now is time to talk especially after two category 4 storms. i think, this is -- every time we have a natural disaster"
33,"should the political conversations be turning into dangers of climate change and ron, let me bring you the republican mayor of miami says yes, this is the time to talk about climate change. this is the time and the"
34,"of them is climate change. i pick two climate change and gender equality and the interesting thing is if you look at these goals, i mean, there's goals that we can all agree on like end poverty, education for"
35,"stop getting in the way of patient recovery and pay attention. every single one of you is on our list. at optum, we're partnering across the health system to tackle its biggest challenges. so what role did climate"
36,"do we need to start -- i understand it's important to do something to mitigate, to affect the trajectory of a warming earth but is it worth also getting serious about adapting to the reality of climate"
37,"how the president is navigating what it is to be the commander in chief in a natural disaster, interacting with people. also it looks like it will reopen conversations that perhaps the president thought were closed, that on climate"
38,"partisanship seems to be dominating the environment in washington to the detriment of the american people. hurricane irma, i would be remiss if i didn't mention, that the storm is more intense, experts say, because of climate"
39,"2020. it's also important to note that the u.s. set its own goals when it comes to reducing greenhouse gas emissions under this deal, so that's something na the u.s. could look to change. change its own targets when it comes to carbon emissions."
40,"talk about global warming right now. neil degrass tyson joins me, he's author of the best sell ter 'astro physics for people.'"
41,"breaking hurricane in weeks, climate change is back in focus but the white house will not draw a connection between"
42,"in shaping this vast new economy. and then there is climate. these hurricanes are not caused by global warming, but their frequency and intensity are"
43,saying what ever she says. most republicans are happy having the choice framed looking forward as a debate of donald trump and hillary clinton. they find different answers on questions like we are discussing how do you find the climate
44,plus winter is coming. 'game of thrones' fans know the phrase but one of its stars wants the world to know that winter could be a thing of the past. he joins me live to talk about his mission to combat climate
45,"the last two nights. we hope tonight does not become another rash of bad decisions in st. louis. ryan young, thank you. he's a man on a mission. nikolaj coster-waldau, better known for 'game of thrones' is raising awareness on climate"
46,"it's also important to point out that the u.s. sets its own goals when it comes to reducing greenhouse gas emissions under this agreement. so that is something the u.s. could look to change, to change those targets that it set for itself. but this has now become"
47,"states, and we have -- so what do you say to the president tonight, mayor regalado? what do you want him to say he's wrong about climate change? no, i don't want him to say he's wrong about climate change. i want him to tell his people to"
48,worldcoming here or they will go elsewhere and create the industries of the future and we'll be shut out. climate change also on the agenda at the bloomberg business forum today. you are also the u.n. special envoy on cities and climate change. president trump we are told was
49,"not only is climate change happening but they are very concerned that climate change is fueling more powerful hurricanes like the ones we saw from harvey and irma and that governments around the world have to do something about it. of course, we know the president was advised by his own family,"
50,myron what's your response. well the shameless hucksters of global warming alarmism will take advantage of every natural disaster. the trump administration is right this is not time for idle
51,"and anyone who believes there is no such thing as global warming, must be blind or unintelligent. lord, please save us all. valuable message right there."
52,"never-ending elections. we just had an election six months ago. it never ends. in the uk, they take two months to elect their candidate. we never stop elections. people are sick and tired of it. they want me to go back to washington to deal with climate"
53,the people pushing the global warming agenda of higher energy prices and energy rationing try to take advantage of it. and the trump administration and administrator pruitt are exactly right to resist that.
54,category 4 or 5 hurricanes. in the same periods from 1969 to now we have had four. so if you think global warming has a direct impact on hurricanes it must be a pretty good one because we've been in a
55,"connection. any thoughts? well, i think we all know the feeling from the white house, that they're not too in favor of the idea of global warming and so we have to deal with that. people will deal with it because"
56,"houston where it is that we were going to have something called global warming, that we'll have rising sea levels, worsening storms. but it is a reality. and it is inescapable. people talk about something like harvey being an act of god."
57,"next? smerkonish, not global warming, don't build homes under sea level, new orleans nor in flood plains in houston. this is ridiculous. that may be a valid comment. but the rise of extreme weather, even in our lifetimes, i think"
58,he says the bottom line is this analysis is that both observations of the past decades and models looking forward to the future do not suggest that one can explain the heavy rains of harvey by global warming and folks that
59,"persuade trump on pulling out of the climate change deal. there's a lot more news happening right now, including"
60,so what role does climate change play in the ferocious strength of hurricane irma and the intense flog cauoding cause irma and harvey.
61,"with a very good proposal with a carbon tax with dividends back to the american people so it doesn't grow the government. but i understand what you're saying. and yes, that's -- does it bother you? no. does it bother me that i would"
62,we deal with climate change or whether there really are 5 million voters in the 2000s elections. i am going to believe what i
63,"almost unprecedented. but the president doesn't want to talk about the role of climate change, is that a mistake? the longer we delay, the more"
64,"they would fire you. you will never see somebody on these television shows screaming about global warming being a hoax that works for a company because no company could put up with that. if you have a plant near the water, you move the plant, you build a wall, you have a back"
65,"overnight. 60% of florida you without power. complete coverage ahead. after the second record breaking hurricane in weeks, climate change in. the white house will not draw"
66,advice about climate change? some presidents have just an inability to want to deal with people that preceded them and bush 41 does not like donald
67,"building fortifications for people, start moving inland, new patterns of irrigation? i think that climate change is so real at this point it's not an academic debate."
68,front now the republican mayor of indy. you heard scott pruitt it's insensitive to the people in florida to be talking about climate change right now. is it insensitive?
69,"but the white house doesn't want to talk about the role of climate change. is that a mistake? i will talk to two brilliant scientists, climate expert cathl"
70,"important goal which is the climate change. it's actually going really bad and the worst projections seems to be getting worse every year and if we don't act globally,"
71,for iran to stop spreading terrorism across the globe. notably absent were climate change. mr. trump has promised to pull out of the paris climate agreement despite officials here
72,administration some pause when it comes to the issue of climate change? i think what's prunt to us is making sure the response is there. causality is outside my ability
73,"from the keys from cuba and other hart hit areas. after these second record breaking hurricane in weeks, climate change is back in focus but the white house will not"
74,time to talk about climate change. the white house also fending off questions stemming from steve bannon as interview with '60 minutes' on sunday night. calling the firing of james
75,"its fewerly on the caribbean and florida, scott pru wet said now is not the time to talk about climate change. the white house also fending off questions stems from steve"
76,"islands. kenny chezny, a. ahead, what is the right time to talk about climate change? well not now, if you ask the white house. kevin, meet your father. kevin kevin"
77,"record that the continental united states had two consecutive category 4 hurricane land falls, the white house dodging questions about whether climate change is to blame saying the president's focus is"
78,"we care about climate change because it exacerbates the climate risks we already see in the places where we live. it's amping up our heat waves, our wildwildfires, our drout s"
79,"and then as climate change became a political issue, you -- people like you have thrust me into this position. with all that said, wouldn't it be better if we had energy"
80,"but when they asked if this mean it is trump administration would take a look at the link between climate change and the storms, bossert dodged the question. are these storms giving this"
81,"climate change. and i'm going to talk to one republican who says this is exactly the time to talk about it. what's the biggest issue there at this time? is it electricity, anderson?"
82,"hardship and suffering. so we would prefer us to except the threat of climate change and build our infrastructure, our buildings, our electricity, electrical grid and our freshwater supplies to be more"
83,"building fortifications for people, start moving inland, new patterns of irrigation? i think that climate change is so real at this point it's not an academic debate. and unfortunately for those who"
84,"world for climate change and on north korea and get the iran agreement to continue. trump is threatening to dismantle the iran deal. macron, uk, germany, they're all for the iran deal."
85,"after these hurricanes we just had both in the u.s. and in france, we do see the direct consequences of co2 emissions and the climate change. we have to fight against this"
86,"sensitive issues. let's listen in. education or global health or climate change, you're setting a standard for the sorts of innovation and persistence and activism that the world desperately needs right now."
87,right now. and the white house also refused to say if the president's skeptical views about climate change have actually altered in any way. just last week with the head of the envier mental protection
88,"carolina. after the second record breaking hurricane in weeks, climate change? the white house will not draw a connection. now is not the time to talk about such things. good morning. i'm dave briggs, tuesday,"
89,"destroy the economy or something if we take on climate change. when in fact, what it is is bedrock conserve attism simply to put all the cost on all the fuels, eliminate all of the"
90,"would be to what end? to save the planet? what would be the end goal, an agenda for climate change. the proposals of the alarmists in fact have almost no eventually on the levels"
91,"and curbing to climate change. errol, on the timing of this ambiguity, as the president prepares for his debut at the u.n., what does that mean that we are haearing this now from a"
92,man. we'll take you to the scene next. plus a star of the hbo hit series 'game of thrones' joins us to talk about his passion. climate change. you're live in the cnn 'newsroom.'
93,"in the same direction, all pointing to the same consequences. that's what we have, with climate change as induced by human conduct. this is a known correspondence, if you want to find 3% of the"
94,"whatever you call the president's speech in that order. in relation to climate change, you said cave dwellers. you should check out this, because they both refer to people who deal in deep, dark"
95,"and i think the president is i'll advised by not understanding what it is. and whether you believe climate change and whether it's happening or not, there is at least you would have to admit"
96,"climate change. money, they're the recipients of 90% plus of the dollars from the cole industry. the biggest reason is geographic. the republican party from every level is highly dependant on the states that are the most found"
97,"the issue of climate change front and center in the wake of hurricane irma, the white house making it clear it's not ready to link the spike in major storm the to global warning. homeland security tom bossert"
98,"vision changes, or eye pain while taking anoro. ask your doctor about anoro. go your own way get your first prescription free at anoro.com. the issue of climate change front and center in the wake of"
99,"avoiding questions on climate change in the wake of the hurricanes harvey and irma saying it was not the time to talk about that calling it insensitive. is he right? no. if this isn't the time, i don't"
100,"conservatives or republicans to even discuss the possibility of climate change, what is that? well it has to do with the activists within the party who have basically been sold a bill of goods about how it's going to"
101,"interview since the story broke. the immediamedia on the left obsessed with sex. and miami's mayor saying irma was due to climate change and he wants donald trump to admit it. he's 'outfront.' good and clean and real,"
102,"we're seeing it from the homeland security, the home president himself as you know mayor regalado has could climate change a hoax. are you concerned about his policies right now? that he is going to make things"
103,"nuclear deal, issues about climate change, the middle east, fight against the islamic state. and there trump really doesn't give you reliable guide as to what you do with the u.s. i think people will of course be"
104,"errol, let's turn to the climate change statement. is this just semantics or is there some significant change here? we heard from the white house after the 'the wall street journal' reporting that the u.s. will withdraw unless essentially"
105,"welcome, ms. hayhoe. that you can for having me. as a layperson who wonders, i look that the stuff, particularly the hurricanes, and i wonder, does climate change have anything to do with it? what's your answer? yes."
106,"look at all this stuff, particularly the hurricanes, and i wonder, does climate change have anything to do with it? what's your answer? yes, we care about a changing climate because it exacerbates and magnifies the existing"
107,houston has the largest medical center in the world. the science there is -- is accepted by all and think climate change should be similar and the response to the hurricane should be similar. both parties should come
108,"on climate change. listerine® e strengthens teeth, helps prevent cavities and restores tooth enamel. it's an easy way to give listerine® total care to the total family. listerine® total care. one bottle, six benefits. power to your mouth™."
109,"houston. and the ongoing battles over climate change that some say energized the storm. well, these two articles on bloomberg caught my eye. harvey wasn't just bad weather, it was bad city planning. by peter coy and christopher"
110,"change, the issue of natural disasters, many forecasters, environmentalists saying they are only going to get bigger as a result of climate change. does this put the president in a position he has to show or may"
111,"clarify whether the president believes that human activity contributes to climate change? the president's addressed this already. i don't think that it's changed over the last several weeks and again, he's addressed his opinion on that several times since."
112,"change. in 2012 when hurricane sandy and superstorm sandy, your daughter tweeted so are we still going to go with climate change not being real, fellow republicans? the republican party, as you know, generally speaking, acts"
113,"as if climate change is not real. there are exceptions, you, your daughter, megan, republican mayor of miami. but generally speaking, the president, the governor of florida, et cetera, act as if it's not real even though the"
114,irma is one of the most powerful hurricanes in history and could create one of the largest mass evacuations. is this hurricane a sign of things to come and is climate change playing a role in more intense hurricanes?
115,"these storms, being prepared and ready. i think irrespective of whether climate change is going to play a role in this, these storms are a part of or past, and future, and maybe more squeer evere so e"
116,climate change and we need global mobilization for that. we have disagreement on this issue but i will keep pushing. we will implement the paris agreement on our own at the french and at the european
117,"agreement, small agreement to save the planet. by taking meaningful action to tackle climate change. it's a threat thmay define the contours of this century more than just about anything else. here is the interesting thing."
118,"the youngest white house speech writers in history. besides the usual topics like health care and climate change, comedy was his forte. he chronicles the behind the scenes in his new book, 'thanks obama, my hopy changy white house years.'"
119,"people that abscesses about climate change but i can tell you for a fact, that in my city we have a problem. in my office i see debate, i've been there eight years through the wound, i see the water."
120,"at this meeting of the united nations, which is of course a global body. that is geared towards addressing global issues. like climate change. elise, to you, it seems like this might be some confusion brought about by semantics, right?"
121,"climate accord. they certainly see this as a global issue, the issue of climate change. so we'll have to wait and see whether the white house has any more to say about their stance ong this on this in the coming days."
122,"the same direction, all pointing to the same consequences. that's what we have with climate change as induced by human conduct. this is a known correspondence. if you want to find the 3% of the papers or the 1% of the"
