109,"the philippines gets hit with eight typhoons or so a year. this one is particularly strong but this region gets hit a lot. as we look to the future and try to link this to climate change, there are several things to talk about."
110,"increasingly become a carbon-dependent globe, which ultimately results in rising sea levels and massive climate change. and so i think that unless we can turn the ship around and turn it around very quickly, it bodes for a very, very difficult future for our children and"
111,"storms like this should get stronger because of the climate change making the water warmer. but at the same time, they may become less frequent because the high level winds that knock them down may be more frequent as well. what are you paying attention"
112,"what the ipcc just said in its report. that humankinds' activities are now responsible for most of this. frankly, i don't know why, dr. spencer, i believe you don't even agree that climate change is man made, last time i checked. if you revised your position i"
113,2013 that climate change is not man made and happening now and causing great suffering in the philippines. great suffering. how do you explain that most of the people who have died in tropical storms -- talking about how there is no human fingerprints on this.
114,"people ask the question did climate change play a part. i know it's difficult to make connections like that but we pulled up the commentary end of last year from the chief philippines negotiator at the climate talks that gave a tearful appeal for progress,"
115,"debated topic and there say major development this week, four of the world's top environmentalists have written an open letter calling for more nuclear power they say it's the only way to reverse climate change. this comes as a new cnn film 'pando 'pandora's promise' that"
116,"stories. that is journalistically irresponsible. mark, did you know i'm one of the 97%, that includes people who believe that some portion of climate change is man made. and i do believe some portion of it is. you think it is a very small"
117,"president obama laid out a very ambitious agenda in his inaugural address. immigration reform, tax reform, gun control, climate change. has he moved enough for you on any of the issues so far? i'm going to break the rule and go back to the last point."
118,"change. it's happening now. yet we're still having this debate primarily in this country about climate change and is it even real? i think that's caused a lot of real problems and long-term lasting negative impacts on the health of our planet. andy, the report that"
119,investments that with a make it more resilient. it strikes me that you run up against two big political problems. first there is still a big debate certainly in washington as to whether climate change is real and man-made and secondly
120,"environmental movement to do anything to combat climate change and i think it's the old definition of insanity is doing the same thing over and over again and expecting a different result. i think frankly, the environmental movement is guilty of that, so it's incumbent on us"
121,"see, this is the conspiracy thinking that you must retreat to in order to say in the year 2013 that climate change is not man made and happening now and causing great suffering in the philippines. great suffering. and we have not o-- dealt with"
122,"more and more people around the world are moving to urban centers. and with that, cities have grown in power and importance. but what can a city do to combat something even bigger? climate change. i had a great set of panelists recently at the clinton global initiative."
123,"that's even if storms themselves don't change at all. what might happen to storms, that's the next question really. here the research and jury is out on tropical storms. we talked earlier about a warm source of water. we do expect climate change to warm those upper ocean"
124,climate change. and in this country the utilities have tripled investment in energy efficiency just in the last few years. that's making all of our homes and shops and businesses get more energy services out of the power that we generate. that's just scratching the surface. but the film clearly says
125,"this. frankly, i don't know why, dr. spencer, i believe you don't even agree that climate change is man made, last time i checked. if you revised your position i would love to hear about it. well, you're wrong about that. i believe that we don't know --  _"
126,"that a man-made climate change you reject that 99 -- so you stand against the 97% of scientists who say this. and piers, i have to tell you as a journalist, you know, we don't talk -- no, mark, i'm part of the 99%. i don't think we should talk"
127,"saying his country was right in the crosshairs of these sort of super storms that might be exacerbated by climate change. is it correct, is there anything to back up making a connection between those two things? you know, it's almost like i want you to stop hitting me on"
128,"we've had misunderstandings on one or the other side. different perceptions on certain issues, namely iraq, guantanamo or even climate change and other things. we always had a pragmatic way to find a solution. now we are at the level that european leaders don't only lose faith in a partner but also their face."
129,"up next, one near after hurricane sandy. more from mayor bloomberg and others on what cities can do to deal with the effects of climate change. are you flo? yes. is this the thing you gave my husband? well, yeah, yes. the 'name your price' tool. you tell us the price you want to pay,"
130,"interviewing those on one kind of the story. see, this is the conspiracy thinking that you must retreat to in order to say in the year 2013 that climate change is not man made and happening now and causing great suffering in the philippines. great suffering. how do you explain that most"
131,"well, my view is that of those that interview scientists. and i beg to differ with them if they say it is not. the fact of the matter is there is an overwhelming consensus that climate change is man-made, it is real, and that it is happening now and it will produce far more powerful storms as we go forward."
