126,"this is the associated press, let's be clear about that. talking about climate change, you watch golden globes, you know what you are watching? a hillary clinton campaign rally/mourning, that is what it"
127,"get bounced? tillerson will face a lot of questions about russia, about putin, maybe climate change, exxon-mobile's oil tentacles etc. what are the chances he may not be confirmed? probably not very good."
128,"i will get somebody. you pretend you have the moral high ground, but you put the man's finger on the nuclear codes. that man doesn't believe in climate change. do you believe in gravity?"
129,"to get off the plane. you pretend you have the moral high ground, you put that man's finger on the nuclear button. that man doesn't believe in climate change, do you believe in gravity?"
130,palestinian authority. money republican lawmakers had been blocking. they didn't want to aid the palestinians as they sought membership in international organizations. obama administration released $4 million for climate change programs and another million
131,cia director. cia analysts look for deeper causes of rising instability in the world. one of the cause those cia analysts see is the impact of climate change. do you have any reason to doubt
132,the assessment of these cia analysts. i haven't had a chance to read those materials with respect to climate change. i know the agencies role is to collect foreign intelligence. jesse: you have a democratic
133,scott pruitt sued the epa more than a dozen teams. rich edson following that hearing. a lot of this was about climate change. it was. they're worried that scott pruitt will gut the epa.
134,answer is leaving pruitt's epa enough room to do nothing to address climate change. republicans have charged for years that the epa under the obama administration with regulations on power plants and waterways have circumvented
135,"shortsighted and reactionary agenda that is rising in the wake of this election. from education to climate change, the state hopes to stop or stall trump's policy reforms. we have the laws, tools of"
136,"shortsighted and reactionary agenda that is rising in the wake of this election. from education to climate change, the state hopes to stop or stall trump's policy reforms. we have the laws, tools of"
137,one of the cause those cia analysts see is the impact of climate change. do you have any reason to doubt the assessment of these cia analysts. i haven't had a chance to read those materials with
138,"possibly work unless countries like india and china do the same thing. as everyone knows, they are not. so, mr. obama imposed regulations that hurts the american economy, knowing full well that climate change wouldn't improve for a while."
139,"children won't have time to debate the existence of climate change. they'll be busy dealing with iti effects. more environmental disasters, more economic disruptions, waves of climate refugees seeking sanctuary. now we can and should arguein"
140,"redefined and redistributed across the globe. financial and economic orders are under distress, climate change is causing harm and creating and leading to greater instability. in many parts of the world there is a view that american"
141,"are you watching? climate change is the most important issue facing not only this generation but all future generations. it was inspiring -- steve steve thanks, leo. could president-elect trump take a chain saw to all those obama"
142,"what we've been doing hasn't worked, which made all the sense in the world prayed >> when i was at the u.n. and i heard our president say climate change is the most impot issue facing our generation."
143,"are in the beginning of the impact and they are getting worse each year. and we are often viewing climate change as a national security issue. and since you believe, i wanted to ask, do you see it as"
144,"increase in celsius, it's beneficial. the computer models are highly inaccurate. okay, okay. russians are trying to hack us. iranians want to kill us. isis wants to blow us out of the water. climate change may be an issue"
145,"i never tried before . i heard our president say climate change is the most important issue, it was inspiring . those words in the constitution, we the people . pete: tears in hollywood. celebrities having heartache as they say farewell to"
146,"do. question the nominees, have a good debate. climate change or the russians or whatever, but to announce in advance. slow them down so he can get started until march, that's not good for the democrats."
147,"i, you know, i heard our president say that climate change is the most important issue facing not only this generation but all future generations, it was inspiring. brian: stroke your goatee. it sounds more thoughtful. don't cry."
148,pipelines in 202016 is because he wanted america to lead the fight against climate change and felt building pipelines would not have been putting our money where our mouth is. the new administration clearly has a different take. watch.
149,"national parks out in the badlands was tweeting about world climate change. and whether what they were saying was true or not, it seems an odd thing for an agency that is supposed to keep the visitors"
150,"publish the communications and so on until my own people were in charge. the other day for example, thend national parks out in the badlands was tweeting about world climate change. and whether what they were"
151,the government likes democrats. i'm going to guess most are democratic leaning and climate change they have a different point of view than the president and new epa director. many of them will believe it is
152,just pretend you have the moral high ground but you put that man's finger on the nuclear button. he doesn't believe in climate change. do you believe in gravity? did you know gravity was just a theory?
153,"side with the climate wing of the party or go with the workers? ultimately the climate change folks -- there was not good logical reason for them to deny the keystone pipeline permit. today you saw keystone pipeline,"
154,"web site, the environmental section was taken down by the obama administration on the way out. donald trump is repopulating the website. there's no climate change section in there because there wasn't one on donald trump's"
155,one of the cause those cia analysts see is the impact of climate change. do you have any reason to doubt the assessment of these cia analysts. i haven't had a chance to read those materials with
156,"province of alberta. obama said it would hamper efforts to meet a global climate change deal. vice president mike pence will speak at the march for life in washington, d.c., tomorrow. they say this is for the first"
157,"legislature, it was uncontroversial for me to accept the science of climate change and 98% of the world scientists believe it is true. what i meant was it was misconstrued on some of these"
158,"against presidency. top adviser to california law make whoars are bracing for an epic battle. holder is expect today butt heads with mr. trump over immigration, voting rights, climate change, pretty much everything else. heather: liberal celebrities"
159,"accords, climate change, he went after him on protectionism and nationalistic approach on trade barriers. he went after him on the currency stuff. and i think that it is two of the most powerful leaders in the"
160,climate change is a hoax. that is important for the president to hear. nikki haley went on the offensive at her confirmation hearing earlier. she's in the running for ambassador to the united nations. like most government
161,"with sycophants. look what you've gotten these hearings. you've got pruitt today on climate change, nikki haley on russia, rex tillerson the other day on russia. a harder line then donald trump has been. jeff sessions on waterboarding."
162,causes of rising instability in the world. one of the cause those cia analysts see is the impact of climate change. do you have any reason to doubt the assessment of these cia analysts. i haven't had a chance to
163,causes of rising instability in the world. one of the cause those cia analysts see is the impact of climate change. do you have any reason to doubt the assessment of these cia analysts. i haven't had a chance to
164,"was from the new senator from the great state of california. camila harris asked mike pompeo, okay, he's going to run the cia, ask him about climate change. maybe she thinks the c in cia stands for climate but it"
165,instability in the world. one of the causes those cia analysts sees a the -- is the impact of climate change. abby: the most ridiculous sound bites of the week. that's coming up. clayton: this website claims to help discover your family tree.
166,the most absurd of the week. new senator harris mike pompeo up for the cia about climate change for all things. take a listen. cia analysts look for deeper causes of rising instability in the world. one of the causes those cia
167,"them blankets. steve: on climate change he says there's a lot out there not related to the imminent threat, that is different, on cuba he doesn't think we got enough of what they got. if you look at cuba we had a"
168,animals are having so much fun in the snow. but i felt there was climate change. well done. we do bring it around. mind is from 'time' magazine paired i encourage everyone to check this feature out. they asked 12 white house
169,"has not worked. which made all the sense in the world. when i was at the u.n., i heard our president say that climate change is the most important, facing, not only this generation but future, it was inspiring."
170,"to make sure that you know that americans have affordable, care going forward, and i think he will talk about climate change. maria: well, i think you make great points. thank you. maria: but we know that president-elect trump is looking"
171,"national organization. well, another hit against israel. the obama administration also released $4 million for climate change programs and another million for organization. all of the candidates for dnc chair want to do more to help minorities get the party back on track."
172,"environmental regulations, and to that point, the climate change section of the white house web site has it just been taken down. might be getting a redo something tells me. by the way, i might note the new potus twitter account is up,"
173,"everything for the next four years. so what's the lesson? apparently, only the left can scare the crap out of you whether it's racial division, climate change or an evil military foot print, the left invented fear. now they're getting the vapors."
174,leader of california from the governor on down have already pulled out their brass knuckles to say they're more interested in protecting california's progressive agenda on things like immigration and climate change than reaching across the aisle. there is plenty at stake if
175,change is a hoax. that's different from what president-elect trump has to say about climate change. he said the chinese came up with the concept to hurt u.s. businesses. he said he would keep an open mind on the issue.
176,"reduce climate change, count me? neil: i don't know how you feel about this. a democrat raised this. governor haley, are you telling us -- paraphrasing here -- that if a decision comes down that you or the administration doesn't like it, that would be"
177,"the claim you made that climate change is settled. how do you know that, are you a scientist? where did you get that figure? that's another one of those interesting kind of questions is that that wasn't what the blog was about."
178,"the claim you made that climate change is settled. how do you know that, are you a scientist? where did you get that figure? that's another one of those interesting kind of questions is that that wasn't what the blog was about."
179,"question on climate change and public lands from both sides of the aisle. joining us now to talk about the prospect he faces, the chairman of gopac, and donnie fowler, who served in the clinton administration as liaison to congress. welcome gentlemen."
180,a break from the president-elect who has suggested climate change is a hoax. zinke appeared to win over bernie sanders with the answer. the retired navy seal is not considered one of the more controversial nominees. bret: we will continue to
181,"take advantage of opportunities. there are issues like climate change, like trade, that are really important for us to address as we lead the world's globally. it is hard for some people to grasp it. but what we -- you -- are doing            _"
182,"used to fight terrorist but also take advantage of opportunities. there are issues like climate change, like trade, that are really important for us to address as we lead the world's globally. it is hard for some people to grasp it."
183,"what a great example for young americans. it's really good. ainsley: how about the crazy bizarre gotcha questions that have nothing to do with the -- steve: climate change. ainsley: what they're going to be running. i don't think -- my daughter's listening, so i have to be careful."
184,"bret: mollie, take a listen to rex tillerson, ceo of exxonmobil, and the issue of climate change. i don't see it as an eminent national security threat that perhaps others do. the facts of the ground are indisputable in terms of what is happening with drought, disease,"
185,"of that foreign intelligence collection task, we will deliver that information to you all into the president. in the past you have questioned the scientific consensus on climate change. nevertheless, according to nasa, multiple studies published in peer-reviewed scientific journals show that 97% or more"
186,"abby: that's a great message to and on, it's been good having you here this morning .>> thank you. abby: coming up, one business ownerhas a message for liberal cnn and even bruce springsteen. we've had it with you. climate change has this meteorologist in a total meltdown."
187,"taxes for companies at a time that profits have tripled. we need to broaden tax base and you can the rate, no there is not a case for save an deregulation from people who believe that global climate change is some kind of myth of"
188,"with the most motivation imaginable, which is what we've been doing hasn't worked. which made all the sense in the world. when i was at the un, and i, you know, i heard our president say that climate change is the most important issue facing."
189,"that's the point. i don't think they have any substantial problems with rex tillerson or his record. tillerson is not a conservative activist or not out there on climate change from their point of view. he endorsed the paris climate treaty, by the way."
190,he wanted america to lead the fight against climate change and felt building pipelines would not have been putting our money where our mouth is. the new administration clearly has a different take. watch. speak of the president's actions today will create tens of
191,the obama state department did a massive study of the keystone xl pipeline. they concluded it would add 42000 jobs and add $3.6 billion to the economy and blocking the keystone xl pipeline would have have almost no impact on climate change because the oil is going
192,"button. that man doesn't believe in climate change. do you believe in gravity? do you know gravity is a theory? bill: here to analyze her, bernard mcguirk and greg gutfeld. i know that you lived with a woman in the 1980s. i don't know what happened to"
193,"saying was true or not, it seems an odd thing for an agency that is supposed to keep the visitors coming and maintain the o condition of the park out there to be tweeting about historical facts about climate change. i don't blame the administration"
194,"coming and maintain the condition of the park out there to be tweeting about historical facts about climate change. i don't blame the administration for saying wait a minute, let stop this and have a chance until we get a hold of this agency."
195,"efforts to clinch a global climate change deal that was the centerpiece of his environmental legacy. today's signing followed yesterday's three executive actions could with the stroke of his pen, president trump pulled america out of the tpp trade deal struck by president obama,"
196,"think that's good news. the democrats opposition, particularly on keystone, was real gesture politics, because even if you really take seriously the arguments on climate change and think that that should be the overriding priority above jobs and economic impact, even then not going"
197,watching someone who runs the cia being questions about his thoughts on climate change makes you wonder how much of this is concerns with them and how much is because mister trump picked them. they should be fully vetted and that is what is happening
198,"chris, as always, thank you. want to make one clarification, it was the obama team that changed the climate change section, took it off the website, taking down all of the web site. the new trump website put n we referenced that earlier, talking"
199,really care about or climate change when the majority of americans care about how will i pay my bills and their healthcare costs and things that really matter to the majority of americans. shannon: a number of democrats have taken that pulse and recognized that may be
200,"governor down has pulled out their brass knuckles, saying that they are more interested in protecting california's progressive agenda on immigration and climate change than reaching across the aisle. plenty at stake as california continues to poke the bear. a third of the state's budget,"
201,"he went after him on the paris accords, climate change, he went after him on protectionism and nationalistic approach on trade barriers. he went after him on the currency stuff. and i think that it is two of the most powerful leaders in the"
202,confirmation hearing to be the next interior secretary. bernie sanders grilled zinke on climate change. zinke replied climate is changing and man has played a role. i think where there is debate is what the influence is and what we can do about it.
203,"hungry. you need to use free market energy economy. that's the kind of thing we do to get a strong and healthy economy. you can talk about climate change, talk about the future, all of those things are important. is the climate changing? yes."
204,"climate change. we should say that president obama probably did this because donald trump has said at least he said on the campaign that he was going to a, cancel paris climate agreement and money going around to global warm programs, he was going to get"
205,"climate change regulations like the epa's clean power plan and the paris claimant agreement can easily go bye-bye. then you go over to congress and throwing repeal and replace obamacare and getting rid of dodd frank and federal regulations. after that, the only thing that"
206,monarch to save his breath and not lecture president trump about climate change during his visit this summer. prince charles has been leading the british effort to save the planet. and mr. clean is getting a little dirty for his first super bowl commercial. there
207,"but i don't think that climate change is an urgent, immediate national security issue. i think that long-term, it's really very vital that we deal with it. all you have to do is look at beijing, look at the smog in beijing. and tillerson was so right on it."
208,"look at the smog in beijing. wren this is heading. it's no good. but it's not like the north korean's have icbm that can reach seattle. you know, it's not that. steve: climate change is a good question for the epa guy not for the guy who is going"
209,"to run cia. by the way, from climate change to face change. face change. what happened here? you had a beer last week? i had a beard. i did o'reilly last week. i looked at myself and, first of all, it came in sort of white. so i bought this -- i bought            _"
210,"people, not necessarily celebrity's, but business people that have notoriety, make a run on that side. people that get things done. i don't take is just the economy, i think you have to make a point when you have a group of people that think climate change is more of a"
211,"the un and i heard our president say that climate change is the most important issue facing not onlythis generation but future generations, it was inspiring . pete: i love that piano music. i do agree with jerry seinfeld, getting to do a comedy by knocking on the"
212,"national parks posted tweets that were facts about climate change, then those tweets disappeared shortly after. i'm wondering if this white house had anything to do with that and if there is a broader acids been reported by other organizations if there is a broader mended mandate and"
213,"climate change. do you believe in gravity? do you know gravity is a theory? bill: here to analyze her, bernard mcguirk and greg gutfeld. gutfeld, i know that you lived with that woman in the 1980s. i don't know what happened to her. she wasn't like that when i was"
214,"before, the flip side of what barack obama did in his second term when he said, i've got a pen and a phone, used the pen to sign a lot of executive actions on immigration, climate change, and a variety of other matters that can all be undone with the"
215,elizabeth: yeah. it's not clear who's going to do that but he has that option could remake the executive actions dealing with climate change. i think that this is a way for him to make an early statement that this is not business as usual in washington there's a
216,"latest. i was in d.c. covering the march yesterday and there were signs for about every issue can think of whether immigration, women's rights, climate change or lgb tea with one eye sockets that i like making signs that one thing was clear that a vast majority of the marchers wanted"
217,"grilling on capitol hill, both appearing at odds on climate change and sanctions against russia but he expects his cabinet to speak their own mind, part of the reason he picked many of them. georgia republican senator david perdue joining us now. good to have you with us."
218,"burn. and finally, 'new york times' science writer covers climate change and said this, that might be the dumbest question i have heard today. of course i do. that is not a word to drive a stick. are there bodies with pickups, since then, of course, this neeo"
219,"here right now, it is of equal importance because it has the ability to literally save life on the planet itself. martha: as you just heard, what are the main tenants of the outgoing administration has been the attempt to put climate change on equal footing with the"
220,"his policies. obama, by all accounts, is a good man. i think we could and cried and the fact that he was our first african-american president. the problem is, when you turn to the policies, he pursued aggressively from obamacare to the iran deal to climate change, they are unpopular and they are"
221,"personally know someone there? burn. and finally, 'new york times' science writer covers climate change and said this, that might be the dumbest question i have heard today. of course i do. that is not a word to drive a stick. are there bodies with pickups, since then, of course, this neeo"
222,"42000 jobs and add $3.6 billion to the economy and blocking the keystone xl pipeline would have have almost no impact on climate change because the oil is going to get to market anyway. if you don't build the keystone xl pipeline, they will do it by rail and by truck, which will"
223,"political representatives of african-american -- martha: you are saying steve harvey is not the person for the conversation? i am talking about if you are talking about the gravitas of black america, no, i don't think that -- martha: but leonardo dicaprio can go talk about climate change with president obama and angelina"
224,"from ever entering the country. the iranian nuclear deal, he didn't go to the senate, the trump administration can take steps to get out of that agreement with the number one state sponsor of terrorism. climate change regulations likee the epa's clean power plan and the paris climate agreement can"
225,"if they want to do it, i'm all for it. but as i say, if you look at the total budget, which i did before coming, less than a billion is going to climate change. martha: i can't help but say, people listen to that, they say, it's not about moving money"
226,i'm not a client scientist expert but i can tell you i will become a lot more familiar with it and it will be based on objective science. i don't believe it's a hoax. a break from the president-elect who has suggested climate change is a hoax. zinke appeared to win over
227,"if they want to do it, i'm all for it. but as i say, if you look at the total budget, which i did before coming, less than a billion is going to climate change. martha: i can't help but say, people listen to that, they say, it's not about moving money"
228,"outgoing administration has been the attempt to put climate change on equal footing with the scourge of global terror, a position that could soon be coming to an end. reports out today suggest that under a trump administration, the state department would be reworked, there would be a renewed effort on stamping out"
229,not a question about cyber security a question about climate change and went on about lbgt issues. interviewing local police officer how do you feel about world hunger? yes it's an issue but has nothing to do with the job. she is one of the few people that gets to interview someone for the head of the
