116,2007 is to be sharedred within e enter governmental panel on climate change and al gore jr. for their efforts to buildup and disseminate great knowledge about manmade climate change.e c the international panel on
117,a fleet of jets to copenhagen to attend last year's climate change summit is the air coming from the left thick with hypocrisy? not to mention carbon emissions. [ male announcer ] it's a universal gesture.
118,"science out of it, and instead there's this mixture of sensationalism, misinformation and fear. coming up, the u.n. enters the for ray with a climate change of its own but it's filled with shock being"
119,"not the whole story, is it, because that tax would go for climate change initiatives? yeah, the u.n. had talked about this for a very long time and it's very problematic. a lot of the european countries"
120,came to a similar conclusion. the u.s. bureaucrats realized if a second report came out saying there is no discernible link between human activities and climate change people would begin to say why are we make for these junkets
121,leading the charge. we come here in copenhagen because climate change poses a great and growing danger. sean: the summit was thrown off course when a draft copy of the proposed agreement leaked. it showed plans to force
122,the president: the threat from climate change is serious. it is urgent. and it is growing. sean: the green revolution has taken democrat-controlled washington. it is no wonder in the 2008 election cycle environmental groups gave democrats nearly
123,"cook stoves have been a long-time part of the overall climate change. the whole agenda, cook stoves are the answer. this is the first concrete step. you have to understand this is part of globalizing the"
124,"climate disruption, you are now making it into an even bigger crisis. and we know, don't let a crisis go to waste. this is making it go to 11. it is turning it to 11. i don't know though. i think global warming is not cahing on, so let's change it up and nobody will notice."
125,"that? well, first of all, in terms of global warming, it's not settled science, we certainly should not penalize our economy to the tune of a trillion dollars when we have this weakened economy. and you know, in terms of social security, i am absolutely for it, for saving social security, preserving it, not only for"
126,"we will have global government run by elites. are you elite? we don't have a stay on this. i didn't know about the cook stove idea. did you get a shot of that one? mice to think about -- nice to think about, you know, all the global warming thing is about the planet and warm food for hungry ugandans, but"
127,"we will have global government run by elites. are you elite? we don't have a stay on this. i didn't know about the cook stove idea. did you get a shot of that one? mice to think about -- nice to think about, you know, all the global warming thing is about the planet and warm food for hungry ugandans, but"
128,"discernible link between humanik activities and climate change, then people would begin to say why are we paying for all these junk gettings around the world every three months. when the second report was published in 1995, all the en"
129,"to rewrite history. in a recent interview with the bbc, mann said this about the graph. thought it was somewhat misplaced to make it ao central icon of the climate change debate. while the, quote, investigations, turned up nothing, thect impact is clear."
130,"survey done. on climate change i said look, nuclear power has to be part of it. now thanks to harry reid and the radical environmental movement that close yucca mountain, there is no recycling, so nuclear power is basically not viable. on immigration, look, if"
131,"staunch opponent of cap-and-trade legislation, the climate change bill in congress. that he now thinks much of health care reform should be repealed though he was never actually a straight up opponent of it. he supported the stimulus but now he is talking very"
132,"now they are trying to ram through a repeal without any kind of really realistic survey done and climate change, i said, look, nuclear power has to be part of the it and thanks to harry reid and the environmental movement that closed yucca"
133,"on climate change i said look, nuclear power has to be part of it. now thanks to harry reid and the radical environmental movement that close yucca mountain, there is no recycling, so nuclear power is basically not viable. on immigration, look, if anybody hasn't seen what is"
134,"let's hope, is right. and now we have to bring back vague, get out there and spend money. bill: you and me, girl. martha: let's go. bill: one of the men who helped create al gore's documentary on climate change taking on the rather unexpected target, you could say. if you look at what has"
135,"they teach students about how the climate is changing, they explain the science behind climate change and how we can change our daily practices to help save our planet and role in preparing students for jobs in the green economy. glenn: there is no green economy. america, this is your job as"
136,"explain the science behind climate change and how we can change our daily practices to help save our planet and role in preparing students for jobs in the green economy. glenn: there is no green economy. america, this is your job as a parent. did you ask your schools to make your child a green environmental citizen?"
