120,"about global warming could turn the gop into the antiscience party. shannon? interesting. peter thank you very much for the update. all right sox just how serious a threat is the governor, governor perry to presumptive frontrunner mit"
121,of a heart attack. it was old. they don't exercise. i accept -- i can accept climate change. it is the whole man made thing
122,he is pro let's get into the climate change and figure out how to fix it and it is shmupert-shmurdoch. are ugly people stupid
123,position. they did it with global warming. you could only haveép one position. now you have this left winger saying on the tea party thing the media shouldn't be reporting what the -- the pea party position. can you imagine the -- can you            _
124,"wow. i'm troubled by that. i like it. you did like it? you are a big libertarian guy. i am reading a same question from the earlier sheet. you have a take on global warming. you covered it in [bleep],"
125,word 'theory' is sloppy. there is a lot to rip apart on what he says. and yet something doesn't feel right to me about the global warming thing. the major thing is you can't see bill gates saying anything about it.
126,"people lose everything they lose it. that's what we just saw. when you start to lose that global warming debate like he has, it has been a while back that meeting they had was dressed done by a congressman from louisiana."
127,"factor' and they've always turned us down in the past but we hope they will reconsider. check two. in addition to causing hurricane irene global warming may be responsible for brand new generation of racists. take it away, al gore."
128,denying global warming are part of organized effort against the entire scientific community. finally we know vladimir putin isn't shy when it comes to publicity stunt so it should be no surprise when a doctor asked russian prime minister about his knelt a
129,"where does that come from? i think some people, there were some in our administration who felt this way, i wasn't one. this notion that somehow global warming was a major cause of recruitment -- that guantanamo bay was a major"
130,denying global warming are part of organized effort against the entire scientific community. finally we know vladimir putin isn't shy when it comes to publicity stunt so it should be no surprise when a doctor asked russian prime minister about his knelt a
131,"global warming. kimberly: really not. greg: it's now the cosmic rays of the sun. bob: you know what is it? greg: called nature. bob: the full moon. greg: 8000 -- bob: you guys are -- eric: coming up, rick perry versus the fed."
132,"tonight, al gore compares anti-global warming people to racists. and colin powell slams dick cheney. bill: reality check and we begin this evening with dick cheney's new book that slams people like condaleeza rice and colin powell. mr. powell doesn't like it."
133,"right wing republican party that does not believe the science of global warming. greg: no, no, no. when you find out -- bob: what is wrong with that? greg: the science was dill luteed by self- -- diluted by self-promotion and"
134,"we think there is global warming and we agree to reduce emissions, if china doesn't do the same, where he used to be the ambassador, it doesn't matter at all. kimberly: it won't matter what we do. it's a drop in the bucket."
135,"global warming. kimberly: really not. greg: it's now the cosmic rays of the sun. bob: you know what is it? greg: called nature. bob: the full moon. greg: 8000 -- bob: you guys are -- eric: coming up, rick perry versus the fed."
136,huntsman tweeted this. to be clear i believe in evolution and trust scientists on global warming. call me crazy. according to the numbers from gallop huntsman may have been a roundabout a whole lot of americans crazy. 40% say god created humans
137,"is meant to be a sacred wore in the sense of the civil rights movement. yes his father was a southerner, i stan that. for al to use this in connection with global warming is a poor choice of words."
138,"evolution and trust scientists on global warming. can me crazy.' according to the latest gallup polling on the issues of evolution and creation, huntsman's tweet may have offended millions of potential voters. 30% creates that god creates humans just as we are today."
139,"perry and talking about the treasonist comments and trying to distance himself in that. clayton: and meanwhile, governor rick perry taking on huntsman now over global warming, take a listen. john is going to make his own decisions and i just"
140,"greg: stupidity, it's semiplified by a lot of people who have been spreading this -- bob: 99% of the sciencetists in the world. dana: huntsman knows we should all recognize this, if we think there is global warming and we agree to reduce"
141,"nicer to them, they will be nicer to us? where does that come from? i think some people, there were some in our administration who felt this way, i wasn't one. this notion that somehow global warming was a major cause of recruitment -- that       _"
142,"so does he think it has been paw lit tau sized, and does he think there has been a substantial number of scientists who have manipulated the data? i do believe that the issue of global warming has been paw lit sized. there is a substantial number"
143,"it is a growing problem on you, bill. you have been setting global warming since 1971. it is a scam. growing up in the 70s they told us, if you don't take care of the environment, by the year 2020 there will be an ice age."
144,i looked this up. bill gates has made a couple of comments about global warming that are all along the lines of 'we should keep looking into it.' i don't know anything about it except that bill gates has an infinite amount of money and a
145,"lauren you said it is a convenience stance for the governor of texas to not believe in global warming. it is true. they produce more carbon dioxide than any other state in the jiecht so i got it right, yeah? absolutely. so much for the corrections thing."
146,"unconstitutional. al gore takes a crew said against global warming skeptics to a new level. you want to hear what he is saying now next in the grapevine. you are paying millions in tax money for postal worker toes do absolutely nothing. nationwide insurance, what's up ?  _"
147,"i expect it to threaten. all i'm trying to say is connie and diane 1955 back to back. carol and edna, 1954 back to back. dennis and floyd 1999. it will not be global warming if we're threatened in 10 days. watch the western gulf, by the"
148,"way, this weekend and japan is about to get hit by a major typhoon. none of this is global warming. it's nature doing what nature does. bill: ok, can you give us any preview of what's happening now with the storm in the east"
149,"yeah, i don't understand it. bill: you know how people are. no, but what's going on here is this. it's surreal to me. the left side of the aisle wants the global warming. to counter them, they want to dehype storms. can't we just judge something"
150,the right compared -- whatever the issue. raising taxes to racism. imagine the outcry that there would be. bob: i heard that somewhere. dana: haven't they done that? bob: you take one scientific area where all the global warming research which is overwhelmingly in favor of
151,the right compared -- whatever the issue. raising taxes to racism. imagine the outcry that there would be. bob: i heard that somewhere. dana: haven't they done that? bob: you take one scientific area where all the global warming research which is overwhelmingly in favor of
152,"yeah, i don't understand it. bill: you know how people are. no, but what's going on here is this. it's surreal to me. the left side of the aisle wants the global warming. to counter them, they want to dehype storms. can't we just judge something"
153,"i expect it to threaten. all i'm trying to say is connie and diane 1955 back to back. carol and edna, 1954 back to back. dennis and floyd 1999. it will not be global warming if we're threatened in 10 days. watch the western gulf, by the"
154,"way, this weekend and japan is about to get hit by a major typhoon. none of this is global warming. it's nature doing what nature does. bill: ok, can you give us any preview of what's happening now with the storm in the east"
155,rights. jon huntsman ridiculed perry's doubt about manmade global warming and evolution. long-time critic ron paul who suggested that perry may not survive much more scrutiny from the press and public. ask me in two weeks. we don't know. this might be a splash.
156,"discussion. i think whoever did that was exactly right. here is the deal. if you're caught in a snowstorm because of no global warming, a lot of snow. you're stuck there, a skinny person will only last three or four days. greg: that is true."
157,"it's just a matter of we need to go through the appropriations process. bob: there will be planty of money around. kimberly: the bills will get paid. eric: can we talk about this, staying on the theme of global warming? did you hear comments out of"
158,"it's just a matter of we need to go through the appropriations process. bob: there will be planty of money around. kimberly: the bills will get paid. eric: can we talk about this, staying on the theme of global warming? did you hear comments out of"
159,"shepard: ask him why he doesn't believe in science, she said. later in the day his fellow candidate jon huntsman took a shot at governor perry with this tweet. to be clear, huntsman said, i believe in evolution and trust scientists on global warming. call me crazy."
160,"discussion. i think whoever did that was exactly right. here is the deal. if you're caught in a snowstorm because of no global warming, a lot of snow. you're stuck there, a skinny person will only last three or four days. greg: that is true."
161,rick perry does not can the republican party elect someone president who doesn't believe in global warming? he referred to social security as a crumbling monument to the failure of the new deal. he compared social security to a bad disease and it was set
162,rights. jon huntsman ridiculed perry's doubt about manmade global warming and evolution. long-time critic ron paul who suggested that perry may not survive much more scrutiny from the press and public. ask me in two weeks. we don't know. this might be a splash.
163,clear i believe in evolution and trust scientists on global warming. call me crazy. the faith and skepticism about science can help him politically in iowa and south carolina where more than half of the gop voters are self-described evangelicals but in the past those claiming
164,"any other context than what it is meant to be a sacred wore in the sense of the civil rights movement. yes his father was a southerner, i stan that. for al to use this in connection with global warming is a poor choice of words."
165,rick perry does not can the republican party elect someone president who doesn't believe in global warming? he referred to social security as a crumbling monument to the failure of the new deal. he compared social security to a bad disease and it was set
166,"crugman. you would think with sag, one of them would have to change their names. if we discovered alien, it would end our economic slump. i am assuming he's all for global warming, right? sure. that stands to reason, right. i think it would end the"
167,"bill, is this report a sign that you and your fellow global warming alarmists are desperate? listen, it's a lot more than that. first of all, could we get rid of the notion that there is any type of alien that even remotely resembles what hollywood would"
168,science said what is causing global climate change and i think we find ourselves on the wrong side of scientists and therefore in a losing position. you had an injury from
169,change doesn't cause mental illness. mental illness causes climate change hysteria. or the harmful chicken little mentality causes panic prone ph.d.s to lead to junk science like this. think about everything we're
170,from 2009 when they cost the government $31 million. the postal service expects to lose $7 billion this year. al gore is comparing climate change skeptics to racists in the civil rights movement.
171,attention earth lings. a new report is asking if global warming may raise the risk of alien attacks. earlier we reported this was from nasa and i said i am not making this up. it turns out i was making that up. it is actually the work of a
172,they did it with the gay rights movement when they said you could only have one position. they did it with global warming. you could only haveép one position. now you have this left winger saying on the tea party thing the media shouldn't be reporting what the -- the pea            _
173,"you have heard all the global warming hysteria out there, a new report links it to mental illness. yes, greg will give you his take on 'the five' up next. bob: which makes sense. greg: welcome back to 'the five.' new report suggests that climb change could lead to"
174,"a serious note that global warming is in the only real, it's changed the dynamics of the planet. it's caused a lot of these things, like a lot of the natural disasters and people do get bummed out as a result of that. there are lasting post tra"
175,"caught the way the bozos in louisiana were caught back during katrina. they're just not. and the media has changed, too. you're right about that. bill: all right, bernie, thanks very much, as always. reality check on deck. tonight, al gore compares anti-global warming people to racists."
176,"you have heard all the global warming hysteria out there, a new report links it to mental illness. yes, greg will give you his take on 'the five' up next. bob: which makes sense. greg: welcome back to 'the five.' new report suggests that climb change could lead to mental illness."
177,"a serious note that global warming is in the only real, it's changed the dynamics of the planet. it's caused a lot of these things, like a lot of the natural disasters and people do get bummed out as a result of that. there are lasting post tra"
178,"sign of things to come. i do think that the tea party may have been involved. dana: i thought you'd blame global warming. bob: i think it has a lot to do with it. andrea: you are always shaking. bob: no, i used always be shaking. eric: some of the west"
179,"tweet -- 'to be clear, i believe in evolution and trust scientists on global warming. can me crazy.' according to the latest gallup polling on the issues of evolution and creation, huntsman's tweet may have offended millions of potential voters. 30% creates that god creates humans just as we are today."
180,"governor, speak a variety of languages so you know the power of your comments so when you say a comment like that, regarding michele bachmann, or you talk about some in the party who do not believe in global warming and you call them out on it, you"
181,"you -- bob: i want you to sit out in the desert, bolling, in the heat. okay? you and the heat no, water, no food. see if you think it's global warming. greg: this is the point i go to a tease. coming up, a man of many words"
182,or you are an evil person and you need some kind of medical attention for what believe in. the same as they did on global warming. they spent years saying there was only one polite position. then the same thing about gay rights. now there's only one polite
183,"for getting up bright and early and explaining your view. thank you for inviting me. the department of education teaching global warming with the help of spongebob? up next, the green agenda getting pushed on kids on your dime. and is having a cell phone a civil right?"
184,"in high school, and she said, we had a choice. we could either watch 'inconvenient truth' or some other michael moore film. that's quite a choice. steve: so we chose 'global warming.' gretchen: coming up, this video is tough to watch. a police officer mowed down in a"
185,"about the $2 gas and michele bachmann says she would bring it down to that level and talking about mitt romney's questionable jobs record in massachusetts you name it, but none of it thus far working. clayton: and talking about global warming, literally registers right now the last"
186,"comment from rick perry and john huntsman going after everyone and he's taken on mitt romney in the past regarding job creation, will it work? i don't know. clayton: if you dive into the weeds a little bit on this global warming thing, you see that it seems that facts are"
187,"10-1 deal? every hand is raised there. so, it's an odd statement to come out on that and he also has been taking on governor rick perry on global warming, which is one of the issues right now, not really on the top of everyone's radar this"
188,"eyebrows, are we in the dog days of summer now? we've got candidates and debates right now, and global warming, there's the grizzly bear. are we awaiting what president obama is going to say, he's on vacation right now and congress out of session right now. are we awaiting what's going"
189,"who is to blame for the downgrade? senator rand paul is here to defend the tea party against empty accusations. still to come, al gore unhinged blasting climate change critics for daring question his beloved"
190,president obama. and we may finally have an explanation for all of al gore's erratic behavior. a new report says continuing climate change could lead to an increase in mental illness. all that and more.
191,harder for chickp littles like himself to talk about climate change now that we all wiseed up. taste this wine. greg: wow! that was elegant. daps he won't be in mix company. did he say this or a rant
192,"credibility of scientific data on man's role in global climate change, perry expressed disbelief. i do not buy in to that a group of scientists who have in some cases found to be manipulating this information."
193,"career. i've been out there arguing when it was unpopular for entitlement reform and private sector health care. i didn't advocate for climate change and things like that. i've been someone who has led on all the issues, national"
194,"i have problems with the fact that with romneycare, the government rationing under another name. the support of climate change, which obviously especially coming from a manufacturing state, i disagree with. i oppose the wall street bailout"
195,"career. i've been out there arguing when it was unpopular for entitlement reform and private sector health care. i didn't advocate for climate change and things like that. i've been someone who has led on all the issues, national"
196,"downgrade? senator rand paul is here to defend the tea party against empty accusations. still to come, al gore unhinged blasting climate change critics for daring question his beloved cause. our great, great american panel, reacts."
197,"the right time is, look we got markets falling apart. everybody is worried about their job. it is going to be hard to move the country now about climate change. he couldn't explain his point of view without"
198,on the flat earth. eric: you are making an exchange to climate change -- andrea: but obama is a natural disaster and he bums people out. bob: nice shot. andrea: why do liberals never want to focus on mental
199,"illness? it's serious. we have the arizona shooting and rather than talk about the fact that jared loughner has a serious mental illness, they blame it on guns. now again they blame climate change on -- bob every single                 _"
200,"illness? it's serious. we have the arizona shooting and rather than talk about the fact that jared loughner has a serious mental illness, they blame it on guns. now again they blame climate change on -- bob every single piece, serious --  _"
201,on the flat earth. eric: you are making an exchange to climate change -- andrea: but obama is a natural disaster and he bums people out. bob: nice shot. andrea: why do liberals never want to focus on mental
202,170000 hours but that is down from 2009 when they cost the government $31 million. the postal service expects to lose $7 billion this year. al gore is comparing climate change skeptics to racists in the civil rights movement.
203,"former vice president al gore is making news, thanks to a speech about global warming he gave in aspen last week. it's a topic al gore is passionate about and he got angry during the speech. he got so angry during the speech, he almost woke a couple of people in the audience up."
204,"dana: i can't believe you -- bob: i want you to sit out in the desert, bolling, in the heat. okay? you and the heat no, water, no food. see if you think it's global warming. greg: this is the point i go to a tease. coming up, a man of many words"
205,"east coast. we have avoided it up until now. this is maybe, you know, a sign of things to come. i do think that the tea party may have been involved. dana: i thought you'd blame global warming. bob: i think it has a lot to do with it. andrea: you are always"
206,"to new hampshire and took on global warming and the validity and 42% of new hampshire are nots don't know who he is. maybe if he keeps making the statements like this and taking on the president, that will change. and no surprise that governor perry came back and said this is"
207,"al gore let's loose on climate change deniers. eggland's best eggs. -the best in nutrition. -just got better. even better nutrition -- high in vitamins d, e and b12. a good source of vitamin b2. plus omega threes. and 25% less saturated fat"
208,"al gore let's loose on climate change deniers. service was very moving, wasn't it? yes, it was. i'm so glad we could be here for larry. at a time like this, friends and family matter most. even preparing this lunch is a help,"
209,"pre game report. w45* is coming up on tonight's show? and microphone check one, two. why did al gore compare climate change skeptics to racists? they will try to answer without using the phrase, that's how he rolls straight ahead."
210,"hanging in there. good to hear. i have a lot of boring facts today. excellent. as if that is any different. well, they are actually facts. true. gore and the climate change , denial thing. margaret you said if you don't"
211,agree with us you are a racist. i agree and i do think democrats need 20* pick a crazy uncle and stick with him. i would pick biden because he is more fun. but gore wasn't saying climate change skeptics were racist.
212,"sacred tenets of scientific exploration, which is raising questions about an idea which makes your theory stronger when people question you. what he was trying to say is at one point when you talk about the climate change, it will be like -- denying it            _"
213,"sacred tenets of scientific exploration, which is raising questions about an idea which makes your theory stronger when people question you. what he was trying to say is at one point when you talk about the climate change, it will be like -- denying it            _"
214,disagree on climate change because science has been hyped up as we know those e-mails. you find that disgrace full? i do. that's one of your -- leading questions. i find the use of that word in any other context than what it
215,"thes -- 'the independent's. clayton: mitt romney also believes in man made climate change and believes in evolution, some of the things that came out and jon huntsman saying the same and are they playing to the new hampshire independent voter that may"
216,"job. we hope you saw some of the fox news coverage of the hurricane. it was the best in the business. next on the rundown, you knew it would happen. far left people are blaming hurricane irene on global warming and later, bernie goldberg on whether the media reported the hurricane responsibly or hyped it to death."
217,"job. we hope you saw some of the fox news coverage of the hurricane. it was the best in the business. next on the rundown, you knew it would happen. far left people are blaming hurricane irene on global warming and later, bernie goldberg on whether the media reported the hurricane responsibly or hyped it to death."
218,"unconstitutional. al gore takes a crew said against global warming skeptics to a new level. you want to hear what he is saying now next in the grapevine. you are paying millions in tax money for postal worker toes do absolutely nothing. [ oswald ] there's a lot of discussion going on about the development of natural gas,"
219,"if you are talking about something you are supposed to say let me prove to you using science and not just saying, i don't want to talk to you about this. the people who are hurt the most about this are people who are racist and don't believe in global warming. those people do not tan easily"
220,"significant or insignificant. you go to the next step is there anything you the do other than spending billions of taxpayers' money on stupid things eric: bob: wait a second there is a lot of the wing of the republican party, the right wing republican party that does not believe the science of global warming. greg: no, no, no."
221,it is either that you are such a moron to be thinking these things that you shouldn't be allowed at the dinner table with adults. or you are an evil person and you need some kind of medical attention for what believe in. the same as they did on global warming. they spent years saying there
222,investigating. clayton: breaking down the statistics and mitt romney has come out in support of man made global warming and this is one of the issues right now that you turn the attention around and talk about jobs and this is what people are getting taken off message and then of course-- we're talking about it this
