230,"accidents. i give them a lot of credit for that. dana, it is about fossil fuels. they don't care if it's a pipeline or a train. everything is about climate change, everything. what i think, i know that the department of the interior is already reaching out to the tribes and i think that if the"
231,"less than 10% of the department of defenses. if you take a look at where they spend it, they spend $20 billion on combating terrorism, less than a billion on climate change. so, if you want to do more, you are going to have to give them our money. martha: the amount of money that it is attributed to"
232,"of defenses. if you take a look at where they spend it, they spend $20 billion on combating terrorism, less than a billion on climate change. so, if you want to do more, you are going to have to give them our money. martha: the amount of money that it is attributed to something, whether or not the"
233,"what's expected in combat. yeah. as long as you don't lower the standards, everything is going to be good. such a great point about green sweeps and everything too. that's been the obsession climate change. it has to move back to isis. it does. the navy doesn't need to be running on biofuel, the navy needs the ability to put a"
234,that walls have good neighbors and that's what a good was for. maybe that's why were going to build one on the southern border to make sure we have good neighbors. this is a hypocrisy of our elected officials. they all say one thing and they go into something else. it's like the climate change expert. the left wing liberals who want to come and see donald trump but
235,that walls have good neighbors and that's what a good was for. maybe that's why were going to build one on the southern border to make sure we have good neighbors. this is a hypocrisy of our elected officials. they all say one thing and they go into something else. it's like the climate change expert. the left wing liberals who want to come and see donald trump but
236,that walls have good neighbors and that's what a good was for. maybe that's why were going to build one on the southern border to make sure we have good neighbors. this is a hypocrisy of our elected officials. they all say one thing and they go into something else. it's like the climate change expert. the left wing liberals who want to come and see donald trump but
