0,critic and skeptic of climate change science. he defended his position that government regulation with hurting business and development but also differed from the president when it came to defining climate change.
1,chipping away at donald trump's credibility. to hurt him and destroy his agenda. i agree with some of that but he's going to be constantly -- i love the hollywood liberals. i love the whole global warming
2,read those materials with respect to climate change. i know the agencies role is to collect foreign intelligence. jesse: you have a democratic senator from california asking the cia directors opinion on climate change.
3,"high ground, but you put that man's statement. but that man doesn't believe in climate change."
4,"analyst sees a the -- is the impact of climate change. do you have any reason to doubt the assessment of these cia analysts? senator, i haven't had a chang chance to read those materials with respect to climate change."
5,"going to, you know, expand this program or eliminate this program. how concerned are we about air pollution or climate change?"
6,change science. he defended his position that government regulation with hurting business and development but also differed from the president when it came to defining climate change. do you agree that global
7,"for saying wait a minute, let stop this and have a chance until we get a hold of this agency. tucker: right. the pentagon has been doing the very same for the past eight years and the state department, every department in the global warming department."
8,is a global kfrgdz. and i want to capture correctly your impression of paris. as i stated before in my statement of climate change.
9,"talk about gender later. we've got a war. we have terror, cyber terror. cumulus clouds aren't trying to kill us? climate change isn't an"
10,"senator from california asking the cia directors opinion on climate change. this is why they lost the election, i think. judge jeanine: it's climate"
11,"it's a great company. i'm worried about one thing, they want to get in hollywood and they're going to dissipate some of that cash. david: what do you like, bill? dr. pepper snapple. the kid will get thirsty and earn back some of the money. that's going to happen if it's global warming and it's"
12,"upon which we all rely. in part, that means multinational institutions because we know that so many of the threats we face today, global terrorism, climate change, organized crime,"
13,yeah and she was questioning the use -- if she questions the use of computer models or that weather is a big complex system then you're called a climate change de denier.
14,"minimum wage are women. this is an economic argument. the health care argument. and then there were also extension issues like immigration reform, to go against donald trump and the republican party's climate change agenda."
15,environmental regulations should not occur in an economic vacuum. ed markey tried to drive a ridge between pruitt and president-elect trump. do you agree that global warming is a hoax? to go i do not. so donald trump is wrong? to go i do not believe climate
16,environmental regulations should not occur in an economic vacuum. ed markey tried to drive a ridge between pruitt and president-elect trump. do you agree that global warming is a hoax? to go i do not. so donald trump is wrong? to go i do not believe climate
17,"project. it would move 1000 barrels of oil a day from alberta to a refinery on the gulf coast. barack obama rejected the pipeline into thousand 15, saying it would hinder efforts to reach a global climate change deal."
18,"now, global warming is real. climate change is happening. but mr. obama's vision of hurting certain economic sectors in america in order to lessen fossil fuel intrusion cannot"
19,"elephants. the only evidence against climate change. this picture, it's the only scientific evidence that global warming isn't real. 31100 year's ago you didn't see elephants with sweaters on. we didn't have at sea."
20,"us. that's a dangerous road for democracy. greg, take us down the road of democracy. i think the phrase alternative facts is freaking people out but it's not a new phenomenon. we've been living this duality of truth for decades. if you look at climate change."
21,"never take our free time. look, the fact that climate change is at the center of this, the fact that global warming is the core, most government employees i'm going to guess are democrats. democrats like the government."
22,"morgan said. meryl streep was talking about the person who is going to be the leader of the free world, our president, commander-in-chief of the strongest and best nation in the world, and not showing his best. brad, ward shows are constantly used for politics. people talk about climate change"
23,"massachusetts democrat senator tried to drive a when between pruitt and president-elect trump trump. do you agree that global warming is a hoax? i do not, senator. so donald trump is wrong? i do not believe that climate change is a hoax. okay, that's important for"
24,"500 years of climate change data and they saw a slight increase in temperature increases the quality of a fine wine. red wine taste better if the temperature goes up slightly, just slightly. this means that global warming is good, especially if you are a drunk like me."
25,"speak to, say, i don't know, george clooney. the problem is, there are political representatives of african-american -- martha: you are saying steve harvey is not the person for the conversation? i am talking about if you are talking about the gravitas of black america, no, i don't think that -- martha: but leonardo dicaprio can go talk about climate change with"
26,"one of the great ironies, brian that a lot of people don't talk about, president obama's own environmental assessment through his own state department showed they would emit more greenhouse gases by not building this"
27,canadian oil production of the greenhouse gases that creates all while she flies around in one of her big chance. the size of a small town as their carbon footprint point specifically a doll of her jet setting she's doing worldwide.
28,"here is a bit of what he faced from lawmakers today. donald trump has called global warming a hoax caused by the chinese. do you agree that global warming is a hoax? i do not, senator. so donald trump is wrong? 's because i do not believe"
29,"climate change. this is why they lost the election, i think. judge jeanine: it's climate change as it relates to isis,"
30,"her way they will not get confirmed. if president-elect gets ready to bid farewell. i never cried before, i her our president say a climate"
31,"back just before thatdeadly shooting spree . clayton: celebrities cannot help themselves . i never cried before except election results when i was at the un, i heard our president say that climate"
32,"he has no political bone to fight. oh, no. crazy liberals. it is crazy to think that climate change takes priority. there is intent to end our civilization. climate change, even a slight"
33,he's vowed in the past to do that. the u.s. one of 194 countries that signed the agreement in the hopes of reducing greenhouse gas emissions the next two decades. any country that leaves the deal would have to wait four years to
34,do you agree that global warming is a hoax? i do not. so you disagree with the president?
35,"doesn't, it stands for central. brien: what about climate change and your vision of the world, wait a second, climate change is an issue but we can't be the only one fighting for it"
36,"president trump delivering a big blow today to president obama's environmental legacy, signing executive orders to move forward with the keystone xl and dakota access pipelines. president obama killed the project in 2015 over climate"
37,"so any questions about his belief on healthcare and questions about his finances, shep. shepard: thanks. more to come. president-elect trump's pick to head the epa, scott pruitt, said he doesn't believe climate"
38,respect to climate change. i know the agencies role is to collect foreign intelligence. jesse: you have a democratic senator from california asking the cia directors opinion on climate change. this is why they lost the
39,respect to climate change. i know the agencies role is to collect foreign intelligence. jesse: you have a democratic senator from california asking the cia directors opinion on climate change. this is why they lost the
40,"but it's not as pressing and urgent as isis. i see. i will leave it alone. we report. you decide. juan, are you making a commercial. write a letter to your editor if you're upset about climate"
41,"the climate agreements, international climate change funding as a part of that. the obama admin's ration is unilaterally pledging $3 billion to the u.n. green climate fund. the initiation has requested 1.3 billion for global climate change initiatives in this"
42,"the minimum wage. two-thirds of people on the minimum wage are women. this is an economic argument. the health care argument. and then there were also extension issues like immigration reform, to go against donald trump and the republican party's climate"
43,"was telling the truth but could not offer assurances. then came the hearing for scott pruitt, chosen to head the epa. he is from one of the biggest oil and gas estates, is a fierce critic and skeptic of climate"
44,"of climate change.' do you have any reason to doubt the assessment of these cia analysts? senator, i haven't had a chance to read those materials with respect to climate change. i do know the agency's role there. its role is to collect foreign"
45,"nominee. my understanding was that democrats were going to pick and choose their battles. there were some that were important. you want to make an issue out of climate change, ask questions. ask rex tillerson about climate change in russia. russia is such a big issue."
46,"on the issue of climate change, trying to see if they could drive a wedge between him and president-elect trump. pruitt says he does not believe that climate change is a hoax. mike emmanuel we look forward to your coverage of inauguration day on friday."
47,"climate change alone. bret: mollie. this should not be such a dramatic thing for him to say except that for the last eight years, we have been told that climate change is the greatest national security threat we face. which i think a lot of people have found frustrating and a"
48,"concern. this is the state of california! immigration is going to be a key, and climate change is going to be a key, because a look at this as a man who, during his campaign, called climate change and some other words a hoax. i guess, didn't we learn from"
49,"choose their battles. there were some that were important. you want to make an issue out of climate change, ask questions. ask rex tillerson about climate change in russia. russia is such a big issue. you want to find out as much as you can about what president trump's policies going to be toward russia."
50,"the iranians do not fear barack obama. in international matters, it's clear, president obama believes global warming is more important than stabilizing and protecting the world. in the face of a global."
51,"we are told that global warming, there's a 97% consensus but that's based on the two question survey. we've been told that shooting of unarmed black men have risen dramatically by white officers"
52,"governor there that is concerned about his legacy, because he is concerned about climate change being part of his legacy. if they are so concerned about climate change, one of the utilities in california says that they are going to switch as much as they can to solar because it's clean. and your utility bills are going"
53,from australia to vegas on a private jet. he is lecturing us about global warming? really? really. of course he's lectured the american people about green who has been knee-deep with corrupt
54,"you support global warning, two of my least favorite subjects. an educational issue, one i cannot possibly define with any accuracy. global warming is real but no one knows whether it's a natural"
55,"they can't necessarily deliver the goods. what's this? global warming? they are often high-minded peer comedians often think they know more than other people. they think that, don't they? i don't know. are you running for"
56,"international leadership on climate change issues with the international community? i think it's important that. the united states maintain its seat at the table in the conversations around how to address threats of climate change which do require a global response. no one country is going to solve this alone. thank you. senator rubio. well, mr. tillerson. do you believe during the 2016 presidential campaign russian"
57,"election, i think. judge jeanine: it's climate change as it relates to isis, or --  _"
58,"election, i think. judge jeanine: it's climate change as it relates to isis, or --  _"
59,"better wine means happier people, which means fewer wars, a better planet. ie, ergo, global warming equals global peace. we win. i love you. cheers! i like that. bill: 's what is your last one? my last run is how to be more"
60,dicaprio wanted to celebrate new year's eve twice so he flew from australia to vegas on a private jet. he is lecturing us about global warming? really? really. of course he's lectured the american people about green who
61,human cause climate change which is where all of the research and focuses being directed and it's
62,"after boarding, the woman started causing troubles. that man doesn't believe in climate change. dto believe in gravity?"
63,"tucker: right. the pentagon has been doing the very same for the past eight years and the state department, every department in the global warming department. what department if you were trump were you trying to get under control first? i would certainly want to get"
64,"tucker: former vice president al gore had an inconvenient moment over the weekend. we have the video to prove it. an inconvenient single, go see it, gores confronted by a woman who asked why the cataclysmic global warming tipping point, which he predicted would occur"
65,did you buy the stock and introduce a bill that was helpful to the company you bought stock with. do you agree with that global warming is a hoax? heather: who is in the hot seat next? the announcement today that could pleat the cabinet.
66,"this is why they lost the election, i think. judge jeanine: it's climate change as it relates to isis, or --  _"
67,"global warming? they are often high-minded peer comedians often think they know more than other people. they think that, don't they? i don't know. are you running for something? i don't think i would run, but they could handle my way. i could get around a debate."
68,that man doesn't believe in climate change. do you believe in gravity? my husband lost his life. have some respect. oh boy.
69,"climate change or an evil military foot print, the left invented fear. now they're getting the vapors. screw 'em. [cheers and applause]"
70,"climate change or an evil military foot print, the left invented fear. now they're getting the vapors. screw 'em. [cheers and applause]"
71,seeing is this dominant theme of human cause climate change which is where all of the research and focuses being directed and it's
72,a woman flown off an airliner for yelling about politics. that man doesn't believe in climate change. bill: out of here. 'the tip' moments away.
73,i love the whole global warming and they fly in on their own planes. they never go anywhere but what i love about it is the liberal elites and the democratic party loves them. they love very little else. they don't love the blue collar workers anymore. they don't love the people that
74,"republican lawmakers had been blocking, they didn't want to aide the palestinians as they sought membership. $4million for climate change programs and another million for un organizations."
75,warming is a hoax? i do not. so you disagree with the president? i do not believe that climate change is a hoax. south carolina governor nikki
76,"planet, what did you do? you noted earlier in this conversation with the chairman the impact of climate change is limited. you indicated that. but also indicated while we"
77,a seat at that table. neil: like a liberal who hears a former ceo question everything behind climate change and that is exactly what you witnessed rex tillerson doing.
78,$55000 a month to fight things like climate change and immigration and the wall. it's unconstitutional since california law to hire outsider for jobs that can be done by
79,heather: donald trump came around on the issue of water boarding and mattis convinced him. he ran opposition to climate change and muslim ban and russia's fine and water
80,"and, they say goodbye to president barak obama. i never cried before. and i heard him say that climate change was the most important institution. say farewell to president"
81,"not the grass, greg. on climate change i don't think there's much debate. i disagree. i read the studies. you read what people put in their mind lender."
82,on climate change. many saw the messages as a protest on president's trump position on climate what i think and epa source telling fox that the mu administration instate --  _
83,that man doesn't believe in climate change. do you believe in gravity? ainsley: do you believe in gravity she asked. target of that woman's range. there he is.
84,organizations who are in the energy sector. and devoted to fighting climate change. with respect to the -- don't you see? exxon-mobil. really? scott pruitt was also grilled
85,the energy sector and devoted to fighting climate change. some of whom i have sued as well. name one you have sued. exxonmobil. really? yes. nikki haley grace concerned
86,"accept the science of climate change, i've been told even rex tillerson does now and the pentagon does. and here i am in the state capital, the governor, the"
87,"tucker: you just said, i'm not holding you to account for censorship. 90% of the world scientists believe in climate change. first of all, how do you know"
88,"tucker: you just said, i'm not holding you to account for censorship. 90% of the world scientists believe in climate change. first of all, how do you know"
89,the energy sector and devoted to fighting climate change. some of whom i have sued as well. name one you have sued. exxonmobil. really? yes. nikki haley grace concerned
90,"has said that this couldn't happen. hillary clinton has said it now they don't like the outcome. the limousine liberals. people fly in private planes complain about global warming and complain about donald trump. take their efforts, unify the country for a change and say in four years from now maybe you should go out and"
91,"take the challenge of climate change. in just eight years, we have our dependence on foreign oil, we've led the world to an agreement on a promise to save this planet."
92,"but without bolder action, our children won't have time to debate the existence of climate change. they will be busy dealing with its effects. more environmental disasters, more economic disruptions, waves"
93,"take the challenge of climate change. in just eight years, we have our dependence on foreign oil, we've led the world to an agreement on a promise to save this planet."
94,"but without bolder action, our children won't have time to debate the existence of climate change. they will be busy dealing with its effects. more environmental disasters, more economic disruptions, waves"
95,connection is not conclusive. and there are many reports out there that we are unable to connect specific events to climate change alone. what we are seeing is a lot
96,"guidance of the ethics counsel. this hearing ended 2 minutes ago. before it concluded, they moved beyond exxon and russia. tillerson says he does not see climate change as an imminent"
97,"marriage, equal pay, and climate change. this is a spy agency. they are supposed to gather intelligence on bad guys. she got on the right committee. probably not a good fit."
98,pretend you have the moral high ground. that man doesn't believe in climate change. bill: out of here. 'the tip' moments away. t decisiy with the arm of your glasses.
99,"the 'tip of the day,' on an alaska airlines flight, shortly after boarding, the woman started causing troubles. that man doesn't believe in climate change. do you believe in gravity?"
100,"you pretend you have the moral high ground, but you put the man's finger on the nuclear codes. that man doesn't believe in climate change. do you believe in gravity?"
101,"economy. now on the keystone pipeline, the environmentists say it brings dirty oil from canada. it's a pollutant. it's going to contribute to climate change. does the president reject that"
102,covered by most health insurance and medicare plans. (woman)  tresiba ready. icht. a major climate change scientist fed up with what she calls the climate signs. why proving climate c.
103,"hoax. listen, climate change is real and glaciers are melting and waters are rising and if i lived in miami i'd head to higher ground. david: and some are doing it"
104,basically ignored the subject of education and went after her about her wealth and her investments and whether she supported -- shannon: climate change. everything but education. they're using these hearings as
105,"climate change came up. i guess i could make a point for nikki haley, darned if i would have a tough time with either commerce or a couple of these"
106,up the american education system. montana republican congressman ryan zinke had his confirmation hearing to be the next interior secretary. bernie sanders grilled zinke on climate change. zinke replied climate is
107,"hypocrites, they talk about global warming then fly around and private jets. they don't like walls, but they have the highest walls to prevent people from even looking at their property appeared they hate guns but they are cemented by gun toting people. it is a town of hypocrites come in they are being called out for it in the american people are"
108,read those materials with respect to climate change. i know the agencies role is to collect foreign intelligence. jesse: you have a democratic senator from california asking the cia directors opinion on
109,"elected over cia human resources and employee benefit policies regarding gays and lesbians. he was pressed over feelings over nasa climate change report. next week confirmation hearing for beth say and wilbur ross,"
110,"do. question the nominees, have a good debate. climate change or the russians or whatever, but to announce in advance. slow them down so he can get started until march, that's not"
111,"accept the science of climate change, i've been told even rex tillerson does now and the pentagon does. and here i am in the state capital, the governor, the legislature, it was"
112,"proceeds go to planned parenthood, aclu and climate change. brian: celebrities are not going to the inauguration and they need something to do. although these names? ainsley: liberal organizations. aclu, planned parenthood."
113,"those wacky liberals. they said climate change is a bigger threat to u.s. national security than isis. mike pompeo, he said even after the house intelligence committee said we are done with benghazi."
114,scientists blaming climate change and threat of nuclear weapons. and the white house transition. oh my. i think we will all wake up tomorrow. steve: it's symbolic not an actual doomsday clock.
115,with the keystone xl and dakota access pipelines. president obama killed the project in 2015 over climate change concerns. president trump also signed an order requiring u.s. financed pipelines to use steel produced
116,"scare the crap out of you whether it's racial division, climate change or an evil military foot print, the left invented fear. now they're getting the vapors. screw 'em. [cheers and applause]"
117,"ask the question that you just asked, to what extent is climate change being driven by human activity? people who ask that are derided as climate deniers. what is your response to that?"
118,"ask the question that you just asked, to what extent is climate change being driven by human activity? people who ask that are derided as climate deniers. what is your response to that?"
119,"democrats pressed pruitt on his fundamental environmental beliefs like climate change. the climate is changing. human activity contributes to that in some manner. in some manner. yes, sir. 97% of the scientists that"
120,"saying state should regulate their own environment, not the federal government. finally the 'new york times' reporting mr. pruitt does not believe in climate change. what questions would you like to ask the epa designate?"
121,noting that addressing climate change requires broad base practical solutions around the world. do you personally believe that the overall national interest of the united states are better served by staying in the paris
122,uncontroversial for me to accept the science of climate change and 98% of the world scientists believe it is true. what i meant was it was misconstrued on some of these
123,"this hearing ended 2 minutes ago. before it concluded, they moved beyond exxon and russia. tillerson says he does not see climate change as an imminent national security threats. he says he opposes fully lifting"
124,"by the way, i just want to say that senator camilla harris, kamala harris, asking about climate change, what a dumb question. why? rachel: this is exactly why why -- this is exactly why they lost."
125,climate change isthe most important issue . i felt those first three words of the constitution . steve: i've often heard if you stroke your beard you sound smaller smarter. tears as hollywood bids farewell to president obama. .  _
