0,"the claimant, the atmosphere, they are all linked. but in this case, it sounds like although i don't think my hair spray is coming back from the 80s. anyway. go ahead. i would be careful not to tie this to climate change or global"
1,believe. this is deeply disturbing. it's the regulatory state using kids now to argue -- the latest environmental scare pushes central family planning and wealth distribution. is nothing unique about the global warming scare.
2,"we made a snap decision here. a bizarre moment occurred just a few minutes ago and alexandria telmex b13 town hall and new york consensual and said she is so worried about global warming,"
3,"he apologized, but the damage was done. the final days of the campaign, barack obama tweeted out support. his main opponent is the conservative party leader adam scheer who pledged to slash government spending and i'll take a carbon tax."
4,"advocate for itself, one of the largest companies in the united states, but another thing to defraud investors and to lie to investors. what will we find out here? absolutely. the allegations here is in one part internally they were doing research about global warming"
5,"this week. the hole inoo the ozone layer hs shrunk to its smallest size on record. according to researchers, the hole shrank due to higher than usual temperatures in our stratosphere. but they say the higher temperatures have no clear connection to global warming."
6,"the biggest existential threat is climate. climate change.e. it really is the existential threat. we're going to have to address the most existential threat to our nation and the world. climate change. on climate change, the"
7,"to tweet out in the morning and i want to wake up to have this normal day. so you wake up look at your phone trump says something, and you just fly off the handle. is that how you feel? i feel it is the environment -- it is not a hoax. there is global warming."
8,"jed? jedediah: we shall see. actress jane fonda taking on a new role as climate change activist. inspired by greta and the students i have decided to upend my life, leave my comfort zone and move to d.c. for four months to focus on climate change."
9,"deal people think that that is a trojan horse for socialism because the way that fight climate change happens to be using the exact same tools they use in socialism. in the book we actually quote several of the international authorities on climate change,"
10,"leland: you can just imagine there's a lot of folks more than happy to see her arrested. molly: really, for climate change? you know the idea-- given her past history and activism. molly: she is getting a lot of attention for this and that was her goal, drawing attention to climate change and apparently"
11,"threat to our nation in the world. climate change. on climate change, the greatest existential threat that we face. we are facing a climate crisis. it represents an existential threat to who we are as"
12,"company appreciates its employees voicing their concerns but the company is committed to not centering political speech, dana. dana: that was about six weeks ago and it's getting attention. thank you so much. so climate change activists are"
13,"as far as being number one issue, the polls are clear in health care. martha: let's put the polls up. immigration is at 13%. guns at 9%. health care at 8%. down at the bottom, you've got climate change at 5%."
14,"are doing it over cellular networks come with a 3g, 4g network which will be pretty slow, that is even worse because it takes more energy to get tha. dana: what do they suggest? how would we ever see the climate change documentary?"
15,"he took to twitter to throw his support behind justin trudeau amid his reelection effort say i was proud to work with justin trudeau as president. he is a hard-working effective leader who takes on big issues like climate change, the world"
16,gop did as a political stunt which is fine. the reason we have the phrase political stunned is they are part of politics. alexandria ocasio cortez stormed nancy pelosi's office with all those young activists to try to get a climate change
17,"new piece going up on foxnews.com's opinion section later tonight. the democratic party states. private jet is a little strange, as we've said. they've used up all the predator males to fly around more in the country of the existential threat. climate change is real."
18,"a long time. i almost did this previously. and once you make that decision, it really doesn't matter who else is in the race. sandra: what would you run on? i would run on being an economic conservative. someone to do a lot with climate change."
19,"let's vote for a deal that can heal this country. the u.k. will leave the eu at the end of the month if the deal is approved. otherwise, johnson must request another extension. and jane fonda in handcuffs again. the 81-year-old actress arrested at a climate change rally for"
20,"atmosphere, the climate, the atmosphere, they are all linked but in this case it sounds like a positive although i don't think my hairspray is coming back from the 80s. i just want to be careful not to tie this to climate change or global warming. this is one data point but at the same time here's what we know."
21,"teach a man to fish? teaching men to fish is what led to exploiting the environment okay? which led to industrialization which led to overpopulation, which is guess what? a major contributor to global"
22,and fuel trucks. and cut their greenhouse gas emissions in half. algae. its potential just keeps growing. .  _
23,"that could one day power planes, propel ships, and fuel trucks. and cut their greenhouse gas emissions in half. algae."
24,"exxonmobil is growing algae for biofuels. that could one day power planes, propel ships, and fuel trucks. and cut their greenhouse gas emissions in half."
25,"that could one day power planes, propel ships, and fuel trucks. and cut their greenhouse gas emissions in half. algae. its potential just keeps growing."
26,"propel ships, and fuel trucks. and cut their greenhouse gas emissions in half. algae. its potential just keeps growing. must be hot out there, huh?"
27,"and cut their greenhouse gas emissions in half. algae. its potential just keeps growing. it is thursday, october 31st. happening at 4:00 am east coast"
28,and fuel trucks. and cut their greenhouse gas emissions in half. algae. its potential just keeps growing. billions of problems. morning breath? garlic breath? stinky breath?
29,and fuel trucks. and cut their greenhouse gas emissions in half. algae. its potential just keeps growing. kennedy: welcome a back. it's time for the fastest seven.
30,and cut their greenhouse gas emissions in half. algae. its potential just keeps growing. its potential just keeps growing. that life of the party look walk it off look one more mile look
31,"and cut their greenhouse gas emissions in half. algae. its potential just keeps growing. its potential just keeps growing. if you have moderate to severe plaque psoriasis, every day can begin with flakes."
32,"propel ships, and fuel trucks. and cut their greenhouse gas emissions in half. algae. its potential just keeps growing. its potential just keeps growing. (mom vo) it's easy to shrink into your own little world."
33,"and cut their greenhouse gas emissions in half. algae. its potential just keeps growing. its potential just keeps growing. oh no,. .a cougher. welcome to flu season, karen. is a regular flu shot strong enough."
34,and fuel trucks. and cut their greenhouse gas emissions in half. algae. its potential just keeps growing. its potential just keeps growing. i can'twhat? ve it. that our new house is haunted by casper the friendly ghost?
35,and fuel trucks. and cut their greenhouse gas emissions in half. algae. its potential just keeps growing. its potential just keeps growing. i was on the fence about changing from a manual to an electric toothbrush.
36,alike. you made clear you don't know how this will take place. we've got one shot to make donald trump a one term president and how we talk about each other in this debate matters. we can't fall the climate
37,disproportionate share of greenhouse gas emissions. the catch. converting your home to an electric heat pump is very expensive and may not work well for bigger homes during a cold snap. if people convert to natural gas you trade one fossil fuel
38,"you about it. sure. i'm a climate change expert. i am a climate change survivor. jedediah: what do you think? yeah, this is the new norm, if you will, in the climate"
39,"yesterday at a climate change rally on capitol hill. after she said she is actually physically moving for the next few months. she is moving to washington, vowing to protest the president, protest on climate change every single friday."
40,"authority on climate change, and are explicit they pex police sitly say it isn't about pollution but from the wealthy countries to developing countries. they admitop that. climate change people admit that. it has a not about pollution its"
41,"okay? which led to industrialization which led to overpopulation, which is guess what? a major contributor to global warming. you are on fire, terry. how about this one?"
42,"roundup, jane fonda among 16 people arrested on capitol hill during the climate change protest. her goal is to keep getting arrested. she has moved to washington to protest climate change and will do it every week."
43,"they did not address. they did not address climate change. they didn't really talk about climate change. they didn't talk about. ainsley: immigration. steve: trade, immigration. the first question some have characterized in the media as a softball because it was"
44,"sandra: now to this big story. the only second climate change trial in the united states, exxonmobile is going to court. they are accused of misleading investors about the risks of climate change. what do we need to know about"
45,dana: outspoken new york congresswoman alexandria ocasio-cortez says her hopes for raising a family are now tarnished and she blames climate change. the far left democrat climate change conference denmark on saturday. let's bring in fern in and dough new york city
46,environment which led to industrialo relations which lead to overpopulation which is guess what a major contributor to global warming. you're on fire. how about this one? hang in there.
47,"$50000. is that illegal? well, it looks disgusting and it could be illegal. maybe we should investigate. looking specifically at the clinton they had a drop after she lost the election of 50%, tens of millions of dollars. is guess all of sudden climate"
48,trying to do is scare the kids that we have and they are trying to scare people out of having them. another scan kids. there is kids who signed a canadian pledge not to have kids when they're older until government acts on climate
49,. 16 people arrested on capitol hill in a climate change protest. fonda's goal is to keep getting arrested. she said she's moved to washington to protest climate change. she's going to do it every week. tonight a 13-year-old girl
50,"color that may be bearing the front of initial havoc of climate change? without a doubt, without a doubt. in terms of that the people producingng climate change, the folks responsible for the largest amount of admissions or community corporation, theylk td to be predominately white, correct?"
51,it wouldn't be my style. sandra: i hear a republican launching climate change. you gave a speech at dartmouth where you kicked things off. that's true. i do think climate change is a major issue. maybe even my number one issue. there is a difference between
52,"punitive tariffs in steel and aluminum. andrew shearer has pledged to slash government spending and hauled to the carbon tax. he argues that if his conservative party gets more votes than the liberals, even if"
53,"tweeting in part this is what climate change looks like, the gop likes to mock scientific warnings about climate change as exaggeration but look around. it is already starting. ocasio cortez has pushed the grand new deal, a radical proposal that could cost the us trillions of dollars."
54,"along with it, let's say she's become the darling of the left wing media which means most of the media outside of here, so they let her get away with a lot in fact it was a woman and her town hall event last week that was so worried about climate"
55,global warming. demonstrators playing steel drums marched through central london today as they kicked off two weeks of activities designed to disrupt that city. some of the other stories tonight. we will be right back. too?
56,"all right, jesse. jesse: one russian story you can get behind. [laughter] all right, so over in london today, a bunch of global warming maniacs tried to spray british treasury building with 500 gallons of fake blood."
57,he has a message he's desperate to disseminate as far and wide as he can. the message? we much confront the existential threat of global warming. can't wait for us to take on what's coming on what's
58,"connection to global warming. they say the whole should be completely cleaned up by 2080, which is interesting because according to the distinguished fit assist alexandria ocasio-cortez, the world is going to end in 12 years and we"
59,you can hardly blame joe biden. he has a message he's desperate to disseminate as far andd wide as he can. the message? we must confront the existential threat of global warming. can't wait for us to take on
60,"four years ago, the son of the prime minister. trudeau was swept into office, during his term he championed left-wing causes including legalizing marijuana, implementing a carbon tax, a number of missteps and scandals may have cost him"
61,"legalizing marijuana, and a carbon tax. the liberal party is not likely to a majority of seats in the parliament. if that happens, he will need the support of smaller left-wing parties if he is to remain"
62,"refugees and imposed a carbon tax, but after a series of stumbles, his former attorney general says he tried to pressure her to stop the criminal prosecution of a construction company in quebec. trudeau justified his actions"
63,"that co2 emissions are causing global climate change, the worst offender by far today and in the future is china. there is a reason that climate change activists go after americans and american consumers but they don't go after china, and it makes it pretty clear that it hast nothing to do with"
64,"teach a man to fish? teaching men to fish is what led to exploiting the environment okay? which led to industrialization which led to overpopulation, which is guess what? a major contributor to global warming. you are on fire, terry."
65,"phone trump said something, and you just fly off the handle. is that how you feel? i feel -- the environment, it is in the a hoax. there is global warming. and we need to do something for futurere generations of our country."
66,"hall. one of her constituents as she so worried about global warming that we need to eat children. ss for yourself. we only have a few months left. i would love to support the green deal, but getting rid of fossil feel is not going to"
67,"votes, and showing him and brown facing blackface, he apologized but the damage was done. the final days of the campaign barack obama tweet support for trudeau, his main opponent is andrew share who pledged to cut government spending and halt the carbon tax, called trudeau a"
68,"on the big issues, he has vowed to halt the carbon tax, says he will cut government spending as well as foreign aid, and among his liabilities, he has dual canadian/american citizenship. he describes trudeau as a phony. the polls are slated to open"
69,human history. governor newsom loves to blame capitalism and global warming and utilities like pg&e. we have seen this coming for a long time. we have half the people in california today that used to work in the logging industry because environmentalists and political enablers have shut
70,feel. jesse: it's called a tube. did you know that? for those of you guys that don't know or ohave never been who london. they call the subway the tube. you are supposed to commute through the tube if you believe in global warming. right? they should be out there on
71,"or her global warming plan makes me nervous. she is saying you are betraying our country.r so you live here. what effect has it had on your life? some people must believe you are an asset. yes, and you know, this has been. the rumors and lies have been"
72,"canadians probably care a lot of issues even beyond that one, taxes, increase taxes on the rich and carbon tax, we will see what happens. leland: all right, check out the pictures live from new orleans, this is going to happen not tomorrow but in the next couple"
73,"about that. think about that. and all of a sudden the scientist come along and say actually it's not true paid it reminds me of global warming but think about all the other thing. and have them with eggs, carbs, remember carbs were really good and they were really bad and now"
74,for those of you guys that don't know or ohave never been who london. they call the subway the tube. you are supposed to commute through the tube if you believe in global warming. right? they should be out there on streets protesting those little cars on the other side of the road.
75,there is global warming. and we need to do something for future generations of our country. all right so you're angry about the environment. besides a lot of other things yes that's one of them. okay. all right. guys i'm nervous now. next time i see you i see what you're capable of.
76,"greatest existential threat that we face. we are facing a climate crisis. it represents an existential threat to who we are as human beings. tucker: the greatest existential threat, says beto."
77,"jillian: a fair argument. democrats won the midterm in 2018 not on impeachment but on climate change, they won on"
78,we will explain why and climate change is partially to blame. welcome to fox news at night. we begin with trace gallagher.
79,"cowardice to do something about gun violence. the denial about climate crisis that we face, the list goes on. that's about the election. that has nothing to do with what is happening in terms of"
80,"but what kind of effect hasn't had on you? it's not like hillary clinton's thing i don't agree with her views on health care. you not i mean, or her global warming plan makes me nervous. she is saying you are betraying our country. so you live here. what effect hasn't had on your life? some people must believe you are"
81,is taking them to court. the administration claims gavin newsom illegally went above the feds to strike the international climate change deal with québec.
82,you think some of those solutions on climate change and medicare for all our two drastic quick. we have a chance but we can
83,the fax will fund free conversions for the poorest residents using heating oil. it is like climate change martial law. they are criminalizing a
84,"trial to determine whether the oil company must pay for misleading shareholders how the climate crisis would affect its bottom line. tillerson worked in president trump's cabinet after working for the oil company. guys? ainsley: thanks, carley."
85,wanted their poor kid. i don't care. i love this. climate change is ripe for parody. the xr is apparently a serious group and they are about
86,"lbgtq. before that, we saw two climate change town halls. can we do town halls on health insurance? a big issue. or maybe on the opioid crisis."
87,"jillian: it should be, larry david bill. todd: democrats found a new way to fight climate change. make people, low-income people, pay more. will work?"
88,how the lawsuit says that company mislead investors over the risk of climate change. can they make their case? exxon realized it had a problem in 2014.
89,"climate change and i hope the neighbors in the north support him for another term, among accomplishments, president trump at one point called trudeau dishonest and weak."
90,"we can't solve the climate crisis in the united states by ourselves. it is an international crisis. donald trump let us down it dangerous cracked with unreliable foreign-policy. this is the united states of america, there's nothing we cannot do."
91,"midwest, because there's not a lot of oceans. at least not yet until climate change. i was born and raised on president. [laughter] shot it right into my mouth."
92,"new trend comic climate change plan. he did say we may not own our own cars, and then he's going to attack cattle farmers so people he last meat."
93,"larger ambitions than merely making a profit, say it's some climate change agenda, that's a recipe for the destruction of capitalism. it sounds like regulated utilities, doesn't it. paul: worse."
94,"protect dreamers, is he too in denial for climate change? save that for the election. this is about the facts relating to the constitution and that is how we will proceed"
95,"save more lives and better improve human health by slowing climate change than by improving health insurance. joining me now, fox news contributor, chris hahn, former aide to senator chuck schumer,"
96,"former president obama is endorsing canadian prime minister, justin tribble in the next election. he takes on big issues like climate change per he says the world needs trudeau's progressive leadership."
97,"david lee is in ottawa tracking the election. reporter: the issues range from climate change to government spending. but one thing all canadians agree on, this will be a close"
98,shannon: you may recall that as we as professor recently theorized about cannibalism as a possible solution to climate change. that idea appeared to come out during a town hall held by new
99,"they came with a complaint, now they're covered in paint. climate change protesters in london, that's a very in england , dana. recently gathered outside the british treasury building for a demonstration that involved"
100,"they came with a complaint, now they're covered in paint. climate change protesters in london, that's a very in england , dana. recently gathered outside the british treasury building for a demonstration that involved"
101,lbgtq. before that 2 climate change town halls. can we do town halls on health insurance or the opioid crisis? that takes research and more than name calling. talk about the things that
102,"making a profit, say it's some climate change agenda, that's a recipe for the destruction of capitalism. it sounds like regulated utilities, doesn't it. paul: worse. how would you make an investment"
103,"producing climate change, the folks responsible for the largest amount of admissions or community corporation, they tend to be predominately white, correct? yes, every study backs that up. tucker: the people that are"
104,"inflamed. here is ocasio-cortez just last week and a public explaining that actually global climate change is the fault of a specific racial group, watch. we see it is the fountain of"
105,"yes, every study backs that up. tucker: the people that are producing climate change. that is right, those people, the ones destroying the earth driving an entire species to extinction, killing children and"
106,"because of it. a major issue we are covering. vaping rob: a mcdonald's drive-through to fight climate change. drive-throughs very convenient, quick and easy but they could get a lot slower."
107,"of bills dealing with infrastructure, gun violence, climate change and more, leader mcconnell has turned our chamber into legislative graveyard. not one of these bills has received vote in the senate, no"
108,"climate change. i was born and raised on president. [laughter] shot it right into my mouth. when you think about it, mike baker. do you know, what's great about this is the redemption for the"
109,not yet until climate change. greg: i was born and raised on perez. i shot it right into my mouth. this kind of when you think about it. what is great about this is the
110,"in the pocket of the fossil fuel business. climate change, he's not doing anything about it. he tries to make it about issues when ultimately it'sdy traction against his problems. president trump is into self"
111,"climate change protesters in london, that's a very in england , dana. recently gathered outside the british treasury building for a demonstration that involved using a fire truck, to spray fake blood on the buildings"
112,"climate change. i was born and raised on president. [laughter] shot it right into my mouth. when you think about it, mike baker. do you know, what's great about this is the redemption for the"
113,"800-pound elephant in the room which is absentee fathers and obama knows this, racism, sexism and the climate change, obama said a kid without a father isis five times more likely to be"
114,we've got some communities starting to ban -- they are linked to climate change. when your vehicle is idling there it is emitting carbon emissions that are released and they want to cut down on those.
115,"juan: who invited the chat? it was the president who invited them. martha: he says the opposite. juan: obviously was at that white house. greg: don't meltdown, juan. juan: with climate change, anything is possible."
116,"plenty of democrats are also not happy about a lack of climate change questions. shannon: thank you. former president obama endorsing the canadian prime minister fresh off of a blackface scandal, yet no word on"
117,"swedish climate change activists greta thunberg. carley: many are vocal opponents of donald trump. carley: men and women sounding off on this, michael writing conservatives don't care about a silly magazine trying to make money."
