115,"leland: saw him in paris criticizing president trump saying there is no leadership anymore and president trump is taking a backseat as relates to climate change. not going after him by name but veiled reference about twitter. so different, for example, than when george w. bush left office."
116,"involved in clinical policies on the report does not mention climate change. john roberts is a life without this afternoon on the north one. hello, john. no surprises here if you been listening to president trump for the last 11 months as president. the previous 18 as a candidate."
117,"have to listen to what the pope says. i don't care about what the pope says. i don't think he helps in this situation. i think he should stay out of i it. i can barely control myself when he talks about climate change, so i don't want to talk about"
118,"culture television when they are talking about climate change, they have to admit we have reduced our carbon footprint and with the refrain is we still have to do more. greg: you know it kills me, there's this perception that if you are against the paris accords, somehow you are less"
119,"climate change. criticism the white house welcomes. this was meant as a direct contrast. the one we're going to talk about how much a contest it was. coming up, ed henry, thank you very much. republicans stand on the end of a victory and it looks like wall street is betting on tax"
120,"taking heat for not mentioning climate change. criticism the white house welcomes. this was meant as a direct contrast. the one we're going to talk about how much a contest it was. coming up, ed henry, thank you very much. republicans stand on the end of a victory and it looks like"
121,let go to help with climate change. if you are opposed to kids you are definitely naughty. that's the best thing i can say about it. melissa: you put brian ross on your naughty list. i have think i know why that is the case. brian ross and the rest of the political media who
122,"trump doctrine? i fully expect a lot of people will call it that i don't think any of us are going to object. brian: right, a couple of things, too. climate change, no longer a security threat as labeled by the administration. something environmental stewardship you call it the other thing is, identify"
123,eboni: got some quick headlines for you. talk about an inconvenient truth truth. algore's climate change sequel is on the oscar short list for best documentary. an inconvenient sequel: truth to power criticizes president trump trump's decision to pull out of the paris climate agreement. this despite an 84-page book
124,"not the person they pay attention to. heather: does it give them talking points, father to use against the current administration when you have someone like president obama talking to business leaders in paris in terms of climate change where he says there is a, quote, temporary absence of american leadership, they take that and use that against this"
125,"warming or climate change like it has -- did in the previous administration because all of those efforts came at the expense of american workers with no clear tangible benefits, so it's going to focus on the threat that is we know that are known that really harm the united states and it's going to attack those really head on and"
