219,"griff: he said he's ready to assume the presidency and he put a mailer out asking for money saying if he does do that it's about transforming our country. we'll grant healthcare to all, address climate change, we'll make public colleges and universities tuition-free, raise the minimum wage to $15, and"
220,"she was about to get arrested so maybe she didn't want the police to confiscate it just my optimistic thinking. jedediah: mark we have another hot topic for you at a bernie sanders rally the mayor of san juan, puerto rico saying she's a climate change survivor. take a listen and we'll talk to"
221,justice warrior. i'm going to set out to get arrested to highlight climate change that is a luxury to someone who has a lot of money and a lot of celebrity can do. people around the country are trying to put food on their table and take care of their kids. i talk to the founder of
222,"republicans a d. this wasn't enough. he needed to have more. he needed to come at this head on, make us all feel better about it. he just didn't do it. ainsley: lee, they did not talk about climate change. they didn't talk about immigration. they didn't talk about china and trade but they did talk a lot,"
223,"my second question is as you are looking at the content and what you want to do next year, in florida in june, the climate change will be one of the issues? mick: no, i don't know if i president has done it and i don't know if the president has owned a property consider for"
224,"as americans care about, the people who are voting care about. two separate tweets, julian castro slamming the question saying 3 hours and no questions about climate, housing or immigration, goes on to say climate change is an essential threat, america has a housing crisis in children are in cages at the border. kamala harris says not one"
225,why is it ridiculous for a climate change activist to fly private? every one of the candidates running for office has embraced the green new deal and a tenet of the green new deal is the abolition of fossil fuels. they said they want to render jet travel obsolete. they want to bring us to a place
226,"chicken sandwich but they are hiring more people to deal with the demand because last time a lot of people really wanted this chicken sandwich. you know who i picked, i picked chick-fil-a. thank you so much. the time is 15 minutes until the top of the hour and is this what climate change look like to you"
227,"the canadian prime minister justin trudeau saying i was proud to work with justin trudeau as president, he is a hard-working effective leader who takes on big issues like climate change, the world needs his progressive leadership and hope neighbors to the north support him. trudeau responded thanks for working hard to keep our progress going but the former president's endorsement sparking"
228,"heather: china, immigration, climate change, do they focus too much on donald trump? they need to focus on their opponent but there are other issues that matter. small business, democrats support small business like the plague and community policing as well. there's a lot of stuff they didn't focus on because it was more about tell us about this mean friend, that was a wasted question and i blame the moderators for that."
229,"california for joining forces with canadian province of québec, california and quebec entered into a cap and trade agreement intended to tackle climate change but the justice department says only the federal government has the right to form agreements with foreign entities. seattle public schools about the new curriculum that would look at the way math is culturally appropriated by the west. according to proposed curriculum methods used to repress people of color. there's a big drop in our energy level"
