223,"after conservatives argued the vaccinations would have sent per misive signal to kids about sex. when asked about the credibility of scientific data on man's role in global climate change, perry expressed disbelief. i do not buy in to that a group of scientists who have"
224,climate change could lead to an increase in mental illness. all that and more. 'the five' starts right now. dana: before we get to the top story tonight we want to give you a quick update on a story we've been covering. more casualties of the botched
225,"call me crazy. right. well, i believe in evolution. i think it's part of god's plan. i've always said and it's on the record and by the way, i'm running on my record, climate change has an established body of science associated with it."
226,"i find the use of that, if you disagree on climate change because science has been hyped up as we know those e-mails. you find that disgrace full? i do. that's one of your -- leading questions. i find the use of that word in"
227,"man's contribution to it, i think we should find ourselves on the wrong side of science and therefore in a losing position. so we are he' talking about global warming, why? and the voters are concerned about are jobs and getting a job and getting na unemployment rate and just to finish up the talk on the debt talk, when he was criticizing"
228,"said, what the national academy of science has said. about what is causing climate change and man's contributions to it and i think we find ourselves on the wrong side of science and therefore in a losing position. that is what he said. here's what rick perry had to"
229,"might. bill: all right, thanks very much. we appreciate all you guys down there who did an outstanding job. we hope you saw some of the fox news coverage of the hurricane. it was the best in the business. next on the rundown, you knew it would happen. far left people are blaming hurricane irene on global warming and later, bernie goldberg on whether the media"
230,"the science that suggests there is man made carbon involved in climate change so do a lot of folks in new england and, frankly, rick perry has had a rough couple of days. he burst on to the scene and started climbing in the polls. but, in new hampshire, he got busted today. folks were asking him questions"
