118,intellect. that's all. dana: what do you think of him raising $10 million in the third quarter? he's charming but this is the new trend comic climate change plan. he did say we may not own our
119,"and it's lights out for hundreds and thousands of people in northern california. pacific gas & electric deliberately cutting power. we will explain why. as they say come up climate change is to partially blame. hello, welcome to 'fox news @ night.'       _"
120,"until we got the one we wanted, poor kid. i don't care. i love this. climate change is right for pairity and the pairity themselves. although this extinction rebellion xr is a fairly serious group that surfaced recently."
121,"poor kid. i don't care. i love this. climate change is right for pairity and the pairity themselves. although this extinction rebellion xr is a fairly serious group that surfaced recently. really. and they are about ready to,"
122,jedediah: her goal to get arrested every friday for the rest of the year protesting climate change at our nation's capital. yesterday she was successful in many quote fire drill fridays. here to react is comedian michael loftus.
123,aoc holding back tears blaming climate change for her fears of having kids. i speak to you not as an elected official or public figure. i speak to you as a human being. a woman whose dreams of
124,"poor kid. i don't care. i love this. climate change is right for pairity and the pairity themselves. although this extinction rebellion xr is a fairly serious group that surfaced recently. really. and they are about ready to,"
125,"the anti list back then. they wanted cooperation on north korea and climate change. the president -- whatever he said, the policy -- that's what i look to, cut through the noise, look at the policy. the president said, now"
126,"maintaining and improving their power lines. brian: stanford university says we are having to adapt to new circumstances brought on by climate change. you don't see it that way? well, look. i don't see it that way at"
127,"vatican will not go this way and he sort of nudging them this way. it's a troubling document, this amazon document. most of it reads like the paris climate change accord. when kanye west's album mentions"
128,"todd: k tth radio, you say this is a really bad idea and won't do much to help the environment. when you talk about what this is doing for climate change, 2% of the total emissions in seattle."
129,"incorrect guide to climate change, joins us tonight, thanks so much for shot my coming on. i don't want to dismiss this is what obviously appears to be amount which is something that would address. this does seem -- lacking in            _"
130,"we're reminded this year of big issues and polls and australia, right? arguably you can't really argue. people who believe in climate change say australia is the best example how it can destroy a country of the great barrier"
131,"several of the international authorities on climate change, and some of them are explicit they explicitly say it isn't about pollution it is about redistributing wealth from wealth countries two developing countries they admit that climate changing people admit"
132,"question about the climate crisis, not one question about lgbt q rights, not one question about immigration, these issues are too important to ignore. the candidates want to talk about these questions and the american people want to hear what they have to say about these questions. reporter: it is hard to take"
133,can have debate. you have one shot to make donald trump a one term president. how we talk about each other in this debate matters. we can solve the climate crisis in the united states by ourselves. it is an international crisis. a dangerous path with foreign-policy.
134,we can't fall the climate crisis in the united states by ourselves. it is an international crisis. he has let us down a dangerous path with erratic and unreliable foreign policies. forgot's take get up and remember this is the united states of america and there is nothing we cannot do when we
135,dollars. i think all the sudden climate change and childhood obesity did not matter quite as much. of the global initiative was shut down. dozens of people were fired. they had to go through their new york state notification process for mass layoffs.
136,"swedish professor recently theorized cannibalism as a solution to climate change. that idea comparing to come up during a townhall held by green new deal advocate alexandria ocasio cortez, here is what a visitor said. we only have a few months"
137,"that i feel bad for them. oh, really? i do. because they were so close right like if they had just managed to get the fake blood only on on the treasury building and not on themselves, climate change would have been solved."
138,"covered in pink. climate change protesters in london a city in england dana, recentlyre gathered outside the british treasury building for demonstration that involved using a fire truck to spray fake blood on the buildings white façade that the group known as"
139,"if they had just managed to get the fake blood only on the treasury building and not on themselves, climate change would have been solved. obviously that's not a thing so there is these people claim to be so passionate about this"
140,"that i feel bad for them. oh, really? i do. because they were so close right like if they had just managed to get the fake blood only on on the treasury building and not on themselves, climate change would have been solved."
141,"not buying that apology is california's governor gavin newsome. he slammed the company in a press conference earlier this week. this is not, from my perspective, a climate change story as much as a story about greed and mismanagement over the"
142,she talked to chad as she left earlier this hour. jane fonda said she will demonstrate at the capital against climate change every friday from now until january. somebody found the memory card as i mentioned on the street in
143,"that i feel bad for them. oh, really? i do. because they were so close right like if they had just managed to get the fake blood only on on the treasury building and not on themselves, climate change would have been solved."
144,"producing climate change. that is right, those people, the ones destroying the earth driving an entire species to extinction -- extinction, killing children and all those people look alike. something in common, don't they? that is right they are the same color."
145,"medicare for all! martha: medicare for all, but a new op-ed suggests the message is old and outdated and ineffective and arguing instead climate change is what threatens the world and everyone who lives on it, the next president can"
146,and syndicated radio host. let me start with you. are they barking up the wrong tree that's encouraging these candidates they should care more about climate change than health insurance? polls consistently so that voters think health care is a number one issue.
147,"excited, jay inslee who ran a campaign exclusive lee devoted to the issue of climate change. he wasn't on the debate stage lately. an issue that some really progressive activists and also a lot of younger voters matters quite a bit."
148,"with dodge power dollars buy any challenger, charger, or durango and get ten bucks cash allowance for every one horsepower. kennedy: well, you can kiss binge watching goodbye if climate change activists have their way. they will. they claim that it emits the"
149,"a direct quote. that's what they said. juan: these are ideas, because guess what, the voters say overwhelmingly, we want action on climate change. greg: until it affects the them. juan: they make fun of everyone who has an innovative"
150,"laura: it's a whole you didn't build that line that we heard last campaign, the campaign from 2012 with obama. thank you so much, having we we you back soon. what happens with climate change protesters to get a little bit too far?."
151,it's an existential threat to our country. and the entire planet. nato is about the common defense. the biggest existential threat is climate. climate change. it really is the existential threat to. we're going to have to address the most existential
152,"with sea turtles because of climate change. as the earth gets warmer, more and more baby sea turtles are apparently turning out to be female. it is because the eggs are more likely to produce females when they incubate in higher"
153,the publisher of climate depot and the author of the politically incorrect guide to climate change. they then give a coming on. i don't want to dismiss this as what it appears to be which is something -- this does seem like lacking in
154,"g7. so i don't know the answer to that question. climate change will not be on the agenda. yes, sir. president trump has called for its closure of the whistle-blower on ukraine and the g7 -- mick: is that the"
155,now? yes. absolutely. what meaningful action would you take to rebirth the effect of climate change and can we count on you to follow through? yes. should they lose their tax-exempt status if they oppose
156,they didn't as quoting this was a chance to press the candidates on lgbt q issues with all-america watching and the network blue it. plenty of democrats are not happy about a lack of climate change questions. thank you.
157,"endorsed his own vp joe biden but he is throwing his support behind canadian prime minister justin trudeau, he tweeted, he is hard-working effective leader who takes on big issues like climate change. the world needs his progressive leadership now."
158,"snarling services during the busy morning rush hour in lond london. interesting video, the group 'extinction rebellion' has been blocking roads, bridges, and airports for more than a week to demand faster action on climate change. just a couple of the stories"
159,"during the 3-hour debate the cnn and new york times moderators didn't ask one question on this issue. they also did not ask questions about other critical issues like housing, climate change and china. it seemed the first two hours of"
160,"issue for democratic voters. here are some answers. watch this. the ability to elect somebody that can defeat trump. at this point it's still the economy. climate change. i have kids. and not many -- not too many politicians, you know,"
161,"california for joining forces with the canadian province of quebec. california and quebec entered into a agreement intended to tackle climate change, but the justice department's as all of the federal government has the right to form agreements with foreign entities."
162,jane fonda in handcuffs again. the 81-year-old actress arrested at climate change rally second anytime one week. this time with her grace and frankie co-star sam watterson. both detained in washington for lawful demonstration. 17 others were also arrested
163,climate change. college loan forgiveness and free childcare and housing. her plans cost between $38 and $48 trillion. you can't pay for that with a wealth tax. the only way to pay for that is a massive tax increase on the middle class.
164,"sandra: seattle passing a tax that will cost thousands of residents more money to stay warm. the mayor of that city saying the tax will fight climate change. just how does that happen? dan springer has the story from seattle. hi, dan."
165,"handcuffs, surprise. this time, for fighting for climate change, but that's not the part of the story our next guest confronted her at the rally, find out what happened, coming up after the break. i came in like a wrecking"
166,"president in the country can make hicks torque gains on healthcare, immigration and guns but not if they push too far and promised to much. do you think that some of the solutions whether climate change, medicare for all by"
167,all of the time about green new deal people think that that is a trojan horse for socialism because the way that fight climate change happens to be using the exact same tools they use in socialism. in the book we actually quote
168,"as well? i mean we all want the best for the future but climate change, would that be the reason? no. i mean, my biggest concern is socialism as being the biggest problem that we are going to face in america"
169,"achieving co2 levels, the worst offender by far is china. there are a reason that they go after american consumers but don't go after china and that makes it pretty clear it has nothing to do with climate change, it has to do with"
170,"if the target of criticism, but when the chinese do it, people seem to be okay with the violation of core values and of course, as you probably know, the most egregious hypocrisy on this front is climate change. if you actually buy the argument"
171,"he got his friend bon jovi to help him out. mr. impeachment, mr. climate change, he's gonna be on the debate stage as well, this field is not actually narrowing down very quickly but i think that my change by thanksgiving. tucker: i'm enjoying the"
172,"on climate change. whether about war and peace, when they are actually supporting the effort to impeach the president? how can we have an idea there is freedom of speech and freedom to hear all sides, frankly? yeah. well there's not. so i taught 28 years in"
173,for coming. in thanks for having me. ed: hanoi jane at it again. protesting climate change. didn't she learn her lesson the first time when she got a little political. go back into the way back machine in a moment.  i just can't get enough
174,jet on over to d.c. to take on climate change. half of america is trying to take out a second mortgage to go to a basketball game and she is jet setting all over green's earth to protest fossil fuels. how much jet fuel is she
175,"so he is going to be like yeah, climate change. and she is that's hot. that's hot. griff: hold on a seconds. i remember i covered when a young barack obama went to hollywood. started taking in donations. it was very big. show you some of the"
176,pg&e office and someone fired a gun at an employee. they face $30 billion in liability claims from last year's fire. utilities say because of climate change overgrown transmission corridors and this high-wind forecast gusts up to 50 miles per hour is forcing
177,"years caused by electrical lines arcing, trees falling on them causing a fire. utilities are saying this is the trade-off. some are blaming climate change and say it's part of the new normal during peak fire season. like we are here in the"
178,point about climate change. we say more than 1000 people have been arrested since monday trying to do the same thing. the sky was eventually removed unstuck from the plane. just some of the other stories beyond our borders tonight. we will be right back.
179,"was right about this last year when he criticized california for not properly maintaining their forests. let assume that the professor was right and that this is being driven by climate change, what would you do to fix it? oh, well, you would do more"
180,"admitted paying 15000 to do so boost her daughter's sat score. and ted danso danson arrested alongside jane fonda in washington, d.c. this is the third time the 81-year-old actress ended up in handcuffs at climate change protest this month. both were arrested for"
181,"liberals are just the fun poli police. juan: i love the premise of this segment. that is all, these liberals are such terrible people. they are trying to address a real challenge in terms of climate change. the gop has its head in the sand."
182,why is it ridiculous for climate change activists to fly private? everyone of the candidates running for office has embraced the green new deal and attendant of the green new deal is the abolition of fossil fuels. they said they want to render jet travel obsolete.
183,believe they didn't ask about climate change and immigration. brian: we know where they stand. ainsley: sunrise 2 minutes and 25 minutes into the debate no no questions on the climate. but you noel len. brian: world going to last 10 more years should have
184,"now congress is like, 'it's off the table, it's not a crisis anymore.' elizabeth: to your point, i'm always curious if the democrats think they can fix climate change and they can't fix the border. [laughs] as jeh johnson, who was obama's former homeland security"
185,"followed by climate change, the economy and gun policy and race relations. i want to focus on those. gun policy has been a big talker as of late because of beto o'rourke and what he said the couple weeks ago about wanting to confiscate mandatory assault"
186,"u.n. did a study in 2006, raising livestock causes more climate change than cars. we always heard that. you go on to write the study was wrong. the author of it had to issue a correction. that is absolute fact. once the stuff gets out there in"
187,for reelection as trudeau works to overcome that blackface scandal. if the former president even tweeting about it saying i was proud to work with justin trudeau as president. he's a hardworking effective leader who takes on big issues like climate change. the world needs his progressive
188,speaking up about this. i was a healthcare -- healthcare is more important. climate change is of course right at the top. steve: so righ all over the place. none of those things are the focal point of the debate we have seen so far.
189,"barack obama has now given the nod to justin trudeau, despite him being involved in a black face scandal. obama says he is an effective leader who takes on big issues like climate change. the world needs his progressive leadership now and i hope our"
190,"strange, as we've said. they've used up all the private air miles to fly around more in the country of the existentialve threat. climate change is real. it's an existential threat to our country. and the entire planet. nato is about the common defense."
191,"but not if they push too far and promised to much. do you think that some of the solutions whether climate change, medicare for all by senators warren and sabers are too drastic? we have a chance to build an american in short term majority"
192,"storm in the atlantic basin. and that's just one region. if you go back in time anyone who lives in the 1940s can claim their climate change survivors was much worse, so they had many hurricanes as bad or worse then, so this is a political phrase"
193,representative alexandria ocasio cortez. she is expected to make her endorsement at today's rally. the two have worked closely together on things like climate change. aoc will be the second endorsement for senator sanders this week from a member of the so-called progressive squad.
194,"do you think that some of the solutions that are being offered whether it's on climate change, medicare for all by senators warren and sanders are too drastic? look, take the example of in the medicare question. i'm proposing medicare for all who want it."
195,all of the time about green new deal people think this is a trojan horse for socialism because the way that fight climate change happens to be using the exact same tools it they use in socialism. in the book we actually quote several of the international
196,alexandria ocasio-cortez is expected to endorse sanders at the l rally today. the two have worked closely together on things like climate change. age has been somewhat of a factor in this race. more questions have come up since senator sans deers sufferesanders sufferedthe hear.
197,"a capitalist. you know, it may work. i think the problem is warren is so well established now with her left-wing policies on education, on healthcare. on climate change. all of these other things that it's kind of hard to imagine that she can be"
198,"the budget of the city of new york, we could have benefit. we understand in america free enterprise works. answer. dana: she says she is worried about having a family because of climate change. you have children and grandchildren. do you have those concerns"
199,"countries actively hate. republicans do it it's the target of criticism. but when the chinese do it, people seem to be okay with a violation of core values. of course, tucker, as you probably know, the most egregious hypocrisy on this front is climate change. if you actually buy the argument"
200,"climate change, it has to do with frankly taking the side of a really vile regime over the interest of our own country. tucker: and they know that we are so self hating that can control us. they can bully us into submission but the chinese don't hate themselves, do they?"
201,"he rented bon jovi to help them out. he ability it makes it into tom steyer, the big billionaire, mr. impeachment, mr. climate change, he's gonna be on the debate stage as well, this field is not actually narrowing down very quickly but i think that my change by thanksgiving."
202,"outcomes, they are completely different and i experienced this in the obama administration, they did nothing with regard to what china was doing particularly -- we could have been cpe back then. they refuse to. they wanted cooperation on north korea and climate change. this president, whatever he says."
203,"and obama knows this, racism, sexism and the climate change, a said a kid without a father is five times more likely to be poor and committed a crime. nine times more likely to drop out of school. 20 times to end up in jail and the welfare state incentivize"
204,"pete: quick headlines for you, ted danson arrested along hanoi jane fonda in washington, d.c. this is the third time the 81-year-old actress ended up in handcuffs at a climate change protest this month. are you bored yet? i am. both were arrested for unlawful demonstration after"
205,"us. brian: that's big of you. how does that play into this overall picture? ainsley: the last question of the debate. steve: yeah, it was. and cnn and anderson cooper taking a lot of heat because rather than talking about immigration or climate change, he asked a question"
206,"ainsley: they didn't bring up hulaian castro no questions about climate, housing or immigration. you noel len, because remember they asked the last question was about ellen and president bush hanging out. why didn't they ask any of these questions? climate change. if you ask some of the"
207,and climate change having recognized it is an issue that will affect the bottom line. it comes down to dollars. the bottom line of the company. outwardly they were giving a different story. that's where the whole case broke and why the lawsuit was brought. exxon's defense is we didn't
208,"the project as well as privacy whether conservatives were targeted, now zuckerberg heads to the hill for a capitol hill ing. jedediah? jedediah: well jane fonda is in handcuffs again the 81-year-old actress arrested at a climate change rally for the second friday in a row, and our next"
209,"which they are trying to scare people with, and essentially lobby for the green new deal. ed: there is also a lot going on in cities across the country where various lawmakers from the left are cracking down, trying, they say, to deal with climate change, florida lawmakers let's"
210,"i'm dana perino. the biden campaign warning fellow democrats to lay off the vice president's family. that's as the former vice president son breaks his silence. also, congresswoman alexandria ocasio-cortez says climate change is ruining her hopes of having a family. i will speak to the democratic"
211,"loftus party earlier and he had to say this. she talks about doing this like she is going on vacation, right? she is like so i decided to take a break and i'm going to jet on over to d.c. to protest climate change. like half of america is trying to take out a second"
212,"democratic voters think health care is number one issue, swing voters think health care is a number one issue. there's a reason why you've seen so much time devoted to health care and so little time relatively devoted to the issue of climate change. in their mind, there was already a candidate on the democrat"
213,"at xfinity, we're here to make life simple. easy. awesome. so come ask, shop, discover at your xfinity store today. tucker: the democratic presidential race is sending a lot of records. no contest in american history has been this focused on climate change. almost every candidate has a plan to spend billions or in"
214,"ainsley: climate change did not. china, trade. brian: how do diners have 20 pages in their menu. they can make anything. how do they do that? steve: because you should be able to start the day with endless possibilities. ainsley: i heard if you own a restaurant the best one to own is a breakfast"
215,i've always been this way and people in my state know that. i have policies that are very much in line with the democratic party. i think we have to do something about climate change and i've been very clear about that. we can't let this sit like president trump has been doing.
216,"summit, the middle of june. mick mulvaney said climate change issues will not be part of it. he also said essentially that it's an open question as to whether or not the russian president vladimir putin will be invited, as to whether or not it will go from a g7 back to a g8"
217,"experts say a former president endorsing a canadian candidate for private or never happened but barack obama has given the nod to justin trudeau despite him being involved in a blackface candle, obama says he is an effective leader who takes on big issues like climate change. the world needs his progressive"
218,ainsley: here's some quick headlines for you. california tried to make its own deal on energy and now the trump administration is taking the state to court. the lawsuit claims california overstepped its legal authority to strike a climate change deal with quebec to lower fossil fuel emissions. governor gavin newsom calls
