113,which led to the nuclear agreement with iran. it was because of rebuilding those alliances that we were able to get the paris accords on climate change done. it was because of those alliances that we've actually restored and renewed america's standing in the world. and now again i think the choice
114,"one quick programming note. we had promised to bring you tonight the second part of our series on climate change in america, the awful events in turkey superceded that story. but we hope to bring you our report from alaska tomorrow night instead. that will do it for us, for 'all in' this evening."
115,"we had promised to bring you tonight the second part of our series on climate change in america, the awful events in turkey superceded that story. but we hope to bring you our report from alaska tomorrow night instead. that will do it for us, for 'all in' this evening. the rachel maddow shows starts"
116,his policy agenda. he's holding out. i was struck. every mom friend i have with kids old enough to pay attention their kids know everything about bernie sanders. they are for everything he's for. they watch those press conferences. the one about climate change and fracking. you sit and talk to him and he
117,"an uncertain direction, frankly to a place we don't want to go. and perhaps by a driver who doesn't speak the very best of english. if we want a bigger economy and more jobs, we are better if we do it together. if we want to fight climate change, we are better if we do"
118,"60 years. from the air, you can see the devastating impact. as soon as you lift off from the airport at home all you see is water. i can attest to the fact that i've been a pilot all my life and watched this land disappear. in the era of climate change the effects of the land sinking"
119,"from both republicans and democrats will be particularly tested because so many of its policies can an tag both the right and left. gary johnson opposes a federal minimum wage, wants to eliminate the education and commerce departments, says that taxation is theft. he supports the second amendment and is not ready to say climate change is manmade. those positions are generally going to appeal to the right. at the same time he would slash military spending."
