116,"if you look at the problems out there, i believe in the strength of america. but how could we possibly deal with nuclear proliferation alone or climate change or energy and environmental issues generally? i just find that such a know"
117,"morning's top stories. this morning, president obama makes his debut at the united nations, addressing a summit on climate change. later today, the president will hold meetings with israeli and palestinian leaders. he will address the u.n. general assembly tomorrow. according to this morning's"
118,"the climate change debate. this is the other big priority that got pushed aside and then, of course, the main thing is trying to reset and reenergize the health care debate to prove to congressional liberals that there can be reform without this"
119,"the only strategy we have is to move aggressively now to do much more than we've been doing in energy efficiency. that helps us meet our climate change responsibilities, and it creates more jobs and less time for less money than any other strategy available to the"
120,"others, will speak about the national security threat of climate change. we need to respond to it. our economic future depends on it. senator kerry, thank you very much. let us know what happens with that. we'll talk to you soon. we'll keep abreast."
121,"howard won't be back. thanks, howard. talk to you soon. so, of course, the president has dealt with nothing but health care reform since, i don't know, the late 1800s, which is why the security council was speak on climate change, middle east peace, nuclear proliferation."
122,"last question for you, chris. the democrats' political argument is that this president would rather spend its political capital on house reform and climate change and -- this is something that would be nice to clean up but it would eclipse everything else the white house"
123,"last question for you, chris. the democrats' political argument is that this president would rather spend its political capital on stuff like health reform and climate change and this is something that would be nice to clean up but would eclipse everything else the"
124,"the clean energy jobs of the future. and they will help us combat the threat posed by climate change. as i said earlier this week in new york, all nations have a responsibility to meet this challenge and together, we have taken a substantial step forward"
125,"huge problem that has to be taken on, but a lot to do with what is going on next week. october 16th is a date for reconciliation because the white house is trying to move forward on the issue of climate change which has an important deadline"
126,"i believe if he were not an african-american, all of the people against him on health care were still against him, because they're all against it, too. health care not a big enough obstacle to tackle? president obama also hits climate change and middle east"
127,"nevada, let's see how aggressively harry reid goes after that. what phrase goes through your mind when you hear him mention a climate change war room? i was thinking, i wonder what heath schuler thinks about that? i wonder what blue dogs in the south -- the war room actually is"
128,"reform, to health care reform? who's going to pay attention to climate change and so forth? all of those issues. it's an unusual concentration of them that are important to massachusetts as they are to the nation that will be voted on in the next -- in the next few weeks."
129,"and for the administration to try to jump-start the jobs. the only strategy we have is to move aggressively now to do much more than we've been doing in energy efficiency. that helps us meet our climate change responsibilities, and it creates more jobs and less time"
130,"alaska, we're not that many people, not even 700000 people to be the governor over, we do have trillions of dollars worth of resources here and managing that and the social ills that happen here and the climate change that's happening here, you know, it's hard work, as"
131,"reform. what's going on with cap and trade? people assumed this would be pushed off until next year. the president got a strong vote in the house. the big u.n. summit on climate change in copenhagen in december, people thought, wow, he should go there with that strong bill."
132,"now, this is where he's trying, i think, to get more support from the rest of the world. okay, we've made these change, but now all of you can't expect us to solve the world's problems. you have you contribute. do your part whether it's climate change, china and some"
133,"change, president obama could've stepped up to that podium and asked for more assistance in afghanistan from our allies. there was a climate change summit on the first day there, so the president did not set the agenda on that. the leaders could talk about whatever they wanted to."
134,"movement, the energy independence movement, as they call it, recognize that delay can be death for a bill. they don't want the same thing to happen this winter that happened to health care this summer. so they've built a climate change war room. they're making plans for advertising. they have activities already in"
135,"hasn't done enough yet on the climate change and environmental issue, on the middle east so far, they don't have a lot to show for some of their efforts with envoy mitchell's frequent trips to the middle east and so forth. so so there's still a lot of details to be ironed out."
136,"we may even know a few more details at that point as well. we're going to be there. norah, peace in the middle east certainly topped the president's agenda during his meeting of the u.n. assembly today in new york. after delivering a speech on climate change the president immediately started separate"
137,"happen here and the climate change that's happening here, you know, it's hard work, as george bush said about being president. and it was too hard of work for sarah palin. so why not go and make lots of money being sarah palin somewhere else? and a typical quote from the political piece that we"
138,house bill passed in june. why do you think this bill has a shot? i'm convinced it has a shot. i've been talking to republicans and members of our party. there's a willingness of a lot of people here to deal with the problem of global climate change. this is really about america's
139,"with the senate ethics rules. but as i say, mainly i was thinking about what is best for massachusetts? who's going to deliver on constituent needs? who's going to pay attention to transportation and education reform, to health care reform? who's going to pay attention to climate change and so forth? all of those issues."
140,"ms. browner is assistant to the president for energy and climate change. this led me to dailykos.com to find everything on glenn beck, his radio producer and roger ailes and we promise we on this program would announce a dedicated e-mail address to send tips on them. on that, more in a moment."
141,"who's going to pay attention to climate change and so forth? all of those issues. it's an unusual concentration of them that are important to massachusetts as they are to the nation that will be voted on in the next -- in the next few weeks. as i say, i think when you think about stewardship as being the"
142,too. health care not a big enough obstacle to tackle? president obama also hits climate change and middle east peace today. the u.s. scores a diplomatic win getting the israelis and palestinians not only in the same room but also shaking hands. it is past time to talk about starting negotiations. it is time to move forward. and how low will he go?
143,"side. and for what people see as alaska, we're not that many people, not even 700000 people to be the governor over, we do have trillions of dollars worth of resources here and managing that and the social ills that happen here and the climate change that's happening here, you know, it's hard work, as george bush said about being"
