0,"the country would honour their climate change mission. mr trump has previously described climate change as a chinese hoax and an american job-killer, as david willis reports from washington. the trump white house is said to be deeply divided on the issue of global warming."
1,shortly here on bbc news. other developing stories this afternoon: president trump is to announce this evening whether the us will pull out of the paris climate agreement. but he's coming under increasing international pressure to honour the commitment to cut greenhouse gases.
2,"announce his verdict, the president told his followers on twitter; in the rose garden of the white house. opponents fear it could prompt other members of the accord to ponder whether they too should think about withdrawing. america produces more in the way of greenhouse gases than"
3,midnight in london and seven peerman washington where president trump has announced in the past few hours that he is pulling out the us of the paris climate change deal which united the world in efforts to stop global warming. he said
4,"don't cool down. the scientists say we'd better get used to this. the un climate panel says more heatwaves are very likely and a new study, just published, says 48% of the world's population face deadly heatwaves by the end of the century and that's assuming we cut the greenhouse gases"
5,"by the decision. they argue that pulling out is the best deal for america. from brussels, damian grammaticas reports. in the fight against global warming,"
6,"and an american job-killer, as david willis reports from washington. the trump white house is said to be deeply divided on the issue of global warming."
7,"in mind that you were supportive of donald trump pulling out of climate change talks, do you believe in climate change? applause"
8,"sally hodkin's family says it's impossible to quantify the void created by a wholly avoidable death. michael buchanan, bbc news. arnold schwarzenegger has warned that tackling global warming must"
9,"but if that wasn't possible it 'didn't matter'. there's been swift international criticism of the us withdrawal. in a joint statement with germany and italy, france warned donald trump that the paris agreement could not be renegotiated. the un secretary general called it a major disappointment for global efforts to reduce greenhouse gas emissions."
10,whether he will pull america out of the paris agreement on climate change. china's premier confirmed china would honour its commitments on climate change. president trump
11,"across the united states have been sending. i want the world to know the us will meet our paris commitment. there has been harsh reaction around the globe. from brussels, damian grammaticas reports. in the fight against global warming,"
12,"of $100 billion a year for poor countries to cope with the effects. but mr trump has long been opposed. we're going to cancel the paris climate agreement. he says it undermines jobs, and he once claimed global warming"
13,on combating climate change. but president donald trump's team is standing by his decision to pull the united states out. let's stay with that story. low lying ocean islands feel the effects of climate change more
14,the disarmament process. stay with us here on bbc news. still to come: calling time on climate change.
15,the same responsibility. make our planet great again. richard black is the director of the energy and climate change
16,"barack obama says the us is rejecting the future. on the line, fiji 's prime minister and cop 23, for climate change."
17,president trump prepares to announce whether he'll pull the us out of the paris global climate change deal. he says his decision will 'make america great again'. he's coming under increasing international pressure to honour the commitment to cut greenhouse gases. we'll have the latest from washington.
18,"greenhouse gases that are heating the atmosphere. they came together amid jubilant scenes, ushering the atmosphere. they came together amidjubilant scenes, ushering in the paris aagreement, negotiated in 2015, the first global attempt to tackle climate change, a landmark deal that america has now dealt a"
19,"agreement remains irreversible and will be implemented, notjust by france but by all the other nations. those gathered outside the white house to protest the president's decision believe the departure of the second-largest polluter on the planet will have a dramatic impact on efforts to combat global warming."
20,in mind is that climate change will also increase global dependence on food trade to meet basic food demand. those countries that are already feeling insecure will depend increasingly on trade out of those choke points around the world to them. given climate change is a
21,"china and the european union are preparing a joint statement in support of the paris climate change agreement - as president trump prepares to announce whether he will withdraw the united states from the deal. he's now said that decision will be announced in about 17 hours. well, for many climate change"
22,"subservience to president trump, as jeremy corbyn said? no, the uk's position on the paris agreement remains as it has always been. it is an important agreement on climate change and the uk is one of the leading nations across the world in dealing with climate change. i made"
23,"led to believe. another point. the paris accord sets targets which many people, including many people who are themselves believers in man-made climate change, think are"
24,"this is what i meant to tell you. of course, we talked about unwillingness to work together -- a willingness to work together. lastly, regarding climate change,"
25,this view from the top of mount everest had never been seen before. the footage is also helping scientists today learn more about the impact of climate change.
26,"joint statement come out from him and members of the eu, reaffirming a commitment to this process. quite apart from any impact on the process around climate change amelioration,"
27,"both powerful politicians who have courted controversy, and have strong domestic constituencies. but ahead of the trip, there are rumblings under the surface. donald trump recently attacked india over climate change,"
28,"earlier, i spoke to hilda heine, president of the republic of the marshall islands in the central pacific ocean. i asked her for her reaction to president trump's withdrawal from the climate change agreement. of course, we were very disappointed. we were. it is highly concerning for those of us that live on the front line of climate change."
29,"is sure to have impacts on businesses around the world and not just america? that's right. you've heard what president trump has to say about climate change and in a few hours, chinese and eu leaders will issue theirjoint statement on the paris climate agreement. china has already said it will honour its commitments on climate change."
30,"have pledged to meet greenhouse gas emission targets regardless of president trump's announcement that he will withdraw the united states from the paris agreement on combatting climate change. the new leader of the biggest party in ireland's coalition government,"
31,"heavier organised rain arriving and that may come as welcome news. the latest headlines view on bbc news: -- foryou. president trump is withdrawing the united states from the paris accord on climate change,"
32,"for you to criticise him publicly? well i have been very clear, i have been happy 0 say i think president trump has been wrong to take america out of the climate change agreement."
33,"india says it won't back down either. 0vernight, president trump said he would announce his decision on the paris deal today. but even in the president's own backyard, there is defiance on climate change."
34,"close to the general election, it is the last seppi 's event, that really ups the stakes a bit. i know you are not a betting woman, but presumably, we will look at climate change,"
35,go along with somebody else. we take independent decisions. i told donald trump our views and we remain committed to the paris agreement. we continue to think it is important for dealing with climate change.
36,"in about 18 hours from the white house. the chinese premier has been given a red-carpet welcome with military honours in berlin by the german chancellor, angela merkel. climate change and trade were expected to dominate their discussions. the visit coincides with indications by mrs merkel of strained relations with mr trump, partly over his stance on climate change."
37,"impacts on infrastructure. we can see it and our own streets. heavy rainfall, storms and floods, periods of drought, they can really affect the integrity of roads and railways and waterways. that is true across the world. climate change"
38,"campaign pledge of his that he would do d o exa ctly do exactly that. and that decision is in the next hour or so. we will bring it to you. michaeljacobs, who worked on the paris climate change"
39,"but we will start to negotiate, and we will see if we can make a deal that is fair. and if we can, that's great. and if we can't, that is fine. climate change is an"
40,"we are seeing quite a profound geopolitical shift here, with china standing upon the world stage and becoming, i guess, whether it it or not, the leader, or one of the chief leaders, on climate change. and"
41,"elliott, thank you very much indeed. very happy to be with you. and you can get much more on the reaction following president trump's decision, plus full details on the science of climate change and the"
42,"going to make, change their minds on whether to build a new coal-fired power station on the back of donald trump's decision. but if other countries, perhaps see this as an opportunity to water down their commitments to climate change or to"
43,"stupid and don't understand what they are voting for? i have been hearing a lot of this, we all a bit stupid. still succumb, we will be looking at what president trump's decision to pull out of the climate change"
44,"districts, there is not a single area where people do not support regulating climate change and c02. 70% of americans overall support action on the climate to reduce global warming. it may be that"
45,"the us out of the paris climate agreement, the first un ocean conference opens on monday. the summit, which begins on world environment day, will deal with issues facing the earth's most important resource such as coral bleaching, plastic pollution, and rising seas due to climate change."
46,"president trump can't command science. he can't command weather, he can't command a climate. the rest of the world is getting it. i don't think we're getting it enough. if anything, our response at this point is rather feeble, given the threat that climate change represents."
47,"automotive sector but laid the groundwork for it to become one of the crown jewels of britain's economy with hi-tech economy and efficient cars. we will embrace that to upgrade our economy, create new good jobs and tackle climate change."
48,to again to donald trump. it is a dereliction of both our duty to this country and our duty to our planet. this is not the type of leadership britain needs to negotiate brexit or stand up to defend our planet in an era of climate change.
49,"that letter, neither has the uk, but we all have the same view that we remain committed to the paris agreement. in brussels, the eu and china have been prompted to take a stand because they share the belief that fighting climate change makes both"
50,"my name is mike embley. our top stories: reports from the philippines say more than 30 people have been killed after a gunman attacked a crowded casino in manila. storm clouds gather, as president trump withdraws the united states from the paris accord on climate change."
51,announced in the past few hours that he is pulling the us out of the paris climate change deal which united the world in efforts to stop global warming. he said the deal punished the us and
52,"of the paris climate deal, france and india have reaffirmed their commitment to climate change. at a meeting in paris, mr macron said they stood together on the issue. india is the third-largest greenhouse gas emitter in the world. mr modi said the paris climate agreement was part of the world's common heritage."
53,of the paris climate agreement. but he's coming under increasing international pressure to honour the commitment to cut greenhouse gases. tickets for sunday's concert to raise money for the victims
54,"agreement that would make a clean and healthy environment a human right. speaking in paris, he unveiled a draft for a legally-binding treaty, which supporters hope will be adopted by the united nations. it follows president trump's decision to take america out of the paris climate change deal."
55,"together with other european nations because she spoke directly to president trump last night to tell him she supports the paris deal. i've made the uk's position on the paris agreement very clear. we remain committed to the paris agreement, it's an important international agreement on climate change."
56,"with thisjoint reaction concert. what we are seeing here with this joint reaction to donald trump's statement is striking. not just for the swiftness, but also for the message it sends, at a time when the us, under president trump, is withdrawing from global leadership on climate change, instantly the"
57,"theresa may is promising britain will become a 'more prosperous' country after brexit, as she returns to the campaign trail after refusing to take part in the bbc's election debate. president trump is to confirm whether or not the us will stick to an major commitment on international climate change."
58,"brexit. the question people have to ask themselves is not about how they voted before, but who do they want to see leading this country in the brexit negotiations and leading the country for the future. you asked about president trump and the paris agreement on climate change. we"
59,"awake at night. why do you think he is so out of step with yellow that i can't answer, and i wouldn't try to understand what happens in the mind of donald trump. what i do know is that the science is overwhelming about climate change, that the"
60,i'm back with the latest from the bbc london newsroom in half an hour. hello. this is breakfast on friday the 2nd ofjune. i'm charlie stayt. the main headline this morning: international condemnation for president trump after he pulls america out of the paris agreement on climate change
61,"and that we wanted the usa to stay within the paris agreement. they have taken a different decision and we continue to commit to the paris agreement, we think it is important in dealing with climate change. the uk is one of the countries at the forefront of dealing with climate"
62,"it is incredible to say we should not have nuclear weapons, we do not need to the 21st-century, even michael portillo says we do not need it, but to say we have it and not use it is an incredible position to have. what about climate change?"
63,"stay above water, the economy is based mainly on tourism, marine -based tourism and fisheries and we have been learning from scientists what climate change and global warming will do to the oceans, it would story fisheries and they will"
64,"that base, we don't want things to create a problem with us, the saudis and ourfriends create a problem with us, the saudis and our friends in create a problem with us, the saudis and ourfriends in the gulf. thank you. stay with us on bbc news, still to come: calling time on climate change -  _"
65,"reports from the philippines say at least 34 bodies have been recovered from a casino in the capital manila hours after it was attacked by a gunman. police and fire officials said most of the victims died of suffocation. president trump is withdrawing the united states from the paris accord on climate change,"
66,"andjapan president trump last night. canada and japan have not signed that letter, neither has the uk. but we all have the same view that we remain committed to the paris agreement. in brussels, the eu and china have been prompted to take a stand because they share the belief that fighting climate change makes"
67,"earlier, as well as american allies, they all expressed disappointment as isaid i said earlier. i spoke to peter godfrey from the energy institute in singapore and asked who would pick up singapore and asked who would pick up the slack now that the usa has turned its back on climate change?"
68,"that the eu will push ahead with measures to tackle climate change, despite the president'sdecision to pull out of the paris agreement on global warming. here is what the german chancellor had to say in her parliament earlier today. translation: the eu fully supports"
69,time we will cut him off. we'll get the controller. it is 7:22am. there were celebrations around the world when the paris climate change agreement was signed two years ago. it was hailed as a major step forward in tackling global greenhouse gas emissions. but the news that president trump is withdrawing from the agreement has been widely criticised
70,"said that we can do a lot of stuff at business level, local level, state level and so on, to meet our targets. look, the united states is a big, diverse and resilient country, so we will move forward. so it's a bit of political theatre, really, what trump was engaged in on the climate change?"
71,"recovered from a casino in manila, hours after it was attacked by a gunman. police and fire officials said most of the victims died of suffocation. the man fired shots from an assault rifle sending hundreds of customers fleeing at the resorts world casino. president trump is withdrawing the united states from the paris accord on climate change,"
72,"seen. the key dynamic is not how manyjobs have been added but how they are paid. if hourly earnings are around 2.5 present, beating inflation, good news for rate rises later in the year. jeremy, you will be back to do the papers. still to come. how have tech firms been reacting to the news that america is quitting the paris climate change agreement?"
73,"emissions reductions. we have reduced greenhouse gas emissions more than any other developed country. we are leading, not by staying at the table with an ineffective international treaty, but by reducing greenhouse gas emissions. thank you for your time."
74,"of greenhouse gases in the world, with treble emissions within the next 15 years. but things have changed more quickly than anyone expected. suddenly, instead of coal"
75,"being set around the world, and scientists saying that more warming will threaten the ice sheets, the challenge is to cut the greenhouse gases heating the atmosphere. the paris agreement,"
76,"to cut greenhouse gases. tickets for sunday's concert to raise money for the victims of the manchester attack sell out within 20 minutes of going on sale. from now on, no more mr nice guy!"
77,"so, what about donald trump's allegation that america is suffering from the paris agreement? for a start, it's voluntary, with no obligations. the us offered to cut its greenhouse gases by up to 28% by 2025,"
78,"hot for them to fly, and more of this may be on the way. global temperatures are rising, largely due to our emissions of carbon dioxide and other greenhouse gases into the atmosphere. that means that our average temperatures in the uk,"
79,"garden of the white house. 0pponents fear it could prompt other members of the accord to wonder whether they should withdraw as well. america produces more in the way of greenhouse gases than any other country on the planet, apart from"
80,"just economy and second largest emitter of greenhouse gases, going into the opposite direction of the rest of the world. with me is our science editor david shukman. if we get this announcement tonight, what does it mean? if he decides to"
81,"emitter of greenhouse gases, responsibility will now fall to state governors, municipal governments, and here is the interesting one: to corporations as well. and shareholders are saying to these corporate leaders that they will not invest if your company is"
82,"will in some form keep his campaign pledge to withdraw. he once famously said global warming is a hoax perpetuated by the chinese. yes, he did say that. although he has qualified that a little bit since then, as he has qualified a number of other things. it is worth point out he has climate change deniers in his cabinet a leading climate denier who organised 22 other senators to write a letter to him, urging them"
83,"becoming both emitting more greenhouse gases and becoming increasingly dependent on imported gas, as with any insurance policy, we kind of don't know until the end of the date as to whether it was worth taking that insurance policy out or not. the point is, and the"
84,that's why i and a lot of residents are angry with camden and with the past labour government. don't blame theresa may now. this was a labour initiative and it was an eu directive to reduce greenhouse gases and reduce the amount of heating
85,"we cut the greenhouse gases warming the climate. in arizona, a heatwave with a surprising impact. at phoenix airport, one of the busiest in the world, some planes are grounded because the temperature reached 48 degrees celsius and that's too hot for them to fly,"
86,"kenya and uganda to grow, but to grow greener. # heretofore the united states. so that they do not contribute to the greenhouse gases warming the planet. president trump pulling back from these commitments and pulling out the rug from countries like kenya and uganda,"
87,"dependent of these countries and the well have to be on the us? the us is still the second largest polluter in the world. first of all, its own paris commitments are critical to reducing the amount of greenhouse gases. although there are many"
88,reducing greenhouse gases so it is good for the planet. 0ne good for the planet. one must not assume that being in a car you are not exposed to the abolition. do we need to move to fines straightaway or is there an argument for advice
89,"opponents fear it could prompt other members of the accord to ponder whether they too should think about withdrawing. america produces more in the way of greenhouse gases than any other country on the planet, apart from china. but president trump is keeping faith with fossil fuels"
90,"america great again'. he's coming under increasing international pressure to honour the commitment to cut greenhouse gases. we'll have the latest from washington. also this lunchtime. theresa may has promised that britain will become more prosperous after brexit, with enormous opportunities leading to 'a brighter future'."
91,"chinese on-board. president obama, try to bring the chinese on-boa rd. what president obama, try to bring the chinese on-board. what president obama did was what ended in paris. for the future, when you have a 30% country, that is china being responsible for 30% of greenhouse"
92,they also agreed to limit greenhouse gases to the level that can be absorbed naturally. and the plan is to review each country's contribution to cutting emissions every five years. earlier the foreign secretary boris johnson told the bbc it's not certain trump will pull out. let's see what the president
93,"on twitter, in the rose garden of the white house. opponents fear it could prompt other members of the accord to ponder whether they too should think about withdrawing. america produces more in the way of greenhouse gases than any other country on the planet, apart from china."
94,"and more of this may be on the way. global temperatures are rising, largely due to our emissions of carbon dioxide and other greenhouse gases into the atmosphere. that means that our average temperatures in the uk, for example, are also rising. which means that when we get the weather conditions for causing"
95,"cut greenhouse gases. the boss of british airways' parent company, has defended the airline's handling of the recent computer failure, that left passengers stranded around the world. i think the team at british airways has done everything possible to get ba back flying a full schedule as quickly as possible and tickets for the manchester"
96,"views on global warming. he called ita views on global warming. he called it a hoax, he has always been clear he does not believe it. he hasn't done anything no one expected him to do? public opinion in the usa shows that even in the most republican"
97,"in clean energy projects so they have sent statement saying there we re were continued us doesn't. if the us doesn't dissolve the nutters in the case you do have the united states which is the largest economy in the world, the second largest emitter of greenhouse gases not being part of this agreement means it will weaken"
98,"he is weakening america, he is losing jobs, he's exposing americans to worst climate change. americans to worst climate change. we'll have the details and the reaction to the president's announcement. also tonight:"
99,"on twitter; in the rose garden of the white house. opponents fear it could prompt other members of the accord to ponder whether they too should think about withdrawing. america produces more in the way of greenhouse gases than any other country on the planet, apart from china. but president trump is keeping faith with fossil fuels in the hope of creating jobs."
100,"is one of the biggest culprits when it comes to the production of greenhouse gas emissions. now this would deal, of course, a shattering blow to the legacy of barack obama"
101,"billion per year. that is not a good use of money. in the natural gas industry, we have done more to reduce greenhouse gas emissions, cap and trade policies, treaties, we"
