331,to an major commitment on international climate change. tickets have gone on sale for sunday's benefit concert for those affected by the manchester suicide bombing. two brothers whose father shot dead their mother and sister have
332,to an major commitment on international climate change. tickets have gone on sale for sunday's benefit concert for those affected by the manchester suicide bombing. two brothers whose father shot dead their mother and sister have
333,on climate change and in reducing c02 emissions and we continue to lobby with the americans to encourage them to do that. to those who are worried about what the president or might not be about to do -  _
334,obligations on countries signing it. basically they agreed to talk about what they were going to do about climate change. not a huge amount more. the us's own commitments are close to what the us emissions are
335,"you ask the question. if we look at what are the big themes in the world today - climate change, fighting terror, handling migration. everyone knows that there is no single country in itself who can handle that."
336,"the independent committee on climate change says eu energy efficiency rules on household appliances have helped reduce emissions. it's warning that the uk government now needs to take up the challenge. here's our environment analyst, roger harrabin."
337,"to tackle climate change, terrorism, health care, economic growth worldwide, tackling the causes of migration and so on. in reality she was trying to rally the troops. she is very keen to put on the united"
338,"of the climate change pact, etc. there is a steadiness, leaning towards change on most of the foreign policy. the big area of changing the trump foreign policy, from president 0bama is in the middle east."
339,"externally, particularly in these areas, in the population. a progressive approach, making people aware, any that can discourage, young people in schools are very conscious of the planet and climate change, so i think you build up over"
340,but the labour leader - jeremy corbyn - will warn that theresa may's approach to brexit risks 'a jobs meltdown.' a senior united nations official has said that the coalition to combat climate change will not break up
341,"president's own backyard, there is defiance on climate change. president trump cannot command science. he can't command the weather, he can't command the climate. the rest of the world is getting it. here at the hay"
342,"and urged others to do the same - but donald trump has previously described climate change as a hoax, and an american job-killer. earlier, alex thier, a former official at the us agency for international development,"
343,"will honour the agreement, and urged others to do the same - but donald trump has previously described climate change as a hoax, and an american job-killer. correspondent laura bicker is in washington for us now. a few hours"
344,have fostered a toxic climate ahead of negotiations with the eu. international pressure is growing on president trump not to abandon america's commitment to the 2015 paris deal on climate change. he will announce this evening whether he will
345,"on the paris deal today. but even in the president's own backyard, there's defiance on climate change. president trump can't command science. he can't command weather, he can't command a climate. the rest of the world is getting it."
346,"i don't think we're getting it enough. if anything, our response at this point is rather feeble, given the threat that climate change represents. so california will be on the field, doing its role, playing an active role"
347,"negotiated in december 2015, is the world's first attempt to tackle climate change and the un hopes it will survive, whatever america does. independently of the decision of the american government, it's important that all other"
348,"he pulls america out. that's true. let's wait to see what happens. it is possible that he will say that he's been persuaded to stay in the paris climate change agreement, we are given to believe that his"
349,"stories. president trump has confirmed the united states will withdraw on combating climate change. the police say an attack on a casino in myler there could've been a robbery rather than a terror attack, the gunmen has reportedly"
350,"polluter per head of population and, until now, it's also been the largest donor and supporter of other countries struggling with the impact of climate change. president trump said the deal could destroy more than two million usjobs."
351,"the main headline this morning: international condemnation for president trump after he pulls america out of the paris agreement on climate change. we will see if we can make a deal that's barefoot if we can, that's"
352,donald trump at the nato summit recently! they'll be geopolitical ramifications well beyond climate change in terms of the us pulling out of the paris deal. they could see china getting a leg up on the
353,"morning and before going any further, i would like to say a few words about leadership. donald trump's decision to pull the united states out of the paris climate change deal is reckless and dangerous. the commitments made in"
354,paris - and i was there - are vital to stop the world reaching the point of no return on climate change. there can be no question of watering those commitments down. the paris deal should not ever be up for
355,"people are trapped in low-paid work and not reaching their full potential. he also talked about president trump's decision to pull out of the paris climate change agreement, which he called reckless and dangerous and said it showed"
356,"agree? yes, it is very reckless and foolish, as well. the world came together at the paris meeting in 2015 and agreed we would do something together against climate change to get the temperature of the"
357,"climate change. nicaragua, there are two other countries that have not signed up and that is syria and nicaragua. nicaragua did not sign up because they said it did not go far enough. they - they will be : 722 e-            _"
358,negotiate an exit or stand up to defend our planet in an era of climate change. a labour government would do it very differently. short time ago i spoke to one of the politicians here who was integral in
359,"sitting in front of them. it is a more challenging experience. 45 minutes, an audience of 150 people. as you say, they can ask anything. given what is happening today, climate change, what else will be in"
360,"john pienaar has more details. putting america first, it's his slogan. but there is outrage donald trump's decision to pull out of the international treaty signed in paris and tackle climate change. i was elected to represent"
361,to pull the united states out of the paris climate change deal is reckless and dangerous. and to depict the prime minister too weak to stand up to america's leader. she has instead opted for silence and once again
362,"would i talk to him? yes. would i be polite? absolutely. i would even offer him some yorkshire tea! the paris treaty committed nations to work to cut emissions that cause climate change. it was seen by signatories, then"
363,"from america where the former mayor of new york says cities and businesses across united states of america are determined to meet their commitments to fight climate change. that, of course, despite president trump's decision to withdraw from"
364,our top stories. president trump has confirmed that the united states will withdraw from the paris agreement on combating climate change. police in the philippines say a gunman who attacked a casino in manila has been killed.
365,"the eu and china will continue to push the policy of change. it isn't only related to climate change, the focus of today. very much also on the business of moving and transitioning to a lower carbon"
366,the whole idea of the climate change court was basically for the rich countries in some way to support developing countries in moving towards a cleaner and greener future. peter godfrey there. we heard from the former presidential
367,"and if we can, that's great. and if we can't, that is fine. climate change is an american problem, too. just visit florida, a picturesque frontline in the wall against pollution. floating and rising sea levels risk"
368,"feet and without it. -- a seminal question. this affects the next generation of americans and people around the world. kevin rudd, thank you forjoining us. for many, climate change is the most important issue based on the planet."
369,"the paris agreement. apart from being the world 's biggest polluter per head of population, it is also the biggest donor and support to other countries in their effort to limit climate change. it also provides satellite to monitor"
370,"climate change. what are the ways around these, how do you hope to advance? for a start, every global leader with the exception of president trump is intent on pushing this agenda forward. when i was in"
371,"the latest headlines view on bbc news: -- foryou. president trump is withdrawing the united states from the paris accord on climate change, signed by 195 nations. he called it an unfair agreement that would cost millions of americanjobs."
372,target after careful study. it was an agreement that was structured to try and create a level playing field s0 so that everyone in the world would be engaged in climate change. it is the first international agreement
373,"marriage, abortion laws and they are divided on climate change with their former environment minister sammy wilson describing it as a con. yet traditionally the dup's relationship with the stories has been strong but what demands they will make of"
374,"disruptive for conventional power generators. it's an issue the uk will have to overcome. all major political parties are committed to low carbon energy to cut pollution and to tackle climate change. roger harrabin, bbc news. our top story this lunchtime."
375,"which is disruptive for conventional power generators. it's an issue the uk will have to overcome. all major political parties are committed to low carbon energy to cut pollution and to tackle climate change. roger harrabin, bbc news. the emirof"
376,the big movements are occurring because of human conflict and often you should recall that human conflict is exacerbated or made worse when we have the pressures from climate change. and i think the problem is that there is nowhere for
377,"support, reiterating support for the paris climate change deal, all of that will be discussed today. but interestingly, that little bit on brexit, she will be ushered from the room. they will not negotiate with her but listen to what she has to"
378,"the rising temperature and acidity of water there is faster and greater than anywhere else on the planet. that means that species such as oysters are at risk of extension. because, they say, is man-made climate change. what is happening"
379,nations. it follows president trump's decision to pull the us out of the paris climate change accord. a cyber attack on the uk houses of parliament has targeted the e-mail accounts of some mps and members of the house of lords.
380,"by chancellor merkel and chinese president xi jinping ahead of the g20 summit in germany. the two countries have found common cause recently on issues such as climate change and free trade, where they agree with each other, not the us."
381,"the two countries have found common cause recently on issues such as climate change and free trade, where they agree with each other, not the us. whether the pairing of these two pandas will prove equally fruitful only time will tell."
382,"cause recently on issues such as climate change and free trade, where they agree with each other, not the us. whether the pairing of these two pandas will prove equally fruitful only time will tell. i'm sure they will be very popular!"
383,this pair will have a week to acclimatise before being unveiled by chancellor merkel and chinese president xi jinping ahead of the g20 summit in germany. the two countries have found common cause recently on issues such as climate change and free trade -  _
384,watching climate change and verses back on the day when they knew exactly when to go hunting and to do this and that. now they have to play with the weather. the winters are colder and a little shorter and
385,"common, but powerful bulletin -- politicians who have courted controversy but ahead of the trip, there are rumblings under the surface. donald trump recently attacked india over climate change, identifying it as one of the world's biggest polluters at the cost of"
386,"but, the two governments hold very different views on important issues such as immigration and climate change. theresa may has said that eu nationals living in the uk will have the right to stay after brexit and will be able"
387,for bear hug. the two presidents hold different positions on issues such as immigration and climate change. here is some of what both leaders had to say a little earlier. not many people know it but both american and the indian constitution
388,"making a joint declaration. they will not abandon the paris agreement. the opposite. they are committed to it. today we are stepping up our cooperation on climate change with china. this means that today, china and europe have demonstrated solidarity with"
389,"refused to say whether the president still believed climate change was a hoax, and described withdrawing from the agreement as a brave decision. in a snub to the president some us cities and states have said the president made a courageous"
390,"climate change or not, are aimed at reducing emissions and ringing around cleaner fuels and around cleanerfuels and cleaner ways of moving ourselves around. and that includes china, which is now turning to california for advice on how to tackle its own pollution"
391,"simplistic and emotive fact, i don't even know if they are facts. of course people will answer in such a way that they are against climate change per se. someone last night was arguing against us polluting rivers, confusing pollution with"
392,"bit off the geography curriculum, but by trying to prevent a colleague from attending climate change talks. he has voted against amendments to reduce emissions. yet within weeks he will have to deliver a clean air strategy. it is a tremendous"
393,"appointment for young people. michael gove tried to take climate change out of the national curriculum for schools. young people are really concerned about the environment. if this is an attempt to engage with the youth vote, it is a bad start."
394,"has described the attack as a 'crime against humanity.' the chinese premier li keqiang is in germany, where he's been holding talks with chancellor angela merkel. climate change and trade are expected to top the agenda. this bbc video -- this video is                 _"
395,there is concern among some about the direction taken by us president donald trump on trade and climate change. chinese premier li keqiang will meet european council president donald tusk and european commission head jean-claude juncker. they are hoping to come up
396,"donald trump will announce today if he's pulling america out of the paris climate change agreement, but chinese and eu leaders are preparing to pledge their support for the deal. as the disgraced breast surgeon ian paterson begins a 15 year prison sentence,"
397,sticking with american leadership on climate change. i think you want me to depart from my iphone into a more aggressive stance of language. i'm not going to do that. we have been clear and firm with our friends and
398,"25 years to repay the debt entirely. the fine exceeds the $2.6 billion imposed on brazilian building firm odebrecht. shareholders in exxon mobil have backed calls demanding the company assesses the risks from climate change. the plan, proposed by investors,"
399,comments as well. what impact does this have on markets? interesting on the day that exxon tells us the -- they need to be more transparent and look at how climate change affects business. the there are some easy things that can
400,throughout the day and asking for comment and advice on many of the election issues. thank you. president trump is due to announce later today whether he'll pull the united states out of the paris climate-change agreement.
401,"in a sense you are more hawkish than he is in some matters. i accept a foreign policy is broad. i don't like breaking of the trade agreements. i don't like pulling out of the climate change pact, etc. there is a steadiness,"
402,"he provides the old and new images to scientists. they use them to determine the impact climate change has had on the himalayas over the past hundred years. but until now, he's only had a handful of still images from the early expeditions."
403,"areas around the world is year by year, bit by bit, the level of the sea is rising. it's why scientists say climate change is making a real impact and why many are worried about the us pulling out of the paris accord."
404,"our top story this lunchtime. president trump is coming under increasing international pressure, as he prepares to announce whether he'll pull the us out of the paris global climate change deal. and still to come. commentator: down the track. lovely!"
405,"of the paris global climate change deal. that's all from the bbc news at one, so it's goodbye from me - and on bbc one we nowjoin the bbc's news teams where you are. have a good afternoon. let's start with cricket"
406,of the paris accord. they have nationally determined commitments that they made that say we are going to grow in a way that emits less carbon in the future. and that contributes less to climate change. our they going to do that? countries
407,"to pay attention to climate change. and on bringing agreements like paris to fruition. if united states pulls out of that, the absence of leadership, the vacuum, will be felt around the world. it will be felt in united states, in industry, in"
408,"that. ben wright on the conservative battlebus somewhere in west yorkshire. the us president, donald trump, is coming under growing international pressure to honour the paris global climate change deal. he's due to announce in three hours or so whether the us"
409,"see if america will honour its commitments to the paris climate change agreement. former fbi directorjames comey, who was fired by president trump, is to testify to the intelligence committee on the administrations links with russia. the boss of british airways's parent"
410,"out of the paris climate change agreement. former fbi directorjames comey, fired by the president, is set to testify about the administration 's links with russia. and a quick look at the market. a lot of green there. the ftse and the"
411,paris climate change agreement. and in america the sacked former fbi directorjames comey is to testify before a senate committee. his evidence will form part of an investigation into alleged russian collusion with president trump's election campaign. an update on the
412,"that climate change exists, therefore america doesn't believe that. that sends a very interesting signal. stay with us. breaking news 110w. signal. stay with us. breaking news now. reports coming in from the philippines of gunfire and explosions outside a complex in the"
413,"lose global leadership, the president doesn't believe climate change is an issue so why would he wa nt to want to be a leader? that's why he will pull out in the manner he expected to. he doesn't believe it"
414,"through these challenges constantly. last year america played a leading role in tackling climate change. but then, the secretary of state, john kerry brought his granddaughter to the signing of the paris agreement. the president is not in fact making"
415,"but we will start to negotiate and we will see if we can make a deal that is fair. and if we can, that's rate. and if we can't, that is fine. climate change is an american problem, too. just visit florida,"
416,"accord on climate change, signed by 195 nations. he called it an unfair agreement that would cost millions of americanjobs. there's been swift international criticism of the withdrawal. in a joint statement, germany, italy and france warned donald trump that the paris agreement"
417,"least 36 bodies have been recovered from the casino in the capital manila. hours after it was attacked by gunman. president trump is withdrawing the united states from the paris accord on climate change, fined 198 nations. called it an"
418,this is breakfast on friday the 2nd ofjune. i'm charlie stayt. the main headline this morning: international condemnation for president trump after he pulls america out of the paris agreement on climate change. theresa may has told the president she's disappointed
419,hello. this is breakfast on friday the 2nd ofjune. i'm charlie stayt. the main headline this morning: international condemnation for president trump after he pulls america out of the paris agreement on climate change. theresa may has told the president she's disappointed
420,"great to have you with us. president trump has said he will pull the united states out of the paris climate change accord, calling it an unfair agreement that would hamstring the american economy while empowering the worst polluting nations."
421,"in a few hours, chinese and eu leaders will issue theirjoint statement on the paris climate agreement. china has already said it will honour its commitments on climate change. so, how much common ground is there between the eu and china"
422,"what more can you tell us? i guess it is somewhat related to your top story, climate change on the paris agreement, but as you mentioned the two leaders of india and russia met and russia has agreed to build two"
423,our planet. this is not the type of leadership britain needs to negotiate brexit all stand up to defend our planet in an era of climate change. a labour government would do it very differently. applause i'm delighted to be here in york
424,"on climate change. with european leaders signing a letter of protest, theresa may comes under criticism for refusing to be more vocal in opposing president trump's decision. the met police say they can find no records, so far, of any calls"
425,"global leaders in fighting climate change, but this is where it has found itself, a short time ago a spokesperson for the foreign ministry said that nearly everybody in the world should have cherished this hard-won"
426,protect the environment and the future of the world. it is probably worth pointing out that here in berlin this is simply not about climate change any more. there is a growing sense here that berlin and washington hold wildly divergent
427,"continue with a foreign policy that really works on other issues from climate change through to trade and security. jenny hill, thank you. the crown prosecution service have announced that craig mackinlay, who is running for south thanet in the election for"
428,"agreement is clear. we remain committed to it, it's an important international agreement on climate change. i made the uk's position clear to president trump at the g-7 meeting, as did the other g-7 leaders and i made the uk's position"
429,"us under president trump is withdrawing from global leadership on climate change. instantly, the eu and china are stepping in to take up that mantle. it's a striking global change that could herald a decline in us influence. so at this special"
430,"is an important international agreement on climate change. i made the uk's position clear to president trump last week at the g7 meeting, as did the other g7 leaders, and i made the uk's position clear to president trump last night. canada"
431,"under criticism from labour over her handling of the response to donald trump's decision on climate change but from other political parties too? you heard some of the claims that were put to theresa may about her handling of her situation, which"
432,"joint reaction to donald trump's statement is striking, not just for the swiftness, but also for the message it sends, at a time when the us under president trump is withdrawing from global leadership on climate change, instantly the eu"
433,"have been prompted to take a stand because they share the belief that fighting climate change makes both environmental and economic sense. and the eu says it put it on the right side of history. damien grammaticas, bbc news, brussels."
434,"continue to work towards the climate change targets. 60 other mayers of us cities coming forward to say they will work towards that, including the mail of pittsburgh's. that is the mail of pittsburgh's. that is the city that donald trump said"
435,"to the shadow international trade, and also climate change minister barry gardiner. you can get in touch via twitter using the hashtag, #bbcaskthis, or text your questions to 611211. you cab also email us at askthis@bbc.co.uk the headlines on bbc news:"
436,"nations to work to cut emissions that cause climate change. it was seen by signatories, then including america as a breakthrough. politicians from china to europe are in step and against the us president. world leaders are speaking out strongly."
437,she once the brexit negotiations but she once the brexit negotiations but she is refusing to say since head-on. she seems to be kowtowing to donald trump's climate change decision today. i thinkjeremy corbyn will do very well tonight.
438,"and he remains our candidate. mr mackinlay, along with nathan gray and marion little, will appear in court next month. we return to the issue- w- w. - of climate change. so, in the absence of america, it was china and europe who came"
