209,"is fine. climate change is an american problem, too. just visit florida, a picture as frontline in the wall against pollution. it is a"
210,other countries is really interesting and whether other countries are stepping up on key issues like global warming to fill a void that has been left by the united states and other so that the something that concerns over this year and america who fear america's pulling back. does she put the
211,"american problem, too. just visit florida, a picturesque frontline in the wall against global warming. -- just visit florida, a picturesque frontline in the fight flooding and rising sea levels risk turning it into a modern-day flooding and rising sea levels risk turning miami into a modern-day"
212,"at home and abroad. cities across america and nations across the world say the fight against global warming will continue. russia signs a deal to build two new reactors at a nuclear power station in india - oh, and it's going to loan india the money to do it. plus, we'll bring you all"
213,"but ahead of the trip, there are rumblings under the surface. donald trump recently attacked india over climate change, identifying it as one of the world's"
214,"as far as we are concerned. he does not appreciate the existential threat that climate change poses for countries like ours, marshall islands and other countries similar"
215,"it was over climate change mr gove most enraged environmentalists, notjust by trying to wipe it off the geography curriculum, but by trying to prevent a colleague"
216,"and a breeding ground for extremism we have a special report from libya on what's been called 'the forgotten war.' for many, climate change is the most"
217,"the european union and china are hoping to forge even closer ties at a summit in brussels today. the aim, to counter president trump's stand on trade and climate change. another day, another political crisis in brazil. this one very unfortunate, as the country is expected"
218,pledging to cap railfares. president trump will announce whether he's pulling the us out of the paris climate change agreement. carol is a hidel gem this morning.
219,from the bbc newsroom. german leader angela merkel says the paris agreement on climate change is non negotiable - in a thinly-veiled attack
220,"ultraconservative. they are not mainstream by any sort of measure. the sort of stuff they talk about in terms of climate change, denying it exists, and gay rights, really"
221,"about those problems, these people are finding that hunting is harder than ever. the elders, they are watching climate change and versus back in the day when they knew"
222,"such as immigration and climate change. theresa may has said that eu nationals living in the uk will have the right to stay after brexit, and will be able"
223,reaction around the world to donald trump's decision to withdraw the us from the paris climate change agreement. in america itself several states say they'll simply ignore president
224,"and so when the white house says it is withdrawing from the paris climate change deal to boost employment, it does not make a lot of sense here."
225,"but campaigners say that's at odds with his record of opposing measures to combat climate change, as our environment analyst roger harrabin explains. the highlands of scotland, michael"
226,"to undermine the us economy, wipe outjobs, and put his country at a permanent disadvantage. joining me now is todd stern, former advisor on climate change to president 0bama,"
227,"and exasperate global warming, which isa is a big issue over there. they claim the amount of carbon dioxide it will emit will be much more than what countries like kuwait and chile do in what countries like kuwait and chile doina what countries like kuwait and chile do in a whole year. clearly, it has"
228,"in the fight against global warming, and just hours after donald trump retreated, enter new leaders. the european union and china. apart from the us, these are the world's other two economic heavyweights, prompted by president trump to act in concert. what we are seeing here with this joint reaction to donald trump's statement is striking."
229,"climate change policies even though they pulled out of paris. the voice control the speaker that can compete with amazon on alexa, unveiled by apple. this is apple 's new ipad pro                 _"
230,not contribute to climate change so how can you justify wanting to be green when we have a perfect solution generating huge amount of power? it is not really a perfect
231,"in? do you want a government that will say to donald trump, you're wrong about climate change? applause dear donald, sorry, you're wrong. think on it. because, if we destroy"
232,still to come: calling time on climate change - arnold schwarzenegger and french president emmanuel macron forge a new friendship. members of the of the neo-nazi resistance movement stormed
233,"quentin sommerville, bbc news, eastern libya. china and the european union are preparing a joint statement in support of the paris climate change agreement. it comes as president trump prepares"
234,"california governorjerry brown. he's going to china soon to discuss climate change. in sacramento, the bbc's james cook asked him how damaging withdrawal might be. california has a long history of"
235,president trump is expected to announce at 8pm this evening whether he will be withdrawn from the us from the paris climate change deal. more than 5500 cases of child sexual
236,"household energy bills and carbon emissions will soar unless ministers devise new power saving policies after brexit, according to a new report. the independent committee on climate change says eu energy"
237,"and if we can, that's great, and if we can't, that's fine. climate change is an american problem too. visit florida, a floodline, rising sea levels risk turning miami beach"
238,"not take urgent action, climate change will lead 100 million people into extreme poverty. there is an urgency. do you want to pick up on that? i also think donald trump's"
239,"in brussels this morning. both men reaffirmed their commitment to tackling climate change and said there could be 'no backsliding' on the paris accord. ourjoint leadership provides business, investors and researchers"
240,"a labour government would do it very differently. there was a similar response from sir ed davey, the former liberal democrat climate change secretary. i'm afraid that price would been"
241,"angela merkel, described america's decision as 'regrettable'. mrs merkel urged the rest of the international community to stick to the path of combating climate change. our correspondentjenny hill is in berlin."
242,"may is under over this issue of climate change? she has been roundly criticised by all of the opposition parties. jeremy corbyn launching his strongest attack yet, i think, on"
243,this is bbc world news. these are the headlines. president trump's income is fighting in defence of his solution to dump the paris climate change deal. voices across a wide
244,"could be the case. we look forward to it. gavin hastings, thank you. arnold schwarzenegger has warned that tackling global warming must not be seen as a political issue. the actor said that everyone breathed the same air and it shouldn't be a question of right versus left. he met french president emmanuel macron, who will later give a speech"
245,"on the issue of global warming. the president's daughter ivanka, favours america remaining part of the paris accord. as does the g7 whose leaders, angela merkel among them, took time out from last week's summit in sicily to lobby mr trump on the issue. even pope francis rallied to the defence of the historic accord when he welcomed the president to the vatican."
246,"and climate change and in terms of the northern ireland political process. from your point of view as a corbyn supporter, i would not want too much about terrorists and i would also"
247,"to resolve it. i have heard that it is comparable to climate change. really, this is quite frightening. and, barbara, give us a sense of how much plastic we are talking about."
248,democracy and he is cutting out the will of the people. do you believe in climate change? of course i believe the climate is changing. who is responsible? a whole lot of
249,"important term we have been trying to share with everybody, the idea of that things are changing rapidly with global climate change, with other factors that are really addressing and affecting island"
250,"are anti-gay marriage, anti-abortion, and they believe that climate change is not real. it is quite similar to donald trump. but a clear political message running through the entirety of this"
251,"the choke points. these choke points and infrastructural bottlenecks, they are exposed to a number of hazards. security threats, climate change is probably the major threat, but also the potential for political"
252,"incorrect or distorted. where is society pulled, in what direction? so climate change, international crime, mass migration, there's all sorts of things that make me think the world is in a very"
253,"which starts on the 6th ofjuly. that's all the sport for now. thank you. for the natives of alaska, the challenge of climate change means traditional reindeer hunting seasons are becoming shorter."
254,"attacked india over climate change, identifying it as one of the world's biggest polluters, at that cost of countries such as the united states. india makes its participation contingent on receiving billions and"
255,talking about climate change and they are ready and waiting to step in on this issue. i be good to see a more national standard interventions to india? with president trump in
256,"to the paris agreement. in brussels, the eu and china have been prompted to take a stand because they share the belief that fighting climate change makes both environmental and economic sense."
257,highly concerning for those of us who live on the front line of climate change. the decision of president trump is quite disappointing and brings sadness to people from the marshall islands and
258,"countries like the marshall islands. you are on the frontline, as you say, what is the reality of climate change for you and your islanders? well, in the last two years we have"
259,"climate change or not, are aimed at reducing emissions and ringing around cleanerfuels and cleaner ways of moving ourselves around. and that includes china, which is now turning to california for advice"
260,"environment secretary. it's just under a year since mrs may sacked the formerjustice secretary - and her rival for the conservative leadership - from the cabinet. to combat climate change, as our environment analyst"
261,"as the country is expected to announce a return to growth for the first time since 2014. we have a report from the capital brasilia. for many, climate change is the most"
262,"mr trump has previously described climate change as a chinese hoax and an american job-killer. there has been widespread condemnation of a bomb in the diplomatic area of the afghan capital, kabul."
263,"the us deals with climate change on a federal level and on a state level, how important are the individual states in tackling emissions? they're critical. you have california and new york and"
264,"anything. the disadvantage of the us leaving is we lose a strong voice for particularly sort of imaginative, market-friendly approaches to dealing with climate change. i think a big worry is how"
265,"of the trade agreements. i don't like pulling out of the climate change pact, etc. there is a steadiness, leaning towards change on most of the foreign policy. the big area of change"
266,rising. is why scientists say climate change is making a real impactand impact and why many are worried about the us pulling out of the paris claude. donald trump says it's aboutjobs
267,"on the paris deal today. but even in the president's own backyard, there is defiance on climate change. president trump can't command science. he can't command weather, he can't command a climate."
268,"the us will be withdrawing from the paris agreement, on combatting climate change. as of today, the united states will cease all implement they of the non-binding paris accord, and the"
269,"on the paris climate agreement. china has already said it will honour its commitments on climate change. with me is james thornton, ceo of clientearth. thank you for coming in. let's start"
270,"real impact is in people'slives. we know climate change means more erratic, extreme weather, drought, flooding, which means for the poorest people in the world, who have done nothing to cause this,"
271,"the chinese have almost found themselves as climate change leaders. that is why we think it is untenable because across the states, from companies, mayors and state governors and companies are saying,"
272,to go ahead as a general election candidate when this cloud was clearly hanging over him? the reaction to donald trump's withdrawal from the paris climate change accord sparks a political row
273,"solution to dump the paris climate change deal. voices across a wide spectrum of bondage points. the president made a thoughtful and important decision. -- advantage points. in other news, with the uk"
274,scott pruitt refused to say whether climate change was a hoax and described withdrawing from the agreement as a brave decision. the president made a very brave decision yesterday. he put america's
275,countries beside syria and nicaragua to oppose the global effort to tackle climate change. but he says he is open to re-negotiating the deal. in order to for furl my solemn
276,"prime minister now who, actually, heads coalition of chaos and crackpots, dup, anti-women's rights climate change deniers and backed by northern ireland terrorists. that is where we have ended up. in terms of"
277,"majority. there are concerns about the dup stance it particularly in things like abortion, gay rights and climate change. there has been lots of twitter activity with mp5, sarah woollaston was one of them, really"
278,"television audience. china, the european union and india have restated their commitment to the paris agreement on combating climate change - but president trump's team are standing by his decision to pull the united states out."
279,"last stand in mosul. china and the eu prepare a joint statement in support of the paris climate change agreement, president trump prepares to announce whether the united states will withdraw from the accord. hello."
280,"challenge, this sort of pulling out of the climate change deal, the more protectionist trade position that donald trump is adopting. -- call. there are still differences between the eu and china. is there enough"
281,"emissions will soar unless ministers devise new power saving policies after brexit, according to a new report. the independent committee on climate change says eu energy efficiency rules on household appliances have helped reduce emissions."
282,and greater than anywhere else on the planet. that means species such as oysters are at risk of extinction. they say the cause is man-made climate change. what's happening here and in coastal
283,"and urged other countries to do the same, but donald trump has previously described climate change as a 'hoax', and an 'american job-killer'. our environment analyst roger harrabin reports. its coal that striving president"
284,"but donald trump has previously described climate change as a hoax, and an american job-killer. 0ur environment analyst roger harrabin reports. it's coal that's driving president trump away from the global climate deal."
285,"jobs but on an important economic factors, how many premature deaths are we avoiding by reducing air pollution and how much hardship we are avoiding by climate change? thank you nathan. one of the"
286,chronicling the need to fight climate change during the president's visit to the vatican. mr trump says he would read them. so whether he did or not we can't know. the president of the european
287,"business advantages investing in renewable energy. so with the european union they will fight on climate change and they will fight for free trade as well, both points in which there are now points of"
288,"middle of climate change every day. we are so affected here. how dare the leader of this great country say it doesn't exist! travel to the mist west coal and rust belt, there is a"
289,"major blow. this is a terrible day for international efforts to combat climate change, the biggest issues that the world faces. 195 countries signed the paris climate agreement and for the second largest polluter"
290,"america great again in this, he is weakening america, he is losing jobs, he is exposing americans to worst climate change. so will the deal survive? well the key may lie in renewable technologies likes"
291,"suggested that the paris climate accord is not renegotiable and that the fight against climate change will continue without the united states. as luck has it for the eu, tomorrow is the annual eu china"
292,to conduct his own climate change negotiations with the president of china. donald trump has gone awol. now it is up to the president of china and for california to work with him and other
293,"climate change is real, leaving paris is not good for america all the world. elon musk, not surprising, he came under pressure for staying on the presidential council. tim cook of apple, not a"
294,"something we have been talking about, for pulling out of the climate change deal and laid out labour's industrial strategy. tom, thank you, i realise it is busy. reckless and dangerous he said about"
295,out of the world and isolate it from climate change which is not possible. it is not over. it is too late for already for it to be over. thanks for coming in. that will
296,"biggest contributor to the problem and the biggest contributor to the solution. it has no choice but to do something about air pollution, even if climate change didn't exist. the commitment to renewable energy here"
297,"donald trump faces condemnation at home and abroad after pulling out of the paris agreement on climate change. theresa may has been accused of 'subservience' to the us byjeremy corbyn, after she refused tojoin italy,"
298,"today, to hit out hard. donald trump's decision to pull the united states out of the paris climate change deal is reckless and dangerous. and to depict the prime minister too weak to stand up"
299,"admitted to me in the spin room backstage they had not prepped a question on climate change, perhaps telling in a different way. of course they will have tonight after trump's decision. and that question"
300,utterly deplore donald trump's decision to withdraw from the paris climate change i would sign a letter with any other leader that would deplore that straightaway. applause let's come home for a moment. steve
301,you very much for giving us your time. thank you very much. much more reaction to president trump's decision and more details on the science of climate change and the paris accord on our website.
302,"was specifically mentioned by president trump? most americans think climate change is real and there was a lot of support for the paris agreement. i think us cities and states, i think they will stick"
303,"of climate change - and the paris accord on our website. just go to bbc.com/news and follow the links. much more to come on bbc news, including this. we talk to one of the surgeons"
304,"we are going to cancel the paris climate agreement. but having made that pledge on the campaign trail, it seems the president intends to stick to it, dealing what environmentalists say would be a shattering blow to the most comprehensive agreement on global warming ever reached. he will announce his verdict, the president told his followers on twitter, in the rose garden of the white house."
305,"signals coming from the white house is that he will in some form keep his campaign pledge to withdraw. of course, he did once say global warming was a hoax perpetuated by the chinese? he did once say that, though he has qualified that a bit since then, as he have a number of other things, but it is worth pointing out he had"
306,"images to scientists. they use them to determine the impact climate change has had on the himalayas over the past hundred years. but until now, he's only had a handful of still images from the early expeditions."
307,"very important. brexit is a huge matter, but i think for me, i'd love to see more engagement and more kind of debate over climate change. for me, one of the main issues is the nhs and funding."
308,"be afraid to pick up the phone to donald trump and say, listen, mate, you're wrong, you're wrong on trying to destroy the paris climate change agreement and you're wrong for this very simple reason. we all live on"
309,some homophobe climate change and nine at extremist. i don't think that will form a stable government for this country. -- forthis country. -- deniers. this is one of the reasons that people here. there are many reasons.
310,"message to take care of your place, 01' or your home, or your planet. the idea that things are changing rapidly with global climate change, and other factors that are really at dressing, and affecting island"
311,"therapeutic, relieves stress sort of just looking at it. wonderful idea. whatever mr trump might feel about climate change, the other party are active, big-time, aren't they? that's right. that is it from us for"
312,the united nations. it follows president trump's decision to take america out of the paris climate change deal. two pandas from a top breeding centre in china have arrived in berlin to start their new life
313,"different positions on important issues such as immigration and climate change. here is some of what both leaders had to say a little earlier. not many people know it, but both american and the indian constitution"
314,"news is that more than half, 55%, see him as a strong leader. but three quarters disagree with his plans for the border wall and to pull out of climate change and trade agreements. less than half surveyed"
315,"and have strong domestic constituencies. but ahead of the trip, there are rumblings under the surface. donald trump recently attacked india over climate change, identifying it as one of the world's biggest polluters at the cost of countries such"
316,adhere to all the agreements on climate change and i thank him for that part of his speech. i turn now to the seconder of today's loyal address whose speech was typically articulate. after all he is a former
317,"in international efforts to tackle mass migration and climate change, to alleviate poverty and end modern slavery. we have always looked beyond europe to the wider world and we will continue to do so. no, i am"
318,"up our cooperation on climate change with china. this means that today, china and europe have demonstrated solidarity with future generations and responsibility for the whole planet. we are convinced that yesterday's decision by the united states"
319,to tell him she supports the paris deal. i've made the uk's position on the paris agreement clear. we remain committed to it. it's an important international agreement on climate change. i made the uk's psoition clear
320,so far america has spent almost 780 million on the green climate fund which helps developing countries cope with the effects of climate change. those payments will now stop. alex pearce ease the director of the
321,"be more important symbolically than practically, because the battle against man-made climate change will continue, i think that the movement towards renewables is economically a strong force. at this point, only 76000 people are working in coal"
322,at whether the -- if you look at the big themes of the world today. climate change. terror. handling migration. everybody knows that there is no country that can handle it on itself. isaby can say that we
323,"about the environment. if this is an attempt to engage with the youth vote, it is a bad start. it was over climate change mr gove most enraged environmentalists, notjust by 20 by trying to wipe it"
324,"off the geography curriculum, but by trying to prevent a colleague from attending climate change talks. he has voted against amendments to reduce emissions. yet within weeks he will have to deliver a clean air strategy."
325,notjust by 20 wiping it off but by trying to prevent a colleague from attending climate change talks. he has voted against amendments to reduce emissions. clean air strategy. it is a tremendous opportunity to do
326,"jerk political reasons. it's not that detrimental, some people say, because as you know, action on climate change is at both federal, state and local level, and as we know, mayor bloomberg, the former mayor of new york,"
327,"as climate change and free trade. the bbc'sjoe mellor has been following the events in berlin. it's tempting to read a lot into this, there have been two east asian leaders here and this comes after a week where"
328,says he will be making an announcement soon if the us will withdraw from the paris climate change deal. media outlets says he'll be pulling out but mr trump will make a decision in a few days'
329,one of his big election campaign promises was pulling the us out of the biggest international agreement ever drawn up to combat climate change. he's now said he'll give his decision later on thursday. china and the european union
330,"actually does. there are a number of different strokes he could play. but yes, of course, we want to see america continued to show leadership on climate change and in reducing c02 co2 emissions. and we continue to"
