345,"greta, who was named 'time magazine' person of the year this week also urged activists to make sure next year is a year of action. not only is greta fighting for climate change, she took time out to fire a shot of sorts in a war of words with u.s. president"
346,"we're going to talk about climate now. senator klobuchar, many scientists say that even if the u.s. reduced its carbon footprint to zero by the year 2050, the damage will have been done. climate change will have made certain places in the u.s. unlivable. knowing this, would you support"
347,entire country to deal with this. i've seen politicians in washington saying the right thing about climate change as long as i've been alive. all these plans we have to get carbon neutral by 2050. and i think most or all of us have one. their impact is multiplied by
348,"senator sanders. i'll answer that question but i wanted to get back to the issue of climate change for a moment, because i do believe this is the existential issue. senator, with all respect, this question is about race. can you answer the question as it was asked?"
349,"to the 2016 issues when he was asked about race and tried to pivot to climate change. he made the joke about also being a white guy. he came out as a white guy last night. he did. it was the wrong moment to do that, when we were feeling the"
350,"going to have to relocate entire cities, but we will probably have to relocate some individual residents. and the problem right now is that this climate change is an existential crisis. you are seeing it here in california with the fires that you just had. you saw it in northern"
351,"get back into the international climate change agreement. i will do that on day one. on day two, bring back the clean power rules. on day three, the gas mileage standards. i see the governor of california who has been working so hard to get those done, defied every"
352,"senator sanders, i do want to put the same question to you, senator sanders. what message do you think -- i'll answer that question but i wanted to get back to the issue of climate change for a moment, because i do believe this is the existential issue. senator, with all respect,"
353,it's a twitter spat with a 16 year-old climate change activist. it's sort of a kind of slow rolling melt down except it's fast. it's almost the norm for him. i don't think he knows how to behave any other way. and we're along for the ride.
354,"and i approve this message because the only way we get universal healthcare, address climate change and make our economy more fair is to change business as usual in washington. some things are too important to do yourself. get customized security with 24/7 monitoring from xfinity home."
355,"protections that were put in place to protect our water, to protect our air, and to act on climate, and eliminating them over the course of a few years. as troublesome, according to military brass, trump turning a blind eye to climate change poses a threat to our national"
356,"serious question about how you fix climate change or other serious issues, and then they say you have a minute to answer, that's not fair to any candidate on the stage. and so for a candidate like vice president biden, who served all of these years, who has been"
357,"pure and civisimple. i'll do everything that i can to make sure that says the focus. thank you, sir. reporter: so obviously he wants to move on to these other topics that he has been talking about. climate change, health care, and his more centrist place in the"
358,"cnn will take you there for a firsthand look. these are the consequences today of climate change. the hilton a. will the hilton app help us pick the starters? great question, no. but it can help you pick your room from the floor plan. can the hilton app help us score?"
359,"meaning the worst, evidence so far of the calamitous effects of climate change. i'm already up to like 50 sunscreen and i still get tan. i don't really get that tan. but you know what i'm saying. weather analysts say indeed 2019 will go down as one of the hottest ever."
360,"and stood up to the coal lobby and this administration to protect this planet from climate change. and now, he's taking on. him. to rebuild a country and restore faith in the dream that defines us. where the wealthy will pay more in taxes and the middle class get their fair share."
361,"bringing jobs and thousands of affordable housing units with it. after witnessing the terrible toll of gun violence. he helped create a movement to protect families across america. and stood up to the coal lobby and this administration to protect this planet from climate change. and now, he's taking on. him. to rebuild a country"
362,"and stood up to the coal lobby and this administration to protect this planet from climate change. and now, he's taking on. him. to rebuild a country and restore faith in the dream that defines us. where the wealthy will pay more in taxes and the middle class get their fair share."
363,"he also believed in climate change back in those days. really? yes. i'm concerned about the future for my children. he doesn't have any children but he was concerned about the future, yeah, absolutely. and so i saw him as somebody who, you know, had been working to try to figure out what he"
364,"and stood up to the coal lobby and this administration to protect this planet from climate change. and now, he's taking on. him. to rebuild a country and restore faith in the dream that defines us. where the wealthy will pay more in taxes and the middle class get their fair share."
365,"change. so you can say i'm for clean air, i'm for clean water, people should stop dumping trash in the ocean. that is not a serious answer from a world leader. it has nothing to do with climate change. ocean garbage is a separate issue all by itself. my sense is that he can't accept"
366,"the way we take on climate change in a big way is by, yes, talking about what's happening on the coast as i just did, but also talking about what's happening in the middle west where i'm from. it's not flyover country to me, i live there. and what we're seeing there is unprecedented flooding."
367,"americans. it doesn't affect their daily lives. they're far more concerned about jobs, health care, what's impacting their kids on a day-to-day basis, climate change, how they pay for college, those kinds of things. i think there is some political expense that both sides will have to suffer for this, but the"
368,"little rusty or what? no. the truth of the matter -- and i'm not knocking the dnc, but a debate stage with 10 or 11 people on it and they ask you a serious question about how you fix climate change or other serious issues, and then they say you have a minute to answer,"
369,"packs. this year provided the best, meaning the worst, evidence so far of the calamitous effects of climate change. i'm already up to like 50 sunscreen and i still get tan. i don't really get that tan. but you know what i'm saying. weather analysts say indeed 2019 will go down as one of the"
370,"what is the effect of this barrage of lies? trump has created a situation where a lot of people who still trust him are not going to believe people who are trying to give them important, accurate information about their lives. whether that's doctors or scientists who are telling that climate change is a real problem."
371,"the bernie sanders message and motto when it came to climate change and when it came to health care. and then there's a whole group of democrats in the field that are saying, no, that's too progressive for where the country is and try to stick to the middle and just improve on obamacare and do other things"
372,far of the calamitous effects of climate change. i'm already up to like 50 sunscreen and i still get tan. i don't really get that tan. but you know what i'm saying. weather analysts say indeed 2019 will go down as one of the hottest ever. in iceland folks even held a funeral for a glacier that
373,"pure and simple. and i'll do everything in my power to make sure that stays the focus, not anything else. reporter: so joe biden there saying the focus should not be on impeachment but on his campaign and the issues he has been trying to talk to voters about here, whether it's climate change or health care or the economy. many voters here in iowa are"
