0,"into mozambique in march, will become more powerful and more frequent. extreme events punishing countries that did little to cause climate change. we should realize that if we look at the historical responsibility for the problem of global warming, the entire"
1,this melting pot of impacted species. everywhere is going to get touched by climate change.
2,el niño is starting to go haywire. everywhere is going to get touched by climate change.
3,el niño is starting to go haywire. everywhere is going to get touched by climate change.
4,"afford and it's too much. polluters don't want to hear this or are turning away from the words. despite the signage declaring otherwise, these climate crisis"
5,"and work together. [ speaking foreign language ] that sounded very good. [ laughter ] any questions. mr. president, climate change"
6,naturally superior sleep. this melting pot of impacted species. everywhere is going to get touched by climate change.
7,ask your dermatologist about skyrizi. this melting pot of impacted species. everywhere is going to get touched by climate change.
8,we're reporters from the new york times. this melting pot of impacted species. everywhere is going to get touched by climate change.
9,"climate change. researchers say global warming expose the millions to a smaller threat, as well. ticks and the illnesses they carry. cnn health reporter jacqueline howard joins us now. explain that connection to climate change and how is the"
10,"leave. reporter: critics blame the prime minister for his inaction on climate change, something morrison has denied in recent weeks. during his absence acting prime minister michael mccormack also recognized that further action is needed but added that a lot of hysteria about climate change"
11,forward. next. we're reporters from the new york times. this melting pot of impacted species. everywhere is going to get touched by climate change.
12,be in your moment. ask your doctor about ibrance. this melting pot of impacted species. everywhere is going to get touched by climate change.
13,"across the country, in the private sector and in the public sector, americans are still in. our children know better than some of the leaders in washington, d.c. the urgency of the climate crisis."
14,"kids who are afraid of gun violence. i think he is cruel when he doesn't deal with helping our dream.ers, of which we're very proud. i think he's in denial about the climate crisis."
15,our kids who are afraid of gun violence. i think he is cruel when he doesn't deal with helping our dreamers of which we're very proud. i think he's in denial about the climate crisis.
16,"the president heads the g-7 heads of state. they'll go first. we'll have ours a couple of weeks later, ours will be in washington, d.c. the theme of ours is the climate crisis, economic environmental"
17,"our kids who are afraid of gun violence. i think he is cruel when he doesn't deal with helping our dreamers, of which we're very proud. i think he is in denial about the climate crisis."
18,our kids who are afraid of gun violence. i think that he is cruel when he doesn't deal with helping our dreamers of which we are very proud before i think he is in denial about the climate crisis.
19,"kansas, and the president said he would easily win if pompeo did run. the filing deadline, though, isn't until june. and jane fonda and friends are back at it, protesting for action on climate crisis, and"
20,and we won't stop. join us in fighting for what's right. this melting pot of impacted species. everywhere is going to get touched by climate change.
21,ask your doctor how prolia® can help strengthen your bones. this melting pot of impacted species. everywhere is going to get touched by climate change. (groans) hmph.
22,we'll tell you what we know next. we're reporters from the new york times. this melting pot of impacted species. everywhere is going to get touched by climate change.
23,"disasters. we had nearly $10 billion in expenditures going towards natural disasters. hurricanes, floodings, and tragic wild fires. you can't deny they have not measured climate change on these"
24,for innovative ideas to fight the climate crisis. the prize given to five winners a year for the next ten years starting in 2021. in addition to the alarming warnings coming from scientists about the impact of the climate
25,"september, she brought 7 million people along with her, and that's really reinvigorated the conversation for climate activists in many ways and also changed a lot of the politics surrounding climate change."
26,"for days, a record-breaking heat wave has fueled more than 100 wildfires across the country, many of which are not contained. and it is igniting a call for action on climate change."
27,"people who heard her screaming from the bottom of a i cliff. the woman in her mid-30s. she was walking along a foot path when she fell down the cliff. she was taken to a local hospital with minor injuries. the climate crisis, a"
28,"part in the annual summit, and this year scientists say it's urgent countries take action. writing in the journal 'nature,' researchers say the earth is heading toward a global tipping point, meaning climate change is"
29,the 1941 attack. we have a live report on what happened next. we're reporters from the new york times. this melting pot of impacted species. everywhere is going to get touched by climate change.
30,we're trying to figure out what animals are being affected. galápagos is a really challenging place to work. el niño is starting to go haywire. everywhere is going to get touched by climate change.
31,"but members of congress, and the corporations who've bought our democracy hate term limits. too bad. i'm tom steyer and i approve this message because the only way we get universal healthcare, address climate change"
32,"suspend. i want to talk about your op-ed for cnn.com, too. in that op-ed you suggest the president is intentionally ignoring dangers of climate change in order to win votes in the upcoming presidential race. how do you see the climate"
33,"organizing. this country right now is so fragmented and being torn apart. you see it in this partisanship, which is being like but fail to do the bigger challenge. the ceiling is climate change, big issues."
34,"skin problems; and severe bone joint, or muscle pain. are you ready? ask your doctor how prolia® can help strengthen your bones. this melting pot of impacted species. everywhere is going to get touched by climate change."
35,argument. it's bigger than her but she has to get away from what's coming her way. next. we're reporters from the new york times. this melting pot of impacted species. everywhere is going to get touched by climate change.
36,"and if you choose to fail us, i say we will never forgive you. 'time' magazine's decision to pick her is going to make sense to many even those who disagree with her about climate change"
37,no flights. no roads. we're trying to figure out what animals are being affected. galápagos is a really challenging place to work. el niño is starting to go haywire. everywhere is going to get touched by climate change.
38,"woman who's a nominee for the nobel peace prize, greta thunberg. a true hero to so many people around the globe because she's focused on the future. she's bringing people together and getting us unified to tackle climate change."
39,this question is about race. can you answer the question as it was asked? [ applause ] because people of color in fact are going to be the people suffering most if we do not deal with climate change.
40,other spaopblresponsibilities. and i accept that. and i accept the criticism. and that is why jeannie and i determined that i should return. he is facing criticism that the government is not doing enough to combat climate change.
41,"talk about their ideas, i have results. you know we delivered health insurance to 99% of the residents in massachusetts. there's not another state in america that can touch that. we delivered a national model for responding to climate change"
42,bringing jobs and thousands of affordable housing units with it. after witnessing the terrible toll of gun violence. he helped create a movement to protect families across america. and stood up to the coal lobby and this administration to protect this planet from climate change.
43,bringing jobs and thousands of affordable housing units with it. after witnessing the terrible toll of gun violence. he helped create a movement to protect families across america. and stood up to the coal lobby and this administration to protect this planet from climate change.
44,be doing a prescription drug bill. last week we voted to expand and protect the right to vote. we are going to be looking at hopefully getting a trade deal done by the end of the year that will be good for climate change
45,you shouldn't have to chase down payments. (vo) send invoices and accept payments to get paid twice as fast. (danny) it's time to get yours! (vo) quickbooks. backing you. this melting pot of impacted species. everywhere is going to get touched by climate change.
46,bringing jobs and thousands of affordable housing units with it. after witnessing the terrible toll of gun violence. he helped create a movement to protect families across america. and stood up to the coal lobby and this administration to protect this planet from climate change.
47,"to make money on private prisons and private detention centers at our border, just not for the people whose lives are torn apart. works great for giant oil companies that want to drill everywhere, but not for the rest of us who see climate change"
48,"davenport, iowa, because we know these places will be hit time and time again? i very much hope we will not have to relocate entire cities, but we will probably have to relocate some individual residents. and the problem right now is that this climate change is an"
49,"a carbon tax and massive research on renewable energy, energy storage, and carbon storage. bigger than that, we have to summon the energies of the entire country to deal with this. i've seen politicians in washington saying the right thing about climate change as long as i've been alive."
50,"change meeting in madrid, and she said the strikes, which you mentioned -- the major strike was last september. achieved nothing, she said, because greenhouse gases have continued to rise. you also heard she said there, she needs a break."
51,for cutting greenhouse gas emissions. a key part of the paris climate accord. teenage activist greta thunberg has made a name for
52,"that could one day power planes, propel ships, and fuel trucks. and cut their greenhouse gas emissions in half. algae. its potential just keeps growing."
53,"that could one day power planes, propel ships, and fuel trucks. and cut their greenhouse gas emissions in half. algae. its potential just keeps growing."
54,"all, climate change is not isolated to just climate change. climate change will affect everything that we do in our nation. there are parts of our nation are currently threatened. southern florida, new orleans, louisiana, various places in"
55,at forging a final declaration to curb global warming. closing statements are expected momentarily.
56,"spain for the cop-25, the climate crisis, to address the climate crisis. and this is really an existential threat to the planet. you can't exaggerate. when i came home that night, i had dinner with some scientists"
57,"kids who are afraid -- of gun violence. i think he is cruel when they doesn't deal with the, helping our dreamers, of which we are very proud. i think he's in denial about the constitution, about the climate"
58,"friday deadline, to wrap up the two-week cop25 summit in madrid. countries cannot agree on how to set regulations and targets for cutting greenhouse gas emissions. a key part of the paris climate"
59,"we -- that the world leaders that people empower grasp the urgency of the climate crisis because right now, it doesn't seem like they are. none of us can hide away any more because the climate crisis is going to affect all of us."
60,"just this past september, mobilizations saw 7.6 people take to the streets demanding real climate action. this process isn't really speaking to or addressing the real causes of emissions, right? if we want to explain why we are at this point of the climate"
61,"a rupe agenda that's very compelling and that addressing climate change directly, making agriculture the tip of the speer in the ballots against climate change. she articulates the most c"
62,of climate change. i'm sure people equally would acknowledge that the direct connection to any single fire event is not credible. we must take action on climate change. reporter: authorities are
63,of climate change. i'm sure people equally would acknowledge that the direct connection to any single fire event is not credible. we must take action on climate change. reporter: authorities are
64,"and the next democratic debate will be held december 19th in los angeles. we'll take another break, but still to come, rising sea levels, extreme weather events. scientists are warning countries must do more to fight climate"
65,donald trump. it's about the future of democracy and democratic process and this is a -- a trend throughout the world. it's about the future of the earth. we have a party that has decided to be disbelieving about climate
66,address climate change and make our economy more fair is to change business as usual in washington.
67,leaders make a global reduction of greenhouse gas emissions so they stay in line with the united nations ipcc report that came out last october. and so one of the ways that we are going to really hold our world leaders accountable is the
68,"for planet earth, and how achievable are they? my overall goals for planet earth is to see our world leaders make a global reduction of greenhouse gas emissions so they stay in line with the united nations ipcc report that came out last october."
69,"missile systems, not russian missile systems. you have to work better when it comes to ukraine. climate change came up, and prime minister trudeau asked about the differences on climate change. this was the president's"
70,because his epa doesn't believe in climate change. he thinks windmills cause cancer is climate change is a hoax. he thinks we should be able to use as much resource as we want. he's completely on a different
71,"because president trump does not adhere to facts, he has no apparent regard for science or scientists. he's rolled back environmental policies and blocked progress fighting climate change. climate change is a hoax. everybody remembers that."
72,"has ever seen anything like it. this is where the incoming gets pretty striking, and, frankly, damning about the president of the united states. dumping trash in the ocean is a serious problem. it is not the cause of climate"
73,"dichbt mo different movements. she doesn't represent them but she's a sign of the young people standing up and saying it's time to do something different. speaking of doing something different, she spoke to leaders at copp 25, this u.n. climate"
74,"democratic primary. not a big surprise, 30% of democratic voters essentially say climate change is the most important issue to them. climate change is down at 11%. it's the economy and healthcare. if i were focusing in on the two"
75,president trump talked about her on twitter. he told the teen working on global warming to go to a good movie with a friend and chill. thunberg changed her bio to
76,"the signs of climate change because then it runs counter to his political comments about what he's doing with epa and deregulations and pulling out of paris. but climate change is a global problem. when he gets up and says something like that, he just"
77,"he's rolled back environmental policies and blocked progress fighting climate change. climate change is a hoax. everybody remembers that. it's wrong, but everybody remembers it. by the way, today we have the cleanest air. we have the cleanest water that we've ever had in the history of"
78,"reporter: global warming aside, it must be heartwarming for a 16-year-old climate activist to be defended by a former first lady when attacked by the current president. michelle obama tweeted, don't let anyone dim your light."
79,"because of global warming and smelled fresh meat and went crazy. the bats are coming for us y'all, ahh! this was certainly appointment viewing in my house. contributor for 'the daily beast' and cnn.com joining us,"
80,"what we do about pollution. and climate change is about pollution. so there's a new language and a new discussion that needs to take place. everything we do in our country is going to be affected by climate change, people need to respect that and understand it. it is a crisis already today and"
81,explanation. he was asked about climate change and this is what we got. climate change is very important to me. i also see what's happening with our oceans where certain countries are dumping unlimited loads of things in it. they tend to float toward the united states. i see that happening and nobody
82,"pure and simple and i'll do everything in my power to make sure that stays the focus, not anything else. reporter: so joe biden there saying the focus should not be on impeachment but on his campaign and the issues he has been trying to talk to voters about here, whether it's climate"
83,"paying off a pole dancer and every spouse you ever had in the past few weeks, making fun in the public of a 16-year-old who speaks out on global issues including global warming and to say that's the message we were"
84,"millennium floods in two years. do the mathematics on that. i insist we act with a carbon tax and massive research on renewable energy, energy storage and carbon storage. bigger than that, we have to summon the energies of the"
85,climate change this as right now the u.s. is in the midst of pulling out of the paris climate accord. a process it will complete just around this time next year. as this unfolds delegations from around the world are coming together in madrid at the annual u.n. climate change conference. the meeting comes after a recent
86,"became uninhabitable because the sea levels rose. we know that town is not alone. that's playing out in coastal areas around the country. the question is do you leave that town on its own to fend for itself, or do you come together as a country and say we need to protect our people from climate"
87,"you know what's worse? denying that global warming is happening. i don't really care about being mean on twitter. you know, that's who he is. let me ask you about this. you shouldn't be mean to anybody who suffers -- i shouldn't say suffer -- has that            _"
88,"skywalker.' that's next. it had all the promise of creating real change to combat the current climate crisis. cop25, a summit of climate"
89,"we relocated a town in louisiana that became uninhabitable because the sea levels rose. we know that town is not alone. that's playing out in coastal areas around the country. the question is do you leave that town on its own to fend for itself, or do you come together as a country and say we need to protect our people from climate"
90,"the world is in peril from the climate crisis. if you were there, you would have heard very dire comments. a recent u.n. report explaining"
91,"of the year for raising awareness to the climate crisis. justin, welcome to the show. thanks for having me. let's start with the simple question."
92,"shipping is always free. go to dealdash.com right now and see how much you can save. the climate crisis, the measles outbreak and the opioid"
93,we're trying to figure out what animals are being affected. galápagos is a really challenging place to work. el niño is starting to go haywire. everywhere is going to get touched by climate change.
94,"he is cruel when he doesn't deal with helping dreamers. he's in denial about the climate crisis. however, that's about the election. this is about the election."
95,"equal work, to raise the minimum work for 33 million americans, the biggest watergate, to respond to neutrality, climate crisis, universal background checks, and we recently"
96,"but we've had 100 hearings already on the climate crisis in the congress. and it's a public health issue. clean air, clean water, food safety. it's a jobs issue."
97,"bright lights of ha long bay's fishing boats are unmistakable. lin: they can only caught the squid in the evening. the light attracts the squid, so they can catch them. anthony: right. they say that because of global warming all the fish are dying but that the squid and cuttlefish populations are increasing."
98,this melting pot of impacted species. everywhere is going to get touched by climate change. here hold this.
99,"doesn't deal with helping our dream.ers of which we are very proud. i think he's in denial about the climate crisis. however, that's about the election. this is about the constitution"
100,"climate crisis created by rich countries. she's at the forefront of the climate protests in her native uganda, cleaning plastic filth out of lake victoria. the change in climate tried her"
101,biggest polluters in the world. emissions are only going up. cnn's jon definite tarios look at how airports are making changes in the face of the climate crisis. reporter: with nearly
102,"and dermatologist recommended. tide free & gentle. safe for skin with psoriasis and eczema. the climate crisis, a measles outbreak, and the opioid epidemic all made news in 2019. cnn's chief medical"
103,this melting pot of impacted species. everywhere is going to get touched by climate change. the holidays are easier.
104,"violence. i think he is cruel when he doesn't deal with helping our dream.ers, of which we're very proud. i think he's in denial about the climate crisis. however, that's about the"
105,"in this age of climate change debates, the rains are seen as another standoff between people and nature. but here a delicate balance"
106,"issues in terms of ending disparaty in income, we have to be part of ending the climate crisis. i keep talking about that because it's an economic issue as well as a public health issue"
107,"violence. i think he is cruel when he doesn't deal with helping our dreamers. i think he's in denial about the climate crisis. however, that's about the election. this is about the -- take it up                 _"
108,"climate crisis. the president thrust the issue back into the forefront, with a bizarre speech, using the green new deal and said the crisis was a rallying cry. trump says he wants to scale"
109,"child stating that five countries, argentina, germany, turkey, and brazil are violating our rights by their inaction on the climate crisis. and so on november 20th, our petition was accepted by the united nations committee on the"
110,"mentioning i just came back from spain, i was there for 48 hours for the climate crisis, the cop-25, 14 of us, members of congress, senator whitehouse, a champion on climate issues. what have we done?"
111,"i think he is cruel when he doesn't deal with helping our dreamers, of which we're very proud. i think he is in denial about the climate crisis. however, that's about the election. this is about the -- take it up                 _"
112,"we'll continue to follow it of course. thanks so much for your reporting. the climate crisis sparks a battle of wits as the u.s. president, donald trump, takes aim at a teenage activist who has been emboldening the world."
113,"did not create. i am the voice of the children, displaced women and people suffering at the hands of climate crisis created by rich countries. reporter: she's at the forefront of the climate protest in her native uganda, claiming"
114,"it's a hunger gripping a u.n.-estimated 45 million people. and this part of africa, the climate crisis is only getting worse. the region is projected to be warming at more or less double the global rate of warming."
115,"brain snatch. he's was funny, self depricating, he believed in climate change. he sold his soul to the devil? i dont know the answer to that."
116,address climate change and make our economy more fair is to change business as usual in washington. (  ) only tylenol® rapid release gels have laser drilled holes.
117,"climate change, on north korea, on terrorism. and, yet, americans are appalled by china's record on human rights, including the detention of over a million muslim."
118,"fight the climate crisis. and he's putting millions of dollars behind it. plus, new details about the stabbing attack at a rabbi's home and what we're learning about the suspect's intent to serve in the military."
119,"the constitution, degrades our environment almost every day, the air children breathe, the water, all of it, in denial about the climate crisis and the rest. and what is america? it's a great, beautiful play from sea to shining sea, which"
120,"i think he is cruel when he doesn't deal with helping our dreamers, of which we are very proud. i think he's in denial about the -- about the climate crisis. however, that's about the election. this is about the -- take it up                 _"
121,"climate crisis. however, that's about the election. take it up in the election. this is about the constitution of the united states and the facts that leads to the president's violation of his oath of office. as a catholic, i resent your"
122,"which were we're very proud of. i think he's in denial about the constitution, the climate crisis, however, that's about election. this is about the -- this is about the constitution of the united states. and the facts that lead to the"
