107,"system, and on climate change, as well. the high education tax rate envisioned would rise to levels not seen in nearly four decades. tonight, president obama will deliver that speech to the naacp convention in new york city to"
108,now it's called climate change. it's slick political maneuvering to try to rename it. john in massachusetts said you had a terrible winter and pretty lousy spring. my mind is elsewhere. this debate will go on and on
109,"solve this problem in one meeting, or one summit, i believe we've made some important strides forward as we move towards copenhagen. i don't think i have to emphasize that climate change is one of the defining challenges"
110,"its effects on weather patterns, our food and water sources, our health and our habitats. every nation on this planet is at risk, and just as no one nation is responsible for climate change, no one nation"
111,savings of 1.8 billion barrels of oil over the lifetime of vehicles sold in the next five years alone. and we just passed in our house of representatives the first climate change legislation that would cut carbon pollution by
112,"somehow we cannot make significant strides. it is no small task for 17 leaders to bridge their differences on an issue like climate change. we each have our national priorities and politics to contend with, and any steps we"
113,"arms talks, they believe he did in italy dealing with financial issue, climate change and at like. now in africa, he was trying to administer what you might call a little tough love. day of the extraordinary moment,"
114,"the president is also trying to move aggressively to deal with another potential crisis. climate change. he helped lead the group to support a reduction of green house gas emissions among developed countries, 80% cut by"
115,president 'has to start taking a very cold hard look at the cost of tackling climate change and reforming health care during a recession.' always watch the costs. looks like a clear road ahead to general motors' plan to
116,"the first one to acknowledge that progress on this issue will not be easy. reporter: after chairing a forum on climate change, a dose of reality. it is no small task for 17 leaders to bridge theon their d"
117,"and his immediate reaction is to throw the cops under the bus. we elected the first black president. the naacp is passing climate change resolutions. for some people, they're never going to get -- as long as there"
118,"basics you buy at the grocery store. it can also take on the biggest issues in the world like climate change, international politics. what happens at this summit seriously might impact how we live for years to come -- if this group of leaders --  _"
119,"wanted. reporter: the financial crisis and climate change, two hot button issues on a lot of the minds of the americans here dominating the agenda here, as well. president obama may be in italy for the first g-8 summit but"
120,on climate change. that's at the top of the hour. i'm poppy harlow in new york. some environmentalists say it's too little and too late. more on that at the top of the hour. i'm susan lisovicz at the new
121,"for us this morning. outside a senate committee on environment and public works hearing on climate change, the line to get in stretches on. a few people arrive in the wee hour hoping to get a seat, not for themselves but for"
122,"high level talks between u.s. and chinese officials began in washington today. president obama, hillary clinton and tim geithner addressing the opening session of the two-day meeting. the talks will cover the global financial crisis, climate change, nuclear proliferation and human rights."
123," everybody wants a new romance  welcome back. 11 minutes past the hour. new this morning, president obama is wrapping up meetings at the g-8 summit at l'aquila, ita italy. the economy as well as climate change dominated those talks."
124,fight world hunger by not giving out aid but helping countries in africa farm better so they can sustain it and not keep getting aid from the dprksg-8. he wants to talk about climate change obviously. a bit of disappointment here for
125,"they believe it's a long process, as you note, in iran. certainly obviously not going to happen overnight. we saw at the g-8 summit, completely different issue like climate change, the president tried to bring along countries like china, india, brazil, big,"
126,"tax, not set in stone, but certainly on the table. thanks, brianna. president obama's ambitions to deal with climate change here in the united states is now stalled on capitol hill. democratic senator barbara boxer is chairwoman of the house environment committee has"
127,"this trip. at the g-8 summit in italy. when he was trying to move forward on the issue of climate change. the group did an agreement, a goal. not to allow the earth's temperature to rise any more than 3.6 degrees fahrenheit."
128,"diversity of islamic force is vital for a simple reason. the problems that the world faces from nuclear proliferation to climate change can't be tackled by the west alone, they need a coalition not of west and east, they need a coalition of"
129,"will benefit and the world will be better off. because our ability to partner with each other is a prerequisite for progress on many of the most pressing global challenges. other related sensitive issues on the table, climate change, human rights, nuclear"
130,"package money is being used where you live. we'll break it down for you. saving the planet. on the agenda at the g-8 summit, president obama is leading a forum on climate change with some non-g8 nations."
131,"is going to happen. you let us know if that occurs. paula newton, thanks so much. we appreciate that live from italy this morning. more on climate change in today's energy fix segment. the two reasons why developing nations are against cutting"
132,"neither of us profits from a growing dependence on foreign oil, nor can we spare our people from the ravages of climate change unless we cooperate. common sense calls upon us to act in concert. both of our countries are taking"
133,"president obama in italy tonight where the annual g-8 summit kicked off this morning. high on the agenda is climate change, the global economic recession and the danger posed by nuclear programs in north korea and iran. the g-8 which is made of"
134,no problem with lobbyists being at hearings but they shouldn't be able to buy a seat. the internet environmental group who was shut out of that climate change hearing. it's unfortunate that the people who come here to line stand always beat us here.
135,optimistic about getting a climate change deal that will satisfy india's interests. obama administration officials were on the sunday talk shows this morning defending the president's health care plan. they say the proposed overhaul is a work in progress. they are asking americans to
136,"warren buffett. let's talk about president obama. he's been on a week-long trip. huge agenda, climate change, global economy, international security, fighting world hunger. everything, kitchen sink kind of trip. yet his poll numbers are not that good. let's look -- a new poll shows"
137,"public works hearing on climate change, the line to get in stretches on. a few people arrived in the wee hours hoping to get a seat. not for themselves, but for lobbyists. they are paid line standers, and some of them are either homeless"
138,"steps forward to address the threat of climate change in our time. the g8 nations agreed that by 2050, we'll reduce our emissions by 80% and that we'll work with all nations to cut global emissions in half. in 17 of the world's leading"
139,clean energy economy is the nation that will lead the 21st century global economy. we did not reach agreement on every issue. and we still have much work ahead on climate change. but these achievements are highly meaningful and they'll generate significant momentum as
140,"effective response from iran and north korea. we also discussed challenges we faced in managing our economies, steps we can take together in combatting climate change, and other important matters. and i believe we laid a solid foundation on these issues. ultimately the summit and the"
141,"acknowledged some disappointm t disappointments. we did not reach agreement on every issue. we still have much work ahead on climate change. reporter: the president failed to get developing countries who are also big polluters, like china, israel, and brazil, to set a specific"
142,"anyway. i have given my reasons and i am taking my fight for what's best for alaska in a new direction. despite this, i don't want anyone, any acian dissituated from entering politics after seeing this real climate change that began in august. we need"
143,"coming out of the house of representatives with a climate change bill but he can't get agreement. this is the year in wila big international treaty is supposed to be struck with china and india. and right now, they're not playing ball. they've been hoping to curb"
144,"i think that our growing understanding of those, that diversity of islamic force, is vital for a simple reason. the problems that the world faces, from nuclear proliferation to climate change, can't be tackled by the west alone. they need a coalition not of"
145,"lobbying for cooperation, a subject that will also be a major topic in the midding of the week at the president's second stop, italy for the g-8 summit. other issues will be financial cry circumstance climate change and efforts to wipe out global"
146,"of the two-day meting. the talks will cover the global financial crisis, climate change, nuclear proliferation and human rights. one of the most important figures in modern dance is dead. at the age of 90. merce cunningham choreographed more than 200 works in his"
147,"two, he set a deadline and had he not for the rerecess, we wouldn't be as far as we are. three, he got a huge stimulus bill, a climate change package, which you can argue if they should have done that before health care, so things are"
148,"bring the budget into a long-term balance. democrats can't wait to spend more public money on new reforms that have nothing to do with combatting the crisis, whether it's in health care or climate change or you name it. so there is a major fiscal"
149,"climate change and regional energy, regional security like north korea and iran. we will not always see eye to eye, and where we can, we will be honest with each other. reporter: human rights still a flashpoint but one not likely to sink this ship."
150,"we also recognize that climate change is already happening, and so we're going to have to help those affected countries adapt, particularly those who are least able to dole with the consequences because of a lack of resources. so, we are looking at providing significant financial assistance to help these countries."
151,"positions. we've made a good start. but i'm the first one to acknowledge that progress on this issue will not be easy. reporter: after chairing a forum on climate change, a dose of reality. it is no small task for 17 leaders to bridge their differences on an issue like"
152,"on to italy to deal with the world's largest economies on issues like climate change, but he said he also decided to stop here in ghana because he believes the 21st century will be shaped not by what happens in capitals like moscow and rome but also what happens in tiny"
153,"afghanistan as well as the financial crisis, climate change and the industrialized nations trying to wipe out poverty. the president will wrap up his trip next weekend in ghana. there will be a lot of international attention on a visit to ghana by the first"
154,"democrats can't wait to spend more public money on new reforms that have nothing to do with combatting the crisis, whether it's on health care or climate change or you name it. so there's a major fiscal crisis building in the united states, it's been building for some time"
155,"out of all of the big foreign policy issues. they're going to talk about the economic recovery, what we're doing together to get there, climate change, energy, and environment, north korea, afghanistan, pakistan, and also as the secretary -- geithner and clinton and in an op ed, this is"
156,"the toughest issues we've seen in our lifetime, wolf -- health care, climate change, recovery efforts. there's no question that speaker pelosi's personal popularity main be as high as other leaders but that's because she's doing the job for the american people. i applaud her of the job she's"
157,"climate cha climate change. let me say that was a pretty good statement i thought i believe in all those things. i also believe that we should have a government that works. i don't like slogans anymore like limited government. that's not the right answer. the right answer is, give me a"
158,"shouldn't be able to buy a seat. an internet environmental group representative was shut out of that climate change hearing. it is very you have been the people who come to line stand always beat us here. reporter: for the line standers it is a job, but it also gives them a sense of"
159,"we are very grateful to all of you. i also want to thank the 17 other leaders that participated. we had a candid and open discussion about the growing threat of climate change and what our nations must do, both individually and collectively, to address it. and while we don't expect to"
160,"recovery here. the problem is the president was forced today to forced to say they did not get to where they wanted to be on climate change, and that's been a very, very big problem here during this entire meeting. i mean, it's really a battle now between the developed countries and the developing countries."
161,"declaration. let's move on and talk about it again at a climate change conference at the end of the year. this is a photo opportunity. what's important here, too, is you heard richard talking about exit strategy. here they're talking about more stimulus. and britain, most forcefully, and the u.s. kind of looking at"
162,"it is not all fun and games here. obviously, there is a lot of substance going on. you mentioned the economy. these leaders already affirming a commitment on the first day to having pro growth policies, dealing with the financial crisis and talking about climate change, a commitment,a broad"
163,"paula. reporter: ali, there's nothing i hate more than having to admit that richard is right, but he is. already today, on climate change, you were supposed to have targets. concrete numbers on the table. what happened? china had to pull out early. no numbers on the table. more wishy-washy language on the"
164,"we did not reach agreement on every issue, and we still have much work ahead on climate change. reporter: the president failed to get developing countries who are also big polluters, like china, india, and brazil, to commit to a specific goal in lowering green house gas emissions. as for the global economic"
165,and reducing missiles but didn't resolve the tough issues with the russians over missile defense. didn't get a lot of support on iran which was very important to him. now he goes into the industrialized nations. and really hopes to get something done on climate change. he goes fresh with this victory
166,"italy. topping the ambitious agenda for the leaders, how best to handle this stage of the global recession. two other major issues they'll be talking about, how to stop the spread of nuclear weapons and climate change. did you know the group of eight used to be the g-6?"
167,"topic of discussion at the president's second stop in the middle of the week when he goes to italy for the g-8 summit. in addition to iran, of course afghanistan, as well as the financial crisis, climate change, and the industrialized nations trying to wipe out global poverty, all major topics"
168,"does the united states need china for the most? we talked about economy here, but also, with other issues around whether that's climate change, whether that's north korea, what do we need them, on what topic do we need their help the most? i think you just named it. we need them on just about every"
169,"key global issue. we need them to rebalance the economy, we need them to address climate change. we need them to be our biggest partner in asia. japan has always held that role but i think it will be china in the future. the relationship between the u.s. and china politically in asia is going to be key to"
