117,message says we're all still thirsty. it's not all about efficiency and money. do you expect him to talk politics? he has been vocal about global warming. he's said the planet is starting
118,"chapter. is that because you disagree with what he is saying or what's in the bible? the chapter about global warming, don, to be honest with you. the bible doesn't say you"
119,"he's aware of that as well. he may raise that issue when he comes to the united states. we're selecting about capitalism, global warming. that will have political implications. then there's how he addresses"
120,the bay. he is using the arctic as a backdrop of the climate agenda. he is taking global warming deniers to task at a conference in anchorage. we have jim acosta all the way
121,"issues like global warming. like income inequality. like immigration. he was very quick to point himself out as the son of immigrants and talking about america as the unit, north america, central america, south"
122,"change which he spoke about it in great detail. you handed me a card, you said here's everything that you need to know about global warming. a graph about co2 going up. co2 and temperatures."
123,"item on his agenda is concern about global warming and the environment. right. i'm just wondering because he's in d.c. at the moment, it's almost exposing a chasm between most catholics and the political"
124,back to washington. but a boat trip he took yesterday that had him sounding the alarm about global warming and a boat trip that brought him face-to-face with a rapidly melting glacier.
125,from hunger to illness and global warming. i'll ask him what works and what doesn't. i basically think there's more good news than bad news. it's just that the bad news captures the headlines.
126,"this, at the same time that you've got, i believe, seven of the candidates running for office right now that are catholics. what do we expect? well, i think the pope is going to talk about a few things. first, the poor, which is one of his great themes, income inequality, certainly, climate"
127,the woodrow wilson center. has president obama hit the mark on this trip or using alaska for the background visuals to push for action on climate change at the summit later this year? i think he hit his mark on the climate change as he set out to do. i was surprised to hear him talk about energy and the need for working with alaska natives and
128,took yesterday that had him sounding the alarm about global warming and a boat trip that brought him face-to-face with a rapidly melting glacier. let's get more now from chief white house correspondent jim acosta in anchorage.
129,you have been busy. john and christine. the pope will say global warming is real and hillary clinton did it. i love that conversation she had with don lemon. what an interesting thing in the political process.
130,"fascinating to see. one of the decoding things, manu, will be privatization on the message. yesterday he was very heavy on global warming. our thought is that is where he agrees. he's not here to breed division,"
131,"issue? it's interesting he's done things to show his priorities. yesterday, in addition to global warming, he met with the little sisters of the poor. who launched that lawsuit against obamacare. it's interesting to see the"
132,"it's not going to solve global warming by itself or stop war, but there are many areas where it can be effective. in relation to health, most years of healthy life lost are behavior, we don't exercise"
133,"what are they going to talk about? you'll have global warming on the table, relations with cuba on the table, you'll have this atmosphere of inclusiveness that's needed, whether that means refugees or religious rites here in the country."
134,just go in to follow their own way but follow jesus' way. reporter: politics do matter. catholic conservatives are in sense the pope blames human beings in part for global warming and accuse the pope of
135,"calling. finding solutions for problems plaguing the world from the syrian crisis to strive in the ukraine, from hunger and illness and global warming. i'll ask him what works and what doesn't. i basically think there's"
136,exploring parts of action ab and a firsthand look at what he says global warming has done to the state and his new warning when we come back. music: 'another sunny day' by belle and sebastian such a shame it's labeled a 'getaway.'
137,"newsroom.' i'm zain asher. welcome back, everybody. i'm john vause. we'll check the headlines this hour. u.s. president obama is making alaska a focal point in his push against global warming. it was the start of a three-day"
138,capitalism. he is anti-trickle down economics. supports the iranian deal and pushed for better relations for cuba. pro global warming and wants us to do more. essentially he's talking about the greed of america. this is pure marxism coming
139,"this man said who am i to judge. and global warming. he says we need to take care of our common home. we have to take care. this man, i heard him in congress today on tv, he has the"
140,"their own way, but who wants to follow jesus' way. reporter: but politics do matter. catholic conservatives, along with other religious conservatives, are incensed the pope blames human beings in part for global warming. they accuse the pope of being a"
141,"global warming and more about reproductive rights. we know on the left they want to hear more about immigration and less about reproductive rights from the pope. as a catholic, as an archbishop, what are you hoping he hits in"
142,i will absolutely apologize some time in the distant future hopefully if i'm ever wrong. that is me. you know you really well. i know. it is freezing and snowing in new york. we need global warming. well i think it's you.
143,"we need to stop judging each other and embrace each other. there is so much controversy. let's say gay marriage. he said who am i to judge. and global warming, he says we need to take care of our common"
144,"and church in its highest forms and they doesn't like that. also, he talks about global warming, he wanted something that's economical. chris, i have to say in italy, that is not a small size car. that's a medium size car."
145,he will take a boat tour of the bay and he will use the arctic as a back drop for the climate agenda. he has taken global warming deniers to task in an unusually blunt speech at the conference in anchorage.
146,"charge for same sex marriage, the pope has softened his own stance. on climate change, the pope says"
147,"flores. reporter: john and christine, pope francis not holding back tackling immigration, climate change and religious freedom and"
148,"[ applause ] accepting the urgency, it seems clear to me also that climate change is a problem we can no"
149,"the pope, then he's now talking about global warming and the pope's words about conservation of humanity and resources. he says he's echoing the sentiments of the father of the revolution, his brother, obviously, fidel castro, who he says in 1992. he's right now speaking,"
150,"warming? is that a safe zone for him? absolutely, it's a sign of respect. cuba can say, listen, we're a country that does a lot with very little, very poor country. at the end of the day, this is an island. global warming has a huge impact"
151,and happy to see the others leave. president obama takes a hike and gets a firsthand look at what he says global warming has done to the state of alaska. we will have details about his trip coming up on the other side of this break.
152,"most importantly, how is he going to say it? we heard global warming at the top of his agenda. we will take you through our guesses at what it could be and once the pope is going to give his speech, you get full and an"
153,"successes of -- he has a phrase, making a mess. he believes in getting involved in controversies and social disorder as a way of finding progre progress. aren't they picking on the global warming stuff, that he's been so heavy-handed, we're"
154,"him in their language. and it was very important not just because of straight level coherence but what pope decided to emphasis, what words seem to matter more to him. you saw on global warming i'm sure it will draw political criticism but he was determined"
155,"only this man, perhaps, can deliver in such a diplomatic way. but he didn't do it in terms of right/left. he did it in terms of right and wrong. human. global warming was the big message yesterday. you were right to point out the"
156,"the best placement maybe ever is that fiat. i can't wait until the story comes out on how many they sold after the pope came. there's this presumption that global warming, that's going to get the republicans. a big shot democrat said that to"
157,"let's say global warming. he says we need to take care of our common home. we have to take care and this man, i heard him in congress today on tv, he has the ability, unique ability to unite. i feel like i'm catholic, but i"
158,"here on the streets of havana, cuba. he landed a short time ago. we heard speeches from president raul castro welcoming him, asking for better relations with the u.s., asking for better global warming policy, and asking for change. pope francis on a similar theme"
159,"should protect and honor the earth, mother nature? sitting there and talking about global warming and that being one of his big things. he goes down to cuba. you don't hear him give this same speech about taking care of others and we need to be"
160,"reverse the current, you know, move towards global warming and all the uncertainties. and i was speaking to archbishop arzo who is the vatican ambassador to the united nations and he said look, we're not democrat or republican. we're talking about b a biblical"
161,"mr. obama spoke again on the issue of global warming, urging countries across the globe to change course before it's too late. here is more of what the president had to say. this is one of the most studied glaciers because it's so easley accessible."
162,"where. of course global warming should be a big concern. but when you have so much warm, so much poverty. so much famine. is there criticism in that tactic. he'll get into that in other areas as well. but i think the bulk of this"
163,entire election. denying of climate change going on all the time. donald trump dominating the dialogue. using negativity to lift him
164,"climate change say problem. we can no longer be left to future generations. [ applause ] when it comes to the climate, we"
165,"their climate change impact. and we're going to begin in panama, where the man sitting behind you has built the maximum"
166,"climate change is already disrupting our agriculture and ecosystems. our water and food supplies. our energy. our infrastructure. human health, human safety."
167,refugees have arrived and in austria they are greeted with open arms. plus president obama addresses climate change. and new satellite proof isis
168,liberals and conservatives. the pope brought up immigration and climate change and income inequality and religious liberty. let's get more from our rosa
169,"climate change. melting glaciers and record high temperatures. he addressed arctic nations, including russia on monday night. his address, he addressed the"
170,"coming from raul castro, unusual. that he's listened to the pope's encyclicals, then spoke a lot about global warming, which is important to the pope and translated that into the need of conservation of resources, that cuba does a lot with the little, that the rich countries around"
171,"majestic corner of the world. mr. obama spoke again on the issue of global warming, urging countries across the globe to change course before it's too late. here is more of what the president had to say. this is one of the most studied glaciers because it's so"
172,cultural performance at a local middle school before coming back to washington. a boat trip yesterday he took that had him sounding the alarm about global warming and a boat trip that brought him face-to-face with a rapidly melting glacier. we get more from jim acosta in
173,"democrats in a tough spot on the issues of life and marriage which are the true teachings of the church. there's a presumption that global warming will bother republicans. but you're right, on a moral issue, those are political issues what to do with them. but morality is something that"
174,"me yesterday. i said, how are you going to feel when the pope looks you in the eye and says you have a duty, the natural right to protect the unborn? how's that going to feel? what do you think hurts more politically, global warming or protect children?"
175,"if he goes before congress and makes the case that seems to be most basic with this pope is you have a lot of money, you don't spend it in the right ways it should change. yes, he'll fold that into global warming and the conservation of humanity."
176,castro said he had a fondness to the pope and he listened to his words and looking at the words in the bible he referred to and looking at the words that the pope had pointed to especially about global warming but he took a political turn and talking
177,"survival skills in the wild as they talk about global warming. later on, he will travel to northern alaska where he will become the first president to visit the arctic to visit fishermen and a white house official described the journey as a signature trip of the obama"
178,global warming was big on the south lawn. was part of what he said to congress. though not as emphasized. today they believe it will be a big message. help people understand why for the vatican that this message is part of a tapestry of a continuum that what they believe
179,"what do you say to that? to his influence here? he has now released on climate change and equality, two topics that are very politically"
180,is there are climate change warrior and then oil baron obama happy to keep the oil pumping. i wouldn't call him an oil baron.
181,impact of climate change more than alaska which is why the president is making the understand precedented three-day visit. alaska is more dnd depend --  _
182,start of a three-day trip to address climate change. the pace of melting is only getting faster. it's now twice what it was
183,i'm sensing the urgency. it seems clear to me also that climate change is a problem we can no longer be left to our
184,"controversial issues, including immigration, marriage and climate change. a strong signal that when this first jesuit pope, first bone in the firstborn in the americas."
185,in this month for the 21st conference regarding the climate change that will take place in december in paris. we see a clear echo in the
186,not take this issue seriously or treats it like a joke is not fit to lead. do you take climate change seriously? i take changes in the
187,hillary clinton e-mails released overnight. the latest ahead. and president obama has harsh words for politicians who deny climate change. the troubling past of the
188,"country which was largely built by families. hates inequality and climate change, loves immigrants. he's like a young bernie sanders. okay. so, you know, the timing was"
189,"on immigration. let us remember the golden rule. and climate change. now is the time for courageous. as pope francis calls for unity, the republican civil war"
190,apprehension. many of the republican lawmakers are concerned about his joint address to congress specifically about his views of climate change and immigration. and while there are some
191,"now. today. and climate change is a trend that affects all trends. economic trends, security trends, everything will be impacted. and it becomes more dramatic with each passing year."
192,"moment. barack obama is wrapping up his visit to alaska and says america must lead the way on one of the biggest throats, climate change. diabetes, steady is exciting."
193,"hate inequality, climate change, loves immigrants, he's like a young bernie sanders. no. why leave now? i just got here. i got a fancy suit and a new set"
194,his signature caution about capitalism and warnings about climate change that made some republicans uncomfortable. and so the most serious effects of the environmental deterioration caused by human
195,it is not what we want for our children. francis delivered his signature caution about capitalism and warnings about climate change that made some republicans uncomfortable. environmental deterioration
196,"immigrati immigration, same-sex marriage and climate change. it may be a sign of what's to come when the pope meets with congress. pope francis making his first"
197,"inspiration from humanity. and from global call for action on social justice, climate change and ensuring a life of dignity for all. let me just say, your holiness,"
198,"they are doing nothing. all they do is talk. we're going to imperil jobs and actually the middle class and the lower classes are going to be the people with no money are going to be imperil led by doin this because it costs so much. if we have global warming, it's going to be of the nuclear form"
199,i believe there is global warming. and it's up to the stewardship and humanity on the earth that we live to fix it. how do you think the message is received? i think some of of the people are going to receive it very well. i think the important thing about the pope's message is this
200,"word whether they got up and close and personal with any wildlife. later today, the president heads to the arctic with another prospective on global warming. to the arctic and he will hear from fishermen who are seeing their livelihoods threatened and he will also talk to nearby communities who are relocating because of the rapid melting in"
201,possible considering the environmental risks of drilling? i think it's really essential to move forward aggressively in addressing climate change so i approve. that but at the same time there
202,"congress did not. through obama's administration, a majority of americans wanted congress to address climate change. they haven't done anything. the richest americans, hedge fund owners pay the lowest tax"
203,"security, get rid of all the foreign entanglements. climate change has nothing to that. the whole list of issues that they agree with him. that's why he is resounding to"
204,accelerate the thaw. we hear about climate change and the damage it is causing the environment. but for one industry it brings advantages. the shipping industry sees opportunities to make routes
205,"reporter: pope francis pleaded with the world's leaders to protect the environment describing the planet as our common home. it seems clear to me, also, that climate change is a problem"
206,"president obama this week to  talk economy, climate change and cyber crime. for more on the five things, be sure to visit 'new day' cnn.com. with the pope arriving in the"
207,"pope francis not holding back during his first full day in the united states tackling immigration, climate change and religious freedom. even cannonizing the first american saint at the basilica"
208,led the charge on same-sex marriage and the pope says climate change is a grave issue with grave implications. the president counted on the pope for the nuclear deal and
209,"the chinese president urged the world community to fight climate change. he pledged that china would shoulder its share of responsibility. and this was a bit of a standout moment, szimbabwe's"
210,"various of his messages. when he put out his encyclical on climate change, it's been a uniting moment. what do you see in terms of unity and disunity among the"
211,"something to deal with climate change today. we'll certainly stay tuned. father thomas reese, thanks for your time today. thank you. colombia's government is taking a major step toward"
212,"do you expect him to go even further than he did on wednesday inned addressing immigration, climate change and abortion? those are the most divisive issues in u.s. politics today."
213,"capital kills scores of people. the pope takes washington by storm with the focus on poverty, immigration and climate change. and breakthrough after decades of conflict. the columbian government moves"
214,"critically important issues, including poverty around the world, climate change, war. christiane amanpour is with us as well. christiane, lots of anticipation building now. exactly. and we're look at the assembly"
215,"obama, of course, toward the paris conference. cap and trade system implemented there. china is the world's largest polluter. anything on climate change from china will be hugely positive to"
216,"joint announcement with president obama tomorrow after their bilateral talks friday. on climate change. they're going to announce a cap and trade system. basically, that caps the level of carbon emissions."
217,"poor -- i'm not so sure students are into climate change. but polls show evangelicals, millenials, christian conservatives, are far more concerned about the planet and income inequality than their parents' generation."
218,"obviously, his family message is multifold. he opposes same-sex marriage. he's also talking about the dignity of the worker and climate change and he's also talking about the importance of"
219,everything else is politics. if people are defying the facts of climate change. we can have a legitimate debate about how we are going to address this problem. we cannot deny the science.
220,"started the trip by renaming mt. mckinley, denali. he will see the effects of climate change first hand. he will tour one of the melting glaciers. he will do that with bear grylls"
221,"grandfather. the penalty phase of the trial will start on tuesday. still breaking here on 'cnn newsroom,' president obama begins a conference on climate change. he ends up saying that the u.s."
222,"here and rename a mountain. that's a lot of the criticism. obama, the emphasis of his trip was the highlight of climate change is affecting alaska and alaskans like most other states."
223,like the economy and climate change. there are also of course expected to address these hack attacks that american officials say they traced back to cyber criminals in beijing. and hillary clinton getting
224,"the pope is a disruptor of politics. because he's with republicans on abortion and same-sex marriage but democrats on more issues, immigration, income inequality, climate change. when he goes to address the"
225,"and the house speaker, john boehner, both catholics themselves. the pope touched on issues ranging from the climate change and the death penalty to abortion and immigration. listen. we, the people, of this"
226,"on immigration. let us remember the golden rule. and climate change. now is the time for courageous. as pope francis calls for unity, the republican civil war explodes. john boehner abruptly resigns as"
227,alaska regarding climate change. and we had sefven foreign ministers who had come together and they were seized by this challenge of the migration that is taking place. it's an enormous challenge.
228,"rough morning. well, act now or condemn the world tonight mare, those words from president obama blasting climate change deniers. the president set to call for more ice breakers in the arctic,"
229,change. which means she's in charge of getting 195 nations to agree and to be ready to take on this goal of combatting climate change. we know in the past 20 years of
230,"during his first full day in the united states. hear this. tackling topics like immigration, climate change, religious freedom and cononizing the first i had spanish american in the basilica."
231,"congress that life at all stages should be protected, tell republicans that immigration and climate change should be priorities and still get standing ovation after standing ovation. no question they walked away"
232,"shine a bright light on issues embraced by many democrats, including immigrants' rights and climate change and equality. we support your call to all world leaders to support the communities most vulnerable to"
233,"six to 12 degrees over the next century, more ice dispappearing sea levels rising one to four feet. also he shut down the climate change deniers. the time to heed the critics"
234,"anticipated that he'll say things about immigration, perhaps deliver a major address in philadelphia using abraham lincoln's lectern. he'll also address climate change, so we've been led to believe. do you think he'll address the"
235,he said the melting glacier is an obvious sign of climate change. this is one of the most studied glaciers because it's so easily accessible. what it indicates because of the changing patterns of winters
236,of this national park. nowhere else is feeling the impact of climate change more than alaska which is why the president is making the understand precedented three-day visit. 90% of the state's government
237,revenue comes from taxing oil. a third of jobs are related to the petroleum industry. perhaps there's no better example of the balancing act between fighting climate change and the need for economic development.
238,"welcome back, everybody. the u.s. president has issued a warning on climate change verging on the apocalyptic. president obama was speaking at an international conference in anchorage, alaska on monday, a"
239,"alaska in fairbanks. thanks for your time. president obama delivered an enthusiastic push for action to address climate change but he also approved offshore drilling exploration for shell. in your view, how can both be"
240,"infallible on those matters. however, the president has embraced the pope, using him to forward the climate change agenda, his overture to the cuban government and the iran deal. i frankly don't understand why"
