110,"but it's right around the time that he will be in oslo getting the nobel peace prize. interesting news, too, on climate change. we'll continue to follow that. jill dougherty in for us this morning. it was a year ago the day before thanksgiving americans"
111,"power, terrorism, climate change, disease, hunger, poverty and even afghanistan. it's really a broad range and that's what the two leaders are talking about right now. they will be coming out as you mentioned and having very brief comments and taking a couple of"
112,saying he intends to finish the job in afghanistan. the president and the prime minister both looking forward to the climate change summit in copenhagen in two weeks as the two leaders attempt to work more closely together on clean energy and the greater economy and
113,"copenhagen, denmark next month for a climate change summit. the white house says he will travel there december 9th, the day before he goes to ogs low. former vice president al gore calls the president's decision to attend 'another example of the significant change in policy"
114,"another few weeks, but some folks are already considering it a failure. earlier they were hoping that the conference would end with an agreement on the treaty, but no one expects that now. in washington, the man who calls climate change a hoax, that's in"
115,"attention on the neighbor, pakistan, because of afghanistan. so this is a way of reassuring them that it's really, really important. and no matter what issue you look at right now in the world, heidi, india is really important. climate change, energy, relations with china, you name"
116,"democracy in the world, so it has that democratic link with the united states. it's going to be central to whether or not we can be successful in afghanistan and with pakistan. and globally, on everything from climate change to terrorism to nuclear proliferation, india"
117,many are wondering after hackers made public some sensitive e-mails. they say the e-mails show how scientists cooked the books to make their case for climate change. brooke baldwin takes a look at it. reporter: the consensus is that the climate is changing
118,"blitzer. what koo doo you have for us? we're looking ahead at the president's announcement on tuesday evening, his afghanistan strategy. we're also looking ahead at his trip to copenhagen on climate change and i talked to dr. oz about the swine flu and"
119,"the war is terribly important. jobs and our economy are terribly important. this may be an audacious suggestion, but i would suggest we put aside the health care debate until next year, the same way we put cap and trade and climate change, and talk now"
120,"ethical bounds. this may not be fair, but if you travel the country, a lot of people say barack obama promised to change washington. never mind the particulars, health care, the economy, climate change. when they see this debate they say more of the same. i can understand that."
121,got a couple of big stories out of the white house today. it now turns out that the president is planning to make a personal appearance as a global climate change summit in copenhagen next month. and here's the real news t white house says that he is prepared
122,"at least 160 people were killed in the four-day siege that started one year ago tomorrow. president obama will go to copenhagen, denmark next month for a major climate change summit. the white house says he will travel there december 9th, the day before he goes to oslo."
123,"the the absolutely discussion to have discussions on what cap and trade means and limiting carbon emissions means and holding back climate change means and we have to do this because if everybody's not doing it, then everybody's got a right to say this is the reason i can't do"
124,"climate change globally, india, the u.s., and china will need to be part of it. second, agriculture. india has the largest number of poor people in the world. it wants the united states, and particularly our land grant institutions in the midwest to be helpful in a second green"
125,"terribly important. so this may be an audacious suggestion, but i would suggest we put aside the health care debate until next year, the same way we put cap and trade and climate change and talk now about the essentials, the war and money. is your republican friend"
126,"fee after another at the airport? members of congress are getting freebies and perks from the airline industry. oh, by the way, the airline industry is an industry they also happen to regulate and guess what, it's all perfectly legal. and new controversy over climate change. computer hackers target some of"
127,"under control. we also need to place a greater emphasis on exports that we can build, produce, and sell to other nations, experts that can help create new jobs at home and raise living standards throughout the world. president obama also touched on the subs of climate change and energy, saying finding"
128,"suggestion, but i would suggest we put aside the health care debate until next year, the same way we put cap and trade and climate change and talk now about the essentials, the war and money. as you can see, we've been watching all of the other sunday shows so maybe you don't have"
129,"sit-down with the governor who says first and foremost the american people care about jobs. i can tell you what people care about most and that's jobs. if there's a concern about three or four issues that are at the top and that's health care and climate change and the war, they"
130,"studied this think this climate change is real. i hope they're wrong for the sake of my children. it seems as though they spent a lot of money and have been very successful here. what do you make of that, ben? do you think it's just a lobbying effort? no, there are huge numbers of"
131,"singh will be talking about several different issues, counterterrorism, climate change, and the economy. that is what we are being told they will discuss. that, of course, a meeting closed to the press. right after that meeting around 11:35, we're told, there will be a press conference that they'll be holding and we will bring"
132,"so this may be an audacious suggestion, but i would suggest we put aside the health care debate until next year, the same way we put cap and trade and climate change and talk now about the essentials, the war and money. is your republican friend making sense, senator reed? should health care be set off"
133,"climate change means and we have to do this because if everybody's not doing it, then everybody's got a right to say this is the reason i can't do it. the fact that we're in an economic pickle at the moment may mean that this is exactly the right time to do it because we have to build factories and"
