0,"crisis like the one that's taken place will never happen again. reporter: the president is also trying to move aggressively to deal with another potential crisis, climate change. he helped lead the group to support a reduction in greenhouse gas emissions among"
1,"issues? well, wolf, he went to this summit with questions on climate change. a much stronger position than america has been in before because he passed that bill to address the global warming."
2,climate change. reporter: the world leaders watered down the group statement committed to tackling global warming. just the day before the u.s. and other g-8 leaders signed on to the goal of cutting greenhouse gas emissions by 80% by 2050. but today joined by leaders from
3,"now for the cafferty file. wolf, global warming has become a religion among the first world urban elites. now, that's just one explosive charge made by australian geologist ian climber who says that manmade global warming is"
4,"gathers, the lawyers who render the opinion, it is criminalization of political and every time i come back to the timing. every time they get in trouble, which the president's poll numbers are slipping and his health care and global warming"
5,"your comments. josh levs will be back to help us do just that. president obama, monitoring the health care debate and other issues from overseas right now. he's with other world leaders at the g-8 summit in italy. they've been tackling global warming issues today."
6,"south korean officials say their government and private websites were also hit and that the attacks may be connected. turning to the most politics in the morning now, an ambitious agenda awaiting president obama at the g-8 summit in italy. the president will tackle a number of pressing issues, including global warming, as"
7,"mumbai and one in delhi, in the capital. after that she traveled to bangkok and then a meeting of the association of southeast asian nations. clinton is talking about climate change and nonproliferation."
8,made important strides in combating climate change. critics were quick to point out the meeting didn't produce specific targets for reducing greenhouse gas emissions. today mr. obama will meet with
9,"and chinese officials began in washington today. president obama, hillary clinton and tim geithner addressing the opening session of the two-day meeting. the talks will cover the global financial crisis, climate change, nuclear proliferation"
10,"crisis? or will we corporate to create balanced and sustainable growth, lifting more people out of poverty and creating a broader prosperity around the world? will the need for energy breed competition and climate change,"
11,"major factors to the regime itself as to the protest movement. truly the beginning of the story. thanks. thanks, erica. at the g-8 summit in italy president obama said they have made important strides in combating climate change."
12,"africa gives off less greenhouse gas than any other part of the world, but it is the most threatened by climate change. a warming planet will spread disease, shrink water resources, and deplete crops. creating conditions that produce"
13,"on climate change. reporter: they signed on to the goal of cutting greenhouse gas emissions by 80% by 2050. today, joined by leaders from rapidly developing countries who are also big polluters like china, india and brazil, they"
14,"burden of cutting greenhouse gas emissions will unfairly fall on them. i think that india and china won't come on board and help us solve global warming unless they see that the people responsible for most of the pollution, the u.s., which has emitted 30% of the world's pollution in the"
15,"washington calling on both sides to seek, in his words, cooperation, not confrontation. let's go to our foreign affairs correspondent, jill dougherty. stakes on this story, jill, very high, as well. reporter: they are, wolf. look at the problems from around the world, from climate change"
16,"crisis like this will never happen again. reporter: the president is trying to deal with another potential crisis. climate change. he helped lead the group to support a reduction in greenhouse gas emissions among developed countries, an 80% cut by 2050."
17,"president obama said they have made important strides in combating climate change. they were quick to point out the meeting didn't produce specific targets for reducing greenhouse gas emissions, that is. tomorrow he'll meet with the pope and it's on to ghana where"
18,"global warming and climate change. the leaders have set a 50% reduction in emissions by 2050. you may know that china and india have balked at that, they won't agree to long-term cuts"
19,"topic. here is a few of what's on the agenda. the economic crisis obviously. they are working to boost international trade. i know that sounds big picture-ish, but that affects the prices of groceries, prices of almost everything. they are also planning to take on climate change, talk about"
20,"to deal with another potential crisis, climate change. he helped lead the group to support a reduction of greenhouse gas emissions of developed countries, an 80% cut by 2050. this is a significant step forward in that the g-8 is the"
21,"much work ahead on climate change. reporter: the president failed to get developing countries who are also big polluters, like china, india and brazil, to commit to a specific goal in lowering greenhouse gas emissions. as for the global economic crisis affecting all of these countries, world leaders were"
22,"house if they don't turn that around. the top three priorities from both of you. break it down a little bit. susan molinari, is health care a do or die issue for the president? i think it's important for the president. the president has taken another one of his important signature issues like climate change and"
23,i'm very optimistic about it. because this technology could be used. to reduce greenhouse gas emissions significantly. to reduce greenhouse gas emissions significantly. now the colors of life can last a lifetime. valspar -- the beauty goes on.
24,"view of what you're saying. in the case of energy versus, which involved the question very important of matters being considered by congress now on climate control and global"
25,"a clean, secure, and prosperous energy future. the united states and china are the two largest consumers of energy in the world. we are also the two largest emitters of greenhouse gases in the world. let's be frank."
26,"burning, it seems like while the president is in rome, he's seeing problems domestically. and, you know, while he's away -- the president came here hoping to forge consensus on an aggressive response to global"
27,"exports from the factories that spout out greenhouse gases. so, it comes down to those sticking points, tough to battle through them, heidi. that will be quite a sticking point, i would imagine. poppy har low with our energy fix today. thank you, poppy. you're welcome."
28,"from the president in a few minutes. he's wrapping up a meeting in italy. we're going to be talking about that because he's going to be holding a news conference shortly and we'll bring it to you live here. by the way on the agenda, we've been talking about global"
29,share your thoughts with us. 33 minutes past the hour. checking top stories. secretary of state hillary clinton doing her part to bolster diplomatic ties with thailand. talks are focusing on climate
30,"have to scrap that commitment, instead, adding language they would figure out later. poorer nations believe the burden of culting greenhouse gas emissions will unfairly fall on them. i think that india and china"
31,that a crisis. reporter: the president is trying to work aggressively to deal with another potential crisis and helped lead the group to reduction in greenhouse gas emissions and 80% cut by 20/50.
32,"goal for lowering greenhouse gas emissions. world leaders were cautious, giving more time for their economic policies to try to turn things around. suzanne malveaux, cnn, l'aquila, italy. following the g-8 meeting"
33,"countries, not signing on to these greenhouse gas cuts, making it not worth very much in the minds of environmentalists, joe. ed henry, thanks so much at the g-8. other stories this morning, journalist lisaling is breathing"
34,"morning, poppy. what can you tell us about this? the g-8 nations agreeing to cut greenhouse gas emissions across the board by 80%, but the goal is a far ways out. they're also pledging to prevent"
35,"gun. happening now and stepping up against global warming, president obama and the g-8 are stepping up and our political analysts are standing by."
36,and really hopes to get something done on climate change. he goes fresh with this victory coming out of the house of representatives with a climate change bill but he can't get agreement. this is the year in which a big international treaty is supposed to be struck with china and
37,"didn't get a lot of support on iran which was very important to him. now he goes into the industrialized nations. and really hopes to get something done on climate change. he goes fresh with this victory coming out of the house of representatives with a climate change bill, but he can't get"
38,"change and it includes five nations that are not a part of the g-8. they account for 80% of the world's greenhouse gas emissions. today's session follows a pledge by g-8 leaders who seek huge cuts in emissions, but emerging"
39,"goal to cut greenhouse gas emissions in the last few moments, they announced, by 80%, among developing countries by 2050. that's obviously very far off. critics will say it will be hard to echb force. a lot of substance on the table."
40,"i think it really added to the show. i appreciate it. you ask and i deliver. rob marciano, thank you. some senators want the u.s. and china to cooperate more on curbing greenhouse gas emissions. a report from the senate foreign"
41,l'acquila. mr. obama touring the destruction this afternoon. members agreeing to condemn the iranian election mess and north koreanen nuclear tests but divided on global warming and jump the global economy.
42,"protection agency and clean water act has a special prominence now that we are debating climate control and global warming. in the second circuit opinion, you were in the majority,"
43,"big countries growing in population, vast energy needs, they need to have a seat at the table, they didn't want to come along with the u.s. and other big powers just yet in terms of cutting greenhouse gas emissions. a lot of work yet to be done,"
44,"i'm very optimistic about it. because this technology could be used. to reduce greenhouse gas emissions significantly. but with aleve, i don't have to worry about my knees hurting. only two aleve can stop pain all day. that would take three times as many tylenol arthritis pain."
45,"to build a plant that will demonstrate this process. i'm very optimistic about it. because this technology could be used. to reduce greenhouse gas emissions significantly. we are taking a look at new york city this morning, near central park. it's 78 degrees and cloudy."
46,"white house of disclosing the program out of pure politics. every time they get in trouble, which the president's poll numbers are slipping and his health care and global warming initiatives are under"
47,"will push america's relations with their countries in the right direction eventually. but so far they find those policies still lacking on military power, respecting international law, global warming. steven cole runs the"
48,"on mt. rushmore saying america honors leaders, not politicians. stop global warming. they're arguing 2050 is way too far away. we need more aggressive short-term goals. these goals are just meaningless, heidi."
49,disease. gridlock. global warming. it can help us make the world work better. [child laughing] we just broke the petaflop barrier. i'm an ibmer. let's build. let's build a smarter. a smarter planet.
50,"off the coast of mexico. so much they think it has to do with the warmer waters, maybe global warming and others say they outfished the predators, which is sharks. we are out of time."
51,"reporter: now president obama met this morning with the president of brazil, one of the key developing countries not signing on to these greenhouse gas cuts and that's why some of these environmentalists around the world are saying, look, this is a real missed opportunity by the g8 leaders because it"
52,"are imperative, that time is running out. the scientific community is increasingly pessimistic about what's happening on global warming. and yet, the politics and bad economic times are proving too much even for barack obama right now."
53,"politicians, stop global warming. that's it, wolf. back to you. thanks very much. stimulus dollars being spent so why is unemployment rising? it's a question that has some republicans seeing red. and a boy tormented by bullies commits suicide."
54,"little more than a con job on the public perpetrated by environmentalists and politicians. according to the vancouver sun, this controversial geologist says global warming is not caused by human behavior. rather, it's an entirely natural"
55,"vegetation won't grow. i hope things don't get worse. bri writes i wasn't concerned about it a year ago and definitely not concerned about it today. jim in california, global warming is real. caused by human activity."
56,"people believe president obama will push america's relations with their countries in the right direction eventually. but so far they find those policies still lacking on military power, respecting international law, global warming. steven cole runs the"
57,cut down on. crime. disease. gridlock. global warming. it can help us make the world work better. [child laughing] we just broke the petaflop barrier. i'm an ibmer. let's build. let's build a smarter. a smarter planet.
58,"we take them full? we'll have an audience with pope benedict, the president, the pontiff expected to discuss global warming, some social issues such as abortion, but we understand that they may also discuss the financial crisis."
59,balance a discussion about global warming and the debate back home over a stimulus plan. senior white house correspondent ed henry live at the g-8. even though he's overseas where a explosive debate getting over
60,"poll numbers are slipping and his health care and global warming initiatives are under assault, they dredge up a darth vader story. reporter: but it's a story that comes as attorney general eric holder just might name a"
61,"members agreeing to condemn the iranian election mess and north korean nuclear tests but divided on global warming and approaches to jump starting the global economy. last stop, moscow, he got agreement on nuclear war head cuts, which were expected, not"
62,players welcoming some smaller players. now the world's leading industrialized nation's opening the doors to five developing countries. president obama is leading the major economies forum at the g-8 summit. the major focus global warming. it is part of his week long
63,going white. that idea is being floated by energy secretary steven shoe. he recently said people the world over can attack global warming by painting rooftops and roadways white. that would keep buildings cooler and then reflect the sun's rays back into space.
64,part of evolution. he shoots down the current logic that global warming can be reversed. he gets particularly worked up about carbon dioxide. he said it's actually at the lowest levels it's been for 500 million years. critics have slammed his new
65,"about global warming than you were a year ago? go to cnn.com/cafferty file. you can post a comment on my blog. wolf. sdoo thank you, jack. we'll get back to you shortly. one man -- one hospital's mission to help patients get"
66,"advantage in this recession. kind of a think globally attitude. and speaking of globally, global warming is a hot topic. it's not all global peeps and world leaders. see if we can see this picture. paula newton is live in l'aquila"
67,"and probably never get done, right? hand grenades and health care reform. close to what? getting what done? if you take a step back, where we -- why health care is stalled as the global warming initiative goes, this is not happening in a"
68,"trying to reduce global warming. our white house correspondent, suzanne malveaux is traveling with the president. suzanne? reporter: president obama is a popular figure here at the g-8 summit. the larger the meetings get, the harder it is to find consensus"
69,"joining us is the author of 'independent nations.' some very broad strokes, he touched on the economy, in a world hunger, he also touched on global warming, which necessarily wasn't so much of a success for him. what do you think the president"
70,"any country are willing to take the tough measures that have to be done that scientists tell us are imperative, that time is running out. the scientific community is increasingly pessimistic what's happening on global warming. and yet, the politics and bad"
71,people talk about global warming. i want to cool the earth down. i also want to calm the block down. reporter: experience he's bringing to his new role in the obama administration. it starts with recycling. throw away trash to just throw
72,"the critics were quick to point out the meeting didn't produce specific targets for reducing greenhouse emissions, greenhouse gas emissions. tomorrow he'll meet with the pope and it's on to ghana where he'll sit down with anderson. he'll have an exclusive interview. back at home, president obama has a lot on his plate. there are new poll numbers that"
73,"mr. obama touring the destruction this afternoon. members agreeing to condemn the iranian election mess and north korean nuclear testing but decided on global warming and approaches to jumpstarting the global economy. it was a similar stop the president's last stop, moscow, where he got"
74,"poll numbers are slipping and his health care and global warming initiatives are under assault, they dredge up a darth vader story so they can say to -- i guess the question is this, james. at a time when the president is trying to get health care reform"
75,"use. thanks so much. health care reform, job creation, fighting global warming. president obama has an ambitious agenda, a lot on his plate. but his approval ratings have actually slipped a bit trying to tackle all these things. earlier i talked about new poll"
76,"their emissions by 80% and we'll work with all nations to cut global emissions in half. this ambitious effort is consistent with limiting global warming to no more than two degrees celsius, which as our declaration explicitly acknowledged for the first time is what the mainstream has"
77,"his health care and global warming initiatives are under assault, they dredge up a darth vader story. reporter: but it's a story that comes as attorney general eric holder just might name a prosecutor to investigate the bush administration's harsh interrogation techniques used on"
78,"the face of the earth today. reporter: qualified and controversial. bob lutz is the man who once said global warming is a total crock of [ bleep ]. he stands by that statement, ask yet he's also the driving force behind the extended-range"
79,"the president said the u.s. should do more to fight global warming. and he said, quote, i know in the past the united states has sometimes fallen short of meeting our responsibilities. so, let me be clear -- those days are over. president obama left italy"
80,"sensiti sensitivity. the question, are you more or less concerned about global warming than you were a year ago. jeff writes from washington, the state, not the capitol hill. it's supposed to 102 in seattle today, all-time high since record keeping began 100 years"
81,"advances in science, medicine, and consumer products are the least of these. creating jobs both in existing and new fields. we must be in space to help solve our current crisis of global warming. the space program has always paid us back much more than what"
82,energy secretary steven chu. he said people the world over can attack global warming by painting rooftops and roadways white. that keeps buildings cooler and reflects the sun's rays back into space. he says it would be like taking all the world's cars off the
83,"relation committee suggests that could be the key to global solution to climate change. by 2012, tough new efficiency standard mean most"
84,nations are not exactly onboard with the targets. progress on climate change is mixed. cnnmoney.com poppy harlow has our energy fix this morning.
85,"every time they get in trouble, which the president's poll numbers are slipping and his health care and global warming initiatives are under assault, they dredge up a darth vader story. reporter: but it's a story that comes as attorney general eric holder just might name a prosecutor to investigate the"
86,more on that. president obama and other world leaders focusing on global warming today at the g-8 summit in italy. but the issue being overshadowed by heated debate back home about the economy and whether the president's stimulus plan is really working. our ed henry is live with the
87,"improvement in the relationship they got, but certainly didn't deteriorate during the course of those two days. it didn't look like there were a whole lot of successes at the g-8 summit on some of the global warming issues, for example. i'm sure the president didn't get whatever he wanted."
88,addresses climate change and that is going to wean us from our dependance on foreign oil. and minnesotans want their kids to have an education that
89,situation room. top lessons today for president obama. the limits of his international star power. he made a big push over at the g-8 summit in italy for an agreement on reducing global warming and he got pushed right back by countries that don't have the will or the wallet to
90,"health care and global warming initiatives are under assault, they dredge up a darth vader story. i guess the question is this, james. at a time when the president is trying to get health care reform and economic stimulus package that may or may not be working the way you thought it would."
91,"president had too much plate at one time. colin powell? yes. and i think lots of people are starting to agree with him. i agree he has too much on his plate, mostly he's been overambitious, trying to remake the health care system and global warming and all this other stuff when there's an"
92,support for education initiatives and filled public safety positions. we built a sub cabinet for climate change and we took fleet outside special interest for our biologically sound wildlife
93,"meeting in l'aquila, italy today. he's expected to spend his time there pushing for more international stimulus packages. other issues, climate change and stopping the spread of nuclear"
94,"actionable intelligence between their agencies. all that happened because of american diplomacy, involvement. reporter: clinton preferred to keep the focus on other issues, climate change, women's rights and education."
95,"as he acknowledged and discovered when he held a meeting on climate change. among world leaders, president obama is the rookie but also the star. playful applause for mr. obama"
96,"increasingly pessimistic about what's happening on global warming. and yet, the politics and bad economic times are proving too much even for barack obama right now. he's also getting huge problems here at home with republicans essentially saying the stimulus plan has been throwing money down the drain putting us deep in debt and is not effective."
97,"to cool things off. the issue of global warming is the focus of a summit taking place. back here at home, critics are turning up the heat on something else, that would be the economy. republicans are saying that the president's stimulus isn't working. they want to know where the jobs are. and our senior white house"
98,"challenges alone. the threat of climate change can't be contained by borders on a map, and the theft of loose nuclear materials could lead to the extermination of any city on earth."
99,"states in that regard, bailouts, spending by government, health care reform or debate about climate change. when it comes to spending and reach and role of government, does president obama meet the"
100,"sanchez, republican congressman brian bilbray will join us. at the g-8 summit, world leaders agreed to work together on climate change. the president announced that deal today, setting a target of"
101,"the climate change conference of cope haguen and beyond. and to increase our security and prosperity, is to keep our markets open to new ideas, new exchanges, and new sources of energy."
102,"peace, the group challenged president obama to take a strong stand against climate change today. by hanging a banner on the presidential faces of mt. rushmore. the 2300 square foot sign america honors leaders not"
103,they worry about inflation and are pushing for restraint. climate change is also on the agenda. there is no consensus developing between the nations on cutting their carbon emissions. some is taking place in the
104,"greenpeace says demonstrators have occupied four coal-fired plants today, urging the g-8 to do more to fight climate change workers at two of the plants held counter-demonstrations."
105,"when it comes to climate change, too, u.s. secretary of state did not get what she wants. this morning india side coming out strongly and saying it will not adhere to any caps on carbon"
106,"doesn't have enough teeth in it in terms of dealing with climate change. white house leaders are saying at least getting the leaders on board gives some momentum for that big, big environmental conference in cope haguen this"
