353,"translators in the room. all before pope francis addresses congress thursday with biden in attendance. even though the president and pope are allies on issues ranging from climate change to income inequality to cuba, even the iran nuclear deal, the white"
354,"largely built by such families. reporter: that subtle reference to u.s. immigration policy, along with more blunt statements about climate change, have many of the same conservatives who wanted the pope to come to washington now nervous about his historic"
355,"but when he becomes the first pope to address congress, it's almost certain not everyone will like his message. especially some politically conservative catholics. they think that he is, you know, talking too much about climate change, that he's too"
356,"even though the president and the pope are allies on issues ranging from climate change to income inequality to cuba, even the iran nuclear deal, the white house refuses to reveal what the two men will discuss. the president will not arrive"
357,"now, if his comments are anything close to what he said on the south lawn of the white house about immigrants. poverty, climate change, republicans may get a bit uncomfortable. listen to this, after the speech, he's going to forego"
358,"were his words, right, and he talked about -- he shamed people when talking about climate change and calling them why haven't we seen more done. do you expect very tough language, biting words in front of congress? i expect tough language, you"
359,what he believes to be an urgent message on climate change. the president is sounding the alarm calling attention to what alaskans are experiencing here. melting glaciers and record high temperatures and one of the worst wildfire seasons in years.
360,those communities that are already at risk so they can become more resilient in the face of climate change. because some of it we're not going to be able to avoid. the planet's already getting warmer. so communities are already going
361,"face of climate change. some of it we're not going to be able to avoid. the planet is already getting warmer. and so, communities are already going to be affected. that's especially pressing here in alaska. earlier in the day, the"
362,"prologued, obviously they're talking about these issues they have in common, income inequality, immigration, climate change, cuba, iran nuclear deal, the pope signed off on the iran nuclear deal. and it's interesting to note, jake, that they are in a way"
363,"calling for measures on climate change but putting forward what china is going to do. acting. china is a big chunk of the problem. and wants to be a big chunk of the solution. wants to change. on the other side, i am"
364,"of action on climate change. he says he's going to follow the government's existing line on this, which isn't as strong as he was talking about before. he's also been a strong advocate for gay marriage. he's dialing a bit on that as"
365,disappearing. villages having to move because of rising sea level. he is having none of the climate change deniers. listen. the time to head the critics and the cynics and the deniers is past. the time to plead ignorance is
366,"obama. a big announcement on climate change and that will keep tensions high. good morning. welcome to 'early start.' i'm john berman. i'm christine romans. it's friday, september 25th. 4:00 a.m. in the east. let's begin with the pope."
367,"the announcement will come at the white house with the visit of xi jinping. this is a big step forward in the battle against climate change. for the first time, the chinese companies will bear a cost for emitting carbons in the"
368,"climate change and, unfortunately, from my perspective, one that interferes with our ability to move forward to deal with all the other issues. therefore, i oppose it. former secretary of state clinton has been asked repeatedly where she stands on"
369,which this pope and president are very closely aligned. climate change perhaps the greatest. precisely and i think it's really important to note that this is not just the pope going ou off piece talking about climate. he took the name francis.
370,"(background talking and yelling) a better network, like verizon, for instance. i'm running through a big door!. the pope focuses on property, immigration and climate change at the white house. his next stop, congress. break through, the colombian government and farc rebels move"
371,"climate change and what to do about it is a moral issue. is that the main sticking point, do you think, for political conservatives? well, this is a whoep who has a young man studied as a scientist and worked as a"
372,"the world, america's values and how we view the challenges. this year in particular, syria is at the core of it. i expect the president will talk about climate change heading into paris next year, coming off the agreement the president made"
373,"immigration. they call it a political issue. but, you know, when you're talking about climate change or immigration or what are you talking about, poverty, these types of things. but it's not a political statement. it's a human statement, you know."
374,"this week saying china is not responsible. there is no state sponsored hacking going on, and it wants to help address that. let's see if anything comes of that. natalie? yes, we will. and what about climate change? because that is an issue,"
375,"contentious in many parts of the united states as far as republicans and democrats duelling over. but these two leaders came together on that issue. yeah, a complete contrast with climate change, natalie. the china is expected to make a"
376,"be in english, they expect it to be a friendly, warm conversation. the topics that they see as the big ones are climate change, poverty and cuba. but what about those areas where there are broad disagreements between the two of them, on"
377,leader who can speak on such a range of issues. there are at least in our american political complex opposed. he is a -- he wants to solve climate change. he wants to address poverty. he wants to address the refugee
378,"time raising politically sensitive issues, including climate change, immigration and marriage during his visit to the united states. his views were made clear on wednesday, his first full day in the u.s. when he met with president obama at the white"
379,"the united states. now, the pope's visit was about more than hugs and handshakes, obviously. pope francis challenged america to embrace millions of undocumented immigrants and join a global campaign against climate change and poverty. he also addressed the scandal"
380,no country can escape the ravages of climate change. there's no stronger sign of leadership than putting future generations first. the united states will work with every nation that is willing to do its part so that we can come
381,"afford to send their kids to college, when we're not addressing the planetary crisis of climate change and, wolf, a huge issue, we have a corrupt campaign finance system as a result of citizens united where billionaires are able to buy"
382,change. jim acosta joins us live from anchorage. reporter: president obama is racking up a lot of miles on the ground and the water here in alaska delivering an urgent message on climate change. he will be the first sitting
383,"the u.s. insists it doesn't spy on other countries for financial gain which it believes china does. other touchy topics will include trade, maritime security, maybe even human rights. we know there has been progress on climate change. expect some announcements on"
384,"certainly on climate change, on poverty, on that polarization, on the arms trade. but he delivered it in such a diplomatic way, a lot of people say that wasn't a scolding. i listened saying he was being pretty stern. certainly being direct."
385,various other disdisagreements that the u.s. and china have had. we expect progress in climate change. china will contribute a lot of money to a big green climate fund. also the u.s. got china to start a cap and trade emissions plan.
386,"united nations where he is set to speak to the u.n. general assembly. big issues he's expected to tackle is europe's migrant crisis and climate change. he'll also visit the september 11th memorial and museum, meeting with families who lost"
387,"coverage, and dominating the conversation, and so when i talked to the republican law mamake ers the concern is a that if the pope leans into some of the more progressive views that you mentioned on the climate change, and immigration, and even criticizing the gun manufactu"
388,"do you expect that he's going to reset the presidential race that is now playing itself out against the backdrop of this visit? something he'll say maybe on climate change, maybe on immigration, maybe on a social issue? oh, i have no question there"
389,"kosinski. reporter: we expect this to last 45 minutes to an hour. the white house did give us some idea of what they thought the biggest topics would be poverty, climate change and cuba. this is really building on the last meeting they had."
390,"sanders. do you expect that he's going to reset the presidential race that is now playing itself out against the backdrop of this visit? something he'll say maybe on climate change, maybe on immigration, maybe on a social issue? oh, i have no question there"
391,"between heat and rent and food. that's why i put out the proposal and that's the people -- governor christie -- i'm coming to you right now on a separate issue. we received a lot of questions from social media about climate change. senator rubio, ronald reagan's"
392,a hike through alaska's gracier. the second day of his alaska trip where he is on a mission to highlight climate change as an urgent threat. during his hike the president stopped at different markers to show where the glacier once stood but has now receded.
393,"president obama's visit to alaska and the arctic circle. we want to bring in our meteorologist, pedram javaheri. you have insight into why alaska plays a big role in this discussion on climate change. absolutely. alaska plays a significant role because you are talking about a"
394,"forced to move away because of melting ice may cause sea levels to rise. he says the time to act on climate change is now. the good news is we made a lot of progress, but i'm here to tell you we have to do more."
395,"claire sebastian, new york. for more on the issues surrounding alaska and what it could mean for the entire planet, our meteorologist pid ram javaheri joins us live now. alaska has really been described as the poster child for climate change. you've got at least four"
396,"anti-american, so do four of your here rose. that was very craft. to that end as well, he used american technological and scientific exceptionalism in terms of how they could work out a solution for climate change. in every way he tipped the hat"
397,"vatican officials before pope francis addresses congress thursday. biden will be in attendance for that the president will not. the president and pope are allies on climate change, income inequality, iran nuclear deal, the white house is not saying they won't reveal what these two"
398,room. of course all five senators who are running for president as well as dr. ben carson. the invited guest from mark sanford from south carolina. now some republicans are slightly uneasy about the message of climate change as jim was saying. some democrats are slightly
399,"obama this morning. a big announcement on climate change. good morning. welcome to 'early start.' i'm christine romans. i'm john berman. nice to see you. it is friday, september 25th. 5:00 a.m. in the east. pope francis waking up this morning in the city that never"
400,"and then he, nonetheless, has not changed the doctrinal substance of the church. then he comes along on economics and on climate change and veers far to the left. and so when i heard you say that the vatican claims it's not political, almost every"
401,"science and ideology into climate change and is being presented to guilt people into leftist policies. so, do you agree with this congressman? i think he raises some valid points. he's coming from a different perspective. i'm speaking as a non-catholic."
402,"cuban relations. of course, he just got to meet the pope, fidel castro. i'm sure the president would be curious about what the climate was like in cuba. they are brothers in arm on the climate change issue. the pope went right to it today"
403,"at the white house conference and then i'm sure in the oval office they talked about it. these are the two global leaders on climate change. and for the pope, climate is also about poverty and environmental justice and about how the changing planet is going"
404,"charter in diplomatic relations with cuba. he and president obama are expected to tackle issues on poverty, climate change. they will be meeting tomorrow in the oval office. pope francis's ideals seem to clash with some on capitol hill. joining me now is karl"
405,"incredibly sensitive politically. i would also just like to add, republican leaders and democratic leaders are moving pretty aggressively to make sure there are no outbursts and if the pope does dive into issues like climate change, they don't want any of their members to"
406,and democratic leaders to say no excessive handshakes. nobody should let the pope move about his business because they recognize that the pope is going to probably dive into a lot of these controversial issues like climate change and they don't want any of their members to
407,"about the climate change, any comment or reaction to hillary clinton's reaction to braeak th silence, and say that she is opposed to the keystone pipeline? well, i amt not sure that there were many people at least in this room, and either any of"
408,"the less agreeable toings beyond climate change were there? even though an interpreter was present, the intention is for that conversation to remain private. it seems that they took longer to come down to the colonnade and the oval office at least than on the time schedul.d"
409,"clear that this is a problem that cannot be left to a future generation. do you agree that climate change is a pressing problem? no, i think that clean air is a pressing problem. you want to have clean air. you want to have clean water."
410,"as we said, there's definitely some discomfort from some republicans who think the pope is going to be too tough on them. on climate change. on the environment. some democrats are a little nervous about his message on abortion. but speaker john boehner is"
411,"looked in this conversation, chris, they were looking for areas of overlap, agreement, and they certainly have a lot. and that's part of the list there. you heard in the public speeches, too, climate change, poverty, refugee crisis, issues like that. lots to discuss in that private"
412,"oval office meeting. reporter: certainly it's no accident, jim, that the one thing the pope spoke about in detail specifically was climate change. everything else was certainly more nuance. he never said the word 'cuba.' he never said the word 'marriage' except to talk about"
413,"like social justice and climate change, does that resonate? absolutely. like my -- we're always talking about in the classroom today we have to look to the future and think about that as well. and the fact that the pope is here at our university it feels"
414,"north. i mean, he was talking about the immigration problem and more importantly the political debate in this country. on climate change he said it's human made and we got to deal with it but when it came to -- those are issues most democrats"
415,"america a harder place for people to live, or to work, or to raise their families. governor christie, you have said that climate change is real, and that humans help contribute to it. without getting into the issue of china versus the united states, which i understand"
416,"up climate change, economic inequality and other important issues? he has been a critic of capitalism. will he do so again? cnn's rosa flores has the latest from washington. christine and boris. pope francis waking up in the united states for the very first"
417,"conversation here. climate change, this is a global responsibility, it's a shared responsibility in his view. poverty, alleviating poverty, this is a global and a shared responsibility. migrants very much in the news in europe, that was part of his conversation with the president"
418,"he's an adept politician and careful with his words. with each of those issues he touched on today, talking about being the son of immigrants, on religious freedom, very much in the election campaign, on poverty, certainly on climate change. he knows the power of his voice,"
419,"as what i believe it is, a distraction from the important work we have to do to combat climate change and, unfortunately, from my perspective, one that interferes with our ability to move forward to deal with all the other issues. therefore, i oppose it."
420,"president, and china president xi. and there are a lot of issues on the agenda christiane. but climate change certainly one of them. i hear you are saying you are upbeat that the u.s. and china are now going to announce a major step forward in dealing"
421,jinping and president obama are all here talking about the same thing is really important for world leaders to get them to come up with realistic goals. if you don't have the u.s. and china on the table at climate change issues you are
422,"environment, climate change. why is this -- all of a sudden, it seems in recent years become such a powerful issue for the pope? well, i think the pope believes that we are at a pivotal turning point. that things could go either way. and that something fundamental"
423,"beyond, beyond, on issues such as climate change, war. everyone is anxious to hear what president putin will say. the first time the leader addressed the u.n. in ten years. it appears he has the upper hand when it's coming to what to do"
424,"talks. but there are some thorny issues on the table from territorial disputes to cybercrimes. talk to us about the list of tricky topics that they will have to discuss. yeah, incredibly tricky. of course climate change the cap and trade system that china will"
425,"thoughts, in a place, in a society, in a time when people use faith as a badge of aggression, this pope says, if you don't believe, it's okay. whether he's speaking about climate change, very controversial issues within the church, whether he's speaking about immigration, he talks"
426,"now, there were a fair number of republicans going in to this address who were a little bit concerned, worried that there would be a scolding from the pope on issues that he's been very outspoken about, like climate change, like immigration. but even those republicans came"
427,wider. and it is not just an american issue. very shortly the top 1% of the world's population will own more wealth than the bottom 99%. and he is also by the way talking very profoundly and significantly about climate change. and he's talking about as a
428,"marriage and abortion, we expect the pope to really hit the subject of climate change, immigration, income inequality. he may even go to violence and gun control. as the white house puts it, pope francis likes to speak his mind. so it will be interesting to see"
429,"agenda that would appeal to say president obama or the democrats. you know, things like ill grags, climate change, all the rest. and it was much more elliptical to use your word on the sort of social cultural issues. there was one thing that kind of"
430,"statements about climate change, have many of the same conservatives who wanted the pope to come to washington now nervous about his historic visit. there's one thing we know about this pope. he's not afraid to take on the status quo or not afraid to say"
431,"francis is wasting no time in raising politically sensitive issues including climate change, immigration and marriage during his visit to the united states. his views were made clear on wednesday. his first full day in the u.s. when he fete with president obama at the white house."
432,"republican paul goser, a self-proclaimed proud catholic said he will boycott the pope's address, charging his views on climate change are, quote, false science, in an attempt to guilt people into leftist policies. to me, i don't know how you call yourself a good catholic if"
433,"year, and they put out their agenda for the rest of the year and beyond. the main thing we're looking for is syria, climate change and other such matters. we're joined by michelle kozinski, jim sciutto and our distinguished panel. michelle, what is it that"
434,"messages on things like climate change, global poverty. but this is new york city. this pope is not going to leave here and frankly new yorkers are not going to let him leave here without connecting with real people. we'll see that today as well."
435,winning activist mulala. likely urging action on climate change and the ongoing refugee crisis in europe. he makes a difference. he's utterly revitalized the political and diplomatic relevance of the vatican in our time. the pope will then travel more than four miles downtown to
436,"world with the south of the world moving north. and, of course, climate change. i think we'll hear all three of those and some other things as well. all right. i like you keeping it a little bit of a mystery there what the"
437,sustainable development goals. also a hugely important gathering world leaders ahead of what many believe is the last chance to reverse course on climate change. and that is the upcoming summit in paris regarding trying to get all world leaders to sign off on
438,"the scientists were right. reagan and his approach worked. secretary schultz asks, why not take out an insurance policy approach climate change the reagan way? we're not going to destroy our economy the way the left wing government -- that we are under now wants to do."
439,"real, and that humans help contribute to it. without getting into the issue of china versus the united states, which i understand you've talked about before, what do you make of skeptics of climate change such as senator rubio? i don't think senator rubio"
440,"alaska, taking a look at the glaciers that are melting rapidly in this state. we also saw some of the stunning wildlife that inhabit this majestic corner of the world. mr. obama spoke again on the issue of global warming, urging countries across the globe to change course before it's too late. here is more of what the president had to say. this is one of the most studied glaciers because it's so easley accessible. but what it indicates, because"
441,"quickly. he authorized priests to forgive abortion and make it easier and faster to get an annulment. he issued a papal and cyclical about the dangers of climate change pleading for global action to help stop it. and in the wake of the attack on charlie hebdo, the pope"
442,"decade. the time has come for those of us in congress to realize if we don't maintain the forest health, if we don't provide the thinning, the forest management, these fires will rage out of control. and, yes, it is climate change, it is drought, but it also is"
443,"president in private, with the leader of the free world, the leader of the church and the leader of the free world. and their minds coming together on these issues, certainly on wealth disparity and cuba and climate change. but separate on other issues. if you're talking about issues"
444,"about like caring for the poor and climate change. those things resonate with him. and he said, you know what? if i see the pope and he strikes me a certain way, then i just may return to the church. one more thing that's interesting. right adjacent to me is the"
445,dependent on oil. 90% of the state's government revenue comes from taxing oil. a third of jobs are related to the petroleum industry. perhaps there's no better example of the balancing act between fighting climate change and the need for economic development. the director of the institute at
446,"from alaska with latest. reporter: john and christine, president obama has arrived in alaska to deliver what he believes to be an urgent message on climate change. the president is sounding the alarm calling attention to what alaskans are experiencing here. melting glaciers, record-high"
447,"out the numbers, the statistics, really, you know, leaving no room for doubt that climate change is happening and getting worse and we all need to act. absolutely. well said. and that's the case and the point he was trying to make and the reason he went to alaska, it"
448,is ground zero for what is happening in climate change. and the impacts don't just cause an issue for the state itself but also not just for the united states but on a planetary level as well. i want to show you what happens in the state of alaska and why
449,"subjects as poverty, climate change and cuba. you can see this comes at a perfect time for the president to tackle those issues that he really wants to in his last year in office. however, it also comes at a time when the government could be shut down over debate over"
450,"base. the president and the pope, tomorrow, will have a visit in the oval office. the top three subjects, expect them to be climate change, cuba and poverty. this comes at a perfect time when president obama wants to hit certain topics in the last year of his presidency."
451,"afflicted and afflict the comfortable. tomorrow i look for him to perhaps afflict those of us who are comfortable. no one will like that but we need to hear it. father beck? i would say immigration again, climate change again and certainly the excesses of capitalism and how it affects"
