0,"there been negotiations quite like these. starting monday, 195 countries will gather at a purpose-built conference center at the airport north of paris to try to find grammy on worldwide limitations on green-- agreement on worldwide limitations on greenhouse gases."
1,we are live next. protests erupting on the streets of paris happening as president obama meets there with world leaders on the topic of global warming.
2,"memorial. president obama arriving sunday in paris for the talks. he visited the memorial at the bataclan theater with french president francois hollande. as the climate summit begins, global warming leaders observing"
3,"right now for the 21st conference of parties. the u.n. meeting to stem climate change, the cop21. the planet warming, according to scientists. the president acknowledging that u.s. is partly to blame for climate change."
4,"giving a stern warning about climate change. after celebrating a mass in kenya, he called for people to come to agreement on fossil fuel emissions. his messages comes days before the climate change in paris."
5,days. france is supposed to welcome up to 90 heads of state and government here for the climate change conference.
6,"they plan to finance climate change measures. what are some of the options they might be considering? reporter: well, i think, rosemary, one of the things being debated here is, of course, the financing of the climate change measures, and"
7,"while he expressed the disappointment given canada's position on this, we did speak about the whole issue of energy and climate change should"
8,"pipeline if it could droibt climate change. something his own state department concluded would not occur, not surprisingly, though, the president sided with his own party. here's what he had to say. america's now a global leader when it comes to taking serious action to fight climate change."
9,a battle with people throwing shoes and candles that came from the paris attack memorial. president obama arriving sunday in paris for the climate change talks.
10,north. there are not many left in the province. sune engel. thank you. president obama in paris meeting with world leaders trying to fight climate change.
11,"who need help right now even as we hope to reduce the flow of migrants because of the situation inside of syria. address other critical issues, climate change, inclusive"
12,"suspect. gave us anti-obama fliers, little pamphlets. is this domestic terrorism? what he did is domestic terrorism. this is typical left-wing tactics. also, climate change clashes"
13,i'm linynda kinkade. i'll be back after the break with another hour of news from around the world. the heat is on in paris as global leaders gather for consensus on climate change.
14,looked at the role of china using the global satellite observations and we can pinpoint more towards china than say other regions but certainly pollution can move from one place to the next. we head into this climate change
15,"disappointed that the protests and clashes with police are distracting from what's happening here at cop21. the demonstrators i talked to were essentially trying to come out and show they're not afraid, that they saw climate change as"
16,"all these things that enable the modern lifestyle are very energy intensive. and so only by making those things clean and low cost can we really solve the problems of poverty. energy is fight central, avoiding climate change where"
17,they would do more to prevent further attacks. and now there's extra security at large events. leaders of g-20 nations gather in turkey this weekend and france is due to host the next climate change conference in
18,"president obama met the chinese president on the sidelines of these -- of this conference today. he also had a brief chat with the russian president, vladimir putin. however, the subject at hand really wasn't climate change."
19,"questions are asked. that's not a good thing. that's not a good thing up. don't to want control the questions, but on the other hand you want them to know that the questions are going to be about the issues that affect the american people. you know, i'd love to debate the rest of the candidates on something like global warming or"
20,official claim of responsibility. security tied right now in paris. an extra 1500 soldiers are being deployed throughout the city. these attacks underscore the challenges authorities are facing. paris had already beefed up security ahead of an upcoming global climate change summit.
21,"the ground because i've seen it. it's wandered around the oval office. there's a hawk that some kids named lincoln who flies around here. the president went on to encourage everyone to protect the environment, mentioning the dangers of climate change."
22,"little bit later on this black friday. overseas, francis is wrapping up an historic three-day trip to kenya. he is on his way to uganda. during his video, he addressed a number of issues from animal poaching and climate change to"
23,"against him. he attempts to double down, attempt to blame others and attempt to defend himself. so, president erdogan of turkey wants to talk face-to-face with vladimir putin when they're both in paris next week for this climate change conference."
24,does come to climate change. phil black is live with us in paris with more. we know a lot of eyes are on this conference and we know the goal is to secure a global deal on limiting greenhouse gas emissions and how likely is it
25,"protestors, angry over a new ban on large demonstrations part of the intense security measures in the french capital. we have come to paris to show our resolve. reporter: but in paris, the president made the case that bringing the world together to battle climate change is yet"
26,"global impacts on greenhouse gases such as carbon dioxide. this puts the past years in prers peck tiff. the red line is carbon dioxide levels. the blue line, temperatures."
27,"assembled leaders. 147 heads of state here. many other national leaders, heads of government as well. they will state their intentions and declare what they are prepared to limit the greenhouse"
28,world's two biggest mrultepollu biggest emitters of greenhouse gases. they have come up with their own plans they believe have set the standard for what they expect other countries to do and to follow.
29,"point, we make it up to about a half a meter increase in sea level conditions. if we continue to pump the greenhouse gases at the same level, observations bring the numbers up to over a meter"
30,"starting monday, 195 countries will gather at a purpose-built conference center at the airport north of paris to try to find agreement on worldwide limitations on greenhouse gases. the complex negotiations were nearly overshadowed by the vicious terrorist attacks in"
31,"he also emphasized, no nation can get everything it wants in the battle to curb greenhouse gases. attendees of cop21 need to recognize that nations have various needs and all need to be taken into account. for all the urgency of climate issues, the cloud hanging over"
32,"it isn't happen something or are we going to embraigs innovative next generation solutions that will allow us to both grow the economy and deal with greenhouse gases? everybody talked about their tax plan, and they all have wonderful tax plans. not one of them in my view has the ability to articulate how"
33,climate change. this is a win for environmentalists. they linked the public energy about climate change. they point to suppressed research. exxon rejects the accusations it
34,"hours. alison. i would imagine as important as climate change is, it will be tough to concentrate on climate change with what is happening with paris and the world these days considering the terrorism."
35,he stood with the french president and laid a single white rose. he is trying to hammer out a deal for greenhouse gas limits with other leaders. president obama hopes this deal
36,"carbon emissions and reduce global warming. we spoke to christiane amanpour and chris cuomo. and mr. gates, the fellow"
37,french president hollande opening the summit saying the future is at stake. president obama saying climate change could be the biggest threat facing the world today. the growing threat of climate change could define the contours
38,climate change. this comes as 150 world leaders gather here in paris for a historic week in the battle over climate change. the summit called cop21. massive security operation also underway. france on virtual lockdown for the summit here.
39,"that he and the president will be coming back to france for the summit expected on climate change. we knew that would happen, but official recognition. this is the climate change conference that starts at end of"
40,"you are embarking on a big push for the paris summit. you gave a speech this week. in that speech, you're very eloquent in criticizing critics in the united states who are still skeptical about climate"
41,mobilization in history on climate change. hundreds of thousands in the streets across the planet. it changed the music. we've seen the best year of progress ever on climate change. much higher commitments from each nation state and unpress denlted commitments from the --  _
42,"a huge number of refugees and climate change. it's a small link but important one. we'll see far more climate migrants, as well. the climate change is getting far more people than terrorism is. that's the harsh truth, but we"
43,outcome? they're looking at the idea of limiting greenhouse gas emissions. that's the general framework. they have a better chance than ever before. why? they have more than 180 commitments. those 180 represent 595% of all
44,"you promised you weren't going to allow a certain amount of greenhouse gas emissions and you are. there's no worldwide body to enforcement. when you were helping me get briefed with this morning, france has never put out this"
45,"every week on cnn we aim to answer your questions about climate change leading up to the united nations conference on climate change in france. this week, the question comes to us from jonas martin in seattle, washington. hi. my question is, if there have"
46,here trying to give them a pep talk and explain to them what's at stake. no doubt the shadow of terrorism hangs over the event. he is not asking to choose between the fight of terrorism and fight against climate
47,"footpri footprints. the two biggest emitter, the united states, china, india, related to the size of that red dot on that map. this new united nations summit study is talking about individual pledges countries are making in advance of the climate"
48,"diplomatic dance is, both putin and hollande will be here in paris on monday for the climate change talks with vienna, as well as president obama and 147 total leaders will be here talking about climate change. this is something that everybody would like to get on board with,"
49,"why? well, chris, thanks for having me on the show. listen, what the president has come to paris to get is to get all countries around the world to follow through on their commitment to make ambitious, robust commitments to cut carbon pollution and fight the climate"
50,"security was climate change. do you still believe that? absolutely. in fact, climate change is directly related to the growth of terrorism. if we do not get our act together and listen to what the scientists say, you're going to see countries all over the world. this is what the cia says. they're going to be struggling"
51,"security was climate change. do you still believe that? absolutely. in fact, climate change is directly related to the growth of terrorism. if we do not get our act together and listen to what the scientists say, you're going to see countries all over the world. this is what the cia says. they're going to be struggling"
52,"european plotters in france or belgium that have that freedom of mobility in europe. so it is a risk but i can it's a risk the president felt important to talk, we wouldn't be cowed by the threats and we would go about our business and address priorities like climate"
53,there is troubling efforts on china's efforts to stop global warming. the biggest emitter of coal has been burning 17% more coal than the government previously disclosed. according to data published by a
54,to stop global warming. france has banned public demonstrations. activists in paris got around that ban and laid down shoes in a symbolic protest. they are demanding strong environmental commitments and we
55,summit in december when everyone is going to put their best offers offen the table about what we're going to be doing about reducing greenhouse gas emissions? especially when you hear that china's emissions are a lot more than they thought they were? i think one of the challenges
56,streets of paris happening as president obama meets with world leaders on how to stop global warming. will there be any real breakthroughs? new information about the man accused in the deadly shooting spree at the colorado
57,"global warming aren't taken into account. california ski resorts are beginning to open their doors after recent heavy snows blanketed the slopes. given the state's horrible drought conditions, that's good news. pedram javaheri joins us with"
58,it began as a movement of people wanting to make their voices heard on the question of global warming and was a movement of extreme radicals against the idea of the state of emergency. changing the tenor and tone of --  _
59,"how to stop global warming. many say the meeting is the last chance to make a deal. when i sat down with john kerry last week, i asked him about whether it could work. let me ask you about climb change, mr. secretary."
60,summit. they will try to agree to a plan to stop the global warming. the summit is also a security headache for france. tens of thousands of officers have been deployed across paris. border patrol has been stepped up. protesters are demanding strong
61,"other countries around them. a scientist has been running from norway to the climate summit in paris. he wants to raise awareness about global warming. you will hear from him and his story later this hour. well, pope francis has left"
62,"reporter: what china and the usa say about global warming and their intentions to fight it at this conference really matters. as you can see from those pictures of beijing there and that terrible smog. they are both together, the"
63,"analyst, maggie haberman. the republicans don't agree, necessarily with president obama that climate change is as bifg a"
64,let me ask you about climate change. you are embarking on a big push for the paris summit.
65,"implementing this. apec joined the g-20, showing that we need to reach a climate change agreement in paris."
66,"change, in effect changing the climate and the potential of global warming. he also said that just being here is an act of defiance. remember, just two weeks ago, you had some of the worst attacks in french history here in and around paris."
67,"about how republicans have to embrace science and embrace the technology that will allow us to deal with issues like global warming, but nobody heard it. i do think we need a different system. it seems like some of the candidates want to control what"
68,a climate agreement that will commit nearly every country on earth to big reducks in carbon emissions over the coming decades. climate scientists aren't so sure it will be enough to avert the most serious affects of global warming. the battle against isis is a big
69,"hopes to get global agreement on how to stop global warming. many say the meeting is the last chance to make a deal. when i sat down with the united states secretary of state john kerry last week, i asked him about whether it could work."
70,"i'm george howell. ahead of the climate change conference, nasa releases a study showing contradictions on what many believe is about"
71,"emissions over the next couple of decades. but chris, climate scientists aren't sure it will be enough to avert the most severe effects of global warming. as president obama was saying a few moments ago in his remarks, you have to start somewhere and they're trying to start here in"
72,"mr. obama acknowledged keystone had become embroiled in politics as republicans said the project would have created u.s. jobs. democrats argued an approval from the white house would have been a damaging defeat in the battle against global warming. in the past, the president had sewed he would turn down the"
73,global warming insisting he should be busy destroying isis. it's insulting to the position he holds. it's insulting even more to the responsibilities that are his for him to be talking about this stuff right now. reporter: after the president's initial response to the paris attacks were slammed
74,"feel the effects of global warming and the last generation who can do something about it. he also said the united states is going to set a new goal for emegs reductions because we're ahead of schedule. those are big themes. but the big question is, alisyn, how do they get consensus and"
75,"reporter: now, republicans are pouncing on the president's focus on global warming insisting he should be busy destroying isis. new jersey governor chris christie said the president's involvement in this summit is insulting, in his words. the white house fired back today saying had the president changed his plans or had the summit been"
76,how to fight climate change. republicans have threatened to starve the president of the money he needs. you can see all of the gunshots. it terrified me.
77,"little pamphlets. is this domestic terrorism? what he did is domestic terrorism. this is typical left-wing tactics. also, climate change clashes in paris. world leaders converge."
78,advertisements from exxon. exxon rejects the accusations that it hid the climate change. stunning revelations about the officer investigators say staged his suicide to make it
79,one of the enemies we'll be fighting at this conference is cynicism. the notion we can't do anything about climate change. our progress should give us hope
80,"in climate change. jim bittermann, thank you. donald trump not backing down from his claim that thousands of muslim americans in new jersey celebrated when the"
81,"or visit your24info.com. in just a few days, world leaders will meet in paris to discuss climate change. meanwhile, scientists are monitoring the ozone hole high"
82,president obama in paris as world leaders meet to fight climate change. 'new day' starts now. protests breaking out as world leaders convene in paris. historic negotiations over
83,"tackling climate change are the defining issues of our generation. a tropical sigh clecyclone impa yemen, and now there's a second one having it way with the region."
84,attorney general for misleading the public and investors of the risks of climate change. a win for environmentalist whoswhoss who probed the link. they point to statements and
85,it's all to raise awareness for how climate change has affected the arctic. take a look. irwin knudson is a climate scientist from norway. he's been running for nearly
86,"the summit. alison. jim, about climate change, past meetings have failed to meet a policy that all world leaders agree. what is different this time? what can come out of this"
87,country offering refuge for that family. protests and rallies around the world this hour as the climate change summit is set to begin in paris. we will take you there.
88,world leaders will begin to arrive in paris today ahead of the conference. protests have erupted around the world to demand action on climate change ahead of the international summit which
89,terrorism is an issue and immediate one. they can deal with that. it will not distract them from other big important issues like climate change. like many officials who gathered
90,"president obama and 150 world leaders converge on paris, a city on lockdown, with one mission, to save the planet. at least get a handle on climate change and soaring temperatures."
91,"also, climate change conferences in paris. leaders converge. this is the moment we would finally determine to save our planet. president obama and his chinese counterpart meet as smog chokes beijing."
92,"wealthy or poor, is immune to what this means. this summer i saw the effects of climate change firsthand in our northern most state, alaska, where the sea is already"
93,monday under heavy security after the terror attacks. the climate change summit will host 150 heads of state along with 40000 visitors and delegates. 120000 police officers and soldiers will provide the
94,"here for the talks climate change is a bigger issue. the discussions they have here will determine the future. and sideline discussions will happen as well. phil black, thanks. we are getting new"
95,"declaration that for all the challenges we face, the growing threat of climate change could define the contours of this century more dramatically than any other. and what should give us hope"
96,the u.n.-sanctioned immedia eed climate change. they're here to find out how to make the world a better place. they're doing it in the midst of abject fear of future terror
97,"the potential for the climate change. do we expect maybe a chance meeting or a scheduled meeting between the russian president and president obama? reporter: right now, officials are saying there is no"
98,grand mosque but then tests showed the powder was just flour. world leaders will gather in paris on monday for the start on talks about climate change. cnn's martin savidge is with us
99,that's the real problem. in those countries they want to develop. they're not going to stop themselves from developing. we will just cripple ourselves without doing much for climate change. that's the challenge.
100,"this is overshadowing the summit and some of that is supposed to be economics. that will come up, too, a session on climate change and economic development and the dinner is focused on isis and"
101,"hundreds of world leaders safe. welcome back. thousands of demonstrators in brisbane, australia, attended a climate change rally on saturday. you see thousands of them marching for action. the protest is one of a number"
102,"there will be security for the event. joining me now is cnn correspondent phil black live from paris. phil, we've seen so main demonstrations people calling for action on climate change. in paris, security concerns."
103,"in belgium are arresting anybody who may have assisted him along the way. we know in monday, paris will hold world leaders, this meeting over climate change. president obama, 40000 delegates there, for this"
104,center. we'll bring you the developments in the latest mass shooting in the u.s. paris counts down to a global climate change summit. security concerns threaten to overshadow the big event. and pope francis celebrates
105,"ways to pay for climate change measures ahead of a major summit on the issue later this month. jim bitterman is in paris where the summit will take place. jim, the big question is how"
106,"themselves from developing, so we will just cripple ourselves without doing much for climate change. well, fareed, that's the challenge. and it doesn't make a lot of sense to develop and kill yourself as you do it."
107,mr. obama is among 150 world leaders attending a united nations climate change summit in france there on the sidelines he huddled with russian president vladimir putin with two major items on the agenda as far as we
108,"the marketplace, which already is seeing investment move into clean, alternative, renewable different kinds of energy production. the solution to climate change is energy policy. so it's a question of what choices we need to make in order"
109,"jinping. senior white house correspondent jim acosta is in paris with the president. jim, it is hard to concentrate on climate change knowing what that city has been through. reporter: that's right. we are expecting the world"
110,"how to fight climate change. we're live next. the beautiful sound of customers making the most of their united flight. power, wi-fi, and streaming entertainment. that's. seize the journey friendly. what makesheart healthysalad the becalifornia walnuts.r?"
111,"change. he says they are both immense challenging. world leaders should strive to deliver to their children a world that is free of both. the climate change, the view here, is clearly the greater challenge long term."
112,spider web of gjihadists in paris. and 150 heads of state here for the conference on climate change. as some say holding the u.n. event is a show of strength. others see it as a real risk.
113,"all seem to understand and agree on, and people seem to be connecting with them. i think that will be a pivotal point. climate change is political. you're going to pick one side, but it's not going to change"
114,"region. of course, new report just came out that they used more coal than previously thought. but not looking good ahead of that climate change summit in december. pedram, thank you. when we come back, caitlyn jenner among 'glamour'"
115,"during the next few decades, rising sea levels could threaten the existence of cities and nations. that's what one new report suggests about the affects of possible climate change. pedram javaheri joins us with the details."
116,"we're living two different worlds. republican debates you talk about the economy, foreign policy, immigration and democrats talking about minimum wage, climate change. they don't matchup. i'm curious to see how a general election goes because we're"
117,"degrees threshold scientists talking about if we reach that we will run away with climate change across the planet. now, united nations saying the world could push the world into that 2 degree danger zone on its"
