243,"ahead especially when you consider climate change. jeff corwin, thank you so much for your expertise. and from the most talked about new user on instagram to the amazing u.s. women's soccer team victory and their fight for"
244,"and the corporations who've bought our democracy hate term limits. too bad. i'm tom steyer and i approve this message because the only way we get universal healthcare, address climate change and make our economy more fair"
245,"natasha chen, thanks for being on the story. the united nations calls climate change a clear and present danger. that statement could not be more true for people in africa who are at risk of a hunger crisis."
246,"doing things that are unwise, but i also thought as i listened to him, i asked him, you signed up knowing he was against trade. he was against immigration. he was skeptical about climate change. these were three of your big"
247,"alexandria villasenor, thank you so much for joining us. thank you for having me. well, as a result of climate change, scientists say hundreds of millions of people around the world are at risk of rising sea levels. a study released in october"
248,"we're reporters from the new york times. this melting pot of impacted species. everywhere is going to get touched by climate change. i'm a verizon engineer, and i'm part of the team building the most powerful 5g experience for america."
249,they will tell you that the threats that the united states faces are augment the as a result of climate change. so it's a threat multiplier and the pentagon has generally until recently had an office dedicated to trying to plan ahead.
250,"you have launched this with california republican former governor arnold schwarzenegger. you just wrote an op-ed with republican and former secretary of defense chuck hagel. i wonder outside of the hours of cnn climate change town halls that we hosted, right, with"
251,"i've done very many environmental statements over my life and i believe in -- i believe very strongly and very, very crystal clean water and clean air. that's a big part of climate change. i also see what's happening with our oceans where certain"
252,"taken on phones. linda kynda kincade shows us. reporter: no words, no movie stars, no effects. but this one-minute video shows the looming dangers of climate change. it's one of the winners of the mobile film festival in paris,"
253,"who've bought our democracy hate term limits. too bad. i'm tom steyer and i approve this message because the only way we get universal healthcare, address climate change and make our economy more fair is to change business as usual"
254,"but members of congress, and the corporations who've bought our democracy hate term limits. too bad. i'm tom steyer and i approve this message because the only way we get universal healthcare, address climate change and make our economy more fair"
255,"age has become the face of the climate change fight. at 16 years of age has addressed the united states, at 16 years of age has been nominated for the nobody pell peace prize. 16 years of age youngest to be"
256,"these children's future. 13-year-old munie dreams of the stars. he wants to be a nasa scientist. if they really love us, they should act right now. the climate change problem should be taken seriously. it's not a joke."
257,"if you choose to fail us i say we will never forgive you. time magazine's decision to pick her is going to make sense to many even those who disagree with her about climate change, which is also known as science."
258,"why greta for person of the year? i think there are two really obvious reasons. one, she's changed the discussion around climate change. a year ago or i should say in august of 2018 she was one person striking, and in"
259,"he believed in climate change. has he sold his soul to the devil? i don't know the answer to that. i think that is a fair question, however. and what i don't understand is how he went from being the"
260,"york senator. he was good company, funny, self-deprecating. he also believed in climate change back in those days. really. he would say i'm concerned about the future for my children. he didn't have any children but he was concerned about the"
261,"and the corporations who've bought our democracy hate term limits. too bad. i'm tom steyer and i approve this message because the only way we get universal healthcare, address climate change and make our economy more fair is to change business as usual"
262,"i'm tom steyer and i approve this message because the only way we get universal healthcare, address climate change and make our economy more fair is to change business as usual in washington. [sneezing] you don't want to cancel your plans. [sneezing]"
263,"and i approve this message because the only way we get universal healthcare, address climate change and make our economy more fair is to change business as usual in washington. the wait is over. t-mobile is lighting up 5g nationwide."
264,"the midwest. [ applause ] mr. yang, 45 seconds, on the issue of nuclear energy. first, we should obviously be paying to relocate americans away from places that are hit by climate change. we're already doing it. we relocated a town in tata that"
265,"earth not to guarantee health care for all people, which is why we need medicare for all. we are facing an existential crisis on climate change. the issue is not old or young, male or female. the issue is working people"
266,"footprint to zero by the year 2050, the damage will have been done. climate change will have made certain places in the u.s. unlivable. knowing this, would you support a new federal program to subsidize the relocation of american families and businesses"
267,"part of the world and that's china. mayor buttigieg, you have said that you think china presents more of a challenge than do your fellow candidates believe. the u.s. clearly wants china's cooperation on human rights, on climate change, on north korea,"
268,"climate change. reporter: amy klobuchar probably gained the most because she had a lot of attention on her, a lot of time to make her case. but now all the candidates head to iowa for campaigning. we are 45 days before those iowa"
269,"i'm tom steyer and i approve this message because the only way we get universal healthcare, address climate change and make our economy more fair is to change business as usual in washington. the wait is over."
270,it's like if you want to convince somebody climate change. bring them to a glacier. and automation bring them to detroit or cleveland. i did that work for seven years and i'm a numbers guy. they are staggering. i understand technology much
271,"gross gun violence across the country. there's a reason we pay twice as much for health care, a reason congress has never passed legislation on climate change and on and on. we have a broken government. i'm saying in order to change"
272,"but members of congress, and the corporations who've bought our democracy hate term limits. too bad. i'm tom steyer and i approve this message because the only way we get universal healthcare, address climate change and make our economy more fair"
273,"but members of congress, and the corporations who've bought our democracy hate term limits. too bad. i'm tom steyer and i approve this message because the only way we get universal healthcare, address climate change and make our economy more fair"
274,"i'm tom steyer and i approve this message because the only way we get universal healthcare, address climate change and make our economy more fair is to change business as usual in washington. i must admit. i had a few good tricks"
275,"the united states. we have a president that makes fun of greta thunberg, that denies climate change. in an opinion piece by paul krugman in 'the new york times' this week, it was titled 'the party that ruined the planet,'"
276,"politics? i think it's unfortunate that we have to start every conversation reiterating and reconfirming that climate change is real. i think the science and the conversation is way beyond that point, and we really need to be dedicating and focusing our"
277,"is that because of partisan politics? i think it's unfortunate that we have to start every conversation reiterating and reconfirming that climate change is real. i think the science and the conversation is way beyond that point, and we really need to be"
278,"i'm tom steyer and i approve this message because the only way we get universal healthcare, address climate change and make our economy more fair is to change business as usual in washington. looking to simplify your skin care routine"
279,"temperatures on record and month after month of natural disasters, 2019 also showed us how climate change is directly impacting our health. it also makes it so these plants have less of the good stuff, like zinc, iron and protein."
280,that's inevitable. it's toilet flushing. it's nancy pelosi teeth. it's a twitter spat with a 16 year-old climate change activist. it's sort of a kind of slow rolling melt down except it's fast. it's almost the norm for him.
281,"and i approve this message because the only way we get universal healthcare, address climate change and make our economy more fair is to change business as usual in washington. the wait is over. t-mobile is lighting up 5g nationwide."
282,"who've bought our democracy hate term limits. too bad. i'm tom steyer and i approve this message because the only way we get universal healthcare, address climate change and make our economy more fair is to change business as usual"
283,"we are the only major country on earth not to guarantee health care for all people, which is why we need medicare for all. we are facing an existential crisis of climate change. the issue is not old or young, male or female."
284,"who've bought our democracy hate term limits. too bad. i'm tom steyer and i approve this message because the only way we get universal healthcare, address climate change and make our economy more fair is to change business as usual"
285,the top health issues of the year. beyond some of the hottest temperatures on record and month after month of disasters 2019 also showed us how climate change is directly impacting our health. it also makes it so these plants
286,"reporter: some of the hottest temperatures on record and month after month of natural disasters, 2019 also showed us how climate change is directly impacting our health. it also makes it so these plants have less of the good stuff,"
287,"beyond some of the hottest temperatures on record and month of month of natural disasters, 2019 also showed us how climate change is directly impacting our health. it also makes it so these plants have less of good stuff, like"
288,"but members of congress, and the corporations who've bought our democracy hate term limits. too bad. i'm tom steyer and i approve this message because the only way we get universal healthcare, address climate change and make our economy more fair"
289,"disasters, 2019 also showed us how climate change is directly impacting our health. it also makes it so these plants have less of the good stuff like zinc, iron, and protein. it's turning some of the best foods we humans have into"
290,"to be the generation that fiddled while the planet burned. and as the u.n. advocates for urgency, there are nations such as zimbabwe which are already feeling the effects of climate change. here's cnn's david mckenzie. it's incredible, isn't it?"
291,"african piece contribution is an order of a percent. of 1%. of 1%. reporter: but now among the first to feel its devastating effects. i wish they could stop climate change, because we are the ones who are now suffering, mumbe"
292,"after month of natural disasters, 2019 also showed us how climate change is directly impacting our health. it also makes it so these plants have less of the good stuff, like zinc, iron and protein. it's turning some of the best"
293,"families across america. and stood up to the coal lobby and this administration to protect this planet from climate change. and now, he's taking on. him. to rebuild a country and restore faith in the dream that defines us. where the wealthy will pay more in taxes"
294,"climate change, all of those things have been issues that nato said this is a new world and we got to continue to evolve and make sure our security is focused on the important things existing around the continent and the globe. we know that thursday,"
295,"and as a result of climate change, scientists say hundreds of millions of people around the world are at risk of rising sea levels. a study released in october predicts entire cities could be submerged in the coming decades. and that includes london as"
296,"believed in climate change back in those days. really? yes. i would say concerned about the future for more children? he has no children but was concerned about the future, yes, absolutely. i saw him as somebody who had been working to try to figure"
297,"because the only way we get universal healthcare, address climate change and make our economy more fair is to change business as usual in washington. seaonly abreva cany to help sget rid of it in. .as little as 2 1/2 days"
298,"rosemary. thank you so much, pedram, for keeping a close eye on all of that. appreciate it. well, the u.n. climate change conference in madrid is now in its second week, and u.s. businesses and leaders attending the event are trying to let the"
299,"after witnessing the terrible toll of gun violence. he helped create a movement to protect families across america. and stood up to the coal lobby and this administration to protect this planet from climate change. and now, he's taking on. him. to rebuild a country"
300,"solve the problem of climate change. you have to have every country at the table. most importantly the 20 or so largest economies in the world which are about 85%, 90% of all emissions. secondly, you've got to start to make a set of decisions that are"
301,is a top priority for the prime minister here as well as for president macron earlier we heard him talk about it. are you thinking about that issue? i think about it all the time. honestly climate change is very important to me and you know
302,"the president and climate change. he withdrew from the paris climate accord. when you talk to diplomats from these countries, they often complain that the president doesn't read the briefing books or seem to care about the briefing books. they don't care about the nato"
303,"he helped create a movement to protect families across america. and stood up to the coal lobby and this administration to protect this planet from climate change. and now, he's taking on. him. to rebuild a country and restore faith in the dream that defines us."
304,"world's climate driving a rise in the diseases and where we're seeing them spread. we can't ignore that climate change is one of the factors playing a role ear. in the united states since 2004, we've seen tick-born disease cases double. that's something to keep in"
305,"he does. but we have a president of the united states who doesn't believe in manmade climate change. that is the scandal. what he calls this young woman, girl, doesn't matter to me. i don't understand the punching down. you're right, she's a public"
306,"film. mostly vladimir putin has been asked about domestic politics in russia. he's been asked about the environment and climate change. we haven't gotten to that part -- we're sure he's going to be asked about impeachment, as well. one thing we know about vladimir"
307,"stands up for farmers, and by the way, the word 'climate change,' to the best of my knowledge, is not discussed in this new nafta agreement at all, which is an outrage. so no, i will not be voting for this agreement, although it"
308,"generations from now. this president doesn't keep his decisions for seven minutes. so what i think we need to do, get back into the international climate change agreement. i will do that on day one. on day two, bring back the clean power rules."
309,"running out of time. that climate change threatens every living thing on this planet. but getting congress to act, they just don't want to hear it. and if we don't attack the corruption first, if we don't attack the corruption head-on,"
310,"we pool our resources and fight our common enemy, which is climate change. reporter: when you break all this down at the end of the day, amy klobuchar probably gained the most because she had attention on her and time to make her case."
311,"the world. instead of spending money to kill each other, maybe we pool our resources and fight our common enemy, which is climate change. reporter: so, when you break all this down at the end of the day, amy klobuchar probably gained the most because she had"
312,"whose lives are torn apart, works great for giant oil companies that want to drill everywhere but not for the rest of us who see climate change bearing down upon us. and when you see a government that works great for the wealthy"
313,"globally on weapons of destruction, maybe an american president, i.e. bernie sanders, can lead the world, instead of spending money to kill each other, maybe we pool our resources and fight our common enemy, which is climate change. thank you, senator sanders. [ cheers and applause ]  _"
314,"time since the 1920s. we are the only major country on earth not to guarantee health care for all people, which is why we need medicare for all. we are facing an existential crisis of climate change. the issue is not old or young,"
315,"you're kind of the last big green standing. you're the last person standing saying climate change is a crisis. with had we try to do it under the obama administration, with e got hit. o are green ideas going to hurt people. they're going to hurt poor"
316,"reporter: 13-year-old dreams of the stars. he wants to be a nasa scientist. if they really love us, they should act right now because the climate change project should be taken seriously. it's not a joke. it's about future generations and our living on earth."
317,"madrid. > well, let's talk about why there were no breakthroughs here with the vice president of climate change for the global strategy group conservation international. she was at the summit and joins me live from madrid. thanks for being here. it's heartbreaking to hear these"
318,"commitments, to support very muching countries that are on the front lines of climate change, and ultimately agree to the rules that will allow countries to cooperate. i think there was a lot of difficulty in reaching agreement because of some particularly contentious issues around"
319,"i want to tag that interview with a quick poll from 'the washington post' in september, which shows a growing number of americans describe climate change as a crisis, and two-thirds say president trump is doing too little to tackle it. well, mother nature is"
320,"temperatures and melting snow packs. this year provided the best, meaning the worst, evidence so far of the calamitous effects of climate change. i'm already up to like 50 sunscreen and i still get tan. i don't really get that tan. but you know what i'm saying."
321,"helped kind of set his own narrative and be able to tell his own story about his experiences in, for example, combatting climate change and working on issues to -- or working on ending gun violence. but it is a question how far spending can actually go."
322,serious civic moral --. mr. trump spun up major falsehoods when he mocked the use of windmills claiming they contribute to climate change and almost none are produced in the u.s. wrong on both counts. as wind is one of the cleanest sources of energy and creates
323,contribute to climate change and that almost none are produced in the u.s. wrong on both counts. as wind is one of the cleanest sources of energy and creates american jobs. i never understood when -- and i know windmills very much. i've studied it better than
324,"address climate change and make our economy more fair is to change business as usual in washington. verizon's important to us because we facetime with her grandparents all the time. (vo) when you have the best network, you want to give the best network. feliz navidad! (laughs)"
325,"environment where our soldiers, sailors, airmen and marines need to work and need to prevail. the arctic is kind of a poster child for that, how the ice is melting out. and although definitive lines between climate change and geopolitical impacts are hard to"
326,koalas. and they are right in the crosshairs of the blazes. certainly they give us an in your face heated feel of the power of climate change and these animals are being consumed literally as a species by these fires. and it has been declared that
327,"far of the calamitous effects of climate change. i'm already up to, like, 50 sunscreen and i still get tan. all right, yent really get that tan, but you know what i'm saying. 2019 will go down as one of the hottest ever and iceland"
328,"climate change if you're influencing the decisions of the magazine. one of the decisions we made is we wouldn't get involved in editorial decisions. we also made a decision that we wouldn't get involved in operational decisions. like you said, we have our hands"
329,"because the only way we get universal healthcare, address climate change and make our economy more fair is to change business as usual in washington. at t-mobile, we're lighting up 5g, and when you buy a samsung note 10+ 5g, you get one free."
330,say. i do think you have that interaction right there with ukraine which really is not that big of a protest issue. it's usually immigration or climate change when it comes to biden's events. but remember the interaction he had last month when he was on
331,"purely on paper and done on gun safety and climate change and his ad which is pretty good, that is running across the country, maybe he could make some headway but i don't see a path for him and i don't think democrats are looking for another candidate and that"
332,"affordable housing units with it. after witnessing the terrible toll of gun violence. he helped create a movement to protect families across america. and stood up to the coal lobby and this administration to protect this planet from climate change. and now, he's taking on. him. to rebuild a country"
333,"everywhere is going to get touched by climate change. wthat's why xfinity hasu made taking your internetself. and tv with you a breeze. really? yup. you can transfer your service online in about a minute. you can do that? yeah. and with two-hour service appointment windows,"
334,"to protect this planet from climate change. and now, he's taking on. him. to rebuild a country and restore faith in the dream that defines us. where the wealthy will pay more in taxes and the middle class get their fair share. everyone without health insurance can get it"
335,"speed of the negotiations that are happening behind closed doors at the government level. why is that the case, and what is actually at stake? first of all, the stakes are huge. what we get to see nowadays is the fact that the climate change is already happening, is already"
336,states at a large national level because we have a president that says that climate change is a chinese hoax and the result of the american presidency moving out of the position of leadership that president obama and the administration gave it is that other nations that want
337,"the race as a candidate? jim, every single democrat has a plan and every single democrat has a plan that would be far more effective than what is happening today. there isn't one democrat who hasn't put forward plans on climate change so i'm not -- i didn't say anything about the"
338,"eventually. i could have gave him the answer. we'll take it. we'll take it. let me ask you this, the newest candidate to jump into the 2020 race on the democratic side is someone who's put a lot of money and muscle behind fighting climate change and that is new"
339,"york -- former new york city mayor mike bloomberg. is he a welcome addition to the race given his focus on climate change? sure. look, i'm not going to sit here and say to any candidate you shouldn't be in the race or, you know, i think mike was obviously"
340,"to protect this planet from climate change. and now, he's taking on. him. to rebuild a country and restore faith in the dream that defines us. where the wealthy will pay more in taxes and the middle class get their fair share. everyone without health insurance can get it"
341,"of it. and a tick commonly found in the south is making the way north and spreading illness. even being blamed for one woman developing an allergy to red meat. how climate change is contributing to the spread of this blood-sucking bug. mike bloomberg's never been afraid of tough fights,."
342,"because we've been in this agony since the referendum in 2016. there are huge agenda points here including climate change and other political issues. if you could get brexit, if you like, running and get this divorce settled by the end of january and look to the future,"
343,"more than one tweet against her, and his complaint seems to be that she's not cheerful enough or smiling enough, that she's too angry. you know, she is upset. a lot of people are upset about climate change in the world, and she has a right to be upset."
344,"address climate change and make our economy more fair is to change business as usual in washington. here's the story of green mountain coffee roasters costa rica paraíso. meet sergio. and his daughter, maria. sergio's coffee tastes spectacular. because costa rica is spectacular. so we support farmers who use natural compost."
