0,that's before hewlett-packard. how many people here believe in global warming? do you believe in global warming? who believes in global warming? who believes in global warming?
1,who believes in global warming?
2,"with what he is saying or what's in the bible? the chapter about global warming, don, to be honest with you. the bible doesn't say you should protect and honor the earth, mother nature? sitting there and talking about global warming and that"
3,for 37 yea years. lusent. headed by who? carly. that was before hewlett packard. how many people here believe in global warming?
4,"family, i'm happy to be a guest a in country. and climate change. it seems clear climate change"
5,"the latest. reporter: john and christine, president obama delivering an urgent message on climate change. the president is sounding the alarm on climate change."
6,"in this country, which. reporter: he also spoke out strongly on climate change."
7,other and embrace each other. he is bringing something to the world that the world needs right now. what did this man say about gay marriage? he said who am i to judge. global warming is controversial.
8,we hope you will speak about climate change and how income is affecting the most vulnerable. please speak about climate
9,"foreign policy challenges facing the u.s. and the world confronted on this stage at the u.n. issues in ukraine, in syria, climate change, u.s. relations with cuba, and the president speaking today to many of the issues. he'll start with climate change,"
10,ambush mystery. prosecutors release new details in the brutal murder of a sheriff's deputy. president obama's dire warning on the dangers of climate change.
11,"real, and that humans help contribute to it. without getting into the issue of china versus the united states, which i understand you've talked about before, what do you make of skeptics of climate change such as senator rubio? i don't think senator rubio is a skeptic of climate change."
12,"now, on the question of climate change, the pope's not putting himself forward as a scientist. he's relying, as best he can, on the scientists who give him the advice that he thinks is the best advice. other scientists, of course, would disagree on the human contribution to climate change."
13,"only at your lincoln dealer. very exciting. the pope is going to be speaking right behind thus morning. washington is really pretty occupied with what's going to happen tomorrow, within the pope will be the first pope ever to address congress. politicians on the right are nervous about global warming."
14,who will test the president's survival skills. he will become the first president to visit the arctic to hear from fishermen who are threatened by climate change.
15,"i am not a believer in climate change. it's gone global warming and climate change, now they cull it extreme weather. that's the new one because weather tends to be a little more extreme. a lot of the big bloods and big"
16,"that's very important to me. i have won many environmental awards. i'm not a believer in climate change. now it's gone global warming and climate change and extreme weather, that's the new one because weather seems to be a little more extreme."
17,streets of ukraine's capital as russia strengthens its hold on the country's east. and u.s. president barack obama heads to alaska to deliver a speech aimed at climate change
18,"cathedral capped a busy day. thursday morning he addressed congress back in washington, where he touched on two hot button topics in the u.s., climate change and immigration."
19,"with this problem, is that right? that is what we understand and, you know, it is very interesting how climate change has actually acted as a bridge between the united states and china. they have many difficulties. they have different positions. different views on so many issues. but on climate change we have"
20,"problem. the idea that the country in its entirety is pausing right now to hear this message, i think says that we are still thirsty. it's not all about efficiency and bottom line in money. do you expect him to talk politics on this trip? he's been very vocal about global warming."
21,"historic trip from cnn's rosa flores. reporter: john and christine, pope francis not holding back on his first day in the united states tackling immigration and climate change and religious"
22,our own children. reporter: there were moments of discomfort for both sides. from abortion -- to protect and defend human life at every stage of its development. reporter: to climate change.
23,"vatican has been in alignment with the gop but pope francis is far from the traditional pope. he shine as bright line affecting the developing world including immigrant rights, climate change and economic"
24,"bitter presidential campaign. joining me now is anna navarro, republican strategies and supporter of jeb bush and visor to other gop candidates. you were at the white house today, immigration, poverty, climate change."
25,run more smoothly. and morning chitchat. less interesting. transportation can work better. with xerox. chinese president xi jinping is urging members of the international community to adopt measures to combat climate change.
26,"on climate change and i would expect the fight against global warming and climate change to be front and center to the address of the u.n., and then the of course, when he gets to philadelphia, it is the world meeting of families that the vatican is sponsoring in philly,"
27,"they couldn't be more pleased with the audacity of pope, the pope's message throughout the day by hardly non-partisan and pointed at times and almost mirrored the president's own remarks on climate change, the"
28,and president obama's new fight against global warming and his tough words for politicians who deny climate change. new information in the shooting death of a sheriff's
29,did he dance well? he liked it. the 400 residents of the island could be forced to move away because melting ice is raising sea levels. the president warning now is the time to act on climate change.
30,"his purview, and yet he would make it a big darn deal to come up here and rename the mountain. that's a lot of the criticism. as you wrote about. the emphasis of this trip is highlight climate change"
31,"he met privately with the president at the oval office. the remarks at the white house include mentions that would delight and concern liberals and conservatives. within opening moments, the pope brought up immigration and climate change and income"
32,i talk to her earlier today about this historic meeting. she said these two leaders may have more business to tackle in the president's final months in office. they're very simpatico on issues like climate change and income
33,"one, we expect, will be there. there's one arizona congressman, representative paul goes-r, catholic, who says he'll skip the pope's address, first address from a pope to u.s. congress because of the pope's position on climate change and"
34,"some mundane government work. i like that. the ipad, they call it the hpad. you have to show me how to use that. the president is in alaska. he was at a climate change president yesterday."
35,"well, earlier i spoke with a parish priest who is from west virginia, father chapin. he attended the pope's speech in washington. he says the pope was not being political when he talked about things like climate change and"
36,"scientific consensus on manmade global warming and climate change. does it make your job more difficult when there isn't a major nation, like the united states, speaking with one voice?"
37,"washington, it's on to new york city for the pope and then after that, philadelphia, we've learned where he is going to be meeting with victims of sexual abuse. the pope also hitting today on some controversial topics. immigration, climate change."
38,"somehow john paul ii can talk about it, benedict can, this pope puts out a cyclical about it, everybody is up in arms. i don't get it. they don't quite view it that way, particularly on an issue like climate change what is"
39,"income and wealth inequality, not discussed a i all. the fact we have the highest rate of childhood poverty of any major country on earth not discussed at all. the fact that the scientific community is virtually unanimous in telling us climate change is real."
40,footprint was not near that glacier in the early 1800s when it started melting. it was before the industrial revolution. these blames on man's activity. some of that i know is bogus. i want to point out that the vast majority of climate change
41,or republican nominee is the best to carry the flag. what about when the pope addresses congress? how do you think he'll be received tomorrow? he'll be received politely. we already know that several members of congress are very unhappy with his position certainly on climate change.
42,his remarks before the unl general assembly come a few days after pope francis advised countries to reach an agreement at the u.n. climate change conference this coming november. joining us to weigh in is the executive secretary for the u.n. framework convention on climate
43,degrees celsius. that is what climate experts say is the difference between stabilizing global warming and run away climate change. take a look at arctic ice levels which have been declining over the past three decades.
44,"history. he will be the first pontiff to address a joint meeting of congress. one congressman calls it the big one. comments about the white house, immigrant, climate change, specifically, global warming, poverty are any indication, it"
45,"republican candidates also rejected the pope's call for a man to take responsibility for climate change and businesses to reign in fossil fuels. there's a different set of priorities that he'd like politicians to talk about. and it's not just abortion and gay marriage anymore. it's immigration, it's climate"
46,got an up close and personal look at the affects of global warming. it is the second day of mr. obama's alaskan trip. his mission is to highlight climate change as an urgent threat. he taped an episode for a
47,"change. it's gone global warming and climate change, now they cull it extreme weather. that's the new one because weather tends to be a little more extreme. a lot of the big bloods and big things. 1890, they have the greatest"
48,"water. all of those things. but i don't think we should destroy our country. if we have climate change or global warming, it's going to be of the nuclear form because we have incompetent politicians watching over us. that's the big problem."
49,"water. all of those things. but i don't think we should destroy our country. if we have climate change or global warming, it's going to be of the nuclear form because we have incompetent politicians watching over us. that's the big problem."
50,"immigrant, climate change, specifically, global warming, poverty are any indication, it may leave some republicans squirming, but his words may also put democrats in an awkward position. here's the big question will someone come back at the pope? let's bring our comprehensive"
51,global warming and he will travel to northern alaska where he will become the first president to visit the arctic to hear from fishermen who are seeing their livelihoods threatened by climate change and white house official described this journey as a signature trip
52,to alaska where he pushed for strong action against climate change. he spent much of his trip underscoring the effects of global warming on the region. he says it is a wakeup call for the world and america must lead the way for change.
53,"cnn's jim acosta is at the white house for us tonight. so do we have any idea, jim, what the president and the pope are going to discuss tomorrow? reporter: anderson, the white house is engaging in some vatican-like secretsy on this topic though the president and the pope are allies on issues ranging from climate change to"
54,"carbon producer anymore, china is. they're drilling a hole and digging anywhere in the world that they can get a hold of so the bottom line is, i am not in favor of any policies that make america a harder place for people to live, or to work, or to raise their families. governor christie, you have said that climate change is"
55,"carbon producer anymore, china is. they're drilling a hole and digging anywhere in the world that they can get a hold of so the bottom line is, i am not in favor of any policies that make america a harder place for people to live, or to work, or to raise their families. governor christie, you have said that climate change is"
56,hillary clinton with 45% and biden 46%. barack obama is wrapping up a three-day visit to alaska where he's been pushing for strong action on climate change. mr. obama has spent much of his trip underscoring the effects of global warming with on the region. he said what is happening in
57,"effect melting the permafrost, releasing greenhouse gases that will trap additional heat that we get in the coming summers. they call this a negative feedback loop. it is. and a reality check for all"
58,find room in people's hearts and in the conscious of society. and the pope in washington now really talking in some controversial subjects this morning mentioning global
59,let's go to cnn's saima mohsin live in beijing. reporter: the president expected to talk about climate
60,and the fight on global warming this morning. the harsh words the president has who deny. and the execution-style murder of the sheriff's deputy.
61,which was largely built by such families. he also spoke out strongly on climate change. climate change is a problem
62,people. he also weighed in on climate change. climate change is a problem we can no longer be left to a future generation.
63,speech touched on climate change and death penalty. his speech will touch on climate change and he will add poverty and social injustice.
64,reporter: later climate change. it seems clear to me also that climate change is a problem with can no longer be left to
65,climate change. that climate change is a problem we can no longer be left to a future generation. [ applause ] reporter: pope francis also touched on the international
66,to the u.n. a speech yesterday touched on climate change and the death penalty. vat kican officials say he will focus on climate change and social injustice.
67,coherence of it because of the ability to see the words of emphasis to this pope. and when he spoke about that there is a clear evidence of a change and that it's a problem that can't be left to future generations with respect to the -- pollution and global                 _
68,something digestible even if disagreed with. i think it's transformative. what i've already seen is the manner and gentle words even when he speaks about a controversial issue like climate
69,international conference on climate change. he called out climate change deniers and said we must act now. we know that human activity is changing the climate. that is beyond dispute.
70,session of congress. the speech on climate change and the death penalty. he says the speech to the u.n. will focus on climate change. the pope's arrival gripped the city last night.
71,"governor christie, you have said that climate change is real, and that humans help contribute to it. without getting into the issue of china versus the united states, which i understand you've talked about before, what do you make of skeptics of climate change such as senator rubio? i don't think senator rubio is a skeptic of climate change. what senator rubio said i agree with. we don't need this massive government intervention to deal"
72,"told is -- you're right, it wouldn't have happened. president obama sent to the vatican, have these meetings that opened up this historic change. this is a moment in the obama presidency, i think, climate"
73,during an international conference in alaska on the effects of climate change. this is the start of a three-day visit to highlight the impact of climate change which mr. obama called the defining threat of the century and
74,"the brunt of his speech on climate change. a climate that has been changing since first created in genesis. more troubling is the fact that this climate change talk has adopted all of the socialist talking points, wrapped in"
75,"climate change is real. the fire season in california is expanding. we know it's intensified by the climate change, but the science about rising sea levels, disruptive storms, this stuff is global. it's a profront throat to the"
76,rejecting every form of injustice discrimination. reporter: why did he mention global warming most specifically? maybe it's because an area of
77,greenhouse gas that is 30 times more potent than carbon dioxide. this is something significant and we know 25% of the northern h hemisphere is covered by permafrost. so we'll take you back to this
78,yourself clear. thank you for getting up with us this morning. thank you very much. alisyn? president obama finishing up his trip to alaska. a hike to see a receding glacier. he pushed urgency on climate
79,"something that's having an immediate impact now, especially in alaska. entire towns need to be reloebtsed because of climate change. and hopefully, president obama's tour of the state will raise awareness in the lower 48 that climate change isn't a problem"
80,"stance on climate change. which is a good thing. because climate change should not be a partisan issue. it is a human challenge and we should all stand above partisan politics and be together on this challenge. christiana, you say it is a"
81,"the pope has a great deal to do with that. the pope, obviously, on his way to different places here in cuba, then on to the united states. raul castro going there to address the u.n. for the first time in a very long time as a cuban presence. what do you think about the choice to start with global"
82,"anchorage, alaska. this is part of a three-day visit to highlight the impact of climate change, which he called the defining threat of the century. the point is that climate change is no longer some far-off problem. it is happening here. it is happening now."
83,"nations to do something now about climate change. the president spoke monday night during an international conference on climate change in anchorage, alaska, and he had some harsh words for those who are not taking it seriously enough. it is wonderful to be -- any       _"
84,"guns, immigration, capitalism and, of course, there is climate change. one congressman, one republican congressman, paul gosar of arizona, says he's not going to be attending the speech because of the pope's views on just that, climate change. let's talk about this with cnn"
85,"you've talked about before, what do you make of skeptics of climate change such as senator rubio? i don't think senator rubio is a skeptic of climate change. what senator rubio said i agree with. we don't need this massive government intervention to deal with the problem."
86,"lot of important issues for businesses like immigration, climate change. what is the price tag of all those plans? all really important business issues. we he wants the u.s. to take action on climate change in particular. how much would that cost? the typical american would end"
87,foreign aid. it's up 36% since 2011. david cameron speaks urgently about global warming and said annual carbon budgets. he's an eager advocate of gay
88,and the fight on global warming this morning. the harsh words the president has who deny. and the execution-style murder of the sheriff's deputy.
89,the climate agenda. already he has taken global warming deniers to task. in an unusually blunt speech in anchorage. we have jim acosta there with
90,visit to the u.s. that may be impossible as the pope and president are allies on the positions that republicans oppose as the white house led the charge for same-sex marriage. pope francis softened his stance on gay priests and climate
91,"reporter: well, there are a lot of issues on the table, and the expectations, as you point out are very different. before leaving for the trip, chinese officials held a press conference where they said science, technology, trade, agricultural, even, and climate"
92,"no. i think that clean air is a pressing problem. you want to have clean air, you want to have clean water, that's very important to me. and i've won many environmental awards. i am not a believer in climate"
93,set to speak before the united nations this morning. just the beginning of the day that brings him all over the city. and china's president wakes up in washington. a key meeting with president obama. a big announcement on climate
94,"who believes in global warming? raise your hand. wow, not much, huh? do you have your hand up? a little? no. nobody? one person? well, sir, that's -- you       _"
95,"thank you. alaska is the perfect backdrop for a conversation on climate change but will obama succeed in changing the national conversation, getting people to think more about climate change than they have in the past. the problem a lot of people point out once this is over, the"
96,effects of climate change in alaska? it's one of those problems that people can't relate to until they're impacted in a major way? exactly. i think people in the lower 48 see climate change as something that will affect them in the future but don't see it as
97,what your specific strategy is for that. let's talk about another topic that the pope has talked about and that's climate change. the pope has said he is clear that this is say problem that cannot be left to a future generation. do you agree that climate change say pressing problem?
98,"pro marriage equality, he wants to take action on climate change me lost the party leadership six years ago because on the issue of climate change and the emissions scheme. and pro for republican of australia but his own party don't like those positions. let's go to asia pacific editor"
99,"history. so how are lawmakers going to respond. we have one here. senator angus king, he's, of course, the independent senator from maine. senator, very good to have you here. you just handed me something that is going to be on the pope's agenda which is climate"
100,"and why the united states wants to let china be number one in solar energy, china be number two in wind energy, because those are the energies of the future, why would they want to let those opportunities go? whether you believe in climate"
101,7000 pages showing frustration with the way her department handled secrets. president obama fight against global warming. new information in the execution-style murder of a houston sheriff's deputy.
102,"but afterwards, you'll hear republicans speak skeptically, especially on the issue of global warming. jimmy, you know, d.c. is all about security. they know how to do this."
103,"climate thing first hand. he will tour the melting glaciers with bear grylls. they will talk about global warming and later this week, he will travel to northern alaska"
104,item on his agenda is concern about global warming and the environment. i'm just wondering if to it's almost exposing a chasm between most catholics and the political
105,the director of the institute at the woodrow wilson senior. has president obama hit the mark on this trip or using alaska for the background visuals to push for action on climate change at the summit later this year? i think he hit his mark on the climate change as he set out
106,"you are looking at the white house briefing there and josh earnest is giving the briefing, and the takeaway is that the reporter asked about the pope speaking about climate change, and he said that the president appreciated his words on climate change, and he also said that it was not a political expression"
107,"who believes in global warming? raise your hand. wow. not much, huh? do you have your hand up? a little? no? no. nobody? one person? well, sir -- well, that's a very interesting --  _"
108,acknowledged the united states role in global warming and addressed those who continue to ignore its existence. the time to heed the cynics has passed. the time to plead ignorance has
109,you're saying that global warming is man-made and you don't believe it's a pressing problem. it's good to get you down the record with that. let's talk about the polls.
110,you're saying that global warming is man-made and you don't believe it's a pressing problem. it's good to get you down the record with that. let's talk about the polls.
111,"to back drop his global warming issues to the forefront. at the speech in anchorage, he speaks out. jim acosta is there. reporter: president obama has arrived in alaska to deliver"
112,not going to solve global warming by itself or stop war but there are very many areas where it can be effective. health. life-style. we don't exercise or eat
113,he keeps up on current events. he knows what he is saying. that's why it intrigues me when people say why would he talk about climate change? because he knows a about climate change and e he believes that stewardship of the earth is an important value. it's a biblical value. it's been a religious value.
114,"lot? we did. we started out, of course with president obama's trip to alaska. that's one of the main reasons we wanted to talk to the former governor of alaska to see what she thought of the renaming of the mountain and president's push for action on climate"
115,president obama chooses a picture perfect setting for his campaign against global warming. he cruised across a bay in alaska and stood on a shrinking gl glacier and he says the warming
116,that's about $14 an hour in today's u.s. dollars. it has massively increased foreign aid. it's up 36% since 2011. david cameron speaks urgently about global warming and said annual carbon budgets.
