118,"criticism. the internet empowers all kinds of action, including offline. we spearheaded the movement on climate change last year and are doing it again. we're seeing early marches from australia and new zealand. the largest marches in australia"
119,"family. another rally cry from around the world. leaders gathering in paris right now for the much anticipated summit on climate change. the leaders of more than a hundred countries arrive for the summit, see how security levels"
120,he to be hearing them talk about the fight against i sasiisis. at the same time prime reason for president obama and other heads of state coming here is the fight against climate change. so this conference is going
121,". paris launches massive security operation as more than 100 world lead aers rife for a crucial summit on climate change. plus, pope francis about to arrive in the central african republic. what he's hoping to accomplish"
122,"determined to arrive with a message of hope. john sutter, cnn, france. and you'll get complete coverage of the cop21 summit on a special section of our website. also reports on the climate change debate from the field"
123,how to fight climate change. the man accused in the planned parenthood will face a judge hours from now as we get new information on what triggered the attack. good morning. welcome to 'early start.' i'm alison kosik.
124,"jinping. senior white house correspondent jim acosta is in paris with the president. jim, it is hard to concentrate on climate change knowing what that city has been through. reporter: that's right. we are expecting the world"
125,"world leaders including president obama and some 40000 in the climate change summit. i have to believe, martin, what they have planned for security for this event is going to look much different now, is that"
126,"up 100 meters from paris. manuel valls said the cop 21, big climate change conference is going to bring in 125 heads of state, whatnot, they said some activities will be curtailed, which is to say the conference"
127,"television ad. let's take a look. funded by over a million contributions, tackling climate change to create clean energy jobs, fighting for living wages, equal pay, and tuition-free public colleges. people are sick and tired of"
128,announcement is ahead of a very big u.n. summit on climate change next month where president obama wants to broker an international agreement to reduce the carbon dioxide emissions. this is is a bold statement in
129,western loss could outpace the gains in eastern antarctica. there's still a lot to learn about how antarctica is reacting to climate change. sea levels will continue to rise as it only makes up about 8% of
130,"been over 1000 ice ages in the past, how do we know that the current climate change is caused by humans? thank you. meteorologist derek van dam is here. that question to you. george, in essence what this"
131,it's all to raise awareness for how climate change affected the arctic. cnn's john sutter biked alongside him for part of that journey. take a look. reporter: he's a climate scientist from norway. he's been running for nearly
132,"but only if we rise to this moment. as one of america's governor has said, we are the first generation to feel the impact of climate change and the last generation that can do something about it."
133,"this is going to resonate not just here in paris but around the world and specifically back home in the u.s. where climate change is still somewhat controversial, especially politically. take us through it, jim. that's right, chris."
134,"i personally think that climate change is the biggest challenge we've ever faced as humanity. terrorist attacks, of course, are horrible, but it's nothing compared to what lies ahead. why? we already see a link between"
135,". paris launches massive security operation as more than 100 world lead aers rife for a crucial summit on climate change. plus, pope francis about to arrive in the central african republic. what he's hoping to accomplish"
136,"president obama leaves for paris this morning. he'll join over 150 heads of state to talk about climate change. the french government has arrested 300 people since the attacks in paris, and police are still hunting for salah"
137,"energy prices will start to decline, too, if you start to get some innovation advancement. sir richard branson told me about a year ago, we need to disrupt climate change the way we've disrupted so many other"
138,shoes at police officers. the day before the summit gets under way. officials there have been a major climate change -- paris is still under a state of emergency. that lasts for three months. all major protests are indeed
139,"protesters in paris tonight throwing bottles and shoes at police, this just a day before a huge summit on climate change set to begin in paris. officials there ban a major climate march that was scheduled"
140,"expected to make their first court appearance on monday. 15 years from now, $100 million more of the world's population could be forced into poverty. this is a result of climate change. this according to a new report"
141,decision for a few months. but you know you have this very big u.n. summit on climate change coming up in december. the president is hoping to broker a very landmark agreement with nations about curbing
142,he has this video message on the issue of climate change. we're going to need you to help us on this. you've got to get engaged about why claimant change is so important. because if all of america is
143,postponement or cancellation of the climate change conference. these are two important things that came out of the meeting with the french president. how much of a challenge is internal? specifically for the french? we are hearing the cultural
144,was a photo of a christian woman who was killed by having a cross basically rammed through her head. we have our president off somewhere talking about climate change. we have a very serious issue in the united states according to
145,"moderates.' so distancing herself a bit. i think it was difficult for her. i would call her subdued in a way in which i expected her to be more assertive. malika henderson, was bernie sanders' statement that climate change represents the major"
146,"the u.s. will present their visions for cutting carbon emissions and security is on everyone's mind. we have jim acosta with the coverage at the paris climate change conference. jim, it is good to have you. the u.s. and china seen as"
147,"will ripley, cnn, pyongyang. very interesting. now, 15 years from now, 100 million more of the world's population could be forced into poverty as a result of climate change. that's according to a new report from the world bank which points"
148,three dead in colorado after a standoff at a woman's health center. we'll bring you the developments in the latest mass shooting in the u.s. paris counts down to a global climate change summit. security concerns threaten to overshadow the big event.
149,"things you've achieved. where do you think your group has made the biggest difference? oh, i think on climate change, one thing that recently lapped is there's a goal -- that happened is there's a goal we need out of this paris"
150,"david mckenzie, cnn, kampala, uganda. still to come, security will be especially high in paris this coming week for the climate change conference. we'll tell you how the country intends to keep hundreds of world leaders safe. stay with us. i have asthma."
151,they are all there right now for this climate summit. a little more than two weeks after the string of attacks. today they are focusing though on global climate change. cnn learned that president obama has used the summit to continue
152,their citizens. reporter: it's interesting in that climate change in particular is an issue that the united states and china have been working upon increasingly constructively. it's one of the reasons why there is a real sense of optimism around this conference.
153,"switzerland. calling for policies on climate change and from hong kong to seattle. millions are expected to voice their concerns on the environment. you see here, some of the displays from around the world thanks to some of our partners"
154,countries that there -- to stabilize fragile growth in some regions. thousand do you take the concerns on board when rallying support for action on climate change? i think it's really important to understand that this transition to obtain an energy
155,"demonstrations. 120000 police and soldiers will provide security for the event. joining me now is correspondent phil black live from paris. phil, we've seen so many demonstrations across the world. they're calling for action on climate change but where you are"
156,we'll be talking to him about what can it be achieved at a cop21? what the real chances are for progress and what needs to happen to make climate change that some generation of americans will look at in the
157,"not just against isis, but to confront the threat posed by climate change. here's more of what the president had to say. i've come here personally, as the leader of the world's largest economy and the second largest emitter, to say that the"
158,"we actually are going to do something to follow through on the cause of climate change. none would be possible without the leadership of the united states and without the leadership of this president. all right. josh ernarnesearnest, white hou"
159,"it's not just governments and multi-lateral institutions making contributions to fight climate change. we also need investment and capitalization from the private sector. fortunately, the private sector recognizes the economic opportunity that exists here. as the world turns toward a more"
160,"summit in paris specifically is an act of defiance. showing the humanitarian world will not be deterred from the cause of freedom. yet, it's also a great distraction. how do you focus on climate change when you have 120000 military and police, unknown"
161,and now primarily the fight of climate change. it is that subject that president obama is in meetings with other big polluting meetings. you mentioned the chinese president that he is meeting with him right now. the other key meetings to take
162,"in turkey this weekend and france is due to host the next climate change conference in just two weeks. the french government says it will go ahead securely, despite the vulnerabilities so brutally exposed in paris. phil black, cnn, london."
163,"in turkey this weekend. and france is due to host the next big climate change conference in just two weeks. the french government says it will go ahead securely, despite the vulnerabilities so brutally exposed in paris. phil black, cnn, london."
164,reporter: absolutely. this meeting is supposed to be about economics and inclusive development. there are still sessions planned in which leaders are going to discuss development and discuss climate change. you can see how this is a dark shadow over this meeting.
165,"nations and then together in a broader picture of how to spur growth. that's been a question for a long thyme. inclusiveness is a big topic. that's supposed to be one of the themes here today. climate change. also the syrian refugee crisis,"
166,security at large imminent international events. leaders of g20 nations gather in turkey this weekend as france is due to host the next big climate change conference in just two weeks. the french government says it will go ahead securely despite
167,"and able to discuss the climate change talks that are coming up in paris as well. obviously, the focus is how to fight isis and bring an end as well to the syrian civil war which is really allowed isis to"
168,"alert for a while now because they are hosting this massive climate change conference which starts in just about two weeks from now. and they have started a huge amount of extra police, of secured roads, of securing borders and putting more border"
169,hid climate change information. the new york attorney general probing that. all right. johnny football. he met the bengals one-on-one. it was more 11 on 11. it was a battle of ohio. did not go well for johnny
170,"of the proponents, and particularly the oil companies suggested, and it all came down to the fact that secretary kerry and president obama feel that the u.s. needs to continue to voice leadership on the climate change issue, and this"
171,"pull this up for you. this is among democrats, mind you, where they rate gun violence, economy and jobs is number one, way out front at 45%. then health care, 9%, foreign policy 9%, climate change 7%, federal deficit 5% and then all"
172,"because of the long-standing commitment that both he and secretary kerry have to the climate change issue, environmentalists have said that this pipeline which will come from canada -- run from canada's oil sands through about six states to the gulf coast was"
173,"about this important summit and the issue of climate change. he's going to make a next -- another speech next week. this week trans-canada, the company that has proposed this project and has spent a lot of money requested that the state"
174,the wind doesn't seem to be a problem. we can blame this on climate change. we're in a wind tunnel right now. bottom line is how do you stop the emission of carbons in a way that is not too painfully
175,"so hopefully while he's talking about climate change in paris, he's talking about how can the nato forces and the u.s. coalition forces and possibly the russians work to defeat and destroy isis. i want to ask you about friday's shooting in colorado"
176,expected to arrive in the next hour. talks over climate change agreement begin tomorrow and run through tuesday. president barack obama expected to meet with leaders from china and india. some observers are also saying there is a chance that mr. obama
177,some coming together saying they're going to invest in a fund to help clean energy companies innovate. they believe innovation is how you're going to solve the climate change conundrum by making clean energy just as cheap oz cheaper than
178,"of two also killed on friday. as he ran to help other officers and civilians in the line of fire. moments ago, president obama arrived in paris for a conference on climate change. you see him as he gets off air"
179,aggressive climate change agenda. trudeau has shown he has the star power of his father. now he has to prove he has the political chops and ride the new wave of trudeau mania into opportunities for canada. that was our elise laughin'
180,"clean alternative renewable different kinds of energy production. the solution to climate change is emergency policy. it's a question of what choices we need to make in order to preserve our ability on this planet to produce food, to have"
181,"consequences of climate change. there is a degree of hope here, but it is somber, too. that is because of the fact this city, only two weeks ago was hit by the terror attack and there is a hope here, i think, that will motivate the assembled"
182,"also asked about the terror threat which he's previously tied at least the major terror threat to the united states to climate change. senator sanders, you said you want to rid the planet of isis. in the previous debate you said the greatest threat to national"
183,"better myself. they are putting forth alarming plans. i mean, all of us support funding planned parenthood. all of us believe climate change is real. all of us want equal pay for equal work. they don't believe in any of that. so let's focus on what this"
184,"i'm wondering which issue do you think will determine the winner ultimately. is it the economy, climate change, or perhaps isis and syria. elaine, let's start with you. i think that people are concerned about what's going on in the middle east, and i think"
185,"in capitol hill without being begged by the media to attack hillary clinton. they want to make it personal. it's easy to cover. i don't want to do that. let's talk about wall street, climate change, education, frankly that is what the american people want to hear"
186,"also asked about the terror threat which he's previously tied at least the major terror threat to the united states to climate change. senator sanders, you said you want to rid the planet of isis. in the previous debate you said the greatest threat to national"
187,"have been tuning into the republican debates, which says a lot. but it's like we're living in two different worlds. republican debates, you talk a lot about the economy, foreign policy, immigration, democrats are talking ant minimum wage, climate change. they don't match up."
188,"people like to gather. there is the climate change summit coming in two weeks. this as we wait to hear whether the suspected ringleader of the paris attacks on friday, whether he was killed. was he inside one of the apartments that was raided"
189,"conference. the world commits the only solution to climate change, to transition our economies to 100% clean energy. when we first started pushing that goal, it was said to be pie in the sky. there was no way. we pushed merkel, the chairman"
190,"justice in countries and take action to reduce vulnerable nations. some say the philippines have been hit by changing weather patterns including deadly typhoons that are worsened by climate change. 150 national leaders will attend the summit, and thousands of security personnel will be"
191,"about it, how will they also tackle the climate change issues? well, they're determined to do it and president obama said before he left for paris he's on his way right now that this would be one way to show isis that the world can come together"
192,"for the people gathering here, they would argue there isn't a more important issue than climate change because thes about the future of the planet. in that context president obama's important meetings over the coming days will be with the leaders of country who that are"
193,"speaking about climate change policy, then it does not matter what comes second. let's discuss now with security concerns further. the terrorism expert we have with us is zaun charles bizarre. i want to start, first, despite what we saw there and wend that"
194,"countries, including france and the u.s. will present their visions for cutting carbon emissions and security is on everyone's mind. we have jim acosta with the coverage at the paris climate change conference. jim, it is good to have you. the u.s. and china seen as"
195,republique. they had messages. many said we're doing this for our children. we have to think about this too. terror is an important subject and one we need to address as well. the climate change is the long-term disaster that will play out over generations.
196,"paris. chris? he has an even tougher bar at home. politically there are a lot of people who are saying they don't believe in climate change the way the scientists do. there's a bigger challenge for the president than most. jim acosta, thank you very much."
197,"change. and also commit to a set of verifiable, transparent steps to make sure we can account for them living up to those commitments. that would make a significant impact on our ability to fight the causes of climate change that are already being felt in"
198,climate change? i think so. the white house is determined to get that business done. president obama is determined to get that business done. he posted a message on facebook just before he left the white house and the u.s. for paris earlier today saying this is
199,"in two weeks, you have all of the world leaders coming here to talk about climate change. i can't imagine a more heightened state of alert. it's a country that knows it has a problem. people going to fight with isis and coming back."
200,"president obama came to paris to honor the victims of the terror attacks here and rally the world to confront the threat posed by climate change but once again appeared to put heads with his long-time global nemesis, vladimir putin. as moscow continues its air"
201,"climate change commission. the kremlin says no plans on-r in the works for such a discussion. we're joined from the russian kpt, a current searcher for the international center of defense and security. at this point, do you think -- the kremlin paris, but do you tk"
202,"130 people have converged on paris for climate change summit. president obama used the summit to sideline talks with president obama about isis and the crisis in syria. before the meeting, president obama warned the world about what he thinks might be an even"
203,"have? where do you stand out? well, on the issues first of all, republicans have to embrace science. we never even talk about the environment, climate change, the fact the earth is getting warmer. and what are we going to do about it, ignore it and pretend"
204,"the things they have to worry about going forward is just in 17 days' time, the climate change conference begins here. and there is something like 80 heads of state that have may come -- maybe some will cancel their plans. but 80 heads of state over here,"
205,"the gain in eastern antarctica. bottom line, there's a lot to learn about how antarctica is reacting to climate change. you can be sure, sea levels will continue to rise as antarctica only made up 8% of the sea level rise that we've observed."
206,changed. there was a huge public participation that is a part of this climate change conference. all of that has been greatly scaled back. the authorities now have to use all of law enforcement to protect the world leaders and the venues. so result they cannot be
207,"named lincoln who flies around here. that's going to go viral. he went on to encourage everyone to protect the environment, mentioning the dangers of climate change. the president says he wants his account to be a place where he can have real conversations with you."
208,"cop-21, huge climate change global summit in december. this city is going to have to do a lot to reduce its freedom and increase its security. you live here, this is your neighborhood, simon. yeah. talking to you as someone who moved to new york in 2001 just"
209,"heavily over this debate tonight. and you imagine that most americans when they think about isis and when they think about threats to the homeland and to their families, they're not necessarily thinking about climate change. but in that instance, i do think he was kind of showing that when"
210,"anything could happen over there. i think it's an explosive situation, and that is the wild card. i think we know how people stand on climate change. we know what the issues are on immigration. i think the wild card is the middle east and anything could happen there."
211,"is make or break time for climate change. later will be too late, say the signs atop the french foreign ministry as the foreign minister himself knows trying to get the nations of the world to agree on anything is a tall order. never perhaps any did where have"
212,"avaz, an advocacy group that encourages global action on climate change. thank you very much for joining us. now two years ago, your organization asked members to contribute to a 30-month campaign to bring the world to a climate deal at this paris summit. what did that campaign involve,"
213,"terrorism and deal with terrorism but, at the same time get together and deal about big important issues. for president obama and 146 other heads of state and many other negotiators and officials coming here, their view there is no issue really bigger than climate change because what we"
214,"reporter: he was telling me that basically he is from the generation that has the most at stake in climate change. i think that was one of the most moving things about the demonstrations i saw yesterday in france, too, all these shoes laid out on the place de la"
215,cnn.com/2degrees. christiane amanpour scored a big interview with bill gates. a big part of the solution to climate change they believe here at the cop21 is public/private partnerships. bill gates has a big announcement with the president this morning. we're getting ready for his address that we'll take live
216,"person who replaces president obama. you'll see a lot more from republicans. you have heard the democrats talking about climate change fight a bit, most notely bernie sanders. i think this is going to rise, especially in a general election as the republican primary is playing out, i think it will"
217,"the end. i'm not sure. a moment of truth. all the leaders meeting this weekend in italia and will meet again for paris for the climate change. a moment of truth. thank you very much for having us. thank you. and john, of course, we're going to be right back."
218,"to have your message get heard. when you have this division based on early national polls, you don't have that equal opportunity to get heard. so i hope to have the chance to debate things like climate change and science with the other 13 candidates. my last question is about,"
219,"paris on monday. both will be in france for a united nations conference on climate change. we know the russian president, vladimir putin, has refused a face-to-face meeting or even a conversation on the phone, but still at least there's a dialogue, so is that a bright"
220,"obama committed to longstanding climate change prevention, and we are just going through the determination right now of secretary kerry, and he says that the pipeline would have a negligible effect on the economy, on the u.s. oil security, and basically not a lot of jobs created, which a lot"
221,"said from time to time, it is going to depend upon whether he believes that the pipeline project which would carry oil from the tar sands of can ta to the gulf of mexico, and would that contribute to climate change, and the president has reached that conclusion through"
