123,"providing equal pay for equal work and responding to the climate crisis, 275 bills are fully bipartisan and 80% of the bills are sitting on the senate majority leader's desk awaiting action. so we'll continue to deliver on the important priorities of the"
124,"coward when it comes to helping our kid who is are afraid of gun violence. i think he is cruel when he doesn't deal with helping our dreamers. i think he's in denial about the climate crisis. however, that's about the"
125,ways. they must choose their words wisely and speak with respect and compassion. here's a crease idea. maybe the president should try to lead by example or have a plan to solve the climate crisis rather than attacking a kid who
126,"and water in the black and brown communities where it's so essential. so if you want to break the corporate strangle hold, beat mr. trump on the economy, and solve our climate crisis, i can deliver. and i'm asking for your vote."
127,"reporter: words the big polluters don't want to hear or are turning away from. despite all the signage declaring otherwise, these climate crisis negotiations feel less like they're about saving the planet and more like a battle between haves and have"
128,"everywhere is going to get touched by climate change. when we were looking he wanted someone super quiet. yeah, and he wanted someone to help out with chores."
129,"countries, military, economic, diplomatic are important. sometimes we're not always in agreement. such as climate change. but on the fight against terrorism and the basic commitments of our soldiers, our"
130,"this melting pot of impacted species. everywhere is going to get touched by climate change. the ups and downs of frequent mood swings can plunge you into deep, depressive lows. (crying)"
131,"self depricating and he believed in climate change. he sold his soul to the devil? i don't know the answer to that. i think that's a fair question, however."
132,"everywhere is going to get touched by climate change. the wait is over. t-mobile is lighting up 5g nationwide. while some 5g signals go only blocks,"
133,climate change accord. but none of those are the reasons we are here today voting today on articles of impeachment. we are only here today voting on these two articles of
134,"well, after months of protests and trekking around the world, 16-year-old climate change activist greta thunberg says she needs a break. you need to take breaks. otherwise, you cannot -- you       _"
135,why? because not passing anything helps them even though we see climate change bearing down on us. not passing anything helps big pharma because they just keep charging prices through the
136,"all the promise of creating real change to combat the climate change. cop 25, a summit of climate negotiators from almost 200 countries was tasked with solidifying the rules of the"
137,"address climate change and make our economy more fair is to change business as usual in washington. we don't see who you're against, through or for,rs,"
138,"get skin healthy™. general is zeroing in on climate change during his new year's message, calling it a clear and present danger to the planet and saying, quote, we cannot afford"
139,"transformed zimbabwe's rivers and farmland into miles upon miles of sand and scorched earth. here they don't speculate about climate change, they're suffering because of it. once proud productive farmers"
140,"our rights by their inaction on the climate crisis. and so on november 20th, our petition was accepted by the united nations committee on the rights of the child. and so those five respondent countries have two months to respond on the admissibility of"
141,"helping the dreamers. i think he's in denial about the climate crisis, however, that's about the election. this is about the election -- take it up -- this is about the constitutional of the united states, and the facts that leads to the president's violation of"
142,"climate crisis. however, that's about the election. this is about the election. take it up. this is about the constitution of the united states and the facts that leads to the president's violation of his oath of office. and as a catholic, i resent your"
143,"climate crisis. however, that's about the election. this is about the -- take it up in the election. this is about the constitution of the united states and the facts that lead to the president's violation of his oath of office. and as a catholic i resent your"
144,to lead by example or have a plan to solve the climate crisis rather than attacking a kid who cares enough to stand up and speak out. and that's your 'reality check.' i remember the vice president speaking out right away when that law professor mentioned
145,"children, displaced women and people suffering at the hands of climate crisis created by rich countries. reporter: she's at the forefront of the climate protests in her native uganda. cleaning plastic filth out of lake victoria. when hilda was just 10 years old, the changing climate dried"
146,"reporter: words the polluters don't want to hear or are turning away from despite all the signage declaring otherwise, these climate crisis negotiations feel less like they're about saving the planet and more like a battle between the haves and have-nots."
147,the victoria falls. one of the natural wonders of the world. but -- and it's a big but -- this entire stretch of rock should be churning with white water. climate scientists say that the climate crisis is hemorrhaging this region. a multi-year drought has
148,"london's vulnerability to what scientists now consider inevitable -- sea level rise caused by climate change. at the moment, we're on track to reach at least a meter. and that's factored in, we"
149,"i'm tom steyer and i approve this message because the only way we get universal healthcare, address climate change and make our economy more fair is to change business as usual in washington."
150,"i'm tom steyer and i approve this message because the only way we get universal healthcare, address climate change and make our economy more fair is to change business as usual in washington."
151,"i'm tom steyer and i approve this message because the only way we get universal healthcare, address climate change and make our economy more fair is to change business as usual in washington."
152,"i'm tom steyer and i approve this message because the only way we get universal healthcare, address climate change and make our economy more fair is to change business as usual in washington."
153,"i'm tom steyer and i approve this message because the only way we get universal healthcare, address climate change and make our economy more fair is to change business as usual in washington."
154,"climate change? he has a date. he said we need stronger toilets! he is like dumber than boris! he is! he is! he is dumber than me! ha ha ha! quick, quick."
155,"galápagos is a really challenging place to work. el niño is starting to go haywire. everywhere is going to get touched by climate change. north korea, state media reporting a very important test"
156,"i'm tom steyer and i approve this message because the only way we get universal healthcare, address climate change and make our economy more fair is to change business as usual in washington."
157,"i'm tom steyer and i approve this message because the only way we get universal healthcare, address climate change and make our economy more fair is to change business as usual in washington."
158,address climate change and make our economy more fair is to change business as usual in washington. wthat's why xfinity hasu made taking your internetself. and tv with you a breeze. really?
159,"i'm tom steyer and i approve this message because the only way we get universal healthcare, address climate change and make our economy more fair is to change business as usual in washington."
160,"the issue, as you should know, what the scientists are telling us is they have underestimated the threat and severity of climate change. you're talking about the paris agreement, that's fine. ain't enough."
161,"climate change threatens every living thing on this planet. but getting congress to act, they just don't want to hear it. and if we don't attack the corruption first, if we don't"
162,"mr. yang, 45 seconds, on the issue of nuclear energy. first, we should obviously be paying to relocate americans away from places that are hit by climate change. we're already doing it."
163,"address climate change and make our economy more fair is to change business as usual in washington. just in, despite the fact it's not clear when a senate impeachment will be the"
164,"really driven by the youth, by those populations whose communities are already feeling the impact of climate change. the security is trying to keep control of this situation. reporter: but they won't give"
165,"i am the voice of displaced women and people suffering at the hands of climate change created by rich countries. most observers, scientists and climate activists, called the resulting agreement a"
166,"i'm tom steyer and i approve this message because the only way we get universal healthcare, address climate change and make our economy more fair is to change business as usual in washington."
167,"i'm tom steyer and i approve this message because the only way we get universal healthcare, address climate change and make our economy more fair is to change business as usual in washington."
168,"i'm tom steyer and i approve this message because the only way we get universal healthcare, address climate change and make our economy more fair is to change business as usual in washington."
169,"i'm tom steyer and i approve this message because the only way we get universal healthcare, address climate change and make our economy more fair is to change business as usual in washington."
170,"for increased action against climate change. he says his government is taking appropriate response to the fires, saying it would be reckless to lower australia's targets for carbon emissions. turkey's president says"
171,"i'm tom steyer and i approve this message because the only way we get universal healthcare, address climate change and make our economy more fair is to change business as usual in washington."
172,"i'm tom steyer and i approve this message because the only way we get universal healthcare, address climate change and make our economy more fair is to change business as usual in washington."
173,"i'm tom steyer and i approve this message because the only way we get universal healthcare, address climate change and make our economy more fair is to change business as usual in washington."
174,"over the course of a few years. as troublesome, according to military brass, trump turning a blind eye to climate change poses a threat to our national security. it changes the very operating"
175,"i'm tom steyer and i approve this message because the only way we get universal healthcare, address climate change and make our economy more fair is to change business as usual in washington."
176,address climate change and make our economy more fair is to change business as usual in washington. good to see you on this saturday. good to be with you. let's start here.
177,political crisis. it was a different kind of crisis that inspired a swedish teenager to stage a weekly protest demanding action on climate change. greta thunberg's message hasn't
178,"and juicy on the inside. the ninja foodi pressure cooker, the pressure cooker that crisps. world leaders are gathering in madrid to tackle climate change at the u.n. conference cop25. for years lawmakers have taken"
179,"change. coming up, a look at the united nations conference going on right now that's looking to do just that. right now world leaders are gathering in madrid to tackle climate change at the u.n."
180,that's to avoid the worst consequences of climate change. scientists say achieving that goal will limit rising sea levels from expanding water and melting ice sheets. but it's already too late to prevent it.
181,"and he believed in climate change. he sold his soul to the can devil? i don't know the answer to that. i think that's a fair question, however. he asked if she had a"
182,"interestingly. health care number one. climate change, way up there. impeachment and economy, very, very close to one another. still to come, how could one commercial drive down the value of a company 1.5 billion"
183,"space agencies accountable for it. back on earth, international negotiations to battle climate change will resume in the coming hours. right now, countries are deadlocked after working well into the overnight hours, past a"
184,"they're letting world leaders know it is time to do something. we're talking about climate change and here are some of their gut westerning stories, coming next. we have a lot of trash on"
185,"because the only way we get universal healthcare, address climate change and make our economy more fair is to change business as usual in washington. if your glasses aren't so will we. no we won't."
186,"medicare for all, raising the minimum wage to a living wage, leading the world in combatting climate change, making public colleges and universities available to all because we have free tuition and canceling all"
187,"workers make less than $2 an hour. what we need is a trade policy that stands up for workers, stands up for farmers. and by the way, the word 'climate change' to the best of"
188,"medicare for all. raising the minimum wage to a living wage. leading the world in combatting climate change. making public colleges and universities available to all because we have free tuition. thank you, senator sanders."
189,"too bad. i'm tom steyer and i approve this message because the only way we get universal healthcare, address climate change and make our economy more fair is to change business as usual in washington."
190,"and i approve this message because the only way we get universal healthcare, address climate change and make our economy more fair is to change business as usual in washington. we've been following a"
191,"and i approve this message because the only way we get universal healthcare, address climate change and make our economy more fair is to change business as usual in washington. billionaires in wine caves"
192,"too bad. i'm tom steyer and i approve this message because the only way we get universal healthcare, address climate change and make our economy more fair is to change business as usual in washington."
193,"because the only way we get universal healthcare, address climate change and make our economy more fair is to change business as usual in washington. the ones that make a truebeen difference in people's lives."
194,"too bad. i'm tom steyer and i approve this message because the only way we get universal healthcare, address climate change and make our economy more fair is to change business as usual in washington."
195,. you can make it up. scientists may have discovered a way to trick animals into repairing the damage caused by the climate crisis. how scientists are using underwater speakers to bring life back to australia's great barrier reef. searching for a way to help stop your cold sore?.
196,"the country and clean up the air and water in the black and brown communities where it's so essential. so if you want to break the corporate strangle hold, beat mr. trump on the economy, and solve our climate crisis, i can deliver. and i'm asking for your vote."
197,"impeachment and also talk about what they want to talk about? evan mcmorris-santoro, cnn, richmond, virginia. and we'll take a short break here. still to come, climate change is causing sea levels to rise, and"
198,global temperature increase below two degrees. that's to avoid the worst consequences of climate change. scientists say achieving that goal will limit rising sea levels from expanding water and melting ice sheets. but it's already too late to
199,"barrier. the thames looking bloated and full gives a powerful sense of london's vulnerability to what scientists now consider inevitable -- sea level rise caused by climate change. at the moment, we're on track to reach at least a meter."
200,"constitutional duty to act. i thought it was important when she pointed out on issues of climate change, gun violence, those are for the election. she pointed to her bracelet. she was wearing a spent shell"
201,"year. look at your screen. it's climate activist greta thunberg. at 16 years old, she is the youngest person ever selected by 'time.' thunberg single handedly sparked a climate change movement after protesting alone outside of"
202,"in how he treats dream.ers, et cetera, or he's in denial about climate change, all of that, that's about the election. that has nothing to do with the facts of the case of the president violating his oath of"
203,"family member watching someone succumb to addiction, solving the opioid problem probably more urgent than this partisan impeachment. if you're a member of the next generation dealing with the challenges of extinction and climate change and budget out of"
204,"this melting pot of impacted species. everywhere is going to get touched by climate change. the wait is over. t-mobile is lighting up 5g nationwide. while some 5g signals go only blocks,"
205,"russia to climate change, he has the impeachment. a lot of moving parts in the hours ahead, so we're going to ask for your patience. we're waiting for president trump, for example, to arrive for tea with the royals."
206,"politics.' i'm john king. thank you for sharing your day with us. it is a contentious controversial day to say the least for president trump. on issues relating to isis to russia to climate change, he has the impeachment."
207,"everywhere is going to get touched by climate change. wat t. rowe price, hundreds of our experts go beyond the numbers to examine investment opportunities firsthand. like a biotech firm that engineers a patient's own cells to fight cancer."
208,"just going to plant trees and we'll be okay. reporter: lessons filmmakers hope will resonate with the audience at the time when every minute counts in the fight against climate change. lynda kincade, cnn. next here, she had no"
209,"calling for immediate action on climate change. portland, oregon, new york, madrid. a lot of protests were lead by students. from extreme weather to rising sea levels, experts have warned about the wide spread effects of"
210,"tunberg, she is scheduled to speak friday before joining a planned march through the spanish capital in the name of climate change. in michigan one 5-year-old boy is getting the ultimate gift this holiday season."
211,"and i approve this message because the only way we get universal healthcare, address climate change and make our economy more fair is to change business as usual in washington. up here at the dewar's distillery,"
212,"me to give back, run for congress, and come here to fight to reduce the costs of health care, protect our communities from gun violence, and act on climate change. i did not come to impeach the"
213,"climate change in the world and she has a right to but set. there's this idea that nice girls just sit and smile and are complaint. that seems to be the message that he's sending. again, baron deserves his"
214,"because the only way we get universal healthcare, address climate change and make our economy more fair is to change business as usual in washington. do seek out an open road.th an italian work of art."
215,"because the only way we get universal healthcare, address climate change and make our economy more fair is to change business as usual in washington. billions of problems. morning breath? garlic breath? stinky breath? there's a therabreath for you."
216,"address climate change and make our economy more fair is to change business as usual in washington. wean air force veteran made of doing what's right,. not what's easy. so when a hailstorm hit, usaa reached out"
217,"thoughts on climate change at the u.n. in september. you have stolen my dreams and my childhood with your empty words. president trump tweeted she seems like a very happy, young girl looking forward to a bright"
218,asperger syndrome. the president communicates in a good way. after greta communicated her thoughts on climate change. you have stolen my dreams and childhood with your empty words. reporter: president trump tweeted she looks like a happy
219,aimed at forging a final declaration. cop 25 was supposed to conclude on friday with the nation members agreeing to ambitious plans which are needed to address climate change. but those talks led to stalemate.
220,"address climate change and make our economy more fair is to change business as usual in washington. yohoo! liz, rob, cough if you nerds are in here. shhhh! shhhh! i took mucinex dm for my phlegmy cough."
221,"buttigieg and yang. what are the top issues for democrats? as we get closer to voting and a big debate thursday night, this is interesting. health care and climate change, runaway leaders. gun policy and immigration down"
222,"on the list. they understand health care, climate change. first and second on the minds of the voters, that's what ends up on the tv ads. from the moment he took office, donald trump has tried to destroy obamacare."
223,"through the mid-west. what do mid-western voters say they care most about harry, thanks for coming in. my pleasure. what do you see '. this is interesting. you' the focus so much on climate change, right, in the"
224,"and the corporations who've bought our democracy hate term limits. too bad. i'm tom steyer and i approve this message because the only way we get universal healthcare, address climate change and make our economy more fair"
225,"and i approve this message because the only way we get universal healthcare, address climate change and make our economy more fair is to change business as usual in washington. divisions in the democratic party were on full display"
226,"climate change. you're talking about the paris agreement, that's fine. ain't enough. we have got to, and i've introduced legislation to do this, declare a national emergency. the united states has got to lead the world."
227,"spending money to kill each other, maybe we pool our resources and fight our common enemy, which is climate change. thank you, senator sanders. [ cheers and applause ] senator warren, a new question to you, senator warren."
228,"[ applause ] because people of color in fact are going to be the people suffering most if we do not deal with climate change. and by the way, we have an obligation up here, if there are"
229,"and i approve this message because the only way we get universal healthcare, address climate change and make our economy more fair is to change business as usual in washington. you may have gingivitis. when you brush,"
230,"russia, india, and the united states. cnn's arwa damon spoke with young activists from some of the world's less powerful countries which are bearing the brunt of climate change because the local and national economies simply cannot cope."
231,to be a nasa scientist. the climate change project should be taken seriously. it's not a joke. it's about future generations and our living on earth. reporter: it's the children whoo the ones having grownup conversations.
232,were no breakthroughs here with the vice president of climate change for the global strategy group conservation international. she was at the summit and joins me live from madrid. thanks for being here. the big holdout to getting
233,"pointing the finger at the united states. we have a president that makes fun of greta thunberg, that denies climate change. in an opinion police by paul krugman in 'the new york times' this week, it was titled 'the"
234,far of the calamitous effects of climate change. i'm already up to like 50 sunscreen and i still get tan. i don't really get that tan. but you know what i'm saying. weather analysts say indeed
235,"and i approve this message because the only way we get universal healthcare, address climate change and make our economy more fair is to change business as usual in washington. and my lack of impulse control,,"
236,"his family to be holidaying in hawaii. he is facing criticism over the climate change position. now, this is something that has been persistent years not just within australia but globally. australia is seen as one of the"
237,"address climate change and make our economy more fair is to change business as usual in washington. our mission is to provide complete, balanced nutrition. for strength and energy! whoo-hoo! great-tasting ensure."
238,"address climate change and make our economy more fair is to change business as usual in washington. the holidays are here and so is t-mobile's newest, most powerful signal. and we want to keep you connected"
239,"about the president scratch their head about this one. there's people that are climate change deniers. but people are in an agreement there's a problem there. and the economic incentives, too. things like that that the president fights against."
240,"information about their lives. whether that's doctors or scientists who are telling them that climate change is a real problem. because president trump does not adhere to facts, he has no apparent regard for science or scientists."
241,"and although definitive lines between climate change and geopolitical impacts are hard to prove conclusively, climatologist michael mann has an even bigger concern. syria is suffering from the worst drought in at least 900 years, and that drought forced"
242,"and i approve this message because the only way we get universal healthcare, address climate change and make our economy more fair is to change business as usual in washington. nyquil severe gives you powerful relief"
