241,"issues ranging from climate change to income unequalty and even the iran nuke dar deal, the white house is using vatican-like secrecy in revealing what these two men will discuss. perhaps that's because, frankly,"
242,"gentle manner belies a man who has come to admonish those for their views on climate change, capitalism and plight of the poor. i think he already started that scolding and i think he's"
243,"ranging from climate change and cuba, even the iran nuclear deal, the white house refuses to reveal what the two men will discuss. this pope can be full of surprises. after their last meeting we"
244,"conservatives within opening seconds. the pope brought up immigration, climate change and income inequity. later it was abortion. let's get the latest on the historic trip from cnn's rosa flores. reporter: john and christine,"
245,families and relationships seemed to speak on issues that might appeal to progressives or liberals. that's a really excellent observation and exactly right. talking about immigration and climate change. there was no question about what
246,"a result of climate change. we saw stunning wildlife that you see inhabiting this corner of the world, including endangered sea lions. as we pause, i asked the president for his impressions of the tour."
247,display. beijing hosts a spectacular parade to mark 70 years since the end of world war ii. president obama talks tough on climate change as he wraps up his trip to alaska. i'm errol barnett.
248,"people coming to this town. we are having transmission problems, but so good to see and hear this from fred. a humanitarian effort in germany. president obama is taking on climate change deniers during a"
249,"people -- thank you. governor christie is right about -- i'm coming to you right now on a separate issue. we received a lot of questions from social media about climate change. senator rubio, ronald reagan's"
250,take out an insurance policy approach climate change the reagan way? we're not going to destroy our economy the way the left wing government -- that we are under now wants to do. citing george schultz.
251,"about my state, thousands of manufacturing jobs. thousands of manufacturing jobs for a rule the obama administration -- the epa has said will have a marginal impact on climate change. so we're going to put thousands"
252,"climate change, the buildup of nuclear arsenals in many countries or the proliferation that is still possible, or financial system is leaving the average american 7% poorer than he or she was seven years ago."
253,"almost certain not everyone will like his message. especially some politically conservative catholics. they think that he is, you know, talking too much about climate change, that he's too critical of capitalism, that he"
254,"nationally built by such families. pope francis pleaded with world leaders to protect the environment, describing the planet as our common home. it seems clear to me also that climate change is a problem"
255,talking about immigration and climate change. there was no question about what he was saying. he was saying you need to open your hearts on immigration. you need to -- he actually talked about people coming
256,"everyone, pray for me. yeah. what will you pray for this pope? i would pray that everything that he's doing and trying to affect climate change and other issues, that his work pays off."
257,"do you believe the sensitive immigration issues, climate change, income inequality, the issues the pope addressed in his speech before congress will have an impact on the political leadership? i don't expect us to"
258,"very well have no intention to. you have that conapplicant. in those issues there, right, issues that democrats as jeff said comfortable with, climate change not so comfortable with and opposition to gay marriage."
259,"years and get rid of you. it'll be interesting on climate change and gay marriage whether over time when he establishes himself, if he moves forward and is perhaps more progressive on both those"
260,renaming mt. mckinley in alaska denali. we will see the effects of climate change first hand. he will tour the melting glaciers. he will do that with tv star bear grylls who will test his
261,afternoon and then takes in a cultural performance at a local middle school before coming back to washington. it was his boat trip he took yesterday that had him sounding the alarm about global warming and a boat trip that brought him face-to-face with a rapidly melting glacier. let's get more now from cnn's chief white house correspondent jim acosta in anchorage.
262,"the united states. he's expected to talk about immigration, the poor, climate change and hopefully the role of women in the catholic church. when pope francis said women in the church were more important than bishops and priests, it"
263,"of making college affordable to paying down the student debt to tackling climate change, and to dealing with subis stance abuse and addiction like i did here in new hampshire today, and i have a comprehensive agenda that, i"
264,"address the public, and we are expecting him to address the key issues of the agenda matters such auz climate change, anti-poverty efforts, criticism of the arms trade, and so on. the issues of immigration"
265,"down student debt to tackling climate change by making us the clean energy super power, dealing with substance abuse and addiction like i did hear in new hampshire today. i have a very comprehensive agenda that i think addresses"
266,point about climate change. welcome to our viewers in the united states and around the world. glad to be with you in second hour of cnn newsroom. i'm zain asher. i'm john vause. cnn newsroom begins right now.
267,this is something last week we were touching on nice conditions and everyone want to tie everything to climate change. if this happens consistently as it has been when you look back in ten years you can say between
268,"issued a warning on climate change verging on apocalyptic. at the same time, he was sharply critical of those who deny human activity is warming the planet. mr. obama was speaking at an international conference in"
269,that he didn't address is the role of oil in alaska and renewables. he talked about the future and needing to act on climate change. but the fact is non-renewable sources are going to play a role
270,trip to talk about climate change. he says melting glaciers are proof that alaska is feeling the effects. the u.s. state department has released another 7000 of hillary clinton's e-mails from the time as america's top
271,"reporter: a professor of ecology joins us now to talk about all of this. stuart, thanks for your time. president obama delivered a detailed and enthusiastic push for action to address climate change but he approved offshore"
272,"the president warning the time to act on climate change is now. so, the good news is we made a lot of progress in the last six years. but i'm here to tell you we have"
273,"when they meet for emergency talks on september 14th. now to another big story we're following for you. the u.s. president issued a strong warning on climate change. president barack obama was speaking in anchorage, alaska on"
274,monday in the start of a three-day visit to highlight climate change which he called the defining threat of the century. mr. obama was critical of those who still deny human activity is warming the planet
275,"what i believe those democrats who want to hear a robust message about the economy, growing income inequality, climate change. it's not that voters disagree with secretary clinton but bernie sanders is a new face in"
276,"much can be attributed to the pope's political views, although he would say he's decidedly not political. but the pope's views on climate change, gay people and undocumented immigrants have angered many americans, have made them feel uncomfortable."
277,"we'll see how political the pope gets. one thing republicans will be watching very closely. it's interesting, father beck, because where does politics and religion end? he's talking about climate change all over the world right now."
278,and he'll be on hand today as well. and there has been some criticism from some republicans thinking there is going too sharp a message on climate change or the environment. but speaker boehner actually had
279,"situation. might mention his recent trip to cuba. might mention climate change. overall, it's about fellowship and keeping the spiritual life, the moral imperatives of the planet alive. he's coming here to spread the message of love and millions,"
280,"josh, pope francis, president obama, very similar views on climate change, income inequality i should say as well. pope helped the u.s. restore diplomatic relations with cuba. does the president consider the pope a political ally?"
281,"meeting of congress about 90 minutes. all are here to hear the pontiff's words and if his comments so far about immigrants and climate change and poverty are any indication, today's speech may make some uneasy."
282,"they would need the jaws of life to extricate me out. if the holy see can fit in there ux you can if. if it's climate change, the disparity between rich and poor, some republicans will say stay"
283,"seems to have an overlap with the president's efforts to address wealth disparity here in the u.s. they also spoke about a duty to protect the planet, to deal with climate change. and listen to those words, chris, obligation,"
284,"republicans, i think most republicans in that chamber, don't agree with. absolutely, climate change, the death penlty, many other issues. very powerful, his words. jeff, dan, gloria, thank you. still ahead, we're talking about all of those in the"
285,"i think many americans recognize that. i did read the encyclical. he puts climate change in moral terms, affecting the most poor and vulnerable, so we can differ on that point. pope francis will make history"
286,"very leery about his political views, some you just mentioned. namely climate change is the reason the arizona congressman paul gosar is not attending. other issues as well, he's been critical of gun manufacturers, he's talked more openly about"
287,"you can see the motorcade. obviously the pope getting a lot of heat from conservative republicans for his position on climate change. some calling him a marxist, a liberal, a lefty. but when you look through the"
288,discussions. how pleased would you say that the president was or how pleased that the white house was that the pope went to climate change on his first visit to the u.s. to the white house?
289,"that would delight and concern liberals and conservatives. the pope brought up immigration and discussed climate change and income equality and religious liberty. later, the pope was talking about abortion. let's get the latest on the"
290,even yesterday he identified himself as a son of an immigrant and so immediately set the stage for the whole situation. not just for climate change but the whole question of immigration. not only in our own country but
291,"against that controversial project. i think it is imperative we look at the keystone pipeline as what i believe it is, a strax from the important work we have to do to combat climate change and unfortunately from my"
292,"climate change, cyber security. so much more. stakes are high, but they are having lobster. it's true. a statement and a bad joke. i'm john berman. i'm christine romans with your bad jokes on 'early start.'"
293,"in the senate. we did it. in terms of climate change, no, chris, i did not hear anybody say, oh, this is a planetary crisis. we have got to do something. really? the federal government should not do something?"
294,"contraception. than they are about climate. change. particularly for republican primary women this year, they talk a lot more like republican primary men than they do other women. partisanship is a greater determinant of your vote."
295,"we're trying to help countries become as energy-independent as possible in a way that maximizes their climate change impact, and we're going to begin in panama where the man sitting right behind you has built the first"
296,"our white house correspondent jim acosta is there. reporter: john and christine, president obama has arrived in alaska to deliver what he believes to be an urgent message on climate change. he is sounding the alarm on"
297,"ever speak to congress directly. while climate change and capitalism are expected talking points, some see his visit as a push toward fully lifting the u.s. trade embargo against cuba. controversial enough, for one congressman to boycott."
298,they have been petitioned to change it for decades anyway. the president is having none of climate change deniers. listen. time to heed the critics and cynics and deniers is past. the time to plead ignorance is
299,president obama's dire warning on the dangers of climate change. and the jokes go viral. kanye west announces his plan to run for president. we want to welcome our viewers in the united states and around the world.
300,california governor jerry brown calls out dr. ben carson on climate change. did dr. carson respond? i'll ask governor brown. he's joining us live. and the countdown continues cnn's republican presidential debate set to begin shortly
301,"denier at real ben carson, climate change is bigger than partisan politics. did you get a response from him? i heard he made some comment, not to me but to the press and continues in his denial."
302,"right into hot button political issues here. immigration, religious freedom and climate change. he's a deft politician. he knows the sensitivities. he will do it carefully. but when you are talking about those topics rur it in the"
303,"on the topic even though the president and pope are allies on things like climate change, incominequality and cuba. after the president greets the pope at the white house the two leaders will speak to the world."
304,"to act on climate change. which of course, if coupled with the economic imperative that we've been hearing more a long time, actually makes this really a non-brainer. is it going to have an impact"
305,"that is for 20 women around the world imprisoned and three of them from china. so, he might not like to see that as he enters. he will focus on climate change. the big meetings with president"
306,"part of this great effort is the creation and distribution of wealth. pope francis also urged lawmakers to take action on key issues he holds dear, like immigration and climate change. cnn's dana bash is in washington"
307,"vote through environmental legislation. when he first came out as a passionate person behind climate change a few months ago, the hope was that it would trickle down to the masses and throughout churches, throughout this world."
308,"do you think that message is being taken out the way he had planned? i'm not quite sure. with the whole climate change issue, because i'm not a scientist, and i'm not going to go against the boss."
309,"and using the message that this is god's earth he gave to us, and despite where you fall on climate change, what's wrong with protecting it? what is your response to that? i would agree that it is our"
310,"of his advocacy of immigration reform, climate change. the perception that he's a maverick shaking up a very deeply traditional institution. and because of all of that, if he lends his personal seal of approval to the freedom clause,"
311,"personable and friendly. it will last about 45 minutes to an hour and will surely touch on climate change, poverty and cuba. of course there are questions, for example, will the pope express irritation over the administration's stances on"
312,it seems to me that climate change is a problem we can no longer be left to our future generations. it was as if they were reading the same speech. we support your call to all
313,"nations at this very moment xi jinping is at the bhous gwhite house getting ready for important meetings with the president of the united states, including on this issue of climate change. a formal arrival ceremony"
314,"i mean, there is a very strong right wing in this -- in this party who have not liked malcolm turnbull because of his social policies in particular which is action on climate change and on gay marriage."
315,"so, i think sanders' appearance today reflects a broader reality than progressive politics are, in fact, broadly popular with a wide majority of americans, including issues like climate change and income inequality and doing something to help the"
316,"the toughest yet, likely urging action on climate change and the ongoing refugee crisis in europe. he makes a difference. he's utterly revitalized the political and diplomatic relevance of the vatican. reporter: he will travel more"
317,"the speech expected to be one of the toughest yet, likely urging action on climate change and the ongoing refugee crisis in europe. he makes a difference. he's utterly revitalized the political and diplomatic relevance of the vatican"
318,"them here, climate change, poverty aleviation, what to do about 60 million refugees, the largest refugee flow in recorded history, at least since world war ii. the question is, can people move from being in awe of this person"
319,"people -- governor christie -- i'm coming to you right now on a separate issue. we received a lot of questions from social media about climate change. senator rubio, ronald reagan's secretary of state john schultz reminds us when reagan was"
320,"glaciers that are melting rapidly in this state. we also saw some of the stunning wildlife that inhabit this majestic corner of the world. mr. obama spoke again on the issue of global warming, urging countries across the globe to change course before it's too late. here is more of what the president had to say. this is one of the most studied glaciers because it's so easley accessible."
321,"for a rule the obama administration -- the epa has said will have a marginal impact on climate change. so we're going to put thousands and thousands of jobs in my state, i think something like 30000 in ohio. other states across this country."
322,"the scientists were right. reagan and his approach worked. secretary schultz asks, why not take out an insurance policy approach climate change the reagan way? we're not going to destroy our economy the way the left wing government -- that we are                 _"
323,"addressing the planetary crisis of climate change. wolf, we have a corrupt campaign finance system as a result of citizens united where billionaires are now able to buy elections. the american people are saying, no, this is not the kind of"
324,i'm sure if he gets into specific issues there will be reactions. we democrats welcome his views on climate change and stewardship. my friend on the other side of the aisle welcome that less. but i think he'll be well
325,"more people feel welcomed in the church. is he going to be speaking of the controversial issues that sort of alienate the republicans in issues such as poverty and the climate change, and the issues that may alienate the democrats' issues for abortion"
326,"also the importance of religious freedom and climate change. they exchanged gifts. we don't yet know what the pope presented to the president, but we know what the president gave him, a metal sculpture of an ascending dove with metal that"
327,"pope francis of course has massive influence. and he's made his views known on subjects ranging from climate change and capitalism to the iran deal and diplomatic relations with cuba. when the pope speaks to congress this week, republican members,"
328,"pope francis has softened his own stance on gay priests. translator: if a person is gay and seeks god and has good will, whom am i to judge him? ? reporter: on climate change the pope says it's a global problem with gave implications."
329,"proposal and that's the people -- governor christie -- i'm coming to you right now on a separate issue. we received a lot of questions from social media about climate change. senator rubio, ronald reagan's secretary of state john schultz reminds us when reagan was"
330,"already told voters i would do and everything from making college affordable to paying down student debt to tackling climate change by making us the clean energy super power, dealing with substance abuse and addiction like i did here in new hampshire today."
331,"it is a real threat to this planet. these guys had nothing to say on that issue. here is the other side, senator. they were saying things, you just didn't like what they were saying. reverse order. climate change, they said yeah"
332,"president, he will change it back. barack obama is the first sitting u.s. president to visit the alaskan arctic, a region where climate change is being felt more intensely than anywhere else in the world because it's warming at almost"
333,drill for oil off the arctic coast. but many argue you can't really be serious about addressing the effects of climate change while allowing offshore drilling to continue. exactly. and i think what that debate is really missing is what you can
334,"the front lines of climate change today, that president obama will visit throughout the next three days should also be at those climate negotiations in paris as a reminder about the immediacy and the need for a solution. victoria herman with the u.s."
335,safe haven. and president obama's message on hope and fear and climate change. welcome to our viewers in the united states and all around the world. thank you so much for joining us. i'm zain asher. and i'm john vause.
336,"three-day visit to highlight climate change, which he called the defining threat of the century. he was sharply critical of anyone who denies that human activity is warming up the planet. he also took responsibility for the role the u.s. plays in"
337,drilling for shell. how can both be possible considering the environmental risks of drilling? i think it's really essential to move forward aggressively in addressing climate change so i approve that. but at the same time there's got to be a transitional mechanism.
338,the fbi is talking about it. 61% do not care about this issue. they care about economics. they call about climate change. we will have to leave it there. we will let the polls speak for themselves tonight. see joe biden in pittsburgh
339,climate change. i've come here today as the leader of the world's largest economy and the second largest emitter to say that the united states recognizes our role in creating this problem. and we embrace our responsibility to help solve it.
340,"avoid irreparable harm. and we hear a lot about climate change and the damage it's causing the environment, but one industry, a warming planet brings some pretty big advantages. the shipping industry sees new opportunities for routes through the arctic that save"
341,"issues, what was the most important in your book? i wanted him to hear about climate change. i know he just wrote the encyclical. i really wanted to hear him talk about the death penalty. i worked to abolish the death"
342,"calling some of his comments lately inappropriate, some saying they don't want to be lectured by a religious leader on climate change. that's why at least one lawmaker is going to boycott his historic speech before both houses of congress on thursday. michaela?"
343,"disagrees with the pope on certain issue, particularly the cultural issues, climate change. he said i am not about to get myself into an arguments with the pope. probably wise. probably wise. the catholic vote very significant in this country."
344,"same-sex marriage. lots of support for immigration. lots of support for protecting the environment, dealing with climate change. lots of support for greater efforts to engage in income inequality to help the poor, to help the needy. he made specific references to"
345,same. it's hard to miss the fact barack obama has been making climate change the number one issue of his second term. here is the pope leading the charge along with him. that is something that the president recognizes there are
346,"jeb bush say about climate change. maybe it will give him some cover on immigration and other things. this is central to the pope's message. we'll hear extensively from the pope thursday. thanks very, very much. programming note, cnn will"
347,"fran sis. and the two agree on re-establishing ties with cuba, and addressing economic inequality and climate change, but they differ on abortion rights and the contra sceptive mandate under the health care law, and so now, let's bring"
348,"the edges a lot of political disagreements going on that had people not being so loving towards one another. but it was a very nice scene. lanny, the pope also took on climate change today. the right is already upset about"
349,"generation. do you agree that climate change say pressing problem? no. i think that clean air is a pressing problem. you want to have clean air, you want to have clean water, that's very important to me. and i've won many environmental awards."
350,"climate change, ill interrogatio immigration as well as what he called traditional values in the families. thousands lined the streets to see the pope as he waved from his popemobile. you can see a special moment right here for a young girl who"
351,"pope is becoming too political, calling his comments lately inappropriate. saying they don't want to be lectured by him on climate change. one republican congressman is even boycotting his historic speech before congress on thursday. chris? all right, michelle, thank"
352,"leaving for that drive to capitol hill. a moving moment but also a political moment. pope francis yesterday talking about immigration reform. talking about climate change. talking about helping those who are stuck, who are mired in poverty. and also talking about religious"
