222,"at least to some measure, at least seen getting on board with. the kind of talks going on in russia today between hollande and putin, they may be on the sidelines of what happens here next week, when the climate change talks start. i think a lot of people worried"
223,"does that look familiar to you? i'm no longer the butler, i am just one of the guys. this just in, president obama landing in paris just a few moments ago for this climate change summit. but first, you see he has stopped at a memorial outside of"
224,all of us support funding planned parenthood. all of us believe climate change is real. all of us want equal pay for equal work. they don't believe in any of that. [ male announcer ] pain not sitting too well? burning to feel better? itching for relief? preparation h offers the most maximum strength solutions
225,"now, it was, of course, high security there in kampala for the pope's visit. security will be especially important in paris for the upcoming climate change conference which gets underway soon. it comes, of course, after those horrific terror attacks in paris. we will tell you what the country is doing to keep"
226,"people of france, acknowledging the courage and defiance that paris is showing in holding the huge conference just two weeks after the terrorist attacks there took place. they are all as one declaring the need to do more to deal with climate change as a problem, not just now, but into the future,"
227,now. we have the story from washington. reporter: president obama rejected the keystone pipeline saying the canadian project would have sent the wrong message to the world on the issue of climate change. the president accepted the recommendation of secretary of state john kerry whose department analyzed the project for nearly seven years.
228,"leaders, who are due to come here in just two weeks from now, for the opening of what's being billed as these last-ditch climate talks. i think those discussions about climate change will increase in scope to talk about other things as well. we're following the breaking news here in paris, the connected terrorist attacks, six"
229,as soon as he landed in france the president laid a single white rose outside the bataclan theater to remember the victims of the paris attacks. but the president made the case here that bringing the world together to battle climate change is yet another way to take the fight to isis. here's wlat president had to
230,to be significant enough for the white house to avert rising sea levels and other effects of climate change. the president feels this is perhaps the most important thing he will accomplish in the remaining months in office. we will have to see if he gets the deal he is hoping to reach here in paris. it is interesting that the
231,"corridors in capitol hill without being really begged by the media to attack hillary clinton. they want to make this personal. it's easy to cover. i choose not to do that. let's talk about the economy. let's talk about wall street. let's talk about climate change. let's talk about education. frankly, that is what the american people want to hear"
