118,"you don't know what's going to happen 500 years from now. even if power goes out, the vault can preserve these seeds for decades. in the race against climate change, protecting our past may be the only way to ensure our future."
119,the effects of climate change but we can begin to build our economy in a totally different way. you here in nevada are doing just that. you've got that big battery factory going in. you have been investing in more
120,"deal with climate change, how to -- i hear you laughing. we have strong disagreements with donald trump and ben carson. that's what democrats are going to talk about. we're not going to begin this round of in-fighting."
121,"same-sex marriage. i'm unbought and i am unbossed. then there's jim webb, a marine veteran, former secretary of the navy, former u.s. senator from virginia, author, teacher, husband and father of six. on the issues, climate change. webb wants to limit the"
122,"my name is satya, and i am from chicago, illinois. my question is climate change associated with the natural disasters we have been currently experiencing? all right. this is about the second most popular question that i receive as a cnn meteorologist behind"
123,"warming. we have to hold it to that and total runaway climate change if it increases more than that. well, derek van dam is among our team of meteorologists taking your climate questions. and here he is now. derek? that's right, natalie."
124,"climate change and reception for the uso. house republicans hoping to identify the next speaker of the house this week. paul ryan is the top choice of many, but still not said he is actually interested. growing number of house"
125,and also come together to strip subsidies from the big oil companies they are highly profitable and we shouldn't be subsidizing them particularly with climate change on our back. so common core in values. and the other is the way he's
126,and the potential of our kids to make college a debt-free option for all families instead of saddling our kids with lifetime crushing debt. we must square our shoulders to the great challenge of climate change and make this threat our opportunity.
127,"by making it possible once again to invest in science and research and taking the opportunity posed by climate change to grow our economy. at the center of my campaign is how we're going to raise wages. yes, of course raise the minimum"
128,"that's why we have to stay vigilant. also united around the world to prevent that. senator sanders. the scientific community is telling us, if we do not address the climate change, transform our energy system away from fossil fuel, the planet we'll be"
129,brain power and the attention of the imf. they also said the world's rich countries would probably be able to reach a goal of providing $100 billion to help poor countries to combat climate change. ten days after a massive
130,"forward specific plans about how we're going to create more good paying jobs by investing in infrastructure and clean energy, by making it possible once again to invest in science and research and taking the opportunity posed by climate change to grow our economy."
131,"are learning, you're going to change your position. i never took a position on keystone until i took a position on keystone but i have been on the forefront of dealing with climate change starting in 2009 when president obama and i crashed a meeting with the"
132,"2 degrees celsius is arguably the most crucial number of our time, especially when it comes to climate change. expert says if average global temperatures rise above it, we're at risk for serious global issues that. is what they say. and just in one month thousands"
133,"crashed a meeting with the chinese and got them to sign up to the first international agreement to combat climate change that they'd ever joined. so i'm not taking a back seat to anybody on my values, my principles and the results that i get."
134,the political and cultural context in many countries around the world. it did not mean for the churches in north america and europe that it was not an important theme for them. the bishops are expected to address the issue of climate change today in a statement.
135,"plus had less major bleeding. both made switching to eliquis right for me. ask your doctor if it's right for you. two degrees celsius is arguably the most critical number when it comes to climate change. expert says that if average global temperatures, if they"
136,"interviews for a run. he showed up late for the climate change event. i'm the late joe biden. as much as i love you, i have been in a meeting with the president for the last two hours. it is hard to say mr. president,"
137,"it's certainly the chaos in the middle east. there's no doubt about it. governor o'malley? i believe nuclear iran remains the greatest threat, climate change of course makes cascading threats even worse. secretary clinton? i think it has to be continued threat from the spread"
138,we knew we had to get them to agree to something because there will be no effective efforts against climate change unless china and india join with the rest of the world. they told us they'd left for the airport. we found out they were having a
139,barack obama on monday and his visit comes amid a range of geopolitical tensions in southeast asia. climate change and trade are expected to be discussed as well. he will travel to the west coast of the u.s. to meet with executives with companies like
140,"i want to put it aside. i'm sorry about it. let's move on to discuss the issues because i think it's important that she has some new policy proposals on climate change, on the economy, on trade. you know, in a way she's changed"
141,i'm not taking a back seat to anybody. climate change is real. i have been as transparent as i know to be. enough of the e-mails. let's talk about the real issues. i think we need someone that has the best and ethical
142,for all families instead of saddling our kids with lifetime crushing debt. we must square our shoulders to the great challenge of climate change and make this threat our opportunity. the future is what we make of it. we are all in this together.
143,"the climate change, transform our energy system away from fossil fuel, the planet we'll be leaving our kids and our grandchildren may well not be habitable. senator webb. our relation with china. our greatest day-to-day threat"
144,"successful community. secondly, climate change. i'm scared about what's happening to our climate. and then third, peace in the world. you have to believe it's possible in the middle east and north africa. put down the gun. s and the bombs and let's find"
145,"will it rain on my wedding day or will it rain on my son's birthday party. but to directly link climate change to an extreme weather event is purely irresponsible. lots of data, lots of research has to be done to find that correlation."
146,"wedding day and my kid's birthday party. to actually correlate an extreme weather event to climate change is hugely irresponsible. there has got to be tons of study. lots of conclusions made before we can draw those two things together. besides, extreme weather events"
147,"house climate change event. i'm the late joe biden and i just want you to know as much as i love you, i have been in a meeting with the president on another matter for last two hours. it is hard to say, mr."
148,"interviews for campaign jobs. he arrived late for a white house climate change event. i'm the late joe biden. i just want you to know as much as i love you, i have been in a meeting with the president on another matter for the last two"
149,"think that joe biden was talking to the democrats who in 2014 ran away from the administration and 67 consecutive months of consecutive job growth, and all of the things that the president is doing on climate change and criminal justice reform, and the"
150,"well while trump was targeting rivals last night, protesters targeted him. we've seen demonstrations outside of his events since the moment he launched his campaign. last week there was an event in iowa where a climate change protester briefly interrupted his speech. but this latest protest went"
151,"on climate change, webb wants to limit the environmental protection agency's power to regulate emissions and supports the keystone pipeline and energy expansion. immigration reform, he wants to see a path to citizenship, but says the border must be secured first. on prison reform, webb wants"
152,"direction the country should go but how fast and far and how to achieve the goals, climate change being a perfect -- so you don't think she's vulnerable on the changes just in the last weeks or months. i think everyone needs to explain their positions whether"
153,"from anna from tempe arizona. as a young person i'm very concerned about climate change and how it will fact my future. please tell anna how you would protect the environment better than the other candidates on the stage. anna, i have put together a"
154,"and really, we are not going to solve climate change simply with the laws here. we've done a good job in this country since 1970. if you look at china and india, they're the greatest polluters in the world. 15 out of the 20 most polluted"
155,"making sure that people know where his money is coming from, making sure we know who he's accountable to. reporter: his supporters call him bernie. they like his stance on climate change, support of free public university education and fighting to close the gap"
156,"unboss. reporter: then there's jim webb, a highly decorated marine veteran. former secretary of the navy. former u.s. senator from virginia, author, teacher, husband, and father of six. on the issues, climate change. webb wants to limit the environmental protection agency's power to regulate"
157,"you know, we know that if you are learning, you're going to change your position. i never took a position on keystone until i took a position on keystone but i have been on the forefront of dealing with climate change starting in 2009 when president obama and i"
158,"climate change? when i was in the senate, i was an all of the above energy voter. we introduced legislation to bring in alternate energy as well as nuclear power. i'm a strong proponent of nuclear power. it is safe, it is clean. and really, we are not going to"
159,"solve climate change simply with the laws here. we've done a good job in this country since 1970. if you look at china and india, they're the greatest polluters in the world. 15 out of the 20 most polluted cities in the world are in one of those two countries."
160,"climate legislation which called for a tax on carbon. nothing is going to happen unless we are prepared to deal with campaign finance reform because the fossil fuel industry is funding the republican party, which denies the reality of climate change and certainly is not prepared to go forward"
161,"and i think jake gave plenty of time to respond. what ben carson complained about today was not giving the opportunity to people like chris christie if you get asked about climate change, step back. that takes three or four minutes to explain. he wants more time octo play"
162,"but really, the fingerprints of climate change are seen across the planet, from south carolina all the way to hokkaido in northern japan. we had a recent typhoon across that region that dumped record-setting rainfall across this part of the world. and i'm going to end off with"
163,"and the views on gun control in rural states are different than in urban states whether we like it or not. reporter: sanders was more comfortable talking about climate change. the future of the planet is at stake. reporter: and the economy, railing against casino capitalism while in a las vegas"
164,"correspondent jim acosta is also here to talk about that subject itself. vice president biden is at a climate change and not at this point said anything about his decision to run for 2016. any idea if he's going to jump into the race or not? a better idea, no."
165,c target is what we should shoot for and aim for. we're very open right now that the path and trajectory that is not on that path which is why we have this renewed sense of urgency. and i'm fully convinced but for the climate change if we are
166,"thank you so much. so interesting as to watch the post-game wrap-up. we have a lot more on cnn's democratic debate coverage, so let's get right to it. i'm not taking a back seat to anybody. climate change is real. i have been as transparent as"
167,"again climate change unless china and india join with the rest of the world. they told us they'd left for the airport. we found out they were having a secret meeting. we marched up, broke in and said we've been looking all over for you, let's sit down and come up"
168,"campaign finance system that only makes it worse. he's going to continue to talk about the consistency of his views as compared to hillary clinton of course. we'll talk about climate change. and if she says to him, you know, your proposals sound great, bernie, but they're not really realistic."
169,and that he says is because the temperature of the water where these cod were just pulled out is 4 to 5 degrees warmer than it used to be. and now the cod can swim here. how do you know that temperature rises because of climate change? we know that temperatures in
170,"to address climate change? when i was in the senate, i was an all of the above energy voter. we introduced legislation to bring in alternate energy as well as nuclear power. i'm a strong proponent of nuclear power. it is safe, it is clean. and really, we are not going to"
171,"a companion study claims temperatures could reach up to 60 degrees celsius. our meteorologist joins us with more on this story. these are pretty scary claims. they are, absolutely are. and you know we've seen so many stutd dis that show when it comes to climate change, just how it relates to glacial melts,"
172,"virginia, is whether trump will come out on stage tonight and slam bernie sanders. whether he'll talk about whether sanders said one of the number one risks right now is climate change. those are some of the things we're going to be looking out for tonight, jake. sara murray in richmond, virginia with the trump"
173,"30 seconds for governor chafee. what is the greatest national security threat to the united states? it's certainly the chaos in the middle east. no doubt about it. it all started with the iraq invasion. governor o'malley? i believe nuclear iran along with the spread of isil, climate change makes cascading threats"
174,"address the high cost of college education, how we're going too deal with climate change. that is what people want to hear from the candidates on the stage and not petty personal attacks like we saw in the republican debate. let's look at the latest polls. this is the nbc maris poll and"
175,"solve climate change simply with the laws here. we've done a good job in this country since 1970. if you look at china and india, they're the greatest polluters in the world. 15 out of the 20 most polluted cities in the world are in one of those two countries. we need to solve this in a"
176,"for allowing people to have the ability to feed their families. and that's why we're focusing on that and that's why we're here today on world food day to really support agriculture. well, we know that you're making tremendous gains. well want the thank you both. you'll have climate change to deal with as you move towards"
