118,we call the internet of everything. trees will talk to networks will talk to scientists about climate change. cars will talk to road sensors will talk to stoplights about traffic efficiency. the ambulance will talk to patient records
119,it's lots of things. all waking up. becoming part of the global phenomenon we call the internet of everything. trees will talk to networks will talk to scientists about climate change. cars will talk to road sensors
120,trees will talk to networks will talk to scientists about climate change. cars will talk to road sensors will talk to stoplights about traffic efficiency. the ambulance will talk to patient records will talk to doctors about saving lives.
121,we call the internet of everything. trees will talk to networks will talk to scientists about climate change. cars will talk to road sensors will talk to stoplights about traffic efficiency. the ambulance will talk to patient records
122,activist. the climate change activists in d.c. concentrated on the keystone pipeline. why concentrate on that? couldn't they pick something else? because it's a cute visual and it makes sense and you can have people dressed up as bald
123,becoming part of the global phenomenon we call the internet of everything. trees will talk to networks will talk to scientists about climate change. cars will talk to road sensors will talk to stoplights about traffic efficiency.
124,"what's going on? is this because of climate change? i don't know. what? it's because of overpopulation of models and overthinking it. now, we have so many models, look at this one, look at this one. before, we had two."
125,"knew what the weather will be and now, it could be big, little. is this because of climate change? what? it's because of overpopulation of model ts and overthinking it. now, we have so many models, look at this one, look at this"
126,"union. to that end, president obama will frame much of the agenda under the umbrella of economic growth as he talks about tax reform and government spending and education, climate change and immigration. while the wind is at his back,"
127,"pollution, prepare our communities for the consequences of climate change and speed the transition to more sustainable sources of energy. and four years ago other countries dominated the clean energy market and the jobs that came with it. we've begun to change that."
128,"change, because this man gets giddy. i want to give you the climate change, because it matters, and there is no question. however, what fomented the most debate before we left was the fundamental proposition to deal with imminently, and it is"
129,"going back and forth hard, but democrats an republicans are actually mirror images when it comes to the climate change, and the democrats say we have a moral obligation to act, and if we keep doing this, we will have"
130,infrastructure to addressing the let threat of climate change. he urged congress to put partisan differences aside on the issue of immigration and to stay focused on a plan to jump-start the nation's lethargic economy. the american people have
131,"great, thank you. actress daryl hannah was among 48 people arrested after they handcuffed themselves to the white house gates today, protesting the keystone oil pipeline. that comes one day after president obama made climate change a priority issue during"
132,climate change. we can choose to believe that superstorm sandy and the worst severe drought in decades and wildfires that some states have ever seen were all just a freak coincidence or we can all choose to believe in the overwhelming
133,"actress daryl hannah was among 48 people arrested after they handcuffed themselves to the white house gates today, protesting the keystone oil pipeline. that comes one day after president obama made climate change a priority issue during his state of the union address."
134,"make meaningful progress on this issue while driving strong economic growth. i urge this congress to get together, pursue a bipartisan market-based solution to climate change like the one john mccain and joe lieberman worked together on a few years ago, but"
135,"spending and his proposals on education, climate change and immigration. but while the wind is at his back, observers say president obama can't appear too bull-headed at the start of his second term. carol, also some news on what"
136,"beneful healthy weight. find us on facebook to help put more play in your day. a huge rally at the national mall in washington today as thousands, well they pleaded for more action on climate change. chris lawrence talked to those"
137,horrific. it is now the time to address climate change. no! it was 20 years ago carol. we have to do something about this. we have to do it now. it's the biggest issue for me personally. i just bought a chevy volt.
138,"a huge rally at the national mall in washington today as thousands, well they pleaded for more action on climate change. chris lawrence talked to those who braved the freezing temperatures hoping it all will lead to changes in the u.s. energy policy."
139,"they are being called superstorms. fueled by changing climate, higher temperatures, and rising sea levels. climate change is real. it's here. it's going to happen again. people and cities once safe. now in the eye of the fury. i see the weather changing."
140,"proposals on education, climate change and immigration. but while the wind is at his back, observers say president obama can't appear too bull headed at the start of the second term. this really is a rare chance for president obama to talk directly"
141,"actress daryl hannah was among 48 people arrested after they handcuffed themselves to the white house gates today, protesting the keystone oil pipeline. that comes one day after president obama made climate change a priority issue during his state of the union address."
142,all waking up. becoming part of the global phenomenon we call the internet of everything. trees will talk to networks will talk to scientists about climate change. cars will talk to road sensors will talk to stoplights about traffic efficiency.
143,climate change is real. it's here. it's going to happen again. people and cities once safe. now in the eye of the fury. i see the weather changing. absolutely. is this the era of the superstorm? water level is rising substantially.
144,"future of these superstorms, rising sea levels, also fueled by climate change. we have satellites in space that are measuring sea level to millimeter accuracy now. since 1992, sea level has gone up 2 1/4 inches since then."
145,"i'm trained as an astronaut. i'm not satisfied until we're back home and the mission is a success. a crucial mission as climate change threatens to intensify the storms ahead. next, what the polar icecap is telling us about how damaging"
146,"earth. we as a species have the capability to at least be prepared. there are a lot of things we don't prepare for, including climate change, but i like to think we're prepared enough to realize that a large object like"
147,"14-year-old cassandra lynn wanted to help the environment and keep the people in her community warm this winter. she and some friends found a great way to do both. when i was young, i heard about global warming and i knew there was huge consequences for this huge problem. i got together with my friends, and we found out that you could"
148,the president will say when it comes to climate change or perhaps i should say what he will not say tonight. lot of environmentalists were hoping he would say he's going to pursue new regulations on existing power plants because they are big producers of carbon
149,last night. you know what they were divided on? gun control and climate change. the areas which they are divided in on every poll we see. even though there is a lot of emotion behind the issues and science. you know where they are together?
150,"sleep number. comfort.individualized. a huge rally at the national mall in washington today as thousands, well they pleaded for more action on climate change. chris lawrence talked to those who braved the freezing temperatures hoping it will all lead to changes in the u.s. energy policy."
151,"cause run away climate change. reporter: on the flipside, folks say tighter emission standards have already cost some jobs at coal plants in places like west virginia and tightening them further is only going to squeeze that part of the economy even more, and sol"
152,"a huge rally at the national mall in washington today as thousands pleaded for more action on climate change. among the demands, the protesters want president obama to reject the keystone xl pipeline and to get the environmental protection agency to set carbon standards for"
153,"country in half carrying a very dangerous fuel, and it will cause runaway climate change. alison kosik at the new york stock exchange -- you're in new york, not at the stock exchange. i recognize the difference in the background. good for you. let's talk about gas prices."
154,"president to take action on climate change. for his part, obama did urging of his own, telling congress to move on the issue during the state of the union. we can choose to believe that super storm sandy and the most severe drought in decades and"
155,"looming and high unemployment, our question, is now the time for climate change legislation? l.z.? yes and no. i think we're going to have a difficult time using that exact language, but i think we can pass things like an admissions tax to talk about using that"
156,"face today. weather is also on the mind of climate change activists in washington today, and they are taking their message to the front gates of the white house. here's emmy schmidt with most. temperatures are in the 30s this weekend in washington, d.c."
157,"statement released by his management company just a short time ago. and back to our big story this hour, history being made in washington. thousands marching for more action on climate change. organizers claim it is the biggest rally of its kind ever in the u.s."
158,runaway climate change. reporter: yet again we talked to a lot of folks who are younger voters who say they back president obama in the last two elections and is that cause that is near and dear to their heart around they do expect some sort
159,"gay marriage and contraception. what if, instead, our faith were known for the teachings relating to the common good, issues like climate change and the need to reorient the world economy to better meet the needs of the world's poor? so, it's much more of a"
160,restricted air space. they have been forced to leave the area. the huge rally at the national mall in washington today as thousands pleaded for more action on climate change. chris lawrence is in the middle of it. all of the demands people are
161,science in school. if it passes the bill would require teachers to address theories like evolution and climate change and lesson plans. the bill also paves the way for students to challenge what are called universally accepted scientific theories. legal analyst sunny hostin is on
162,"there's been so much speculation about climate change, which is why we're seeing all these extreme weather patterns emerge. you're not ready to draw that conclusion yet? not with respect to individual storms. there is evidence to suggest that as you, well, if the"
163,"bones. i'm told he will also talk about gay rights, women's rights and climate change. the big difference from the inaugural is the president views tomorrow night as his big opportunity to speak to the american people about the stakes in those across the board budget"
164,ems and fire were coming out with the boy at this point. around this point i got a good look at his face. eyes were rolled back in his head. i've seen that look before. climate change is real. it's here. it's going to happen again.
165,"the movie trailer, the state of the union is the full-length feature on immigration and jobs and guns, climate change to talk about what he hopes to accomplish. i think clark is right, that he does need to reach out. but to be honest, he's made"
166,"adding to the destructive future of these superstorms, rising sea levels, also fueled by climate change. we have satellites in space that are measuring sea level to millimeter accuracy now. since 1992, sea level has gone up 2 1/4 inches since then."
167,"don't prepare for, including climate change, but i like to think we're prepared enough to realize that a large object like that is severe enough, if you don't move it, there's no getting out of the way. it's a disaster large enough to produce global fires."
168,"capability to at least be prepared. there are a lot of things we don't prepare for, including climate change, but i like to think we're prepared enough to realize that a large object like that is severe enough, if you don't move it, there's no"
169,"we appreciate it. let's get took this hour's big story, the historic rally in washington. thousands marching for more action to protest against climate change. organizers claim it is the biggest rally of its kind ever in the u.s. our chris lawrence spent date"
170,"the reason we can't get substantive climate change is because we can't convince the car industry that it makes sense financially. obama can do a lot. he should do something that provides jobs and cleans the air, not just talk policy. that sounds so simple, anna."
171,and hurricane katrina and everything 10 or 15 months because we can't fix a problem that scientists believe on. solutions are there. what are our facebook friends saying about the queson? is now the time for climate change legislation? now is the time to talk about
172,people are marching. their demands? they want more action on climate change. among their calls is for president obama to kill the big keystone xl pipeline. we have a reporter been in the crowds all afternoon. we will take you there in a few
173,"here. these are the top stories that we're following right now in the 'cnn newsroom.' at this hour thousands of people marching in washington. they want more action on climate change. among the demands, they're looking for president obama to kill the keystone xl pipeline."
174,"it used to be to me we always knew what the weather will be and now, it could be big, little. is this because of climate change? what? it's because of overpopulation of model ts and overthinking it. now, we have so many models, look at this one, look at this"
175,"of the union' address. jobs and the economy will probably be issue number one, but the president is also expected to make his case for immigration reform as well as climate change and, of course, gun control. cnn's live coverage of the address begins at 7:00 p.m. eastern time."
176,"ever for the fourth state of the union address. a lot on agenda immigration reform. climate change, and gun control. if you want an example of how divided the country is now, look who will be in the audience, a survivor of the sandy hook elementary massacre and other"
177,"change, was that enough for you? no, no. i mean, look, i'm a huge supporter of obama's. it's the first president i ever donated money to. but i think in terms of climate change and the environment, he's been at best disappointing. i thought it was decent rhetoric"
178,"probably made its decision on keystone. the political calculus is obvious. if they come out against, it they are going to pay a very big price. president obama talked about climate change in his state of the union address last week, but he did not specifically mention the keystone xl pipeline."
179,"keystone pipeline. reporter: you know, you have got to go state by state, legislator boo by legislator. if you look at some of the states out west that president obama carried in the last couple of elections, oregon, california, states like that, climate change is a very big,"
180,"keystone xl is a dirty and dangerous pipeline to literally cut the country in half carrying a dangerous fuel, and it will cause run away climate change. reporter: on the flipside, a lot of folks say tighter emission standards have already cost some jobs at coal plants in"
181,"republicans in the response to the state of the union is a party that's divided. i think in the past election, we saw that the republican party is on the wrong side of history when it comes to climate change, guns, gay marriage, jobs, all these issues the president laid"
182,"otherwise would have been. adding to the destructive future of these superstorms, rising sea levels, also fueled by climate change. we have satellites in space that are measuring sea level to millimeter accuracy now. since 1992, sea level has gone up 2 1/4 inches since then."
183,"climate change, there was no snow last year. here we are. it brought to memory some of the big snow storms of 19-plus inches in new york, where there would be people cross country skiing down park avenue, in the middle of new york city, some fun and amazing images. right."
184,"just listening out, listening to the news what's up, follow twitter and see what is going on. because for me, i'm still in slightly shock for what happened. history being made in washington. thousands marching for more action on climate change. organizers claim it is the biggest rally of its kind ever"
185,"and always a camera obviously on the white house, but there's going to be even more possibly today because environmental activists from across the country are planning a rally there in washington to bring attention to climate change starting at mall we believe and ending at the white house. some got an early start."
186,"donated money to. but i think in terms of climate change and the environment, he's been at best disappointing. i thought it was decent rhetoric and i don't know if there's any teeth to this but, you know, look, it's complicated. he can't -- i think politicians feel like it's political suicide to be talking about the environment."
187,as environmental activists are coming here hoping to heat up political talk about climate change. they are planning a gathering on the national mall with a march to the white house. it will be the second high-profile event organized in a week by groups including the sierra club and 350.org.
188,"storm a little bit and makes it just a little bit worse than it otherwise would have been. adding to the destructive future of these superstorms, rising sea levels, also fueled by climate change. we have satellites in space that are measuring sea level to millimeter accuracy now. since 1992, sea level has gone up 2 1/4 inches since then."
189,"really quite livid, very surprised and he marched forward with an agenda that was quite liberal with gun control, with gay rights, with talking a whole bunch about climate change. these are very near and dear issues to democrats not republicans. they don't want to work with him on it. they think that we'll know tonight if he's going to stick"
