0,"thank you, ben. a cold day to talk about global warming. thousands descended on the national mall to demand action on climate change."
1,"natural gas without drilling. kind of a miracle, right? they're making fuel from pond scum. giving the challenges ahead of us with global warming, this"
2,"like that. china and india continue to add a power plant, essentially, every week. so, do you look at that and say climate change is going to happen, no matter what at this point? well, some climate change is"
3,"but for the sake of our children and our future, we must do more to combat climate change."
4,sorry. yeah. many weather experts believe sandy is a grim preview of a future with more powerful and more damaging storms fueled by climate change.
5,freak coincidence. or we can choose to believe in the overwhelming judgment of science and act before it's too late. the climate change activist
6,"country, we haven't had a major snowfall event now in two years, so once the pattern gets set up, you can get these repetitive storms, and this is exactly what's happened in the midwest. and you can't relate these individual storms to the global warming aspect."
7,"has been the thorniest problem he faces? yeah. of course, i do believe that he should move boldly on the agenda that he articulated in his inaugural address. i was very pleased that he put the climate crisis front and"
8,it's lots of things. all waking up. becoming part of the global phenomenon we call the internet of everything. trees will talk to networks will talk to scientists about climate change.
9,like environmentally safe and natural. a dirty and dangerous pipeline that's going to cut our country in half carrying a very da dangerous fuel and it will cause run away climate change.
10,"it, why can't we? bowman warned of the need for storm barriers years ago warning in the 'new york times' after katrina in 2005 and tried again in 2008 on a climate change"
11,"diesel. they call it e-gas, and according to brian, it's the fuel of the future. the company has figured out a way to make its own brand of natural gas without drilling. kind of a miracle, right? they're making fuel from pond scum. giving the challenges ahead of us with global warming, this"
12,"money to help repair roads. so we're addressing the climate issue without using that language that seems to make people bristle for some reason. will? no. look, here's the deal. climate change regulation is"
13,"you know, i was just wondering, since you've brought this issue up, we haven't really been able to do much in the united states, the european union has done something in terms of the kind of things you want to see, cap and trade or perhaps a carbon tax or things"
14,"second term, president obama unveiled a slate of new proposals, aimed at improving the lives of the middle class, taking on everything from universal preschool education to repairing the nation's aging infrastructure, to addressing the threat of climate change."
15,"thank you, ben. a cold day to talk about global warming. thousands descended on the national mall to demand action on climate change. three, two, one."
16,"phenomenon. yeah. you know, i was just wondering, since you've brought this issue up, we haven't really been able to do much in the united states, the european union has done something in terms of the kind of things you want to see, cap and trade or perhaps a carbon tax or things"
17,"no, i wasn't there but the organization that i'm involved with, rain forest action network, their people were there. and -- so when you heard the president speak last night about climate change and that we must do something about climate"
18,"have a play here. this is the president's agenda, what he wants to go. you will hear echoes of the inaugural speech, because you will see things like immigration, climate change, maybe a little meat on those bones, like what about climate"
19,"was from the early 1900s, a watercolor that's been in our family. tough, tough. it's painful. sorry. yeah. many weather experts believe sandy is a grim preview of a future with more powerful and more damaging storms fueled by climate change."
20,"in, in the state of the union. reporter: to that end, president obama will frame much of his agenda under the umbrella of economic growth as he talks about tax reform and government spending and his proposals on education, climate change and immigration."
21,1-800-222-tips. more on this story and others after the break. it's lots of things. all waking up. becoming part of the global phenomenon we call the internet of everything. trees will talk to networks will talk to scientists about climate change.
22,"hoover, were you laughing at me flubbing on the prompter or something else? well, just doing a little dance with the climate change -- and you to love van jones, because he has a great name and good moves. and we are all just happy that he mentioned climate"
23,"of global warming climate change. we have to do something. we have to do it soon. we are on the edge. next story is about carbon dioxide, not able to go into the warmer ocean water. it's true. one of the issues that we look at is that while this type of"
24,"to establish tighter standards on current power plant. in other words, they don't want these current power plants to produce as much greenhouse gases. not just future power plants that are going to be built, but the ones already built right now. and they want president obama to"
25,"change legislation? in washington climate change activists billed it ads the largest climate change rally in history. they were also chanting hey,"
26,"hurry. $14.95 won't last. welcome to our new half hour talk show. three hot topics, great guests on tap today. president obama's tea time with tiger. the fight over climate"
27,to help protect your eye health. now that's a pill worth taking. [ male announcer ] ocuvite. help protect your eye health. onto our section talk back question. is now the time for climate
28,believe that global climate change is real. this president rather than passing global climate change should try to change the economy in the country. we've never had unemployment under 7%. why are we going to pass more crippling regulations to hurt
29,climate change. we will respond to the threat of climate change. knowing that the failure to do so would betray our children and future generations. reporter: to reducing the deficit and saving safety net programs. the commitments we make to
30,experts say our weather patterns are changing due to global warming. we dispatched a team of team of
31,"climate change is going to happen, no matter what at this point? well, some climate change is already happening and will continue to happen. the physics of the problem are quite challenging. we put, well, 85% of the energy used by earth inc, it"
32,"held note of climate change skeptics. the government can't change the weather. we can pass a bunch of laws that will destroy our economy, but it isn't going to change the weather. all those climate change activists in d.c. want the president to talk the keystone"
33,"what, we just saw a draft memo a couple of weeks ago the international panel on climate change and prediction in temperatur increases were wildly overstated. as they have been the last 20 years. now is not the time for climate change. get your research in order, make"
34,"is now the time for climate change legislation? yes. obama can do a lot about climate change. he needs to start simple. he needs to take a bold idea that he and john mccain were pitching around in 2008, which is a promise to change all the delete of cars."
35,"but while the wind is at his back, observers say president obama can't appear too bull-headed at the start of his second term. to that point, soledad, there had been a question how aggressive president obama would be on the topic of climate"
36,"it's a race against time. we're determined to fulfill the mission, working as fast as we can, we're putting the right people into place. i'm trained as an astronaut. i'm not satisfied until we're back home and the mission is a success. a crucial mission as climate"
37,"with, rainforest action network, their people were there and -- . so when you heard the president speak last night about climate change and that we must do something about climate change, was that enough for you? no, no. i mean, look, i'm a huge supporter of obama's. it's the first president i ever"
38,"do something about climate change, was that enough for you? no, no. i mean, look, i'm a huge supporter of obama's. it's the first president i ever donated money to. but i think in terms of climate change and the environment, he's been at best disappointing. i thought it was decent rhetoric"
39,"so you're selling this television network to a gas and oil supported or emerate. isn't that one of the problems with the global warming? yes, it is."
40,somehow adding to global warming by handing this over to al jazeera. a stretch beyond a stretch. al gore selling his company to al jazeera which is owned by
41,"degrades to co2 or water. methane leakage may be occurring in sufficient quantities to outweigh the global warming advantages of switching from gas to coal. so, i think that the fracking"
42,"methane leakage may be occurring in sufficient quantities to outweigh the global warming advantages of switching from gas to coal. so, i think that the fracking story needs to be written"
43,"measuring the global warming impact of the strategies that we choose. if you look at the latest satellite pictures of north america, there's a new ball of light as large as chicago in"
44,requires the epa to regulate pollution. the supreme court has agreed with the obvious interpretation that global warming pollution is pollution. it's been applied to new coal plants and should be applied to all facilities.
45,"pipeline. it will most likely add to our collusion problem, which in part causes global warming. that pipeline will create jobs and further energy independence and yeah, gas prices are now $3.73 a gallon."
46,temperatures on the national mall to demand action on climate change. [heart beating] [heartbeat continues]
47,"jazeera. do you think the charges that have been made of al gore, that he's being hypocritical because of his passion against global warming, selling his company, a significant part of the company to al jazeera, which is really"
48,"global warming, and i knew there was huge consequences for this huge problem. i got together with my friends. we found that you could turn waist cooking oil into diesel fuel. because many families in my own"
49,congressional approval. there is a law on the books that requires the epa to regulate pollution. the supreme court has agreed with the obvious interpretation that global warming pollution is pollution. it's been applied to new coal
50,"about and were the media holding him accountable? they were and they should because he's been a big spokesman on global warming, a principled man and now he is this big, fat target. he sold his network and worth"
51,"$300 million more than mitt romney and he's seen as a guy now who enriched himself, rather than advancing his cause. opening up to the criticism of people like this global warming deniers. this strikes me."
52,"when i was young, i heard about global warming and i knew there was huge consequences for this huge problem. i got together with my friends and we found out that you could actually turn oil into batteries for fuel."
53,"however, a senior vatican spokesman on saturday said that, it could happen earlier than planned, before the 15th of march. i'm ben wedeman, cnn, reporting from rome. all right. thank you, ben. a cold day to talk about global warming. thousands braved frigid"
54,"when i was young, i heard about global warming and i knew that there were huge consequences for this huge problem. i got together with my friends and we found out that you could actually turn waste cooking oil into biodiesel fuel."
55,"when i was young, i heard about global warming and i knew there was huge consequences for this huge problem. i got together with my friends and we found out that you could actually turn oil into batteries for fuel."
56,"when i was young, i heard about global warming and i knew that there were huge consequences for this huge problem. i got together with my friends and we found out that you could actually turn waste cooking oil into biodiesel fuel."
57,"we have to be careful in terms of measuring the global warming impact of the strategies that we choose. if you look at the latest satellite pictures of north america, there's a new ball of light as large as chicago in"
58,when i was yourngs i heard about global warming. i knew there were huge consequences for this problem. i got together with my friends and we found out you could actually turn waste cooking oil knew fuel. because many families in my own
59,"when i was young, i heard about global warming and i knew there was huge consequences for this huge problem. i got together with my friends and we found out that you could actually turn oil into batteries for fuel."
60,"when i was young, i heard about global warming and i knew there was huge consequences for this huge problem. i got together with my friends and we found out that you could actually turn oil into batteries for fuel."
61,"contribute to global warming. hln's susan hendricks spoke to kennedy about what happened, and how he thinks the president is handling this issue. i think virtually everybody who was in that crowd. 50 people got arrested and thousands of people in the"
62,"kind of carbon tax and manufacturing, you know, cleaning up the voting system, raising the minimum wage. what's really going to happen? i do agree with senator schumer from before that immigration reform in some form"
63,"the biggest factk factor contributing to climate change. no, we're not all putting our hands up? that is what is sad about"
64,oceans around the world are in danger now. it is estimated that 30% of the coral reefs on the planet will be destroyed in the next ten years and that's mostly because of global warming. now scientists think the tiny mineral might hold the key to
65,"this world one french fry at a time. have a look. when i was young, i heard about global warming and i knew there was a huge consequence for this huge problem. i got together with my friends and we found out that you could"
66,conor kennedy and daryl hannah were arrested in a protest demanding the obama administration take concrete action against climate change. the activists chanted 'president
67,"of new proposals, taking on everything from universal preschool education to preparing the aging infrastructure to addressing the threat of climate change. he urged congress to put"
68,"you think? yeah, just a little. he had a press conference today where he announced this. he gave the blueprints away and i want to tell you a full screen quote here. one of the benefits of global warming, there hasn't been as many icebergs in the north"
69,"when i was young, i heard about global warming and i knew that there were huge consequences for this huge problem. i got together with my friends and we found out that you could actually turn waste cooking oil into biodiesel fuel. because many families in my own"
70,"when i was young, i heard about global warming and i knew that there were huge consequences for this huge problem. i got together with my friends and we found out that you could actually turn waste cooking oil into biodiesel fuel. because many families in my own"
71,this. republicans and only republicans don't believe in science. climate change is the biggest threat outside the nuclear holocaust. they don't believe that science is embarrassing and it's
72,have a point. 98% of climate believe climate change is manmade. so why can't anyone find common ground? there's certainly no doubt? i dispute the 98% factor that
73,"small business? my beloved home state of california. the home of the hope and change and global climate change and whatnot, those green regulations have killed in california."
74,endangered species list. the wolverine cannot out run climate change. there's only 250 to 300 left in the u.s. interesting. rising temperatures in the northern rockies is causing
75,"what gets said in the state of the union does not necessarily get done, at least not right away. let me ask you, immigration, reforming the tax code, some kind of carbon tax and manufacturing, you know, cleaning up the voting system, raising the minimum wage."
76,"dangerous pipeline to literally cut the country in half carrying a dangerous fuel, and it will cause run away climate change. reporter: on the flipside, folks say tighter emission standard"
77,climate change where we have prolonged drought and adverse conditions and freezing conditions that we haven't seen much of before and unsan ter unsanitary conditions like this. they have already distributed
78,storm barriers years ago warning in the 'new york times' after katrina in 2005 and tried again in 2008 on a climate change panel by mayor bloomberg but none were built.
79,"organization that i'm involved with, rain forest action network, their people were there. and -- so when you heard the president speak last night about climate change and that we must"
80,until his bond hearing tuesday. he says he did not kill his model girlfriend reeva steenkamp. thousands marching in washington for more action on climate change. organizers claim it's the
81,"you had hurricane sandy, and that's just in the united states. there are extreme weather conditions and weather events happening all around the globe, which has people asking that same question, do you think -- is this global warming or is this just a band of extreme weather event? well, first of all, with"
82,"giving the challenges ahead of us with global warming, this is a solution. which is why pond scum is so perfect. it's low cost, renewable, and it's a raw material that can be converted into by ofuels that can then be used in diesel engines. this man said his goal is to"
83,"faces. of course, i do believe that he should move boldly on the agenda that he articulated in his inaugural address. i was very pleased that he put the climate crisis front and center, the first issue he brought up. a very bold commitment."
84,controversial issue that he spoke about in the address and the topic is climate change. we can choose to believe that super storm sandy and the most severe drought in decades and
85,"control, climate change and much more. coming up. also, did you have more money in your bank account this week than a major african nation? probably. i'll explain. but, first, here's my take."
86,"so, you, al gore doing business with this country that enabling your ultimate foe, climate change. i think i understand what you're getting at. but i disagree with it. fareed zakaria asked him"
87,enomenon we call the internet of everything. trees will talk to networks will talk to scientists about climate change. cars will talk to road sensors will talk to stoplights about traffic efficiency.
88,"a crucial mission as climate change threatens to intensify the storms ahead. next, what the polar icecap is telling us about how damaging those storms could be. next, what the polar icecap is"
89,"agenda for immigration reform, climate change. and in the audience, victims of the sandy hook massacre along rocker and gun rights advocate ted nugent. brianna keilar with more on what we can expect."
90,"a crucial mission as climate change threatens to intensify the storms ahead. next, what the polar icecap is telling us about how damaging those storms could be. next, what the polar icecap is"
91,"of action. deb? you know, chris, president obama has been talking pretty tough on climate change, he wants to see things happen s anything likely to happen, especially with respect to the"
92,"stopping climate change. joining us now, chad meyers and phillipe cousteau. good to have you on the couch. finally in person. i love this. this is good. this is great. tell us about this -- what the            _"
93,will talk to scientists about climate change. cars will talk to road sensors will talk to stoplights about traffic efficiency. the ambulance will talk to patient records will talk to doctors about saving lives.
94,will talk to scientists about climate change. cars will talk to road sensors will talk to stoplights about traffic efficiency. the ambulance will talk to patient records will talk to doctors about saving lives.
95,"proposals aimed at improving the lives of the middle class, taking on everything from universal preschool education to repairing the nation's aging infrastructure to addressing the threat of climate change. he urged congress to put"
96,"facebook.com/carolcnn or tweet me@carolcnn. is now the time for climate change legislation? [ loud party sounds ] hi, i'm ensure clear. clear, huh? i'm not juice or fancy water. i've got nine grams of protein."
97,trees will talk to networks will talk to scientists about climate change. cars will talk to road sensors will talk to stoplights about traffic efficiency. the ambulance will talk to patient records will talk to doctors about saving lives.
98,repairing the nation's aging infrastructure to addressing the threat of climate change. he urged congress to put partisan differences aside on the image of immigration and to stay focused on a plan to jump start the nation's lethargic economy.
99,we call the internet of everything. trees will talk to networks will talk to scientists about climate change. cars will talk to road sensors will talk to stoplights about traffic efficiency. the ambulance will talk to patient records
100,"spending and his proposals on education, climate change, and immigration. but while the wind is at his back, observers say president obama can't appear too bullheaded at the start of his second term. brianna keilar, cnn, the white"
101,trees will talk to networks will talk to scientists about climate change. cars will talk to road sensors will talk to stoplights about traffic efficiency. the ambulance will talk to patient records will talk to doctors about saving lives.
102,it's lots of things. all waking up. becoming part of the global phenomenon we call the internet of everything. trees will talk to networks will talk to scientists about climate change. cars will talk to road sensors
103,"white house, urging president obama to take more action on climate change. and to do that, he must kill the extension of the keystone pipeline. keystone xl is a dirty and dangerous pipeline. it's literally going to cut our"
104,"environmental activist, al gore, on american politics, gun control, climate change and much more. coming up. also, did you have more money in your bank account this week than a major african nation? probably. i'll explain."
105,will talk to scientists about climate change. cars will talk to road sensors will talk to stoplights about traffic efficiency. the ambulance will talk to patient records will talk to doctors about saving lives. it's going to be amazing.
106,it's lots of things. all waking up. becoming part of the global phenomenon we call the internet of everything. trees will talk to networks will talk to scientists about climate change. cars will talk to road sensors
107,we call the internet of everything. trees will talk to networks will talk to scientists about climate change. cars will talk to road sensors will talk to stoplights about traffic efficiency. the ambulance will talk to patient records
108,we call the internet of everything. trees will talk to networks will talk to scientists about climate change. cars will talk to road sensors will talk to stoplights about traffic efficiency. the ambulance will talk to patient records
109,will talk to scientists about climate change. cars will talk to road sensors will talk to stoplights about traffic efficiency. the ambulance will talk to patient records will talk to doctors about saving lives. it's going to be amazing.
110,storm barriers years ago warning in the 'new york times' after katrina in 2005 and tried again in 2008 on a climate change panel by mayor bloomberg but none were built. if barriers and sand berms
111,"yeah. many weather experts believe sandy is a grim preview of a future with more powerful and more damaging storms fueled by climate change. it's not that these storms wouldn't occur and that they wouldn't happen anyway, but"
112,in the 'new york times' after katrina in 2005 and tried again in 2008 on a climate change panel by mayor bloomberg but none were built. if barriers and sand berms had been built in the last eight
113,it's lots of things. all waking up. becoming part of the global phenomenon we call the internet of everything. trees will talk to networks will talk to scientists about climate change. cars will talk to road sensors
114,it's lots of things. all waking up. becoming part of the global phenomenon we call the internet of everything. trees will talk to networks will talk to scientists about climate change. cars will talk to road sensors
115,"climate change or immigration, issues on our national borders. these are the things that most catholics are thinking about in the global context. and we're thinking now do we have an opportunity with the next pontiff to reorient the"
116,"many weather experts believe sandy is a grim preview of a future with more powerful and more damaging storms fueled by climate change. it's not that these storms wouldn't occur and that they wouldn't happen anyway, but"
117,"forecasting, have seen anything like this. they are being called superstorms. fueled by changing climate, higher temperatures, and rising sea levels. climate change is real. it's here. it's going to happen again. people and cities once safe."
