117,"what do you mean? i've always taped the windows, but let's start with the first one. i hear there are more hurricanes and that it makes sense, global warming, the water is warmer. it's worse. so a lot of people think that there are more hurricanes now than in the past, and that is absolutely false. there is no data to support"
118,congress and move ahead with the president's climate change agenda. this despite fierce opposition from the gop. we'll tell you what is up there. heavy rain prompts a flash flood warning in parts of the midwest where the storm could be headed next?
119,this week epa chief mccarthy saying that the president plans to bypass congress to get that done. they do think that this climate change issue and its impacts are fundamentally an economic challenge. they are fundamentally an economic challenge and i think
120,"this summer he would not wait for congress to act on climate change. if there was any doubt he really meant it, epa administrator mccarthy said it this week. he said he wasn't going to wait for congress and he had"
121,al gore made a claim about climate change last week that had scientists and other experts scratching their heads. 'the washington post' says it's responsible for stronger storms saying the extreme events are more extreme. the hurricane scale used to be
122,"monica and you are certainly right. the science is not settled. we're not clear on precise impact, but to me, nuclear, energy, nuclear power, nuclear weapons, climate change, these are issues for debate and rationale judgment. they're not like racial issues"
123,"medium, we just haven't don't found it yet. peter brooks, thanks so much more your expertise. jon: the head of the epa announcing new plans to move ahead with the president's climate change agenda, the obama administration will bypass be"
124,"the direction of all sorts of issues in terms of climate change, i think that she was being very straightforward, that they probably aren't going to entertain alternative viewpoints and i don't know anybody would be surprised by that frankly."
125,"president obama trying to make an end run around congress. yet again. in june, president obama vowed to make climate change a priority of his second term and this week epa chief mccarthy saying that the president plans to bypass congress to get that"
126,"planet. this only happens when the sun is particularly active. gregg: which is now. which is now. this kind of flip happens every 22 years. gregg: will we see more climate change here? normore clouds, auroras? what about auroras? this is time of solar"
127,"say this week, administrator mccarthy of the epa has announced her plan to circumvent congress and carry out the president's regulatory climate change agenda. he said that he wasn't going to wait for congress, but that he had administrative authorities, and it was time to"
128,"hyperbole especially when he is realizes not only is he losing the argument on climate change but losing the science because the science is not settled. nowhere near settled. gregg: it is not settled, doug to that point, it is obvious man and industry emit carbons, but"
129,"no, i don't think it is constructive. on the other hand there will be a new u.n. report coming out next month or so that shows the balance of the evidence is suggesting that climate change, that man-made efforts are in fact degrading our environment."
130,"this war on coal. julian, before you answer that question or see that impact, do you have to really take a closer look whether or not climate change exists. the president is insisting as the epa director, the time to act is now because these"
131,"and all the water on the surface? that is what we'll find, i believe when we go to the mountain. the mountain will tell us that it has pages in a history book what happened geologically. and what kind of climate change occurred that made mars"
132,"on jewel 18th held a big senate hearing on climate change. they had a bunch of experts there, all of them were asked do you any of you agree with president obama's claim that climate is accelerating, temperatures are accelerating over the last 10 years."
133,"the second term obama administration will make climate change a priority, he said. jimmy carter had solar panels installed, they came down during the reagan years, and george w. bush put them back up. this will be the first time solar has been used for a president's living quarters."
134,"jamie. on another note, growing worries about the environmental protection agency's new plans to get this, bypass congress, and go ahead with the president's new climate change rules. we will look at the effect this could have on americans from coast-to-coast. that's coming up."
135,"he has a long record. doug mentioned u.n. intergovernmental panel of climate change, for years they have been exaggerating the science. a lot of this corruption in how they're looking at the science and what they have been reporting, that has come to light over the last couple of"
136,"years. so look, to me, when i look at this, this is not even about climate change. this is not about man made or not. the left has been pushing this a couple decades. not because they care about the earth per se because they're interesting in global wealth"
137,very much. appreciate it. martha: lots more coming up on that on 'america's newsroom.' meantime al gore is once again taking on his opponents of climate change but his description of the opponents gotten at love attention. we'll tell you what he had to say. see what you think about it.
138,"obama's own reasoning which is this concern about climate change, his argument doesn't hold up, because the oil is going to flow. if it doesn't flow to us as charles has argued, it's going to flow somewhere else. so, there is no reason not to do this. and it, indeed, can help us"
139,climate change without going to congress. he'll get a lot of blow back on that in the next few weeks when congress returns. some of that seems to be coming from democrats. this is more bipartisan than it's been in the past. what is fascinating to me is a few days ago president obama
140,that the president recognizes that. he said that he wasn't going to wait for congress but that he had administrative authorities and it was time to start utilizing those more effectively in a more concerted way. it's not just climate change. president obama making his own plans to finance high-speed internet in schools telling the
141,"$125 million. martha: would you. reporter: all of those issues will be gone within 30 days. martha: phil, thank you. bill: he is after all robin leech. martha: life-styles of the rich and famous. bill: new suggestions that the president will go around congress to enact his controversial climate change agenda. what he intends to do and how"
