121,"jihadists from syria to the u.s. through mexico to carry out attacks against this country. let's weigh it in the balance, right? your favorite thing to talk about is climate change. get these bozos to care about isis, you would have to link"
122,"followed by climate change. and the federal deficit, as well. you know, okay, so coming up on tuesday, we'll have the new york primary. and after that, we've got pennsylvania. i was reading something about pennsylvania. this is crazy -- the person who                 _"
123,god bless you. get out of the bronx. it's an immigrant community. we deal with climate change every single day. he wants to say it doesn't exist. we're living in the poorest kochi congressional district in the country. to receive this right-wing bigot
124,"people are dying from climate change? well, welcome to new york. i guess that's your -- if you haven't been here in a while. well, look, sean, i don't really actually know why senator ted cruz went to the bronx, certainly probably not going to"
125,if there is not enough enter pope francis. now we learn today a week from today bernie sanders will be at the vatican some kind of conference about the climate change and the economy. he is sort of similar in his views with pope francis in
126,"legitimately standing up to the people. standing up to the banks. i'm supporting bernie sanders because at this point there isn't s. no other decent campaign in the race that's willing -- -- free college, among other things like stopping climate change. supporting bernie sanders is mass incarceration."
127,"32 percent of the voters say the economy is the most important. the next most important terrorism. healthcare, climate change in the federal deficit round out the top 5. voters it is clear they are frustrated. 42 percent say they are satisfied now with how things"
128,if there is not enough enter pope francis. now we learn today a week from today bernie sanders will be at the vatican some kind of conference about the climate change and the economy. he is sort of similar in his views with pope francis in
129,"legitimately standing up to the people. standing up to the banks. i'm supporting bernie sanders because at this point there isn't s. no other decent campaign in the race that's willing -- -- free college, among other things like stopping climate change. supporting bernie sanders is mass incarceration."
130,"climate change. something he felt he couldn't refuse. on social issues you may have some in your party saying why is he with the pope when on abortion, same sex marriage, whole range of issues bernie sanders disagrees sharply with the pope. he does have dispreements"
131,"conversation with him then afterwards and things seemed to square away. what do you make of the pope's visitation with bernie sanders? well, i think five smins very short to have been talking about as bernie says climate change and all of the other things he"
132,"we deal with climate change every day. he says it doesn't exist. we are the poorest congressional district in the country and to receive this right wing bigot is an insult! reporter: on the democratic side after his big win in wisconsin, bernie sanders was"
133,"nice work, phillips! the tasty side of fiber, from phillips'. this dude has no business being in the community. we deal with climate change every day. he says it doesn't,çh/ñ exist. poorest congressional distinct in the. to receive this right wing bigot is an insult."
134,"climate change, i hope that we have the courage to see that the path forward is to bring people together. not push people apart. so if you monitor the internet to try to find out if isis tried to kill you like in brussels, like in san"
135,"campaign trail. think to myself, why is that? why is it that republicans are invested in saying there's no climate change? these are a bunch of bozo scientists. gregory says science it good, you should be skeptical. i buy into that. but what happens when you see"
136,"piece of advice? i think of anybody i've ever known that has read more about climate change, it is greg gutfe gutfeld. which is why i'm losing my mind. i never use the word hoax, because i don't think it's fair. there could be something going"
137,some heads of state gathered at the u.n. to sign a climate change agreement reached last december in paris. secretary of state john kerry who brought his granddaughter represented the u.s. we learned that 2015 was the hottest year in recorded history by far.
138,if you will remember to fight climate change. decaprio says it means nothing if they don't act now. then brian where did he go? on his private jet to a deserted island where he has a yacht. because it matters but not that much. his carbon footprint.
139,"in a very clear way. take on the billionaire class. so that statement has some wondering if perhaps sanders is starting to see the writing on the wall, but today at a rally in rhode island, he continued to hammer clinton for her stance on climate change and her ties to"
140,"percent which is so bad water companies are likely to slap them with mandatory cutbacks. were going to have to move that way to deal with what climate change is going to bring where were going to have those lousy snowpacks more often because it's hotter. reporter: politically, what"
141,"we're at the forefront of climate change, ted cruz. so we're putting him down as a maybe. breaking tonight, senator ted cruz gets a rather rough welcome from the big apple as he begins campaigning in new york. you heard those folks in the bronx, and also from mr. trump,"
142,"morning after the big brawl in brooklyn -- [laughter] i guess you would call it that. sanders and clinton went at it for two hours last night. this is a trip to talk about climate change, other social issues. so some vatican officials invited him. we don't think he's meeting with"
143,"after he landed with his parachute near the crash site. up next, with the signing of a major agreement on climate change means for the u.s. first here's what some fox affiliates around the country are covering tonight. fox 19 in cincinnati, covering a mass shooting in pike county,"
144,"well, i once had an ambassador from a small island country in the pacific to come visit me to talk about the effects of climate change. she was worried, basically, wouldn't be an ambassador for long and wouldn't be a country, i didn't have really anything to say to"
145,"well, i once had an ambassador from a small island country in the pacific to come visit me to talk about the effects of climate change. she was worried, basically, wouldn't be an ambassador for long and wouldn't be a country, i didn't have really anything to say to"
146,"is going to be their demise, they believe that this is their number one issue. if you look at the exit polls from any of the states that have had elections so far, it's all, climate change is usually in the at least the top three of their"
147,"you had some warming, then it stopped, now you have to call it climate change. if indeed there's warming. the problem has always been that their statistics have been off. sometimes double, tripled the estimation, in order to get money. that creates a skeptical nation when we know that -- when you            _"
148,"his brain will climate change. i will start with you, eric from sylvia, if you could be any age for a week, what age would you be? for one week? one week. you go back to the current age? i think i would like to be 18 for one week again."
149,"fighters captured the pilot after he landed with his parachute near the crash site. up next, with the signing of a major agreement on climate change means for the u.s. first here's what some fox affiliates around the country are covering tonight. fox 19 in cincinnati, covering a"
150,"climate change. pretty low there. we are back with our panel. okay. chuck, tonight another debate. the last one before the new york primary. you look at the national numbers it seems like bernie sanders is closing the gap. you know, i will be interested to see how2p hard"
151,ignores people who are hurting. talking about climate change. it was an honor to meet with him. bernie sanders had a great opportunity while he was at the vatican to get out all of his talking points that we always hear from him on the campaign trail about corporate greed and giving away free
152,"well, he says it's because he was invited on this conference on the economy and climate change and other issues. obviously pope francis has said a lot about how he thinks wall street and others should step up and be maybe more humane and that's something bernie sanders has been calling for out on the"
153,"he's going to stay in this thing and i think his supporters are giving him good reason to. heather: you mentioned vocal supporters. hillary clinton willing to actually go after his supporters as well last night as they were vocal in the crowd. here's what she had to say about climate change specifically with sanders. listen. i am getting a little bit, i'm getting alittle bit concerned here because you"
