117,"green energy doesn't take place. there are two layers. the part that is an op to the base. i may be eavesdropping, but i am talking about global warming so you can be happy about that. and then there the other part that is a practical policy part."
118,"example of global warming, so you may be right. sean: i may be right. i'm thinking do i have to rethink where i am in this? all right, mr. speaker, good to see you. thanks for being with us. good to be with you. sean: when we come back, ann"
119,"global warming, gay marriage, moving to the left on everything, perhaps he is nervous of the scandals but he is out of touch with the middle of the political spectrum. he is shoring up the left, obviously, the right doesn't like him. he is losing in the middle."
120,for a year. it's what the global warming people want. the bad news is millions would die as life support systems were off line and planes fell from the sky. and the kids would talk to you of course because they would be awake. and they would need to know
121,the fourth amendment was about british soldiers going into people's homes and directly invading their privacy. this data search doesn't seem to rise to that level. laura: i have a pain in high heart. i know you are upset about the global warming talk that obama did today.
122,"laura: continuing now with lead story. has the president completely lost touch with the problems facing america? jing us now from the nation's capital senator from the great state of texas senator cruz. he goes out there today and hits it on global warming outdoor, georgetown university. the plains were -- planes       _"
123,"his strategy to combat climate change. there would be an increase for customers. and honoring one of the greatest heroes, neal armstrong and legends of the space program"
124,"introduces new climate change regulations, one of his aides calls for a war on coal. some lawmakers on both sides of the aisle say that translates to a war on jobs."
125,i'm here to enlist your generation's help in keeping the united states of america a leader in the fight against climate change. laura: now in on whether the white house has
126,candidacy for the presidency. he made it clear he wanted to be aggressive on global climate change and executive action. this is a followup on his commitments as a candidate in
127,"to get the changes through, the president calling this in the name of climate change. 9 % of scientists, including some who originally disputed the data, have now put that to rest."
128,"were kind of drowning him out. voice really hot. i guess that's global warming. what's the republican response to this urgent initiative where the epa is going to be regulating all these companies now? i have got to tell you it doesn't matter whether you are talking to republicans or democrats or independents, all americans"
129,were kind of drowning him out. voice really hot. i guess that's global warming. what's the republican response to this urgent initiative where the epa is going to be regulating all these companies now? i have got to tell you it doesn't matter whether you are talking to republicans or democrats or
130,"substance, what the president said in berlin, he still is disputing whether or not north korea has nuclear program. wants to negotiate with the russians and putin over arms control and everybody else is building more nuclear arms and most for issue to face is global warming. you are waiting for the"
131,first of all it is identity theft and second of all it is a fake name with the epa which also global warming and fake issue. and she wants to be the dude because she gets 75 cents on the dollar if she is a woman. now that is a good joke.
132,"unelected bureaucrats writing law and making law. if he tries to do this, we will have a vote in the senate. we have something called the congressional review act. and if he writes a regulation or tries to have a new carbon tax without us voting on it, we will"
133,quarters with hah mid karzai who was expected to talk about ongoing peace efforts there. martha: later today president obama expected to deliver a big speech on climate change at georgetown university.
134,it is important and going to be expensive. and what is more expensive. retrofitting them with gills so we can breathe under water. at some point climate change will be amazingly expensive and
135,the rest of the world that the u.s. is serious about climate change. the president will announce more steps to increase efficiency for home appliances and renewable energy on public lands and low
136,the power companies passing on higher prices for your energy costs at home. the president said it is the last best shot of reducing pollution and climate change. for the sake of future
137,scandal what will the president focus on this week? climate change of course. we'll take a closer look at the president's agenda this week. fox and friends hour three starts right now.
138,"feeling the affects of climate change don't have time to deny. it they are busy dealing with it. fire fights are braving longer, wildfires seasons, and states and federal governments have to"
139,generation's help in keeping the united states of america a leader in the fight against climate change. laura: now in on whether the white house has completely lost touch. i think the president
140,"as president obama introduces new climate change regulations, one of his aides calls for a war on coal. some lawmakers on both sides of the aisle say that translates to a war on jobs."
141,generation's help in keeping the united states of america a leader in the fight against climate change. laura: now in on whether the white house has completely lost touch. i think the president
142,"just remember what we were talking about the president had a big agenda. gun control, climate change all this stuff. in now in june, scanneds have swallowed the whole agenda. white house is playing"
143,attention to the global theft our time. that threat is climate change. the administration planning a renewed push on the environment after the issue of the back seat of other priorities in the first term.
144,"last week. they're not happy. eric, do you think he is doing it because he will okay the pipeline? he is embroiled in scandal upon scandal, let's go with climate change, bring that one back up."
145,"far left's wish list. folks are saying that the president is now in legacy mode. he did big healthcare, so now he wants big immigration reform and then big climate change action. the president, as usual,"
146,"white house faces scandal after scandal, what is the president going to focus on this week? climate change. we'll take a closer look at that. fox and friends starts right now. sunday morning on the east"
147,"andrea still has hers. it's time for him to let go of his dirty blanket called climate change, because it is being systemically debunked by science. looking at 33 years actualed measured increase in temperature is 0.2 degrees."
148,"andrea still has hers. it's time for him to let go of his dirty blanket called climate change, because it is being systemically debunked by science. looking at 33 years actualed measured increase in temperature is 0.2 degrees."
149,"americans jobs? it is the right time to focus on climate change. that is a good question, sure. it is important and going to be expensive. and what is more expensive. retrofitting them with gills so"
150,"we can breathe under water. at some point climate change will be amazingly expensive and we need to address that. and americans living paycheck to paycheck, that is sad. i don't think it is liberal or"
151,"happen, he is saying it's possible and that is fueling much speculation on the internet. shep? shepard: trace gallagher, thanks. president obama says he is planning historic steps to fight climate change. and he does not need the"
152,"this week about the president's climate change plan? i should not have to be sitting here as a u.s. senator fighting my own president and fighting my own government. that's ridiculous. alisyn: up next, republican congresswoman and democratic"
153,"address, the president talking about getting on board with climate change proposals, which would basically go around congress, go right to the epa and enable the epa to put stricter emissions standards for those coal powered plants."
154,"folks are saying that the president is now in legacy mode. he did big healthcare, so now he wants big immigration reform and then big climate change action. the president, as usual, well, he wraps up his new"
155,"well, i think what the president's been trying to do is through executive order and through administrative processes, regulations and other things move where he wants to go on things like global climate change and other issues, gitmo,"
156,"last week. they're not happy. eric, do you think he is doing it because he will okay the pipeline? he is embroiled in scandal upon scandal, let's go with climate change, bring that one back up."
157,"our governments don't agree on every issue. no two countries do. we have seen the progress we can make together on nuclear security, on climate change, given south africa's history and given what it represents to the"
158,"interesting if you're at like a thursday night seminar at harvard. global warming, we're going to get rid of all the cars. but in the end, the american people want jobs and they want to know their kids will be able to go to college and maybe pay off their loans and they want a better life for their kids."
159,"his friend odin lloyd. and climate change in a speech on tuesday, president obama says he will lay out to reduce carbon solutions, something he called the global threat of our lifetime. those are the top stories. shannon: thank you very"
160,out his energy and climate change policy and suggesting that he could be close to a decision on the keystone xl pipeline. it would carry oil from canada to refineries in texas. but there are new questions about a billionaire donor to the
161,"warming up to your climate change silliness, when there is so many other pressing problems on the table. that's the memo. now on to the top story tonight with alan shaking his head. reaction from our barack and hard place duo monica"
162,generation's help in keeping the united states of america a leader in the fight against climate change. laura: now in on whether the white house has completely lost touch. i think the president has drunk the kool-aid.
163,"of climate change knowing that the failure to do so would betray our children and future generations. reporter: former vice president al gore last week goaded the president to go bold on the issue, tell 'the guardian,' 'he doesn't need"
164,"trouble with its banks and that's not good news for anybody. number three, president obama tomorrow will outline his plans for climate change policies which are likely to raise the price of electricity. in other words, that's what he's going to do, that's"
165,"his earlier tries to push climate change through congress has failed. the family of the only known u.s. prisoner of war speaks out as a taliban prisoner swal offer sits on the table. i will not leave you on the battlefield, beau."
166,"president think of the single biggest threat to america? ladies and gentlemen, the commander in chief. the efforts of small climate change requires bold action. this is the global threat of our time. and for the sake of future generations, our generation must"
167,"president think of the single biggest threat to america? ladies and gentlemen, the commander in chief. the efforts of small climate change requires bold action. this is the global threat of our time. and for the sake of future generations, our generation must"
168,"leaders, that's just not true. ange angela merkel has spent millions of dollars. germany was on the forefront of green energy and climate change legislation. eric, they spent millions and millions of dollars in europe, in germany, in denmark, in"
169,months of expenses. more than 20 percent have no savings at all. and the president this week said we have to work on climate change that most people believe will cost americans jobs. is this the right time to cost
170,"owners and the ceos of walmart, ceo of honeywell, they believe in a clean energy economy, that we can fix climate change, protect our environment and have a strong economy. they don't have to be separate. well, gary, it's a pretty"
171,generation's help in keeping the united states of america a leader in the fight against climate change. laura: now in on whether the white house has completely lost touch. i think the president has drunk the kool-aid.
172,yes. tucker: he is making a major push to combat climate change he says. i'm directing the environmental protection agency to put an end to the limitless dumping of carbon pollution from our power plants and complete new pollution standards for both
173,joe manchin was earlier this week about the president's climate change plan? i should not have to be sitting here as a u.s. senator fighting my own president and fighting my own government. that's ridiculous. steve: democratic congresswoman debbie wasserman
174,"breaking news, statement he comes out and he's interviewed. here are your other headlines. white house faces scandal after scandal the president ises about focusing this weekend on climate change. georgetown university, i'll lay out my vision to prepare our"
175,"members of the flat earth society. he did. he pointed out 12 of the hottest years on record have been in the last 15 years, and more violent storms are a result of climate change but others disagree. the president's critics strongly"
176,"laughable to say this is obama's priority when he was given a speech about climate change today which no one cares about. in terms of the vacuum, this situation has been an opportunity for countries like cuba, china and russia to work"
177,"with something like iran this is not quite at that level, so we shouldn't elevate it to that. thank you, guys. climate change. an issue that americans view as one of the least important problems we face as a country."
178,clean fossil fuel. open up federal land to solar and wind projects. he wants to jump start global climate change talks. the president also laid down a marker for approving the keystone pipeline project. allowing the keystone pipeline to be built
179,"income housing sites. none of these steps require congressional approval. this is a sign that the presidents' day is done waiting for lawmakers to act on climate change and instead will seek ways to work around them. diane mass doe, thank y -- m       _"
180,"appreciate it. lets eat. lets talk about this, coming up on the show, the president's climate change plan firing up his own party. listen. this should not have to be sitting here as a u.s. senator fighting my own president and own government."
181,let us know what you think about that on twitter. meanwhile we thought the president might move in another direction focusing on jobs and the economy. it surprised some his new message is about climate change. in saturday's weekly video
182,"big climate change action. the president, as usual, well, he wraps up his new plan around protecting the children. this is the same president, of course, who thinks it's just hunky-dory to give half a billion dollars taxpayer money to the"
183,generation's help in keeping the united states of america a leader in the fight against climate change. laura: now in on whether the white house has completely lost touch. i think the president has drunk the kool-aid.
184,jenna: the speech about climate change is causing certain sectors of the stock market to take a hit today. the coal producers are down in part because of the anticipation of the speech. it has more to do with the
185,savings at all. and the president this week said we have to work on climate change that most people believe will cost americans jobs. is this the right time to cost americans jobs? it is the right time to focus
186,"mr. president, if i'm not warming up to your climate change silliness, when there is so many other pressing problems on the table. that's the memo. now on to the top story tonight with alan shaking his head. reaction from our barack and hard place duo monica"
187,"that he has been talking about that nobody else is talking about or cares about, these are all distractions as he gets everything he wants on immigration, as he carries out climate change. border. all the things that he is getting for the fundamental transformation of the"
188,"country he is getting whether through executive order or -- laura: alan, this climate thing change look, when he ran in 2008, this one of his promises he was going to pursue climate change. people knew what they were getting, right? i don't blame the left for"
189,immigration and other things. laura: immigration? ignore the changing demographic of this country are. losing the forest for the trees. laura: get back to the fundamental transformation of the nation. climate change he has been doing for the last four and a half years through
190,"low and their standard of living diminished. so, forgive me, mr. president, if i'm not warming up to your climate change silliness, when there is so many other pressing problems on the table. that's the memo. now on to the top story tonight with alan shaking"
191,"if there was a symbol for catastrophe on the periodic table, it would be obama's face. because this climate change thing has become his -- you know how a child has a favorite blanket and it just gets dirtier and dirtier and it needs to be thrown out?"
192,"ange angela merkel has spent millions of dollars. germany was on the forefront of green energy and climate change legislation. eric, they spent millions and millions of dollars in europe, in germany, in denmark, in spain, in italy and they have since backed off all of these."
193,"knows you when you are down-and-out. al gore hit him, get moving on climate change. then bill clinton in a closed session that obama risks looking like a fool if he didn't improve his policy on syria. within days he announced we"
194,"if there was a symbol for catastrophe on the periodic table, it would be obama's face. because this climate change thing has become his -- you know how a child has a favorite blanket and it just gets dirtier and dirtier and it needs to be thrown out?"
195,hills' thank you for joining us. alisyn: remember how fired up senator joe manchin was earlier this week about the president's climate change plan? i should not have to be sitting here as a u.s. senator fighting my own president and my own government. that's ridiculous.
196,"speech about climate change today which no one cares about. in terms of the vacuum, this situation has been an opportunity for countries like cuba, china and russia to work together. and despite what jay carney said about our relationship with russia, we don't have a good"
197,"georgetown university on global climate change, in the fifth year of his presidency, didn't talk about it in his campaign, they are describing this as a big, major speech. how's that going to help jobs? i think he's going to kill the coal industry"
198,details. and the president's new climate change plan causing trouble with his own party. this is just ridiculous. i should not have to sit here as a u.s. senator fighting my own president and fighting the government. we're breaking down the potentially devastating job
199,"peter? well, shep, the president relaunched his climate change agenda to heavy fire from republicans and from some coal state democrats. but he doesn't need congress to approve anything here. he can do all of this under his existing authority as the nation's chief"
200,"not quite at that level, so we shouldn't elevate it to that. thank you, guys. climate change. an issue that americans view as one of the least important problems we face as a country. that is exactly what president obama spent time talking about today."
201,climate change or whatever. megyn: that must have been awkward for ed behind ri. [ laughter ] megyn: we are being told this is off the record. so the reporter is not allowed to say what president obama said to them. we have heard a couple come
202,"climate change nobody is talking about and not an issue. these things are planted by barack obama on purpose, laura, to distract us from what's really going on. first of all you have all of the scandals, the seeds of which are planted in the first term. irs, doj, benghazi."
203,pursuing what the left wants to do. i don't blame them at all. wait a second. why is climate change only about the left? laura: because the government is now stepping on one of the few industries in the united states that is managing to spin off jobs that pay
204,fundamental transformation of the nation. climate change he has been doing for the last four and a half years through executive order. this is about remaking the energy sector the may he remade obama tore. made the industrial base with the car bailout. this is part of a much
205,"wait a second. why is climate change only about the left? laura: because the government is now stepping on one of the few industries in the united states that is managing to spin off jobs that pay wages, decent wages that haven't yet been undercut by a whole bunch of foreign"
206,"about is an issue. climate change nobody is talking about and not an issue. these things are planted by barack obama on purpose, laura, to distract us from what's really going on. first of all you have all of the scandals, the seeds of which are planted in the first term."
207,"with a little bit of politics. president obama mired in scandal. but that's not stopping him. he's moving full speed ahead on immigration, climate change, and obama care is looming. the stock market's crashing, iran's still pursuing nukes, msnbc's ratings are in free fall, and what does the"
208,"first al gore hit him, he told him to get moving on climate change. and then bill clinton in a closed session said that the obama risked looking like a fool if he didn't improve his policy on syria. within days he announced we were going to start arming the syrian"
209,"with a little bit of politics. president obama mired in scandal. but that's not stopping him. he's moving full speed ahead on immigration, climate change, and obama care is looming. the stock market's crashing, iran's still pursuing nukes, msnbc's ratings are in free fall, and what does the"
210,"chinese government need something from the united states and we won't be there for them. that's the price that both china and russia are going to pay here. shepard: nicklaus burns, live. thank you very much. the president laid out his plan to tackle climate change. a plan republicans are already"
211,"shepard? shepard: peter, rosen says there were legal and ethical considerations about how much he could say today but he tells us he does fully intend to say a lot more some day. well, president obama says we need to act on climate change before its too late."
212,"you ask them specifically about climate change, i will acknowledge, people do think that something is happening because of the propaganda campaign, but nobody believes, overwhelmingly in polls, that, one, it's a crisis, and that, two, that federal money should be spent on it. when you talk about european"
213,"climate change nobody is talking about and not an issue. these things are planted by barack obama on purpose, laura, to distract us from what's really going on. first of all you have all of the scandals, the seeds of which are planted in the first term. irs, doj, benghazi."
214,"that he has been talking about that nobody else is talking about or cares about, these are all distractions as he gets everything he wants on immigration, as he carries out climate change. border. all the things that he is getting for the fundamental transformation of the country he is getting"
215,"all of these other issues that he has been talking about that nobody else is talking about or cares about, these are all distractions as he gets everything he wants on immigration, as he carries out climate change. border. all the things that he is getting for the fundamental"
216,"transformation of the country he is getting whether through executive order or -- laura: alan, this climate thing change look, when he ran in 2008, this one of his promises he was going to pursue climate change. people knew what they were getting, right? i don't blame the left for"
217,fundamental transformation of the nation. climate change he has been doing for the last four and a half years through executive order. this is about remaking the energy sector the may he remade obama tore. made the industrial base with the car bailout. this is part of a much
218,"like the irs, shows them that they are right when they believe that congress has no idea what average people care about. we're not talking about immigration or the economy or climate change or anything that people actually want to focus on. we're talking about issues like this that are definitelydistrac."
219,and so on. he's had the chance to talk about snowden and why that is important. he's delegated those issues and he himself has talked to climate change and arms control. jon: we'll have to leave it there. thank you both. we'll have you back again soon. thank you.
220,"go on what i think is a good trip to africa. all these people he gave a speech to, all the private jets that love to give money to the democratic party to talk global climate change, it is a pipe dream and not the kind of pipe we need. it does rally the base,"
