120,"understand why he cares. they worry more about climate change than they do about this. what could possibly be the holdup? where is it? in addition to that, not only do the families deserve justice, but remember, he stands to get"
121,"about climate change as the real threats when in fact the urgent threats, whether it's isis or whether it is ebola, is ignored. and i think that's a real -- i mean, this is actual science. people see this. the see that conservatives react"
122,"screaming for more serious people and more serious response, it's because the sense that the administration doesn't take their threats seriously. instead the think about childhood obesity and think about climate change as the real threats when in fact the urgent"
123,"teaching us how to do it ourselves. that's on 'cashin' in.' but first right here, ebola, isis, and climate change? what the defense department just declared an immediate and costly threat to our national security that has some people here"
124,"although his attorney general didn't fight it other than that go through the list. everything. speech in cairo going to solve the problem. muslim world that didn't happen. immigration speech 2010, that didn't happen. climate change, that didn't happen. gitmo didn't happen."
125,"continuing on. they're not mutually exclusive from not allowing him to talk to his counterparts in other countries that have serious issues that are affected by climate change, as will we in this country. i'm interested in the timing. there is an election in three weeks time --  _"
126,"he -- you look at the u.s. navy. the commander -- the naval commander, who is in charge of the u.s. navy, last year, came out and said, this is the most important issue we're facing right now. climate change. relative to our naval bases and"
127,"you're always talking about china. we have your facts, we have our facts on our side. but that's all right. we're not going to agree on it. it's not worth arguing about anymore. you said that climate change is more of a threat than isis?"
128,"china? you're always talking about china. we have your facts, we have our facts on our side. but that's all right. we're not going to agree on it. it's not worth arguing about anymore. you said that climate change is more of a threat than isis?"
129,"my one for the road, the defense department has its hands full with isis, but not really. its number one threat. and chuck hagel says climate change. it poses immediate risk to u.s. national security. that and the fact that isis is blowing through the middle east"
130,in this is the first misnomer because another study done said climate change had nothing to do with drought. there was extreme drought causing extreme poverty from 2006 to 2010. we know there are different geographic elements involved. so this drought and these college professors saying
131,liberal friends couldn't wait to criticize george w. bush no matter what he said. no matter what. the man could be talking about the weather and they could make it into a discussion how he didn't care about climate change. they would sit in my room
132,"more polar bears are alive and happy than there have been in 100 years. life is good. we love to talk about climate change. so bob, let me talk to you about that question. i don't think it's unreasonable for the white house and"
133,"more polar bears are alive and happy than there have been in 100 years. life is good. we love to talk about climate change. so bob, let me talk to you about that question. i don't think it's unreasonable for the white house and"
134,"from the last even presidential debate. even some of the republican candidates up there suggested you are nuts. remember john huntsman? if you don't believe in manmade global climate change. well, it's very difficult for anybody to be against it because the media has told the nation"
135,epidemics. poverty. the proliferation of weapons of mass destruction. the reality is the climate change ranks right up there with every single one of them. no nation is immune. we know what we have to do to avoid irreparable harm. and for the sake of future
136,"closet. i mean, this is a tough go for people who don't believe in climate change. well, we heard a lot of that from the last even presidential debate. even some of the republican candidates up there suggested you are nuts. remember john huntsman?"
137,"if you don't believe in manmade global climate change. well, it's very difficult for anybody to be against it because the media has told the nation over and over again day after day for 20 years that the oceans are rising, the polar bears are"
138,"the reality is the climate change ranks right up there with every single one of them. no nation is immune. we know what we have to do to avoid irreparable harm. and for the sake of future generations, our generation must move toward a global compact to"
139,"tunes if you don't believe it. and i only met two republicans the whole time. and they were both hiding in the closet. i mean, this is a tough go for people who don't believe in climate change. well, we heard a lot of that"
140,in this is the first misnomer because another study done said climate change had nothing to do with drought. there was extreme drought causing extreme poverty from 2006 to 2010. we know there are different geographic elements involved. so this drought and these college professors saying
141,"situation that would, in fact, be a problem for our national security. let's really spell it out. this is specifically what the defense department said, and i'm quoting them now, 'climate change will affect the department of defense's ability to defend the nation and poses"
142,"wait a second. [overlapping speakers] i'm going to raise my voice, do you think that next week, we're going to have a climate change catastrophe because next week, we're going to have more americans beheaded, we could have baghdad fall and we could have a mass ebola outbreak where"
143,"around here. do you think the climate change is important as that? well, stuart, back to my point. he was at a conference and said we're laying out a road map. nothing is saying we're diverting attention from isis and ebola and other conflicts and things that's u.s. military"
144,he got a d and yet he's made a million dollars off climate change. standby. i want to play al gore. this is his argument and then you can respond. starting in 1970 there was a precipitous dropoff in the amount and extent and thickness of the arctic icecap.
145,"bottom. only 3% there at the very bottom think climate change is of immediate concern. yeah, look, i acknowledge i'm troubled by the word 'immediate.' maybe it's how you define it. i would define it in the next fur years and don't really believe that this is a national"
146,"security problem in the next few years. however, if, and i'm underlining the word 'if' so we don't have to have that debate. if you believe there's climate change taking place, whether naturally or man made, then it's not that hard to see how that does translate into the"
147,affairs. he may just be falling back to shore up his base amongst the greens by saying that climate change is a clear and present danger. we have to jump on it. it's politics-isn't it? i don't know how you refer to it as politics. the secretary of defense and so
148,"grave, but just protecting us from immediate threats. we do have those threats. ebola, isis, et cetera. is there any circumstance under which climate change could be considered an immediate threat? david, i really don't think west point is going to start teaching the people that go there how to dispose of plastic"
149,this. you said that some of your liberal friends couldn't wait to criticize george w. bush no matter what he said. no matter what. the man could be talking about the weather and they could make it into a discussion how he didn't care about climate change. they would sit in my room watching the television watching
150,"a moral high grounlaim this is an evil threat that must be defeated? he'll use the rhetoric because leftists have to use the rhetoric to look tough. so they talk about fighting a war, a crusade against global climate change. they got to use the rhetoric, but don't have the ability to actually stand up for it. let me get this straight, you"
