0,"it is quite serious. the senator is trying to use cold weather to refute global warming and is not acknowledging that it results in extreme weather events. according to scientific reports, global climate change just might"
1,"expensive global warming bull [ bleep ] has got to stop! our planet is freezing. record low temps. and our global warming scientists are stuck in ice. the right wing had a field day, pointing and laughing at the global warming believers, who"
2,"amendment. another piece of model legislation, the civil rights act eliminates affirmative action. while the climate accountability act uses state audits to reduce greenhouse gas emissions."
3,"al gore was cold. therefore global warming is a hoax. ahem. according to the logic of the distinguished gentleman from oklahoma, if the planet is getting warmer, how can it possibly be cold out? for one, the term global warming"
4,"when ideology dictates to science, you get very bad science. my father is an exsoviet engineer and republican. he doesn't believe there's manmade global warming."
5,"these are the hot topics. here are today's top trenders voted on by you. the ice man cometh. the number three trender, freeze. no global warming."
6,"just because it snows in winter. doesn't mean the planet isn't getting warmer. remember, a u.n. panel said there's a 90% probability that humans are the primary cause of global warming. .  _"
7,"evolution. but the pressure to reject climate science in a way is a lot stronger because the ideological underpinnings of this issue are in order to do something about global warming,"
8,"thanks, everyone! this incredible rescue today of 52 scientists, journalists, and tourists, all part of a month-long research trip to study changes in antarctica's environment over the last hundred years, including what role global warming has played"
9,"[ speaking simultaneously ] did you understand any of that? i sure didn't. they did not respond in the chamber to climate change,"
10,"to take us home! thanks, everyone! this incredible rescue today of 52 scientists, journalists, and tourists, all part of a month-long research trip to study changes in antarctica's environment over the last hundred years, including what role global warming has played"
11,the 2006 study that found the carbon accumulating in the atmosphere is same carbon from fossil fuels. it is extremely climate change
12,"i've become a public figure in this larger debate over climate change, because of this iconic graph that my colleagues and i published a decade and a half ago. and that has put me at the center of the larger debate about climate change, but it's"
13,"conservative issues, just sort of rationalizations for corporate interests. red state's erick erickson got theological today. the difference between -- this is his actual tweet. the difference between the people who believe in the second coming of gee u.s. and those who believe in global warming is"
14,"approach. we have to grow the pie. get all our people jobs. let's not let other countries take our jobs away. free trade is a religion. you can't question it. all i'm doing is if you believe in climate, if you really believe in global warming, who"
15,"welcome back to the first 'politicsnation' science lab of the new year. in the lab tonight, a right wing meltdown over global warming. a winter storm is battling much of the country and climate"
16,the fact that all this is happening due to manmade gases is the greatest hoax perpetrated to the american people. one climate change denier is
17,"out. it looks to me like we're looking at global cooling. forget the global warming. that's my opinion. tis the season for climate change denial. tweeted the donald last week, this very expensive global warming bs has got to stop."
18,"industry that wants to destroy any attempt to deal with problem and inculcate this world of people who are just, apparently, average joes, who spend their time in the comment section of every article every published. what is the deal with this subculture on the right of global warming paranoid"
19,"again, the host of 'fix my life' and author of 'forgiveness.' thank you so much. still ahead, brutal cold snap adding fuel to the debate over climate change but are"
20,political imperiproblems? it is deeply rooted in conservative ideology. it is all about individualism. it is sort of like the guns issue. the idea that winter weather refutes climate change is just
21,"climate change, calling it global warming makes your argument kind of sort of legit. we'll explore one senator's weird science up next. welcome back. how is everything?"
22,"had been a cynic and have been proven wrong so far. read the landscape, if you will, if you're the president. here he has given the state of the union. he said climate change is a"
23,"plan for his executive order to raise the minimum wage for federal contractors to $10.10 an hour. where this dysfunctional congress fails to act, the president will. we've seen it on gun safety, on immigration, on climate change."
24,this deep freeze has brought record low temperatures to much of the country. the coldest in a generation in some places. it's all the result of an arctic chill from the north. but some of the climate change
25,"this morning? that global warming is really taking the its toll, isn't it? of course, no one ever said that climate change meant it wouldn't ever be cold. even in the most overdramatic climate change nightmare conceived by liberal hollywood, the end came not from hot, but from cold. a giant snow hurricane, a"
26,salute whoever came up with the term polar vortex. 'tis the season for climate change denial. this very expensive global warming bs has to stop. these scientists are laughing
27,"great opportunity to point and laugh about the hoax called global warming. because, you know, ice. the ship sent to the antarctic to study climate change that be stranded in the"
28,"some of the world's wealthiest people and representatives from the most powerful nations are meeting at the world economic forum in davos, switzerland. as we speak, at least 80 billionaires and 2500 business and political leaders are talking peace, climate change,"
29,"why wait? reporter: there are some actions that he has taken, you know, in the past year. for example, we did a big proposal that wires 99% of our schools. he took a lot of action on clean energy and on climate change,"
30,"forecasting. he doesn't complete deny that climate change is happening. for that, you have to turn to ranking member of the senate committee on the environment and public works and the most powerful republican in the country when it comes to climate"
31,"technical term for this phenomenon. it's called winter. and you know, we're going to continue to have cold days in winter. that's weather. but if you take a step back and you look at the larger picture, which is what climate change is,"
32,"that would seem to refute the argument right there. dana milbank, joe madison, thank you both for your time this evening. thank you, reverend. thanks, reverend. coming up, the polar vortex is giving right-wingers brain freeze on climate change."
33,"automatic enrollment of workers in retirement accounts. that would require congressional action. this my-ra plan is something to do by executive order. and i think the biggest one of these and one people haven't talked about enough is what he said about climate change, that"
34,"scientists actually have a technical term for this phenomenon. it's called winter. and you know, we're going to continue to have cold days in winter. that's weather. but if you take a step back and you look at the larger picture, which is what climate change is,"
35,"and physics and go on to study climate science. i didn't realize that i would be at the center of a widespread attack, an effort to undermine the credibility of not just me, but my scientific colleagues in a cynical effort to discredit concern for climate change."
36,"is a growing political effort. and it does feel like to some degree these social issues are becoming more political conversations. right. than policy conversations. yeah. that's another piece of this. when you think about you have to now set aside climate change, if"
37,"the world for the army of climate change people we have dubbed the snow trollers. to gleefully suggest the, quote/unquote, global warming hoax has been exposed by mother nature. well, there's been a"
38,"like climate change and global disruption, global warming. what is key is to have a great diversity of opinion represented at all levels. and i think the greatest threat to that was money in politics."
39,"great opportunity to point and laugh about the hoax called global warming. because, you know, ice. the ship sent to the a antarctic to study climate change that be stranded in the ice for ten days."
40,there's no polar vortex and it's some left-winged media conspiracy. let me tell you we've never used the phrase global warming or climate change in conjunction with this. take a look at this right here.
41,"they've ever had. so it's that larger context. that's climate change. and that's global warming. can you explain to me, finally, what this antarctica expedition was about, and what is going on with the ice in"
42,"the world for the army of climate change people we have dubbed the snow trollers. to gleefully suggest the quote/unquote global warming hoax has been exposed by mother nature. well, there's been a concerted effort of people to"
43,"president committed to drastically reducing greenhouse gas emissions, a tall order and a controversial move to some. last year, the president called out climate change deniers and called fossil fuel yesterday's energy. but this year, the president went a bit further. first, he said he directed his"
44,dollars building tschetters so if a tornado sweeps through town people can get into the shelters. they'd probably have thought i was crazy. but i think the point that the emergency management fellow made is true. cities now in the south have to accept that climate change is as
45,"is going to be out educating their members as well as, you know, the work that you're doing and members of congress are doing, i think are going to slow down the whole process, and hopefully put it to sleep. last year, the president talked about climate change."
46,"that's climate change. and that's global warming. can you explain to me, finally, what this antarctica expedition was about, and what is going on with the ice in antarctica? i've seen the people that occupy this strange nether region of"
47,"packers going to play in wisconsin in january, it's so cold, therefore there's no climate change or global warming. again, as mr. mann just said, we still have winter. it still gets cold in wisconsin. but, yeah, this is part of a"
48,"scientists that believe climate change is the result of human activities presented some evidence. in january of 2004, i remember when al gore held a global warming rally in new york city, one of the cold eflt days in new york city in its history."
49,"cold, therefore there's no climate change or global warming. again, as mr. mann just said, we still have winter. it still gets cold in wisconsin. but, yeah, this is part of a larger movement, sort of anti-science. a recent poll came out, fewer and fewer conservatives believe"
50,"one way or another for global warming or climate change. right? the evidence is a massive body of data that we're collecting in all sorts of places from hawaii to the arctic, to the antarctic, in ice cores and all over the place, right? sure. that massive body of data"
51,"but for the american right wing, you instead thinking it's a great opportunity to point and laugh about the hoax called global warming. because, you know, ice. the ship sent to the antarctic to study climate change that be stranded in the ice for ten days. rescuers finally got through"
52,"63% of the country is now covered in snow. and it's breaking al gore's heart! i wonder where al gore is this morning? that global warming is really taking the its toll, isn't it? reporter: of course, no one ever said that climate change meant it wouldn't ever be cold."
53,"definieie deniers, it's proof they've been looking for, that climate change is a hoax there. has been a concerted effort of people to believe that global warming is taking place, that we're all going to die and all of that. at the same time, the evidence out there is almost laughable."
54,"one way or another for global warming or climate change. right? the evidence is a massive body of data that we're collecting in all sorts of places from hawaii to the arctic, to the antarctic, in ice cores and all over the place, right? sure. that massive body of data which is studied by"
55,"climate change or global warming. again, as mr. mann just said, we still have winter. it still gets cold in wisconsin. but, yeah, this is part of a larger movement, sort of anti-science. a recent poll came out, fewer and fewer conservatives believe in evolution. these are the people who said"
56,"and as i speak to you today, and down under, in australia, they're experiencing a record heat wave. they have just announced that they had the warmest year that they've ever had. so it's that larger context. that's climate change. and that's global warming. can you explain to me, finally, what this antarctica expedition was about, and what"
57,"woods-plaquey. thanks for coming on, bernadette. i guess all the people who think climate change is hoeky are saying, see, there's no global warming, what are you guys talking about? what do you say to them? that has been a big question this week, but we have to step back and look at the big"
58,any suvs driving around in jupiter. it has nothing to do with greenhouse gases. must have caught a radio newscast from jupiter the other
59,today's top lines. global warming is one more liberal experience. people believe global warming is taking place and we're all going to die. we're going die. don't you understand.
60,so let me get this straight. it's cold during the winter. so that means global warming isn't real. that's ridiculous. nobody else thinks that. right? wrong. global warming is a great
61,"study changes in antarctica's environment over the last hundred years, including what role global warming has played"
62,most intense cold fronts in american history. temperatures feeling like they're in the 50s and 40s below zero. it has to make everyone question as to whether global
63,"data supports. to point out the cold is -- here's where it's really important to get this straight, okay? there is -- the weather on any given day is not the evidence one way or another for global warming or climate change. right? the evidence is a massive body of data that we're collecting in all sorts of places from hawaii to the arctic, to the antarctic, in ice cores and all over the place, right? sure. that massive body of data which is studied by climatologists above 98% of whom"
64,"rich with mockable goodness for the right's leading intellectual likes. donald trump tweeted, this very expensive global warming bull [ bleep ] has got to stop! our planet is freezing. record low temps. and our global warming scientists are stuck in ice."
65,"we are in the u.s. about 2% of the earth's surface. if that's your control section, that's tougher. if it is down to one city, it is even tougher. donald trump called global"
66,"rich with mockable goodness for the right's leading intellectual likes. donald trump tweeted, this very expensive global warming bull [ bleep ] has got to stop! our planet is freezing. record low temps. and our global warming scientists are stuck in ice. the right wing had a field day,"
67,forget this global warming. and get this. a global warming scientologist had to be removed from his frozen vehicle after days of being trapped. poetic justice much? for the past 16 years there has been no warming to speak of. they called it unusually
68,"to gleefully suggest the quote/unquote global warming hoax has been exposed by mother nature. well, there's been a concerted effort of people to believe that global warming is taking place, that we're all going to die and all of that. at the same time, the evidence"
69,"dioxide in the air than there was now. it's the rate. it's the speed at which we're adding these greenhouse gases that is of deep concern, because we have now instead of in 1750, let's say about a billion humans on earth, now we have well over"
70,"yep.doh. [ boy ] slurpably fun and a good source of calcium. dads who get it, get go-gurt. the gop has a new climate"
71,"why they never, never quit. and right now we are witnessing an incredible weather experiment. the polar vortex's affect on right wing brain. it has them denying climate"
72,"we permit greenhouse gases. so this is a done deal. not only is climate a fact, but it's a fact that -- you're not worried -- you don't believe this court case is really going to limit -- no. -- what you do too much? actually, the court had an opportunity to retake those issues up again for the third"
73,'national review' criticized the left for hyperbole on global warming but at least admitted
74,"scientific conclusion that there is climate change. no, no. it has to do with it, almost certainly. but here is what i mean. we use the expression climate change or global change to"
75,the good of the people. take climate change for an example. you could put into place laws that would reduce climate change in a much smarter way if you get congress engaged. but if congress is going to
76,"gave the climate change speech and he said if keystone exacerbates climate change, he won't do it. we'll hold him through to his word. yahoo! is urging users of their accounts to reset passwords in what is the latest"
77,"reporter: of course, no one ever said that climate change meant it wouldn't ever be cold. even in the most overdramatic climate change nightmare conceived by liberal hollywood, the end came not from hot, but from cold."
78,"act uses state audits to reduce greenhouse gas emissions. alec takes actions that look a lot like lobbyists. last year, an alec lawmaker in ohio wrote to a colleague, to"
79,"skillfully. the other thing, i don't discount this executive action that he can take on serve on some big issues like, you know, what he is doing on the federal minimum wage. there are also things on climate"
80,"there was not even 50% support saying it should be a priority this year, even among democrats across the board. immigration was one of them. climate change was one of them. both immigration and climate change didn't have 50% support"
81,"research and development and environmental standards. the big problem here is he thinks the idea of manmade global warming is, quote, folklore."
82,"how can there be snow when there's global warming? well, you know, we climate scientists actually have a technical term for this phenomenon."
83,old man winter has launched a record low cold front. some think this suggests that global warming is some kind of hoax.
84,his replacement death tax sounds like it impacts everyone. he counselled the second bush administration to stop calling it global warming and call it
85,"and similarly i think as we -- as we sort of think about, oh climate change agenda versus climate change denier that those also seem like categories that seem too stark. so i wanted to show anthony this sort of incredible graphic about how the american public looks at"
86,"passionate that he believed in it, and then he puts out ridiculous statements in 2010 not sure about climate change anymore. and he knew what he was doing. he cared about climate change. he knew about it, but he had higher aspirations. it was time to move the right to"
87,"over climate change. he said point blank tonight, the debate is settled. climate change is a fact. unexpectedly, one of the biggest applause lines tonight was on the issue of women's equality and workplace policies affecting women and families in the workplace, and i think a lot of people, myself included,"
88,"administration to set new limits on carbon pollution, and then he gave his strongest statement yet on climate change. but the debate is settled. climate change is a fact, and when our children's children look us in the eye and ask if we did all we could to leave them a"
89,"i've become a public figure in this larger debate over climate change, because of this iconic graph that my colleagues and i published a decade and a half ago. and that has put me at the center of the larger debate about climate change, but it's also given me an opportunity,"
90,"symptom of climate change. if you're going to go ahead, though, and say that droughts were caused by climate change, you need a lot more -- you said that, barack obama said that. the -- what was it called? it was a drought task force went ahead and said, no, i don't"
91,"themselves in the campaign. and the president can help bring success to some candidates in some districts across this country. gayle, i want to talk about another issue that may seem like it's out of left field, climate change. climate change could be a 2014 political background issue."
92,"new york just two weeks ago. it's like 9 degrees now. it's this back and forth, in fact shows there is climate change is what you're telling me. well, it's very reasonable that this is a result of climate change. as we say, and this is what is"
93,"climate change in the state of the union address. the debate is the settled. climate change is a fact. and when our children's children look us in the eye and ask if we did all we could to leave them a safer, more stable world with new sources of energy, i want us"
94,middle of global warming. it's the most severe winter storm in years. get it? it's cold! where's your al gore now? that's why i feel bad for al gore.
95,president obama has the final say on whether the pipeline gets built and has previously said he will approve the project only if he's convinced it will not significantly worsen greenhouse gas emissions. many expect today's report to conclude that the pipeline poses
96,"symptom of climate change. if you're going to go ahead, though, and say that droughts were caused by climate change, you need a lot more -- you said that, barack obama said that. the -- what was it called? it was a drought task force went ahead and said, no, i don't think you can attribute the 2012"
97,"girlfriend. what she originally told them about the alleged domestic disturbance. but first, winter weather brings out the global warming deniers on the right. we'll drop some science on them"
98,"today, there must not be global warming. get out your beanie, but don't forget your science hat. i want to salute the person who came up with the term polar"
99,"what is the deal with this subculture on the right of global warming paranoid conspiracy theories. it's using the media as a megaphone. rush limbaugh today talking about, you know, how are the"
100,"readings are so accurate. how can there be snow when there's global warming? we climate scientists actually have a technical term for this phenomenon, it's called winter. he blinded them with science."
101,so off base. only half of the world is in winter. the rest is in summer. that's why it is global warming. not american warming. you can't infer anything about global temperature trends.
102,"road. where are you on this? i think the president has been clear that the natural gas boom has provided us an opportunity -- tremendous -- you think it's a net positive? from a greenhouse gas perspective, it certainly is. and what we can do and what the"
103,"can you explain in the simplest terms possible how it is possible for cold weather to be the result of global warming? well it's a shift in weather patterns, so many of us are"
104,"engender response like this treat. lol, 30 inches in new england. charles cook, conservative 'national review' criticized the left for hyperbole on global warming but at least admitted weather is not the same as"
105,"conservatives are rocking the two greatest hits which is evolution denial and global warming denial. they're not the same. i agree the evolution one is rooted in religious morality. if you accept evolution, your"
106,see fun poked at this issue. 'the daily show' making fun of the fact that different sides are going at each other regardiregard ing global warming and weather. do listeners agree this is just
107,"while the climate accountability act uses state audits to reduce greenhouse gas emissions. alec takes actions that look a lot like lobbyists. last year, an alec lawmaker in ohio wrote to a colleague, to relay alec's concerns about a bill that would make it easier to recover money from businesses"
108,i would say from a political perceptive you say you have a nobel physicist who resigned from the american fiscal society who said it's not incontrovertible that we have global warming. if you look at the last decade
109,rescuers finally got through using a whopping helicopter that landed on the surprisingly thin ice. they're all out. so it looks like we're looking at global cooling. the prospect of air quote global warming scientist was too
110,"forecasting a historic cold outbreak across the middle of the country. i don't like how that sounds. minneapolis is expecting wind chills minus 45, minus 60. where is global warming when you need it? come on."
111,"australia just reported their warmest year they ever had. we're not in australia. doesn't do us a whole lot of good back here. come on. come on. global warming, let's get it moving. thanks so much, bill karins."
112,"'this is the kind of cold you don't want to mess around with. as crazy as it sounds, global warming may be at least partly to blame.' he goes on to explain why. and a published post titled"
