113,'winter does not disprove global warming.' we have now an msnbc contributor. you were really interested in this debate and it's become political and why weather as we go through this huge arctic blast coming through the united
114,us with a snowy white wonder in a crystal cathedral. you have windchills below zero. you're not going to convince those people they're in the middle of global warming. it's the most severe winter storm in years. get it?
115,us with a snowy white wonder in a crystal cathedral. you have windchills below zero. you're not going to convince those people they're in the middle of global warming. it's the most severe winter storm in years. get it?
116,and a choice. take up to 4 advil in a day or 2 aleve for all day relief. [ male announcer ] that's handy. republicans can call it global warming or a hoax. it doesn't change the fact that
117,"trends. it looks to me like we're looking at global cooling. forget this global warming. that's just like your opinion. that's just my opinion. yeah, your [ bleep ] opinion. that's your opinion. as a news man, i want to"
118,"grandstanding for gain. i think privately, actually believe this nonsense. here's congressman john flemming from louisiana. this is his tweet today. 'global warming isn't so warm these days.' i think this is an actual belief of these people."
119,"concerted effort of people to believe that global warming is taking place and we're all going to die and all of that. at the same time, the evidence out there is just almost laughable. while disputing the 97% of"
120,"poetry with you. and the titanic, it's poetry. and it has to be seen in that context. you know what it is? you are a winter poet. is that what it is? i think that's what it is. what we are going to talk about next that is also big, bigger than the globe and climate"
121,"interesting that the dogma post-clinton is pro-immigration at a time when we have a much larger supply of labor than we need, and pro free trade. even though we are supposed to be greenhouse gas oriented, we know where those jobs go. those jobs leave this country to countries that can pollute all"
122,"suspicion that currently hangs over. what i recall from the fact we were hit so hard by sandy, i believe global warming is a real thing that will affect our community. we need to prepare for it. i think we need that funding"
123,"the right wing had a field day, pointing and laughing at the global warming believers, who just to be clear, are only a group of scientists risking their lives for no monetary gain and little glory in order to help save the planet."
124,"what is the deal with this subculture on the right of global warming paranoid conspiracy theories. it's using the media as a megaphone. rush limbaugh today talking about, you know, how are the packers going to play in wisconsin in january, it's so"
125,"edge of and so using those examples to illustrate that is completely legitimate. what is not legitimate is saying it's 15 degrees out in minnesota right now, ergo al gore is fat, er errgo there's no global warming. not legitimate so say we're"
126,"doors. governors declared states of emergency. no one is happy about this, except for one group. right wing snow trollers. right now they're thrilled because all this winter cold means global warming isn't real. right? that's next. the comeback trail."
127,"that's the number two guy in texas. this is the number two in wisconsin. she's amazing. hi, rebecca clayfish here pip'm out in the global warming today poisoning the world with my breath. i don't know what it is about"
128,ice for ten days. rescuers finally got through using a whopping helicopter that landed on the surprisingly thin ice. they're all out. so it looks like we're looking at global cooling. the prospect of air quote global warming scientist was too
129,"thanks, everyone! this incredible rescue today of 52 scientists, journalists, and tourists, all part of a month-long research trip to study changes in antarctica's environment over the last hundred years, including what role global warming has played over that time period."
130,"hopefully, to try to inform this increasingly poisonous discourse that we have over this issue. speaking of poisonous discourse, i'm going to stump you right here. how can there be snow when there's global warming? well, you know, we climate"
131,thick ice. because they're unusually thick people who have not been paying attention to the science on global warming for 16 years and think we're about to roast like a chestnut on an open fire. these right wingers are boiling over with denial.
132,"example. it's a full-fledged now documented hoax. this whole global warming hoax. this winter is brutal. i mean, i'm in new york right now. the airports were closed, everything is closed. it's freezing. so it looks to me like we're"
133,"looking at global cooling. forget this global warming. the age of the dinosaurs was dramatically warmer than this is right now. and it didn't cook the planet. and in fact, life was fine. life was fine during the age of dinosaurs?"
134,"left for hyperbole on global warming but at least admitted weather is not the same as climate, allowing that it's silly to see snow out your win dean conclude the world is cooling. if only someone would tell jane enhoff."
135,"completely legitimate. what is not legitimate is saying it's 15 degrees out in minnesota right now, ergo al gore is fat, ergo there's no global warming. not legitimate to say we're going to get 40 foot sea level rises because antarctica is"
136,"the state of texas. you incarcerated my sister-in-law. that's the number two guy in texas. this is the number two in wisconsin. she's amazing. hi, rebecca clayfish here. i'm out in the global warming today poisoning the world with"
137,"possible point to do it. if you want to -- because the world is warming. if you want to talk about melting arctic ice, that is a symptom of climate change. if you're going to go ahead, though, and say that droughts were caused by climate change, you need a lot more -- you said that, barack obama said that. the -- what was it called? it was a drought task force went ahead and said, no, i don't"
138,"for tax reform, climate change, and immigration reform and none of that happened. we have done nothing in terms"
139,"nine of the ten coldest. you don't think the world is getting colder, right? i think chicago winter are getting colder. you understand the world is not getting colder. you understand the world is warming. the world is warming. thank you. greenhouse gas concentrations in the world are adding to that. industrial activity is adding to"
140,"concerted effort of people to believe that global warming is taking place, that we're all going to die and all of that. at the same time, the evidence out there is just, it's almost laughable. this winter is brutal. i mean, i'm in new york right now."
141,"and if you read one thing this morning, read the take in 'the new yorker,' which starts with the brilliant line, 'the so-called polar vortex caused hundreds of injuries across the midwest today, as people who said so much for global warming and similar comments were"
142,"and tourists, all part of a month-long research trip to study changes in antarctica's environment over the last hundred years, including what role global warming has played over that time period. because of a blizzard, their ship had been stuck in what is basically a sea of ice since"
143,climate change because that sounds more benign. he told republicans to say they're not willing to compromise. he used the emotional potential
144,"supportive of gop causes than it is of democratic or more progressive causes and consequently if we do something like carbon tax credit, if we wean dependence from petroleum products, that's going to impact that industry. it could be that. it would also be -- here's a            _"
145,"minimum wage, equal pay, climate change and obamacare and immigration. you are watching a special 'hardball,' your place for politics."
146,and on giving people the security we need to tackle problems like climate change. we cannot go forward if we don't do it together.
147,"change guy, except he doesn't believe in climate change. that group has jurisdiction over all matter relating to environmental research and environmental protection agency"
148,committee. they regularly use the imp t impacts from hurricanes and floods to justify the costs for climate change regulations. the administration should try to
149,"effort of people to believe that global warming is taking place and we're all going to die and all of that. at the same time the evidence out there is just -- it's almost laughable. senator, we all are going to die. i'm just saying. this is no laughing matter."
150,"time scales. when it comes to science, this is a theory with global warming that's been built up over decades of research very slow to change slow to adjust to any differences that are happening on a day by day schedule. so you see that sort of jump"
151,"chinese do. you know what? it's one big globe and one big atmosphere. if you care about global warming, you should fight chinese and not the american companies. i think that's a great point. thank you for stating it. one other thing that we've been talking about, jim, is the fact"
152,"also given me an opportunity, hopefully, to try to inform this increasingly poisonous discourse that we have over this issue. speaking of poisonous discourse, i'm going to stump you right here. how can there be snow when there's global warming? well, you know, we climate scientists actually have a"
153,errgo there's no global warming. not legitimate so say we're going to get 40 foot sea level rises because antarctica is going to melt when antarctica's ice levels are thickening. we've known for a while even in the global water -- the sea ice is thickening but the arctic is melting.
154,"pointing and laughing at the global warming believers, who just to be clear, are only a group of scientists risking their lives for no monetary gain and little glory in order to help save the planet. it truly was a new year's gift of faux irony for the"
155,"republican caucus, i mean, a majority, if you take the house caucus -- and i'm not saying grandstanding for gain. i think privately, actually believe this nonsense. here's congressman john flemming from louisiana. this is his tweet today. 'global warming isn't so warm these days.' i think this is an actual belief"
156,"it's cold! where's your al gore now? that's why i feel bad for al gore. 63% of the country is now covered in snow. and it's breaking al gore's heart! i wonder where al gore is this morning? that global warming is really taking the its toll, isn't it?"
157,"jon huntsman was so annoyed by the rhetoric he was hearing from people in his party when he ran for president in 2011 he tweeted, to be clear i believe in evolution and trust scientists on global warming. call me crazy. and then one of his opponents rick santorum responded by"
158,"i'm the lieutenant governor of the state of texas. you incarcerated my sister-in-law. that's the number two guy in texas. this is the number two in wisconsin. she's amazing. hi, rebecca clayfish here. i'm out in the global warming today poisoning the world with my breath."
159,"believe that global warming is taking place, that we're all going to die and all of that. at the same time, the evidence out there is just, it's almost laughable. this winter is brutal. i mean, i'm in new york right now. the airports were closed. everything is closed."
160,"using a whopping helicopter that landed on the surprisingly thin ice. they're all out. so it looks like we're looking at global cooling. the prospect of air quote global warming scientist was too rich with mockable goodness for the right's leading intellectual likes. donald trump tweeted, this very"
161,corporate interests. red state's erick erickson got theological today. the difference between -- this is his actual tweet. the difference between the people who believe in the second coming of gee u.s. and those who believe in global warming is that jesus will return. and to tie it into the
162,he said understanding what part of climate change is a natural cycle and a human component is the first step. they should react to facts like
163,"great disqualification? he spoke mandarin and believed in the threat of climate change. that disqualified him. ultimately, it is a set of primary voters and donors that"
164,"what i recall from the fact we were hit so hard by sandy, i believe global warming is a real thing that will affect our community. we need to prepare for it. i think we need that funding because we have a good plan in place that needs to be more flushed out."
165,"climate change, conserve important areas, very strong, saying this office will continue to make it better. the issue of immigration, you didn't have that authorityive point saying this administration"
166,plus one big snowstorm is giving all the right wing climate change deniers brain freeze. but we're breaking out the 'politicsnation' science lab tonight for a little lesson.
167,"california is the state where immigrants can dream and drive. leading the fight against climate change and same-sex marriage inequality, and adding another string to its bow,"
168,"is manmade. he doesn't try to deny all manmade climate change. for that, you have to turn to mr. lamar smith, the republican chair of the entire science"
169,"just days after he announced that climate change is a fact, president obama stands at a cross roads. will he or won't he green light keystone? we'll discuss when chris haynes"
170,"bipartisan, comprehensive tax reform that encourages job creation and helps bring down the deficit. but for the sake of our children and our future, we must do more to combat climate change. [ applause ]  _          _"
171,pat robertson says the temperature swings across the nation have nothing to do with manmade climate change. his logic falls just sort of a jetson's episode. the world isn't getting
172,theory. it could also be that climate change became so synonymous with al gore in its initial station that people on the right side of the aisle said if gore believes
173,"suspicion that currently hangs over. what i recall from the fact we were hit so hard by sandy, i believe global warming is a real thing that will affect our community. we need to prepare for it. i think we need that funding because we have a good plan in place that needs to be more"
174,"the difference between the people who believe in the second coming of gee u.s. and those who believe in global warming is that jesus will return. and to tie it into the politics, the important thing is, there are members of the republican party who aren't laughing about this, they regurgitate it. i would say a majority of the"
175,"develop below freezing across the country. hundreds of canceled flights, thousands of travelers found themselves stranded. meanwhiles, schools shut their doors. governors declared states of emergency. no one is happy about this, except for one group. right wing snow trollers. right now they're thrilled because all this winter cold means global warming isn't real. right? that's next."
176,"study changes in antarctica's environment over the last hundred years, including what role global warming has played over that time period. because of a blizzard, their ship had been stuck in what is basically a sea of ice since christmas eve. now, for anyone with any sense, you think, fantastic. i'm so glad they were rescued."
177,"all when you're talking climate change to minimum wage and the kitchen sink gets thrown in, too. i have some sympathy with todd's comment that we have to scale the address back again."
178,"outrage, it is a horrible constraint on economic growth and on giving people the security we need to tackle problems like climate change. we cannot go forward if we don't do it together."
179,"gridlock with more than 4000 flights canceled today, alone. absolute mess. it was also the greatest day in the world for the army of climate change people we have dubbed the snow trollers."
180,it's cold outside. thank you. what does your gut tell you about the subject? does a person's views on climate change are based on facts or politics? what does your gut tell you.
181,"and unintended public figure. i've become a public figure in this larger debate over climate change, because of this iconic graph that my colleagues and i published a decade and a half ago."
182,"strong. he spoke directly to the american people. went over congress' head to deal with issues of voter registration, minimum wage, iran and diplomacy, climate change, the issue of using the an tick"
183,"even in the most overdramatic climate change nightmare conceived by liberal hollywood, the end came not from hot, but from cold. a giant snow hurricane, a snurricane. and yet, here we are."
184,"directly to a much larger fe nonnonof global climate change is difficult. yeah. however, it is consistent with what you'd expect as the ice melts, as there's more heat in the atmosphere and as weather"
185,"benefits to be extended, and to stop climate change, and to stop taking up endless ridiculous votes on the affordable health care act. and he said it is time to do away with workplace policies"
186,"one of the reasons why is natural gas. if extracted safely, it's the bridge fuel that can power our economy with less of the carbon pollution that causes climate change. businesses plan to invest almost"
187,"stop climate change, and to stop taking up endless ridiculous votes on the affordable health care act. and he said it is time to do away with workplace policies that plong in a 'mad men'"
188,"changing. it is a sad answer. it depends. john huntsman, what was his great disqualification? he spoke mandarin and believed in the threat of climate change. that disqualified him. ultimately, it is a set of"
189,economic growth and giving people the security we need to tackle problems like climate change. we cannot go forward if we don't do it together. hillary clinton also tweeted out this photo and so pleased
190,"snurricane. and yet, here we are. this willful stupidity is backed by a lot of money. groups spent $1 billion a year to fight action on climate change. $1 billion to fight a group of"
191,"think you can attribute the 2012 droughts to climate change. this noaa. the federal government -- you attributed to it and obama attributed to it. that's my friend, charles cook's point -- here is the point, though."
192,"doesn't tell the whole story. scientists argue in addition to overall heating of planet earth, human initiated climate change is also contributing to extreme weather events. some scientists are already saying that the polar vortex"
193,"the point is you come on, right, and the first thing you do is say, well, look at this chicago, nine of the ten coldest. you don't think the world is getting colder, right? i think chicago winter are getting colder. you understand the world is not getting colder. you understand the world is warming. the world is warming. thank you. greenhouse gas concentrations in the world are adding to that. industrial activity is adding to"
194,"getting colder. you understand the world is not getting colder. you understand the world is warming. the world is warming. thank you. greenhouse gas concentrations in the world are adding to that. industrial activity is adding to it. and your favorite policies will not turn that around and any policy that would turn that around will cost much more than adaptation. if we get to the point where james inhofe goes to the floor and says the world is warming,"
195,"not falsifying the high pocket sis that there is climate change. why can't we agree on that right? as a basic set of scientific precepts outside of politics. it's difficult because science, they work at different"
196,"i think the president's message is that he's really worked with congress to try to get laws in place to address the threat of climate change, more comprehensi comprehensively, but that doesn't mean we can't take reasonable steps forward."
197,reduce carbon pollution over the next several years. the united states has done more to reduce our contribution to climate change than any other country in the world. we've made some important progress. most of that is because of
198,"the question of inequality, income inequality and talk about pushing for a raise of the minimum wage which is a big white house agenda. he'll talk about climate change where the president will do more without congress's approval in"
199,did they try to berate you? absolutely. constantly. for what? for -- great example. the governor clearly made strong commitments on climate change in 2009 to be very aggressive and do the right thing pep made a
200,"the beginning but it got worse and worst and worse. we're environmental advocates not in it for the money. we're about protecting people. you know from sandys, from climate change, for protecting our drinking water, environmental justice and if"
201,fuel costs by reducing the nation's reliance on oil imports from nations less friendly than canada. critics say it would harm the environment and impact climate change. no better authority on this than the straight talking former
202,"report says it does not significantly exacerbate the problem of climate change, you would think the president would approve this. of course, we don't know exactly where the president's head is on this, but it's a significant step forward."
203,security we need to tackle problems like climate change. we cannot go forward if we don't do it together. the politics of that has put a spotlight on raising the minimum wang. and for the democratic party
204,"climate change communication and professor cristina beltran and daily beast columnist and bill nye the science guy. so nice to have you. it's so good to be had. indeed, it is. bill, will it me start with you."
205,coca-cola now knows there's climate change and that we need to deal with this issue as well as evolution and tomorrow of the other things they deny. kasie. i learn that prevus was throwing his weight around.
206,this willful stupidity is backed by a lot of money. groups spent $1 billion a year to fight action on climate change. $1 billion to fight a group of people who delight being on the wrong side of history.
207,"if each individual functions in their own best interests, society and, theoretically, the environment will do better. and of course, climate change debunks that. it also attacks the notion that as a communal effort, we can do something."
208,whole moral system is out the window. climate change is much more about this john wayne sort of individualism. government leave us alone. don't interfere with the marketplace. there's a science issue for each of them.
209,"thank you for your time. you bet. thank you very much. after the break, subzero winter temperatures falling record breaking summer heat. the tell tale signs of climate change. but when you do not believe in"
210,"climate change is a fact. unexpectedly, one of the biggest applause lines tonight was on the issue of women's equality and workplace policies affecting women and families in the workplace, and i think a lot of"
211,"reach 5 to 20 degrees below zero from minnesota to indiana on monday. brr! beware of climate change, folks! there's something we can do about it. when we come back, it's a pretty safe rule in a national"
212,"issued in this current cold slap this week is a result of climate change. furthermore, extreme cold in one part of the world may coincide with extreme heat elsewhere. senator inhofe did not mention that australia is experiencing"
213,"however, it is consistent with what we would expect. now keep in mind senator inhofe was a guy that was at least in one quotation, he was concerned about climate change until he found out how much it would"
214,"temperatures drop below freezing across the country. hundreds of canceled flights, thousands of travelers found themselves stranded. meanwhile, schools shut their doors. governors declared states of emergency. no one is happy about this, except for one group. right wing snow trollers. right now they're thrilled because all this winter cold means global warming isn't real. right? that's next. r good gummies. they're fruity delicious!"
215,political and ideological identity here with both of these issues where dismissives are very afraid of clie mass change not because they're afraid of climate change the phenomenon but because they're afraid of the policy. they're afraid it will be used
216,"real as the president said and that with climate change bizarre weather outcomes are possible and they've got to be prepared and ready to go not only with the right equipment, salt, plows, et cetera, but with the right division of responsibility."
217,"the pristine landscape cans and he will pick up the pen to do it, and talked about climate change in a real way which is to the base it means that he is probably not going to greenlight the keystone pipeline."
218,"we know back in june of 2013 of last year, the president said this project could only be approved if it didn't significantly exacerbate the problem of climate change. that's going to leave a lot of people to conclude that if this"
219,"safer more stable world with new sources of energy, i want us to be able to say, yes, we did. [ applause ] on tuesday, president obama said we'd face tough choices when it came to climate change. today, he faces his toughest one"
220,"connected at the expense of the disconnected. p i know, because i'm one of those critics. anyway, thank you, michael steele, and joy reid, and here are the top issues trending on facebook tonight. minimum wage, equal pay, climate change and obamacare and"
