109,ensures that we are able to get funds to the people that we're working with and expand with great confidence. when girls go to school we're going to maximize their talents. we could have a solution for climate change in that girl. that girl could be the next nobel peace prize winner.
110,"when girls go to school we're going to maximize their talents. we could have a solution for climate change in that girl. that girl could be the next nobel peace prize winner. eight hundred dollars when wet switched our auto and home insurance. with liberty, we could afford a real babysitter instead of your brother."
111,"of the relationship between president trump and our european allies? we've got some serious differences with our closest allies. whether it was the french and climate change, the brits and the issue of the embassy in jerusalem. what do you make of the relationship? so two things here. the handshakes you know, they've"
112,"warming/climate change tweet from the president, i was talking to somebody about his tweeting habits saying the president has the instincts to troll. he puts things out there just to get a reaction, just to get a rise from his critics and from his opponents. is that how you look at this"
113,ensures that we are able to get funds to the people that we're working with and expand with great confidence. when girls go to school we're going to maximize their talents. we could have a solution for climate change in that girl. that girl could be the next nobel peace prize winner.
114,"schwarzenegger is right. scientists and engineers have not stopped working to combat climate change, in part because the french president is literally hiring american scientists to do that work in france. that's things 2 in 60 seconds. french president emmanuel macron has repeated a clear message in the trump era. american scientists are welcome in france."
115,"he made, republicans lined up and endorsed him. climate change and science and facts, republicans continually bury their heads in the sand, ignore them. they don't talk about it. with trump's relentless attack on the first amendment and the right of the free press to do their job and investigate and hold truth to power, again,"
116,"but it doesn't men when you hhe have the president continuing the fiction that weather is the same as climate change. one thing he talked about the political i don't knows we'll spend in paris, he missed the fact that our paris commitment was $3 billion. we just passed legislation last week to commit $81 billion to"
117,"he hasn't reneged on i. it was a key campaign speculation, nafta is still in place for the moment. we still have american troops in afghanistan. we still have them in iraq, we still have them in syria. so in some ways things are the same. what's different is that in the foreign policy, the big security strategy review that the president gave at the end of the year, no mention of climate change as a national security"
