114,"there has been a part of this conversation, at least it would seem to me, that has been noticeably absent over the last few days, i know this is a cause near and dear to your heart, climate change and what we saw"
115,"a dapation to the fact that we should clear, sea level rise is caused primarily by climate change, though not exclusively, that you can adapt here. this is a place that was almost levelled right after it sort of first boomeded."
116,"if this isn't climate change, i don't know what is. it may be a good time to get people's attention. you in miami have water coming up through the drains some days because of rising water levels. actually, we do have already"
117,"to move on climate change. irma, first hurricane to ever have sustained winds over 185 miles an hour for 25 hours. harvey, largest record rainfall in the history of hurricanes. wildfires burning out of control in the western part of our country."
118,"nobody wants to talk about, climate change, obviously. once in a while your own al roker will slip it in. as the ocean gets warmer, especially the gulf of mexico. now, the north atlantic, north of the equator, as it gets"
119,"gates can fix measure, richard branson and michael bloomberg can fix climate change. you're saying falling into the trap of conflating wealth with a public serviceman date or the ability to help the country is broadly a problem across the"
120,"liberals who care about climate change, even if there's a 1% chance of burning up the planet, let's not do it. you think there's a 1% chance that he may blow up. a missile -- i'm talking about doing something against other people,"
121,"eclipse. i said next week's total solar eclipse, odd that there are no deniers about this eclipse because like climate change the methods and tools of science predict it. and somehow that went viral. i remember the tweet, yeah. people resonated with that."
122,"much like in a separate set of circumstances the climate change paris accord. when those deems are done, leaders don't necessarily want to go back to the negotiating table. president trump may jumble things up and try to force a new"
123,"insulting america. it's ridiculous. paris addresses a vital international issue, global climate change. but it does not set a numerical target so it doesn't make any sense we're going to renegotiate. this is just a brainless mantra trump has been repeating about"
124,"republican circles some rethinking about climate change and its possible connection to the severity of storms. so again, but this ought to be the sort of agreement they would embrace. this ought to be a precedent for a kind of multilateralism they"
125,"involved in the decision-making. if he shoots at guam we could shoot it out of the air and take him down. the liberals care about climate change. if there's a 1% chance we're burning up the planet, let's not do it."
126,and acquisitions of politicizing science and with all of the research that nasa has done on climate change you could see a big fight over the science throughout the trump administration going beyond just the epa and that is nasa. and we'll see out of all of
127,"the claim by epa chief and oil and gas industry darling scott pruitt from right before irma hit that it is, quote, very, very insensitive to talk about climate change. and later on, the white house is once again playing defense after another high level dismissal."
128,begin in june and end in november. will we know there is climate change is having an impact when we start seeing december storms sometime between december 1 and may 31st? that's one of the project shups that computer models put out there is that the seasons
129,"something, it's going to get catastrophic. you say everybody agrees with it. the president of the united states doesn't agree with it. after all of the catastrophic hurricanes in the caribbean and texas if it's changed his view of climate change, he's said no."
130,devastated. are people preparing for the worst of the worst that could happen if the results of climate change as they kick in? i think we have to do a lot more and i think that -- because what we see now is a little
131,"thank you, you, too. the white house pushes back against a report saying the president is reconsidering his position on the paris climate agreement. how his policies on climate change are likely to be received at the united nations this week. plus, the pageantry of"
132,"he literally -- even if he actually gives it it's literally almost the least he could do. he could do more in terms of preparedness, in terms of climate change, in terms of getting people to realize that we need to change the we think about development."
133,"climate change, there are going to be hurricanes, and there are going to be storms, and as you said, houston, the water drainage and control system was designed for a much smaller city. not as much of it was paved. there are ways for water to"
134,"change things? do peoples miepds get changed with this? i hope that what it does is it gives them the space to begin to be able to think more critically about how these additional impacts that are coming because of climate change, because of sea level"
135,fixodent plus adhesives. just one application gives you superior hold even at the end of the day fixodent. strong more like natural teeth. donald trump believes climate change is a hoax created by the chinese. do the recent floods in texas change his minds?
136,against the livingston priorities that are nativist candy for the rab i had base rather than priorities for the nation. we don't need a wall we need walls around houston so make sure the climate change doesn't swamp it. you got to the shut down.
137,"he doesn't believe in climate change. if you're asking for a comment, you know, stephanie, i'll tell you, the folks at nasa are very professional, the career folk there. nasa has been the best place to work in the federal government for five years running now."
138,"there are some out there saying that you should ignore this, that it is hype, that it is fake news, part of a climate change kind of conspiracy. it is not. this is life threatening, it could be devastating. and if anybody tells you"
139,"this should be a lesson for everybody in the united states. i think you're absolutely right, this is an opportunity to think about how we build, how we mitigate rising sea levels and climate change and it's not fake news but mayor you've got a lot"
140,"best you're being disingenuous and putting people's lives at risk. tom, i'm a money guy, and we are constantly talking about moneyed interests that are working for their profitability at stifling discussions on climate change because it's going to cause them to do things"
141,"the energy system that we have now, which is creating climate change. and the politicians who take the money from the fossil fueled interests and then lie about what's happening are now watching what's happened as a result. so really the way i think about"
142,"damage and that causes me to lose a little bit of sleep at night because we've dealing with seasonal high tides, rising sea level and climate change. ft. lauderdale has been a leading city on that nationally. but there's not much we can do"
143,"land subsidence -- miami is a sitting duck. you and i have talked about this before. there's a lot of argument in the literature about climate modeling, climate change and hurricanes. what we do now is water is on average warmer and the sea levels are higher."
144,"we know in florida water levels are rising and that contributes to the damage that a storm like this can do. that's right. a foot of sea level rise more or less largely because of climate change, other places in florida because of the dynamics of these"
145,"neek of vulnerability to extreme weather in the area of climate change. today, we've been talking to residents, official, ablgt how they're preparing. we'll be here through the weekend rorying on the response to the storm. right now, irma is heading this way after a devastating path"
146,"retiring congresswoman ileana ros-lehtinen. they both said if you live here, you cannot deny what's happening. climate change is real. it has risen the -- the sea level has risen. it's about a foot largely attributed to that, and it has actual tangible effects."
147,paris climate change. let's see whether we fashion a collective response on north korea. let's see what we do on helping ukraine. sanctions towards russia. so many things that's possible. we can hope for that. we're not there yet. former british prime minster tony blare.
148,"the globe. whether that is climate change or refugee problems or rogue nations with nuclear weapons, the world looked to the united states to organize a coherent strategy. as you point out, andrea, there is a distinct lack of coherence in this strategy president trump"
149,"so and reformulating the doctrine in terms of preparing, but what about -- what about climate change and does that play into this or is that a separate entity of the government that should be addressing that? i'm not an expert -- i know but we all have"
150,"in his own backyard. these are the climate change and iron nuclear deal are going to be hard to put america first when you're at odds with everybody else. for issues as big as these, you need the support of your allies and partners otherwise it's"
151,"shudder. we really push away the rest of the world in the actions we take. likewise with climate change, which we heard about from the secretary general, how important that is to the future of the world. so this is a united states that"
152,"science. it's about good long-term decision making and climate change -- here's an example. people making long-term decisions whether you're talking about business or science. so if you build infrastructure to withstand rising sea levels, it costs you $1. if you repair that"
153,which i think is a positive thing -- i think everyone shares that commitment. i think the president shares that commitment. he wants to do this right. he wants to address climate change in a way -- really? does scott pruitt support that? the president clearly believings
154,"doesn't understand education. climate change is out. i don't know if we have the first incompetent president of my time, that's for sure, and the only one that i know. i don't know if he's competent enough to deal with those issues. when i look at how he's -- what       _"
155,"told people not to use the phrase 'climate change' in the state's planning apparatus, right? yeah. is it going to wake him up? you know, that might have been -- i don't know why that was said because he is a highly intelligent man. and what he has done in"
156,"mobilizing for this storm and how -- yeah, he has done a very impressive job. and how extraordinary we have, you know. i think it's part of that mind-set that, oh, gosh, if we talk about climate change, it's going hurt our economy. people aren't going to come."
157,"a chapter on miami where i learned a lot how it was developed. one thing the book communicates, it's just not a miami issue. the threat posed by climate change and rising sea levels is is intensely global and we're talking hundreds of millions of people in harm's way."
158,active seasons before. prior to this year we had some quiet seasons. so the seasonal activity goes in and out of cycles. the question is whether the storms on average are becoming more intense. and the climate change assessments which have been done show that we don't yet have a
159,"detectable influence on hurricanes in terms of climate change. however, anecdotally if you look at some of the storms we've seen around the world in the last few years if you look at super typhoon high yen which decimated the philippines in 2013, and then patricia which had 213"
160,"light on this issue, and to press other partners around the world to try to do something to stop kim jong-un. there will be another topics, of course, from iran to climate change. that presents another challenge for president trump, because one of his friends on the world"
161,"any other nation is prepared to renegotiate. so there will be a tension on climate change at a time when president trump will be in the spotlight putting more pressure on him to find some way to participate. nbc's kelly o'donnell, thank you. north korean state television airing video of its"
162,"within this last hour about the north korean leader with another unique twist. we've got those details ahead. mixed signals. a new report, a new denial from the white house about where the president stands on climate change. why this happens to be in flux two days ahead of his united"
163,"politics. miss america not shying away from climate change controversy in her pursuit of the crown. her political prowess getting plenty of play from 'the daily show with trevor noah.' we have that. you know, i realize it's actually easier to become president than it is to become miss america."
164,"decision. once we reject that -- thank u you -- once we reject that, we take ourselves out of the negotiating table. there is evidence that climate change exists. whether or not you believe that, you have to be at the table, and i think it's a bad decision on"
165,"where we're on national television. and you know, you want to make sure that those women up there, we're scholars, we're able to answer those difficult questions. and climate change was the topic that you addressed here in terms of understanding the issue. your opinion was that the united"
166,"a million dollars is -- even if he literally -- even if he actually gives it it's literally almost the least he could do. he could do more in terms of preparedness, in terms of climate change, in terms of getting people to realize that we need to change the we think"
167,"therefore, you're not -- you're creating gaps, if you will, in your planning process. when you don't think that the impacts from climate change play a role in some of the things that are playing out. so i think that the administration is actually doing themselves a disservice by not"
168,"was. and now we have 500 year and thousand year floods that are happening year after year after year. so as we're moving forward with planning, we need to be able to properly plan, so that means we have to include climate change as a part of the overall"
169,"a large amount of water, and we're going to see the same thing with irma. the third factor is we know that the sea level is going up. one of the impacts of climate change is rising sea levels. we worry about that over the"
170,"we don't know if climate change is going to increase the number of these storms, but there is growing evidence that the strength of the storms is increasingly influenced by unfortunately what we're doing to the climate. peter, thank you so much. if you could join us in a couple"
171,"miami has water coming up from its drains because of rising sea level. and if we don't take this seriously when things like this happen, we don't tend to take it seriously when nobody can feel climate change. that's right. and you got to separate the problems, for example, with"
172,"said this is media hype to advance a climate change agenda. well, i tell them that they're being disingenuous. there's no better time than this moment now. actually, the conversation should have been started as soon as the new administration came in so they could begin to think"
173,"are necessary. and folks just have to begin to prioritize it. it just makes sense for us, one, to understand that the impacts from climate change are real and that there are solutions that can help us to lessen the intensity of the storms. we can make sure we're moving"
174,"you begin to wonder, what are they going to get done before the entire thing begins to implode and how big a role will steve bannon play in the implosion? i also want to ask both of you about climate change. it's something -- sam, you've been writing about this."
175,"what we discovered by going through transcripts of white house briefings and by television interviews and pundits, except for msnbc, i should say, was that this is not being discussed at all. the white house has not faced a question on climate change since these storms came on the"
176,"do you rebuild with the vulnerabilities of all those people have had, or do you take into account the fact that climate change is happening, it's real and it's contributing to events like this. and you may not want to live at or below sea level in many cases."
177,"if climate change wasn't happening, if it was, see how much of a difference this storm will make. we won't know -- it's called post analysis. we won't know that for another couple of weeks. takes a while to put that together. it's not instantaneous. we'll find out on that people"
178,"east and to the west. so miami beach could get it from either direction. reason we were here talking before, this is an area very exposed to climate change and lot of that has to do with sea level rise, so that water is sitting at a higher elevation"
179,"to climate change. miami-dade is only within ten feet. do you feel confident the federal government is doing what it can when you have someone like scott pruitt who questions the science of its, the president. we're planning properly so this area can be sustaining and thriving into the future."
180,"constituents in the long run, their pocketbook. so our party needs to por get about who caused climate change and all that nonsense and just say look, this is real. sea level rise is science. this is not somebody's opinion. it's guided by science. do you ever say that to your"
181,"the administration? i know this administration has gone back and forth with climate, accepting climate change as a reality, and from your perspective it needs to be if those islands are going to be rebuilt with responsibility. yeah. i mean, i just think that, you know, fortunately 192 countries"
182,"the united nations general assembly. is the white house you think setting expectations high or low for what they're hoping to get out of it not just on the north korea issue, but on the issues including climate change and what have you. they see trump on kind of a"
183,"that climate change exists -- i don't know a member of congress or anyone in washington, d.c. that says we want to pollute our air and water more. what we're all united on is reducing the negative impacts on our environment. that's common ground. when you talk about reducing"
184,"withdrawal from that land narc climate change treaty. kristen welker is outside trump tower. welcome to busy new york, traffic is a mess. the weather will not be good. and there you are outside of trump tower where everyone is braced for what is going to happen at the united nations."
185,"for the way people face climate change. existential threat people can put off and not deal with it and deal with what's in front of them? yeah, the good thing is now we're at a point where you can't deny it. it's kind of like in the show. everybody knows it's happening."
186,"them as they now try to recover from that there in the florida keys. just glad they're safe. nbc's lucy kafanov with their story. thank you, lucy. miss america getting a little political. the pageant winner who expressed her opinions on climate change will join us after the break. and do talk about the response,"
187,"hour, governor florida rick scott scheduled to give another update on hurricane irma now that the path has changed. we're going to bring that to you live. governor scott has said irma could be worse than hurricane andrew. so will the governor change his mind on climate change? we're going to ask that question next."
188,"level perspective we have more higher sea levels, of course the oceans are getting warmer, and so climate change is going to increase the frequency of these kind of events. i think what's going to happen after this event is we'll start to see some secular changes as it relates to the way that we"
189,"telling people this isn't all that serious, allegations that it is -- that the media is trying to advance some kind of climate change narrative by telling people this is serious. the thing i'm asking you, in the time you've been in this business, there has never been a more accurate time for"
190,"with the mayor of miami just a moment ago, who says this is the time to have the conversation about climate change. the epa administrator said this isn't the time to have that conversation. what are you hearing from people around there who have witnessed in miami this idea of rising sea"
191,"category 1 to a category 3 or 4 in a short period of time. to strengthen that much. to your point, what is contributing to this and how do we prepare? i know what you want me to say and i'll say it, it's climate change, there. the dirty two words that"
192,"to respond and then all of a sudden a hurricane hits and you've got to fill it up. we're smarter than that, we're better than that as a people and we need to make the appropriations necessary. and the realization that because of climate change, we're going to be seeing a lot of 800-year floods."
193,"together and i believe we are. that's the course we're seeing unfold in houston's long recovery ahead of us. and this may be one step towards getting everybody to understand the concept of climate change and get everybody on the same page in terms of accepting that as a reality. may i ask you, sir, about the"
194,"climate change. quote, to have any kind of focus on the cause and effect of the storm versus helping people who are actually facing the effect of the storm is misplaced. to use time and effort to address it at this point is very, very insensitive to the people in florida. but today i spoke with the chair"
195,"ahead of the hurricane, the trump administration's epa chief scott pruitt said that now was not the time to talk about climate change. quote, to have any kind of focus on the cause and effect of the storm versus helping people who are actually facing the effect of the storm is misplaced. to use time and effort to"
196,"and basically, said it doesn't matter, we're going to nuke them. i mean, it's a question of will president trump support her. i think tillerson's increasingly dealing himself out of the deal, but they've got climate change, north korea and iran all front and center. so, the work coming up this week is incredibly important, and i"
197,"still a little puzzled about what the role of climate change is, but nobody should be puzzled about being able to take a ruler over the side of the banks in new york city or in miami and realize that over the last 30 or 40 years, the water level has risen. there's a rate at which it's"
198,"damage happened when it came flooding back in to tampa bay. senator, i know you will take the opportunity and there are a lot of people who say this isn't the time to discuss the effect of rising sea levels and climate change and you'll need to take the opportunity to remind floridians that this is a matter"
199,"impact of climate change would be, and it says 1, 2, 3 feet of sea level rise could be devastating to this area. that's right. of course, it would be temporary storm surge from a hurricane like the one we expect to strike here, but nerls it's something that they think about here often, they prepare for"
200,israeli prime minister benjamin netanyahu. you have climate change big. president trump meeting the french president with new push-back this morning from the white house about reports the president does not plan to pull out of the paris accord. and we know we're going to hear about the con city fusional crisis in event lay za.
201,"nations, not a lot of support for that in certain parts of the united states. at the same time, he's used it quite effectively in ratcheting up sanctions against north korea. is he going to have to decide whether he finds a way to get back into the paris climate change pact and he has to decide"
202,"of work to do in your state. lot of people are doing very hard work right now to alleviate the suffering that south florida is going to have, but they don't necessarily share your view that this may be an issue of a climate change so you and i are going to stay in touch on this topic and continue to discuss"
203,"that water in all sorts of ways that to make florida what it is today which is a place with $1 trillion-plus real estate and 19 million people. but the water still comes. that's where the sort of equilibrium of climate change really makes a big difference. when you look at these systems that were built, the drainage"
204,"for the state of florida. and i think as we move, you know, hopefully we don't have to have too many of these wake-up calls to make those adjustments. but gosh. will it wake up -- you have a governor who literally said and told people not to use the phrase 'climate change' in the state's planning apparatus, right? yeah. is it going to wake him up?"
205,"here, penny taylor. she is a republican who accepts the consensus on climate change. she says once noaa undertook a study on how collier county will be affected by sea level rise, people there became more open to the issue. and then hurricane irma happened. the folks that say oh, you know, it ebbs and it flows and whatever, well, it does. but this ebb might be longer than we have ever experienced. and so to me, there is much more"
206,"need to get serious about this. well, you're going to be busy for the next several days, but you and i will talk on the other side of this when we have a little more time to go through some of the things you are doing in miami and in that region that the country can learn from when it comes to climate change. but at the moment we're going to be thinking about you and"
