104,"that warmth and part of the energy in the atmosphere that's giving us all this extreme weather is due to the effect of climate change, putting more moisture in the atmosphere, more energy in the atmosphere to generate the sorts of storms we are seeing. okay. we'll have to leave it there,"
105,"new york city now seven of the ten greatest snowfalls happened in the last 20 years. there you go. that will lead you into your climate change discussion. forecast for the next seven days no snow. new york city, this is the five day forecast for new york and mid-atlantic all the same. no storms."
106,"income wealth inequality, when you've got climate change, we need a president who now has the courage to stand up to the billionaire class and wall street -- does hillary clinton have the courage -- well i'm running for president because i think not, all right? because i think at this particular moment, somebody has got to tell wall street and"
107,"east coast is bracing for a major winter storm. but that very storm which will be hitting the east coast this weekend is going to threaten a huge storm surge, part of which is due to a higher sea level due to climate change. 2015 breaks a record set just last year, making it the warmest"
108,"technology once we can confirm or verify that it didn't happen one way or the other. the secretary of state who made the point that on his very first mission he said to the chinese when he was there meeting on climate change back in 2013, okay, we'll do it your way, which is to pressure north"
109,"heavier precipitation occurrences, such as what we're seeing here. there is no such thing as a climate change storm, just like there's no such thing as an el nino storm. however, what we are seeing is we're seeing a trend in an increase in a number of these storms and heat waves and droughts. reporter: all right. mark jackson, meteorologist in"
110,executives there he shot out at their corporate greed and insisted that we have to do something about climate change and said that fossil fuels should remain in the ground. that was the message from leonardo dicaprio. we'll have to see if the oil executives have any response as think continue to deal with the declining price in crude at the
111,"this is real. absolutely. climate scientists have been pretty clear and they have been increasingly certain that humans are driving climate change just as you heard from gavin schmidt. i mean, the degree of certainty that they ascribe to that conclusion has just gone up and up and up and now it's very high. what did you make of what ted"
